,title,text
77,4.0,"We have spend too much walking on the first 2 day hence not really enjoy the view here. The scenic is nice if taking picture with Hanbok. Else it just a tourist place with some many selfie stick on your photo session. But, a short walk after lunch is nice."
78,4.0,"The narrow streets and traditional roof design gives you a feel of an old Korean community, perhaps of the nobility class because of the house sizes and hilly location. Because of the large number of tourists who flock this area, the community is less welcoming as shown in their street banners/signs Tourist guides also warn tourists not to talk loudly so as not to disturb residents. Still worth visiting."
79,5.0,"Loved walking around this suburb. Charming traditional houses, galleries, art & craft shops, fashion.You can obtain a local map from the information volunteers around (dressed up in red) or walk around."
80,5.0,I loved Bukchon Hanok... it can make you travel in time. But be ready to walk into sloping streets. Definitely worth the exercise.
81,5.0,"walk along these streets and the rustic feel welcomes you.  Thought i assume some or most of these houses have been revamped recently, the rustic feel is still there. clean and fresh feeling."
82,4.0,Local residents disapproved Bukchon become tourist attractions in Seoul because of the noise and damaging effect from tourist. Many houses isn't intended for tourist. Need to be very quiet when visiting this place.
83,5.0,"If I could, I would get myself a house there. It was nestled in those uphills with unique designs. The houses looked old but with a touch of modernism. Make sure you go visit it. But please, be silent while admiring this gem."
84,4.0,"It is uphill streets lined with traditional houses. It was nice to take pictures of the traditional houses. If you visit here, be aware that the residents strongly discourage the presence of tourists. They see them as a nuisance. So please be quiet when you are here. There is a hanbok rental shop at the beginning of the street."
85,5.0,"A ""Must Visit"" place. One of the nicest places to visit in Seoul and... it's free!!! It is very busy with tourists so go as early as possible in the morning if you want to enjoy it all by your selves! But as it is not an actual ""touristic place"" by choice and people still live their daily lives in their homes, please be respectful and quiet. It is always mentioned on other reviews as well but it was sad to see that a lot of tourists did not respect that. It goes without saying that having your camera or phone camera is essential! Lot's of great photo opportunities."
86,3.0,"Good to see all the streets of Korean housing, people do live here so bear that in mind. The roads are VERY steep so not for those who struggle with that."
87,5.0,"These are traditional Korean Houses back from around 600 years ago.  There are many small alleyways, and long roads for great pictures.  I came here after exploring Gyeongbokgung Palace and the Blue House, a walk away!  Afterwards, I'd highly recommend visiting the renovated courthouse, a walk away again, haha.  Also, there was a Hanok that was available to tour and explore, so that's a must!"
88,5.0,"Very nice village to visit, very traditional and very pretty and nice to walk around. Just that some areas were steep, elderly need to be careful. Very well preserved place, there are still people living there and hence pls be considerate and do not talk loudly and behave rowdy. Overall, I think it I worth a visit."
89,5.0,This is a lovely residential area which worth to pay a visit.  The houses are beautiful but we didn’t have a chance to look inside!
90,5.0,This is a must-visit place. It's very well preserved and it's like your transported back in time. It's always packed with people but you can still manage to take pictures without including them in your photos. Place is good for kids too so you may take your family here.
91,3.0,"Bukchon Hanok Village is the small village in in middle of buzzling city of Seoul which keep its traditional architectural houses. If you'd like to explore the inside of houses, try not visit it in the evening because you can not go inside after 5 PM. Wearing hanbok while exploring the house will give you new experience of the real Korean village people."
92,4.0,"We strolled through this village which is well-preserved from hundreds of years ago and still has inhabitants throughout. It was OK but once you get here, there is limited observation other than externals of buildings."
93,5.0,Amazing picture worthy area but it is very picky neighbors do not like to have visitors in the area in fact there are lots of signs telling everyone they are to be quiet.
94,4.0,This is a good walk around the old Korean Village and you will see all the old houses and of course some have been converted to shops and eateries...
95,3.0,"Bukchon Hanok Village is one of the last traditional villages in the ever-developing city of Seoul where you can still see cobblestone paths and traditional Korean houses. A great place to appreciate the architecture but sadly due to the high volume of tourist that visits this place, the residents are unwelcoming and there are signs telling people to keep quiet or not to take pictures outside their gates."
96,3.0,"Quite nice architecture but all doors are closed except for one or two which have been turned to shops. The street can be narrow and steep. I was surprised to see a banner that roughly says ‘No tourists please ‘ and no talking signs pasted on most doors. I guess people live inside these houses and the whole atmosphere is very quite except for those made by tourists. Despite the hot summer, some tourists are game enough to wear traditional dresses to take photos.😂"
97,4.0,"This is residential area. I admire the idea of ""showing"" Korean traditional houses (only several houses were open and allowed to be entered), but still caring for people who lives there. There were persons who standing with banner to remind all visitors to be quite and to keep the area clean. Around the village, we can find small tea house, cafe and shops."
98,4.0,It looks lovely enough but I would avoid coming here on Monday because most of the shops were closed and definitely not in late July. The heat was just unbearable and all I wanted to do was to stay indoor.
99,4.0,"We walked around lot of places to see,local restaurants, shops.Museums, and art gallery.Even a place to experience the dark, led by blind folks."
100,5.0,My daughter lives in Seoul so she took me here. It is a very charming Korean village. Many local Koreans live here. It is beautiful and if you are in the right place you can get pics of the old with the new seoul behind it. We loved walking around here.
101,4.0,"There are lots of refurbished traditional Korean houses here.  You can walk around to explore the area and it is very picturesque.  Some of the houses are converted into shops, so you can go in for a visit and take some photos.Many little shops and cafe here, so you can stop and relax, when you are tired."
102,2.0,"Perhaps it was a hot summer day, we were dehydrated and hungry, the visit to Bukchon Hanok Village was not the best experience in Seoul. We walked and walked, and came upon some small alleys with traditional houses, that was it!!! It was interesting to see many visitors, dressed in traditional Hanbok, and taking poses in the 100 degree weather. The highly rated Ginseng Chicken Soup restaurant was a disappointment, too hot, lack of taste, and varieties. What menu choices? the restaurant only served one dish during our visit."
103,3.0,"The village itself is wondetful, it has beautiful plants, lovely houses, and architecture. But this is a residential area, and the residents are not happy about the tourists disturbing their peaceful neighbourhood. There are some gentle signs on the houses by the government to keep quiet, but the residents have put up flags that say: Get out, you are not welcome! These really degraded my experience, but if you talk quietly, it's definitely a must see."
104,4.0,"Visited here as part of a private tour...just me, my daughter and the guide. It's a quiet change from the larger more commercialized tours. Worth it if you have a historian as a guide. There were some locals starting to gather to protest against the large tour groups due to the noise. But there are also a lot of local shops geared towards tourists."
105,5.0,"This place is one of the best place to take picture and having an image of living in the old Korean. The houses are so pretty but when I went there, there are a few house that's under construction (which is the government help the people to maintain their house). And this place is sooo crowded. If you want to have a very good picture with less people you should come early morning."
106,4.0,"You can walk for some hours and learn more about Korea, there are nice houses, doors, little stores and coffe"
107,4.0,This village offers you a way to look into past history housing. People still live in the houses so you have to be quiet and be respectful when you are walking around. The doors in some of these homes are gorgeous! Bring an umbrella if you are coming during summer months.
108,3.0,I don’t regret going but I will probably skip this/will not recommend visiting this area to anyone. Its actually a residential area and there is a very big sign to say that tourist are not allowed in the area. I just don’t feel welcomed at all in this area. Although I know there are very nice shops/cafes in the area I just don’t feel like wandering around the village. Do not have high expectation if you go!
109,4.0,"It was fun to walk around this neighborhood, but I felt kind of guilty that people live there and have to post signs telling others to be quiet. They post it in English and what I guessed was Korean. Tourists from other parts of the world were so loud, but you can't post in every language of the world. Some fun shops crop up randomly between the homes. Beautiful homes, fun, historic feel. But tread lightly and quietly."
110,2.0,"I don’t regret going, but it was a waste of time. There really isn’t much to see or do, and the people living in the village are very vocal as to how much they hate that you are there.  In prominent display are signs specifically complaining about and admonishing tourists.  Who cares though because it’s not really a cool place to go."
111,2.0,"The walking journey from Gyeongbokgung was very tiring and hilly. Lots of tourist didn't follow the advise to keep their voice low. Noticed several posting on the wall indicated the tenant not welcoming tourist to their village.However, I enjoy looking at many beautiful doors each houses have."
112,5.0,What a great place to visit.   Spent one evening in a traditional guest home.     What a unique experience.     The whole area is really very different.   A one of a kind place to see.
113,5.0,"spent about 1 to 2 hours there.This is a residential area so do be quiet and not be a nuisance to the residents there (not all welcome the prying eyes of tourists into their personal homes)Beautiful architecture. Would recommend hiring some traditional dresses for more authentic pictures but we were too hot and sweaty to get into those.But besides just looking at the resident's houses, there isn't very much to do there. But still worth a visit.PS : There is a self-proclaimed Michelin star Ginseng Chicken soup there near the entrance. It's a fake! We tried it and were disappointed. And my husband checked the Michelin guide and it's not there!"
114,5.0,"A very quite place, beautiful architecture, it is a place as a example for traditional Korean neighborhood , please respect the local and do not make noise.You can pay and access to the observatory,It is a must during any Seoul visit, also the you can walk around the neighborhood where you can find good shops, cafe, bars."
115,4.0,"Get yourself a map before you enter the place as the road is very confusing. Luckily, there are tourist information officers with red shirt where you can spot at some places. Ask them of the famous spots so you won't waste energy to roam aimlessly.Toilets are hard to come by in the area.There are cafes and shops around, as well as some houses that are open for public free of charge.Make sure to respect the residents and do not cause any disturbance and loud noises."
116,4.0,"Interesting place with many shops, restaurants, cafes. Generally it is possible to see some street activities also. Other than all these, you can see nice traditional houses, also many art galleries.Prices in all those shops are above the average level in Seoul. Also, in my opinion, no need to join any guided tour for here, even it is free. Just good weather is required."
117,4.0,"The place is wonderful well kept and pristine, but please understand this is a residential areq where ypu are free to roam please keep quiet and dont litter in the area... the people living in the area are annoyed of the noise in the area."
118,3.0,"Visited June 2018. This is a low priority attraction.  The best part of this attraction is the del monte mango ice cream popsicle at the nearby convenience store at a street corner.  I don't remember the name of the store.  For 50 cents, it was the cheapest and best mango popsicle ice cream I've ever had.  Real mango flavor.  We looked for this ice cream popsicle every where we went in Seoul and bummed we couldn't find it anywhere else. Bukchon Son Mandu dumplings restaurant was really good too."
119,5.0,Very nice place to visit. Easy access via train. Be cooperative to the villager so that they will allow us to visit this very nice place. We rented hanbok to go around.
120,5.0,A quaint village in the heart of the city. Must see place if you want to experience traditional Korean culture and architecture.
121,5.0,"It was a nice leisurely walk we took but everywhere around the village are signs to reject tourists and signs to say keep quiet. There are residents residing in the hanoks and i think tourists are really a bother to them. So try to keep the noise level down and move along fast. Don’t take too long to snap your fotos or selfies as well. Oh this is where the drama Goblin was filmed, but I didn’t bother to go find the exact alley and wall. Was trying to move along and finish my tour asap so as not to bother the residents. If you have time and is travelling solo, then mayb you can slowly explore."
122,5.0,If you like the historical place then  you need to see here a folk village. it is very interesting to know how korean live back then.
123,4.0,Its really a sight seeing placing. Beautiful architecture and friendly business owner. U gotta walk the slopes.
124,3.0,"A decent view of old Korean houses, many which are still residences. I have a mixed feeling about this place - as much as I want to walk around and see more of these olden architectures and there are official tourism officers roaming around to help in directions, we saw banners than hinted that tourists aren't that welcomed. I can fully understand - if you are a resident, you wouldn't want to have tourists roaming in your neighborhood, taking pictures and making noises!"
125,5.0,- cultural experience we even rented Hanbok to take photos from the Hanok Village - a place where historical places / houses are preserved
126,5.0,The streets and buildings are well preserved and served as residences for the locals. A lot of photo opportunities. However the locals seem to dislike the throngs of tourists flocking to the area and have put up banners stating their displeasure with visitors.
127,4.0,Its a few streets where there are old houses. The houses are occupied and you can stand outside on the streets to see. The houses are all along the hill so you will need to climb up
128,5.0,"Do the walk to Bukchon, eat at the samgaetang ginseng chicken restaurant and sip coffee at a nice cafe"
129,4.0,"Before arriving at Bukchon Hanok Village, I thought it would be streets and streets of old traditional buildings. But for some reason, it was smaller than i expected. Maybe we also went during the summer and there were fewer tourists around. The structures are REAL houses of people inhabit and they have many signs that said ""to be quiet"". I guess they're not too fond of tourists visiting their homes. There are also plenty of hanbok renting stores outside so you can rent the costumes and have a photoshoot there. Overall, we spent about 30 minutes to an hour exploring the place."
130,4.0,If you wish to come here please get hold of a map. The map detailed the required walking route and photo point. The weather and the slope is a killer and not suitable for elderly with walking issue. There are also volunteer tourist information ambassador going round. So if you need help just ask them!
131,3.0,"This unique place is really in the heart of Seoul, Korea. We really amazed the Korean's preservation of their ancient houses which still exist to date. This is one of the place you need to visit in Seoul."
132,4.0,"Had a great wander through these streets dotted with cafes, art and boutique pieces of souvenirs. Lovely vibe and saw many people dressed in rented traditional gear strolling around here.It’s very accessible from the palace and would be a recommended stop for those interested in doing a walking tour around the area. Plenty for all ages."
133,5.0,"Such an interesting place with lovely views, many flowers, trees, old houses and some amazing activities for families and youngster. You should go in early morning to feel the peace and the stillness there!"
134,5.0,"Even though many houses are built new and people don't live in old styles, this is still amazing place to feel old times.- Fun fact is to see lots of foreign tourists trying Hanbok on.- Good to have a connected trip with Seochon, Gyeongbokgung, Insadong, Changdeokgung, Changgyeonggung, Naksan Park, Jongro Street and some other places."
135,4.0,"At the Northern edge of the city lies the traditional village of Bukchon, A must see for visitors to imagine how life was like in Seoul before the high rise apartments took over the landscape. Making the effort to walk up the hill through the small streets is worth it with great photo opportunities of the old houses with Namsan tower in the back ground. Stop for a coffee, cake, street food or try one of the many Korean restaurants for a taste of the local cuisine. While the distances are not far there are plenty of stops along the way to keep occupied for a few hours.  On weekends start early and plan for lunch there. Evenings are also good but can get busy. We went with 10 YO boys and it was fine."
136,2.0,Residence here are suffering with tourist. You better explore other place. Nothing special here just make you & your feet fatigue. Trust me.
137,4.0,"Nice neighbourhood to walk around since the houses are mostly the traditional houses. Be prepared for an uphill climb if you were wanting to walk up the village. Fairly small and quaint streets with nicely decorated gates, some of which are shops while others are residential, although most of the souvenir and food shops are at the lower end of the village. There are signs around asking you to not talk too loudly. There was one house which looked like a museum. You could go in to see what one of these houses look like inside and it was free entry. Most of these houses have electronic gates and garage openers. The houses slowly become more modern as you walk away from the village."
138,5.0,"People who wants to take photos are not allowed to make noise. It's great for photos and to walk around because its quiet. though there are too many people/tourist there, some are wearing traditional clothes that you can rent. Great experience for me as I'm into vintage stuff."
139,4.0,The street is narrow and you can see beautiful Hanok House side by side. There are some coffee places too. Do keep your voice low and do not disturb the quiet and peaceful environment there. I believed it is a good experience to stay in Hanok house.
140,4.0,"Nice place, easy walk from the palaces, full of good cafes and restaurants. We had a very good time here"
141,5.0,"A nice little cosy place for introduction to Hanoks, Korean traditional houses, in Seoul. One will find several signs of ""Silence Please"" as people still live here. Our guide told us that there are mostly used as vacation homes. It might seem intrusion into their privacy with loads of tourists invading the narrow street. Only a very few houses are open for visitors. We couldn't cover the entire stretch as we were tired coming here after visiting Gyeondbokgung palace, but I would believe its worth a stroll."
142,5.0,This is the best Hanok village in Seoul where one can get to see the architect and the beauty of the buildings. Walking around and taking photos here is good.One can also rent the Hanbok and experience being a Korean back to the olden days walking around the village in it! 🤩
143,3.0,"It was a hike which we didn't mind. We followed a walking tour but yet we still didn't learn much. Houses were well, houses. Don't get me wrong. I totally adore beautiful architecture. The houses were nice but they are all rebuilt with new materials so it looks astonishing new. Comparing with Kyoto and the alleys of Shanghai, this place pales in comparison and it's extremely touristy with tourist traps all along the way. It's a nice walk but if you don't have time, give this a miss."
144,3.0,"The Bukchon Hanok Village can be accessed via Anguk Subway Station Exit 2. This village is famous for its Bukchon's Eight Views for photography. We dropped here to have a look of the traditional houses in this village before heading to Gyeongbokgung Palace. The design of the traditional houses was beautiful. Since this village still occupied by the locals, hence the visitors must be ensure quietness is to be observed. We were here early in the morning, hence we could take various pictures without others appearing in our pictures. There is a shop for Hanbok rental located near the entrance of this village."
145,4.0,"I thought I was going to see a lot from this area but was wrong. It’s basically a small residential area with traditional homes from many years ago. You can appreciate the design/structure of the homes made of wood. There were a lot of tourists walking around, there were signs all over the place to be quiet since it is a residential area to this date. The streets are really narrow and long. I rented out the hanbok dress at the store closest to the entrance of this village. It was pricier than others, but this was my last chance to dress up :).When we walked down out side the village, we came across the chicken ginseng soup resto, it was delicious!"
146,3.0,"If you are curious how the residential area of the Koreans look like, you can drop by here. Maybe take a few photos, maybe an hour will do. This has become a tourist spot so you see signs of the residents to ""keep quiet"" to respect their privacy. Small village, nothing much to see and do."
147,5.0,Good experience to see the 'older' side of the residential area. Most of the houses are well kept and clean. Many tourists rented the hanbok to take pictures.
148,2.0,A few houses along a steep slope with some shops selling souvenirs and ice-creams nearby. not worth the visit. Waste time
149,4.0,Place was easy to find with Naver Maps app. It’s basically an uphill walk and a quiet residential area. Good for exercise those legs with steep hills. Many areas for Instagram worthy photos.
150,5.0,I feel sorry for the people that live in this neighborhood. There are signs that ask visitors to be respectful and speak quietly. But the chance to see Korean architecture is not to be missed. They have beautiful homes and views with some shops that will allow you to go inside and see what the home is like on the inside.
151,5.0,The Bukchon Hanok village is up on a hilltop not far from the hustle and bustle of the center of Myeongdong and the Palace. It 's a fairly steep climb up through the narrow  but picturesque little streets. Inside some of the homes are workshops selling or teaching Korean craftsmanship.  There is a nice view of the rooftops from the top of the village. The doors on some of the homes are quite ornate and fun to look at. Walk down the hill and stroll through the nearby shops and cafes. Nice place to spend about 3 hours.
152,5.0,Must experience. Rent their traditional costumes then tour the village! Great for unlimited pics and memories.
153,4.0,Went to the Bukchon Hanok Village and it was a trip worth making. The traditional house is really nice.
154,4.0,"It's a nice place to visit, you can even rent their traditional Hanbok costume for taking pictures around the Hanok Village, costume rental costs 10,000won per hour, hairdo + 5,000won"
155,4.0,"Take a walk through this ‘village’ to get a taste of what Korea was like before Seoul became a megalopolis. More like several, wide city blocks Bukchon village is a nice mix of narrow streets, tea and coffee houses, museums, craft workshops and little shops interspersed with private homes from modest to quite grand. Stop at the visitor center for a map with a nice walking trail laid out and then be prepared to wander for the next hour or so as you explore. Tip: stop at the tea museum (top of the trail) for a great view of the village and surrounding area. It costs 5,000 won to get in but includes a nice cup of tea with your view."
