,title,text
224,4.0,"Bukchon hanok village very near to Gyeongbokgung palace.From main gate of Gyeongbokgung palace we just follow the street and then turn left after that just go straight untill you find the street name at right side.( you need to cross the street).Btw,its better you if you get a map from tourist information office.so many people wearing hanbok around this place.Great experience.In small street got many mini shops which sell cloth and light food."
225,4.0,"Road abit steep at some point, would required to walk up slope.Do wear comfortable shoes.Beautiful place for photo taking."
226,4.0,"My family took subway (Dark Blue line1) from Seoul station for 3 stops to Jongno 3(sam)-ga and transfer to Orange line 3 for 1 stop to Anguk station. Exit 3 and walk towards Constitution Court of Korea, and carry on walking for another 5 mins up slope and you should be able to see the entrance to the conservatory Bukchon Village. For those who has plans to try out their traditional hanbok costumes, one can try renting them in Anguk station or shops around the station. One advise is to go early so one would have the widest choices of prettiest and best hanbok available to choose from. Cost wise is normally 10,000won for 2 hrs, 20,000 for 4hrs."
227,5.0,"We didn't find it at first, but when we did the picturesque village was worth a look. Be awarw that there are quite a lot of tourists (like yourself) that are in the way of that perfect picture."
228,4.0,"Road very steep at some point, gorgeous architecture. Lots of tourist, beautiful scenery at the higher point. A must visit when in Korea."
229,4.0,"Picturesque, charming, hilly, rustic, stone and earth dwellings. A look backward to the traditional homes of the elite. Also, museums, galleries, cafes, traditional Hanok houses. If you make it to the top, I have been told, the view is spectacular. My bum knee kept me from making it that far. Sigh."
230,4.0,"We had a fairly difficult time finding the actual village proper, because after getting off at the right subway, you need to walk a long, long way to see any tourists. We definitely had different expectations upon arriving. What we assumed was a museum-like town turned out to be an actual residential district! People actually live in this part of town, and what makes it a ""hanok"" village is that all of their homes resemble the old ""hanok"" of Korea's past dynasties. Unless you get a walking tour with a group, you won't have any commentary at all. But if you go here yourself, you can find a hanbok rental store and wear their traditional costume around the village for 1-2 hours! I think it's a great deal and is worth the Won because the experience of wearing their costume freely around an old-school style village is priceless. It's like you're living the life of a traditional Korean princess! Besides that, there isn't much to see or do."
231,4.0,"Near by historical museums can be found, lots of shopping, food and you can see also tourist wearing Hanbok; old architecture of their houses can be seen here."
232,3.0,"if you don't have the time , then this place is worth a short visit of about 2 hours . The place is big and you might not see the real Bukchon Hanok village.  here is a tip -Get a map from the tourist office at Insadong . They are really helpful  and will point out which streets to go to.  only a few streets are worth seeing. The rest are just too modern. but if you really have time and want to see a real Hanok village then take a day trip to Yongin , ( south of Seoul) or go to Andong Folk village.  They are really two Hanok of differing eras. Yongin is reflective of earlier Joseon whilst Andong Folk village is more a later Joseon. Whilst Bukchon is more like a 20th century version of a Hanok village.  Korean drams use Yongin and Andong as film locations for Saguek dramas.Here is a tip, go to the visitkorea website and join a free walking tour with a guide you will learn so much more of the Bukchon area. Lin Lin"
233,4.0,We visited this village in the morning. It is nestled behind commercial shops and restaurants so we had a hard time looking for it. We saw ancient and traditional houses which were given to the nobility during the past. Hanbok rental are available for authentic feel during those times. I got to wear one. Amazing!
234,4.0,"Visit if you like architecture and also buying/looking at handicraft items. A lot of the traditional houses (with proper signage) are actually open for visits (free) and you can pick up a map from these locations that have a route planned out for you. At the end of the route, you will end up along Yulgok-ro 3 gil which is a very trendy and lively street with shops and nice modern/traditional blended houses. This street is connected to Insadong"
235,5.0,"Really amazed of the beautiful Old Korean House and the beautiful cherry blossoms that surrounds the village. It`s very near Myeongdong, and just get off at Chungmuro Station exit 3 then just 2 minutes walking and you will see this beautiful Korean Village. There`s a lot of activities you can try to. I was amazed of the cherry blossoms there."
236,5.0,this is a must visit place while you are in Seoul.. stacks of korean style home and few shops along the way.. has a view of the neighborhood... rent an hanbok and take a picture of yourself in one of the studios. there were many boutiques where you can pretty stuffs ..
237,5.0,"Good thing that we booked for the free local guided walk otherwise we might not appreciate as much the history and culture of this place other than seeing the type of traditional Korean house.  Started at Unhyeongung understanding the history of this palace, the differences in the gender affecting the housing and decor before walking to see the high school where Winter Sonata was filmed.  Followed by the hanok village itself where the guide also brought us to see the Kokdu museum and sharing with us which houses were used by which k drama with which popular Korean actors/actresses.  Recommend to go for this guided tour rather than walking by yourself plus it is Free!!"
238,4.0,"관광객이 너무 많아 천천히 돌아보지 못 한 것이 너무 아깝습니다만, 너무 큰 기대를 하지 않고 아기자기하게 펼쳐진 골목길을 둘러 보고 현대식 건물들 사이에 남아 있는 옛 모습들을 즐긴다면 더 좋았을 것 같습니다. 단, 음식점들이 너무 고가인 관계로 잘 조사한 후에 적절한 식당을 미리 알아 가는 것이 좋겠습니다.It was a big island surrounded by modern buildings. It is good to walk slowly through back alleys. I would like to recommend to wear Han-Bok (Korean traditional costume. there are many rental shops) and take some pictures in front of traditional houses."
239,4.0,This is a private area wherein you can see old Korean houses.  A bit steep for walking and lots of tourist.  Good to go to see the traditional houses in Seoul.
240,4.0,"nice place to take photos, especially if you already renting the hanbok and wearing them before going to this place. the perfect itinerary was going to rent hanbok around the palace, going to palace and strolling around and after that you can go to this village with that hanbok (because usually the renting time was just 2hrs or 4hrs)."
241,4.0,"This is actually not a tourist area but private residences! People stay in these homes. Try to stay quiet and respectful while exploring the area. The village has many old Korean houses. Little shops and eateries line along the streets of the exits, and you can rent a hanbok to walk in all day at a rental shop nearby."
242,3.0,"There really was nothing much to do here but take pictures and some stroll around it, so overall it was simply okay."
243,5.0,I walked on old street. There are many old korean style houses around the area. Tourists are wearing traditional clothes and enjoying like TV drama stars who act as girls in old palace. There are many rental costume shop. I wanna try someday.
244,5.0,"If you're a fan of treadmills and you've been doing the climb and these streets are all yours. The scenery is beautiful and the cultural heritage is surely there. This is not a museum nor a public place, these are people homes and they live inside there. There's a lot of warning not to be noisy and appreciate the neighborhood but seems like the local teens are the one that so noisy, all the tourists from abroad. At least when we were there, are all paying respect and keep their voices down. Many girls wearing gorgeous hanbok took pictures here and there's a delicious delicacies like octopus, taebokki. And i love the perfumery there too. A must visit for sure.  on the top of the road there's like a temple, but walking there is a bit tough,  do use walking shoes."
245,4.0,Came here after reading reviews. Managed to find after following the instructions on the street map. Walked around for nearly an hour
246,5.0,"Lived here for 6 months! WOW! Quintessential traditional Korean! Beautiful traditional buildings and you can rent out Hanbok costumes (traditional Korean attire) to complete the feeling. A part of all tourist stops when visiting Seoul, and just to the right of the Royal Palace and the Blue House. Some superb gastronomic cubby holes .... eating is Seoul is overall cheap and an unforgettable experience - after a total of 18 months ... a complete convert!"
247,5.0,"Walking through the streets is so nice, seeing the old style hanok homes, also before going into the hanok streets there's a lot of cool shop for souvenirs or for food too."
248,4.0,"pros:- charming neighbour with traditional korean house (please low down your voice theres residence within the house)- you should come here early morning to get a good picture. during day there are so many tourist walking around.- good place for photography and sight seeing- its free to walk aroundcons:- very small areas. you can finish less than 1 hour- not many store, cafe and restaurant within the areas. mostly just residence house- you need to walk around hilly areas.- not a good place to visit during rainy day- i dont see any public toilet around the areas"
249,4.0,Nice little cultural village with traditional houses.  Have good walking shoes if you're going there. There are a few good souvenirs stores as well as nice small restaurants and snack stalls. We were there on a beautiful sunny Saturday so it was quite packed.
250,4.0,Very traditional & unique..its gd tat such a heritage still exist. Explore around with my family till the top..Amazing scenaries with those many mountains.took pics with those whos wearing traditional hanok costumes. Lots of tourists n definately will come again..
251,4.0,"We visited on a sunny afternoon in late-March, after going to Changdeokgung palace in the morning. It's a nice walk through narrow streets lined with old-style houses, some of which are coffee shops. There were lots of tourists but everyone respected the privacy of the local people and kept their voices quiet. The views from the top of the hill were great and we enjoyed wandering around for a few hours."
252,4.0,"The wonderful village at Seoul, many houses with the original style and traditional things.We can wearing hanok and walking around for taking the pictures here."
253,4.0,The area is very picturesque and unique with lots of character. There are interesting shops and museums to visit in the village but the sharp inclines and windy lanes can make it tiring for some.
254,4.0,"This place just like another dimension, the architecture and design was astonishing! i mean people still living there! who doesn't want to live in a beautiful place like that? the environment was really great! also this place was really close to gweongbokgung palace. By wearing the hanbok you can get a very great picture with this place! but yeah most this place you need to have stamina! climb uphill and downhill.."
255,5.0,We went there at night so it was very quiet and very few people. You can see the N-tower from one area. We really enjoyed the HanOk style homes! Nice place to visit and take photos.
256,4.0,Must place to visit. Just be aware that this is residential area and must observe silence everywhere.
257,3.0,"It was quite a cold winter day when we explored this area. It's all outdoors so it can be difficult in the cold. But there's some shops or eateries to pop into if you must. We walked around many of the old houses and also went into some which were open for viewing, such as the tourism heritage house. Got a good feel of how the people lived in olden days. Quite a nice experience. Most of the eateries were closed from 2:30 to 5pm, so we didn't manage to get a tea time snack and hide from the cold even though we wanted to. It's just a nice place to wonder about and admire architecture and some old crafts too. The slopes can be quite steep, so people with weak knees may find it tough. Also, many houses here are still inhabited, so tourists must keep quiet and respect their privacy and take care of the environment."
258,4.0,"Seeing the Bukchon village is a good thing to do on a nice afternoon. Be prepared to walk for about an hour through pedestrian-friendly streets, but keep in mind there are some hills. If you're visiting when it's really hot, you won't want to do it during the heat of the day. Because people live in these houses there are many signs asking for quiet and respect of private property. In the busier and more contemporary area, you'll find lots of restaurants, shops and treats. Another highlight is seeing all the tourists dressed in traditional Hanboks - great for photos.Enjoy the walk and the nice architecture."
259,4.0,"Quite uphill so be ready to walk, plenty of souvenier shops around and coffee shops for breaks and rest."
260,5.0,"We went to the Bukchon Hanok Village.  Be prepared to walk. The roads are very narrow and steep but it's worth the visit. However, it can get a bit crowded. It was very nice to walk along the houses. There were Street food along the way."
261,4.0,Nothing much to mention about the area but one thing is worth mentioning was the samgyetang chicken we had before exploring bukchon village. food was great at affordable price
262,3.0,"Nice traditional houses, interesting to look at. Some spots are great for photo taking.  To view the inside of a house, you can get into one that has ongoing activities to have quick look and a few pictures - leave shamelessly if you are not keen to pay for joining, which we did. :P  Does not need very long to finish the whole area, they look quite the same after 30mins."
263,5.0,The Bukchon Hanok Village is a testament to the old Korean culture and history as hanok or traditional Korean houses were preserved. We joined a free walking tour offered by the Seoul Tourism Organization wherein we learned more of the history of Bukchon Hanok Village through their volunteer tour guides. This is a valuable and enriching experience for tourists.
264,4.0,"A great place to walk around and discover different activities and shops. It's an actual area where people live so be mindful of the residents. Come before 5 to experience the handiworks and the hands-on activities. We came too late for it, but it is still a picturesque area to meander."
265,3.0,Bit of a letdown this traditional village. Place looks deserted except if you admire traditional korean architecture. Its a bit like a hilly walk behind back alleys. Nothing much to see.
266,5.0,Traditional house area to walk around. Surrounded by busy traffic and modern buildings yet the premise is quaint and picturesque. Modern meets traditional architecture is amazing too.This is residential area so quiet is a must in order not to disturb the people living here. Some slopes very steep and it’s all about walking up and down. Worth a visit!
267,4.0,Ancient village in the city. There are many nice shop near this village. Don't miss to visit here. This place is far from subway.
268,4.0,"The street is lined up with traditional Korean architecture. Good for photo taking. There is hanbok rental shop nearby $18000w per person for a couple of hours. Lots of tourists, can't take a photo without people in it."
269,4.0,"This area is really near the Gyeongbokgung Palace area and it should definitely be in your itinerary for visit as the houses really are traditional and worth visiting. There are plenty of cafes and small houses operating as restaurants serving traditional Korean dishes, cafes serving coffee and cakes, and there were also an area for shopping. I particularly liked a shop which sold traditional Korean clothes though it would be weird for me to be wearing them out of Korea so i decided not to buy them."
270,4.0,"The whole area is basically a residential area with an traditional kind of architecture. It's nice to spend some time and have a slow walk around these houses. There're some stores selling things too. Things that are sold here are usually a bit pricy than outside. However, we should lower our voice while walking around as its a residential area. It's worth going to take some pictures and to know more about Korea. :)"
271,5.0,"These are the traditional type houses and contrast to the more modern dwellings in other parts of the city. There are hills and steps so it is a physical activity. Local shops are also a high;light with some nice craft stores along with the usual cheaper socks, etc shops"
272,3.0,Fully immerse yourself with the preserved houses by dressing up with a hanbok. Just be sure to be quiet and to not knock on the houses as they are privately owned as well
273,4.0,"It is a village with traditional Korean homes, or known as HANOK. There are 8 photo spots to look for. However you can still take photos anywhere and everywhere. To go here take a subway to Anguk Station (Line 3) and go out from Exit No 2."
274,5.0,"If you're a fan of K-dramas, you will definitely feel like one of the characters here. It's one of those scene where they climb up the hill going home or something like that (Haha!) You'll be able to go into one of the houses and see what it looks like on the inside. You'll also see people wearing the traditional Hanbok."
275,5.0,Worth the time exploring this quaint and serene village. The houses were unique and the scenics were picturesque. Plenty of tourists as you would expect but there are enough spaces to take the perfect photo. A must-go if you are in Seoul!
276,3.0,"We spent about 2 hours exploring the Bukchon village. As there are residents staying inside, we have to keep our noise level to a minimum. There are quite a few streets that are more traditional than the rest. I just hope that the new building are not invading the old style buiding structure further, else this village is not going to retain its tradtional images."
277,4.0,"Love the old traditional houses and tiny alley ways. And with little quaint shops peppered all over with good cafes and eateries, it is indeed time well spent on a cold afternoon."
278,5.0,There are quite a few of traditional Hanok spread across the streets. All are very unique and quite well maintained.Quite a pleasant walk along these streets even in cold weather.
279,3.0,If you are going to this place just to take photos. I will advise you to find the actual locations of the spot that you planned to have your photos taken. I went to this place twice in my trip and I spent hours running up nad down to find the 'right' spot.Please be prepare to trek the uphills
280,5.0,"We stayed on one of these traditional houses that was converted into a hotel/homestay.  Really lovely experience to be in such a cosy home.   The owner was very helpful and upgraded us to a room that had an adjoining toilet.  My family of five slept comfortably in the two rooms even though they were kind of small.  The village or area itself is quiet and is a great place with quaint little shops selling souvenirs, clothes, Jewellery.  They aren't tacky shops but are shops that sell affordable local brands. Most of the shops are located along two main roads  but you won't find it as busy or crowded as Myeongdong which is another experience of its own.  So while most tourists spend an afternoon walking and looking and the old houses, this was actually a nice refuge and charming place to spend a a couple of days at.  We really enjoyed the cafes and interesting shops that we could take our time with and not be hassled by crowds.  From here we could venture to Insadong which was nearby."
281,3.0,"We strolled Bukchon and saw many houses with characters. Some are shops and some are residences. We went inside a few shops partly for souvenir and partly to just look at those houses.Due to the high volume of tourists, there were often local people held up signs to ask tourists to be quiet."
282,4.0,"Really worthwhile to visit and to combine with other visits to local palaces and the Insadong shopping area. You can start with this village and continue to the palaces on walking distance, then end at Insadong."
283,3.0,"Bukchon is just a residential area with a taste of old Korea and most of the houses were locked and closed when we visited there. Need to walk for 20-30 mins along the wall of Gyeongbukgung palace before reaching Buckhon. Do take bus or other transport to reach Bukchon. Honestly, nothing much in Buckhon and should be able to complete the area by 1 hour."
284,3.0,"I would probably put this area near the middle or bottom of your list for places in Seoul.  Yes, there are some nice old houses in a residential area lined with very narrow streets.  The houses are on a hill so there are some nice views available, but it may require that you have a prerequisite good health to walk the hills.  And because it is a residential area, there are numerous signs and people (dressed in traditional Korean garb) standing with signs asking tourists to keep their voices down.There are also some restaurants and shops on the outskirts which provide some shopping opportunities.However, the area really doesn't warrant a must-see status..."
285,4.0,เป็นหมู่บ้านวัฒนธรรม ที่ยังคงรักษาสภาพอาคาร บ้านเรือน ในแบบดั้งเดิมไว้ได้อย่างดี สวยงาม มีจุดถ่ายภาพมากมาย เดินไกลนิด เหนื่อยหน่อย แต่ก็คุ้มThis is the cultural village that remain old style and beautiful. Although it's a long way for walking but valuable for photographer and most visitor.
286,3.0,Requires lots of walking up hills and downhills. Not suitable for elderly or children. The view is not bad. Visitors should wear proper shoes for this attraction. Sports shoes is highly recommended.
287,4.0,"This is Just an alley to take good photos of the traditional Hanok village in Korea. Hanbok rental are also available for 10,000 krw. This is a beautiful place to Visit, You just have to be quiet because this is a residential area. Bukchon is 5-10 minutes walk to anguk station. Visit this place at Around 8-9AM because Group/bus of tourists usually arrives after this hour which makes it a little bit crowded."
288,4.0,"It is a great place to stroll if you want to know the Korean house that is actually with people living inside. It has a lot of walkings to do and the area is flooded with tourists in rented hanbok, so it makes you difficult to take some good photos as every corner you will bump into people."
289,4.0,"Rented hanok & walk around the village. Makes you felt like a Korean. Hanok give us an impression it is heavy but after experiencing, weighted much more lighter than expected. Mistaken as Korean & had some pictures taken with other tourists."
290,5.0,We had a wonderful time exploring this village! Quaint & insightful. Highly recommended. Will come back again!
291,4.0,This area is fantastic to wander around in. The village is nice to see and there are many great little shops and quaint cafes.We stayed one night and liked it so much we changed our hotel booking to stay another night. Definitely try staying in a traditional hanok for the night!
292,5.0,Beautiful Korean traditional house. Walking distance from Insadong. Uphill location so be prepared to walk. Must see place.
293,5.0,Very pretty street with loads of quaint cafes and shops along the way. A must visit when you are in Seoul!
294,5.0,"I recently visited Seoul with my husband and 4 month old baby. We stayed in a traditional hanok in the Bukchon area on our first night and loved it so much we cancelled our accommodation closer to town and stayed on in an airbnb. Loved the area, great cafes, restaurants, galleries and shops. Easy to walk to streets, easy access to the palaces and also the subway for anywhere else. Would highly recommend."
