,title,text
0,5.0,This is one of the best area's to stroll through while getting a feel of the old city. The village is basically made up of Hanoks (traditional Korean houses) and little food stalls and restaurants. We enjoyed discovering this little gem by lazily walking through different by lanes.
1,5.0,"This was a lovely experience with my girls!!! We got dolled up for the traditional dresses- hanbok, going around the neighborhood.  The houses were so beautiful.  The architectural designs of each house was jus amazing."
2,5.0,"Ancient village in Seoul, where there are still residence living there. There are scouts who try to remind visitors to respect the residence and not to be loud while visiting .Many instances able pics can be taken here."
3,5.0,Visited this place on a cold Saturday. Went up to the youth cultural corps and they provided high school students to help guide you along the place. The two student guides were super informative and helped provided so much info and thus such meaning to the place. Overall it was intriguing to get a sneak preview of the lifes of these Korean officials. Especially like how they dried persimmon  and make alcohol.
4,4.0,A fine example that modernity does not have to obliterate the old world. Of note are the hanoks which have been taken over by the city govt to preserve and be used as mini-museums.
5,5.0,"This small, quaint village was a lively place to visit. It presented a lot of traditional housing and Korean day-to-day lifestyle. Although it was a bit of a hike, the people were lovely and were confidently showing us their various artworks, handmade clothes and so on. The architecture was sensational and having a Red Bean Pankake is a must-do! I would advise being cautious when bringing young children or large groups as it could disturb others and they have posters almost everywhere about remaining quiet. The village itself links into the main town which is also advisable to visit, and is nearby to other attractions."
6,3.0,It's a peaceful place to shop after visiting gyeongbokgung palace. There are tourist guides around to assist tourist. Rmb to visit Granhand shop for their local scents
7,3.0,It's easy to find the moment you are out of the subway because you will see people in costumes & costumes rental shops.Nice little area but too touristy and I find it sorry for the people living there.Many China tourists and they can be overwhelming.Remember to keep quiet and civilised when you are outside the residences.
8,5.0,"Been here last Dec 7, 2019 and the first day of snow! Totally awesome experience for us who came from the Philippines. From MTR Anguk station exit 2 and walk straight. And Red clad tourist guides were visible giving assistance. Nice traditional Korean houses to see."
9,5.0,"As u walk from the subway station towards Bukchon Hanok Village, look for the tourism ambassadors decked out in bright red uniform & hat. They will offer u a physical map and recommend a route for u to follow so that u will not be lost figuring out where to go inside Bukchon Hanok Village. The walking route is highly recommended as u get to see lots of stuff which u might miss if u cluelessly wander around."
10,5.0,We spent almost whole day here walking around. Bukchon Hanok Village is the real residential area with 900 hanoks. There are many interesting photo spots here especially when you put on the rented Hanbok!
11,5.0,A great and beautiful place to visit. You need to be quiet while walking along the area as there are people living there.
12,4.0,Very interesting to see a traditional Korean village in the middle of Seoul.  Wonderful wooden doors lead to secluded courtyards and private areas where people live. Rather steep hills await the walker. Cafés are nearby.
13,4.0,Nice to visit this kind of place that reminds the Korean Culture and History. The place is clean and tourist friendly especially the shops and cuisine near the area. Keep up the good work. Will visit again and tell our friends to visit the place. Thank you
14,5.0,"Lovely quaint place with plenty of little shops offering good food, coffee, dessert. A bit of a steep walk but wee worth it. The place gives you great photo opportunities."
15,4.0,"Personally not impressed with the visit while one do see the Korean style homes and some of the traditional arts like dyeing with natural substance, incense making etc. The center is good but not sure I will consider it as a must see"
16,3.0,"It is a good spot to view older buildings, is Hanok style. There is a popular trail that many visitors take, which makes some parts of the street rather crowded.Given that the village is sandwiched between palaces, it is nice to walk through the village after visiting one palace and on the way to the other. Overall, I found only a few spots in the village that was nice but awfully crowded. Perhaps coming earlier in the morning would have been better."
17,5.0,"We visited here and decided to dress up in traditional hanboks. They rental stores are all around and rent on an hourly basis. The village itself is lovely to tour around and get great pictures of the hanoks. I would highly recommend, esp silly if you have children, dressing up. We had a great time and it made for wonderful pics."
18,3.0,"The taxi ride from our hotel in Gangnam-gu to Bukchon Hanok was 32000 won. What makes it worse was that the Naver Map direction didn't bring us to the correct spot. We were left at the end of the street near a park and had to walk for 20 minutes looking for the old village. Well not exactly old. Its a residential area with old houses and people still live in it. Snap some pictures and good to go. One of the checklist. And oh yeah, decent amount of climbing needed especially when with kids"
19,4.0,"You'll need your walking shoes to get up there. Steep narrow roads but for those who love Korean architecture, this is a must see. Fantastic view of Seoul skyline from the top of the hill too. Breathtaking. Got to keep your voice down though because there are people living in the houses."
20,5.0,Its a very pretty housing complex to walk in small alley. The houses are very pretty!! There are 2 side areas that you can visit. If you get lost there are local guide which offering you help to reach the area.
21,5.0,"This is a MUST! to visit, this place is definitely one of the most important historic places in Seoul, you can find lots of souvenirs and also rent a traditional Hanboks dresses and much more."
22,3.0,This village is actually local residential area. There were shops that provides the traditional hanbok where tourist can walk around and take pictures. You don’t really feel welcome there as there were few protest signs on local unhappiness.
23,5.0,This Korean traditional houses are interesting and for me a must experience. The traditional villages have lots of alleys and the house have open air in the center court with rooms around it. We stayed in one of them in order to have the sleep experience. Sleeping on the futons and enjoy the close community.
24,5.0,"Great place, great atmosphere, a must visit before even other places. Need an hour to two hours minimum."
25,5.0,"Bukchon was really the only thing I wanted to see in Korea. We went on a tour and I was quite disappointed, not by the village, but by the tour guide who rushed us through. It also started pissing it down raining. I managed to get some decent shots which I have to edit, but I could have used more time. The houses are all still inhabited and are worth upwards of a million dollars each. Although the facades are required to be preserved, the interior of the houses are all very modern and updated. There's signs asking tourists to keep their voices down, no loud pictures, music or talking. I guess some rude westerners had caused problems in the past. Anyway, bring comfy walking shoes as there are a lot of hills in the village. Bring a wide angle lens as well."
26,3.0,This is a cluster of Korean houses (Hanok) situated nearby the palaces in Gangbok.Most of the houses have been modernised but maintained the traditional Korean architecture design.It’s on an incline and may be a challenge for older people or parents with strollers.Generally a residential area and will have to observe general etiquette when visiting this area.
27,3.0,"Many nice traditional houses, there are so many shops and cafes on walking street. But it’s so crowded, some people talk loudly even though they have attention boards. It made us not enjoyable, although its great place to visit. Luckily we went to another part, its a short street. less people 😆"
28,4.0,"Picturesque village, can have a walk around, and look at the old style buidlings, also lots of souvenir shops and food"
29,4.0,We rent a hanbok in Bukchon Hanok Village.  It was a beautiful place for taking pictures in a hanbok. Many historic and ancient korean house there. Overall it's beautiful.
30,4.0,"It is nice to walk around the area if you are in the city. Up & down hills with ancient houses, nice small shops & restaurants, cozy cafe & design goods, this is the area worths to spend at least couple hours. Popular cafe houses, restaurants, photo taking spots & local and ancient life sightseeing can be all found.如果你在首爾，這裡肯定適合走一走，上坡下坡於老房子、很不錯的小店和餐廳、舒服的咖啡廳和設計小店，這個地方可以花個幾小時慢慢走一走，有名又受歡迎咖啡、餐廳、拍照熱點和當地又古老的生活在這裡都找得到。"
31,5.0,We visited on a Sunday morning while it was quiet. So able to walk around freely before the crowds. Amazing photo opportunities along the route. Ditch the guide book and just go for a wonder. Free museum and galleries also made for interesting tour. Steep roads in some places. What an amazing place the neighbourhood was aliving museum. Well worth the 3.8mile walk.
32,5.0,"Cobble line streets, historical neighborhoods, swanky cafe's, eateries, easy access by metro, quaint neighborhoods make this one of my top destinations in Seoul."
33,3.0,"it is very tiring to climb all the hills just to get to the photo scenic spots, but i think they're worth it..? the view is really nice. on the base of the path there are some shops around too. i wouldn't go again, but once is good enough :)"
34,4.0,"The walk through this traditional neighborhood was enhanced by visiting a home that the city had acquired and opened to visitors.  We were able to walk into the courtyard and then after removing our shoes, enter the house where 3 rooms were available to us to walk through.  In one room, traditional tables and chairs were setup on the floor but it was not so easy to sit down.  In the other rooms were displays of vases made out of wood and a person was available to answer questions.  We continued walking through the very narrow and sometimes steep streets looking at the other homes and cafes.  We also stopped by the Bukchon Traditional Crafts Experience Center which was a building that housed a number of local craftspeople who taught you about traditional Korean crafts for a small fee."
35,5.0,The area is not very big but you can get disoriented and end up going around in circles. Best to go with a local or plan your walking route well. Buildings here are beautiful and some are renovated so you can spot the difference roofing modern and original. Do look out for the beautifully hand crafted clay tiles in some of the original roof of the Hanoks. Do make a stop at the Baek Inje House in Gahoe-dong area. This is free and you can see the interior layout of a typical Hanok house. Absolutely beautiful!
36,5.0,"In this village, you will see a lot of Traditional Korean House with various model. A lot of tourist will take picture witb the background of this house. This is a must to go place if you visit seoul."
37,5.0,"Don’t miss this place. This is one herritage place with lots of thing to do. But must be quiet because this is a real village, there still have people stay here. Almost shops will close at 5 pm. Reccommend be here in the afternoon after visiting Gyeongbokgung Palace."
38,3.0,"Family of 3 adults.  We would include this as a PART of your day - early or late.  Too many tourists in-between :(  However, for those tourists that hire the Hanbok costume … and to see them here... adds for thinking of what it might used to be like in the old days: 600 years ago!  Also, just South nearby, is a restaurant called Warm Kitchen, Share Kitchen (opposite the Library and just beyond Pink Butter café in Samcheong-ro 2-gil Road - where you will see a man in a Panda costume to entice you in: don't be put off!) which was a very tasty place for a quick lunch and good value :)"
39,3.0,"We got lost searching this place, even when we asked around and was using the Google maps. It was beautiful but a bit crowded. Not really a ""must-see"" in my opinion, but the houses looked beautiful."
40,5.0,"This year we choose spring for our vacation.It was our 2 yrs wishlist and this year we found it by walking from myeongdong area and if we knew it was not far from our hostel stayed back in 2017..We rented a hanbok & we can walk along the area with our hanbok,why not right?Our hanbok this year i can say it was more pretty that our hanbok we wore at Ihwa Mural Village back in 2017 🤭🥰"
41,5.0,It is a lovely residential are with beautiful houses on every street and corner. Here you can see people wearing Hanboks (you can rent them from the shops nearby) walking around. Take a nice leisure stroll along these lanes and you will see the beautiful architecture of these old houses. You will also find delicious and cheap fresh fruits and local sweets sold from a truck. I didn't want to upload pictures of people's homes in respect of their privacy.
42,5.0,This is a beautiful village with ancient architecture and traditional house of Korea.Beautiful place to have good photos.You should visit here early morning because of crowed people.
43,3.0,It's a residence area. Better come here on early morning because so many people come here to take photos. People shd be quiet if visit this area. Only 1 alley which famous with its hanok house and so many people took photos here with hanbok. But nice to walk around this area and took some photos with hanok style house using hanbok or not. The road is quite step. So it's not for elderly people. Also near to changdeokgung palace.
44,4.0,"i take my kids here to learn the traditional house of Korea, a lots of wonderful home to see, even some of we can't take a picture of it"
45,4.0,this place is not really a tourist place but Koreans actually stillare living privately in this place. It is a good place to see the old way of life and culture. You need to be very quiet when visiting this place. Nice for picture taking.
46,4.0,"Bukchon Hanok Village is pretty much close to Gyeongbokgung Palace. After visiting the palace, you can walk yourself to this heritage village with ease.PROS:-Paved road going to the village. If you’re bringing kids in strollers, it will be easier.-Since this is located in a residential area, even if there’s a lot of visitors, you will feel the quietness of the area. -Tourism staff are everywhere in case you lose your way. You’ll also see them bringing placards reminding everyone to be quiet.-You will also see a lot of souvenir shops in the area. Some food stalls too in case you need something to munch in.CONS:-There’s nothing much to do other than take photos with the old houses as your background-Tourists flock to the area on a daily basis so be prepared to get your way to get good photos-If you’re bringing a car, there’s not much parking space available as the alleys are really narrow. Street parking is not a good idea.-Get yourself ready for a lot of walking.Will I go back to Bukchon again? Probably not but it’s always good to see these types of heritage at least once."
47,4.0,"Place to visit while in Myeongbokgung palace, you can walk or take the bus to the village. They have good restaurant, authentic korean food. Try Beef Bulgogi, chicken soup, and kimchi fried rice."
48,5.0,It was our first afternoon in Seoul and we wandered around here for a few hours in the spring sunshine. Although it is allegedly closed on Sundays it certainly wasn’t. Many a Korean here dressed in hanbok’s added to the scenes. It may not be suitable for those with walking difficulties as much of it is up and down hills.
49,5.0,"Despite the crowds, this is a lovely place to visit. Seeing the architecture and knowing the history of the area makes it worthwhile. Finish the visit with a pleasant spot of tea at a traditional tea house."
50,5.0,Not necessary to wear your rented Hanbok here but is was gorgeous as easy enough to get to from main palace. This is the place to find a tea house.  Sorry that I did not mark the location or name of tea house but the owner mentioned that the home is her inheritance. The teas were excellent and this is a lovely strolling area.
51,5.0,This is embarrising but pretty. We ate in the village then we put dresses. Even  onni suri she weared the hundok.
52,4.0,This is a very well kept ancient village that was traditionally the residential quarter of high-ranking government officials and nobility during the Joseon Dynasty. It is a very pictureque place for photos as it is set on on small hill overlooking the fringe of the city.
53,3.0,"I have brought my family to Japan, Indonesia and Thailand. This Bukchon Hanok Village is average compared to the other places my family has been. My kids took minimal photos..."
54,5.0,Came on a quiet cold morning and there were plenty of photo opportunities. Just walk around to enjoy the views and soak in the atmosphere.
55,4.0,We walked around this traditional Korean village. The area is vast and as such a lot to see. You will be able to see traditional Korean houses back in the olden days. Overall a nice area centrally located. You will also find a lot of locals and tourists dressed up in traditional Korean outfits. It’s a place kids will also enjoy walking around.
56,2.0,I think we just need 1 hour to explore this place. Only for photostop around the korean houses and there are many shop for rental hanbok and some souvenir shops
57,4.0,"Bukchon Hanok Village is a quiet Korean traditional village.  It has long history and composes of tight alleys, traditional yet beautiful houses.  However, the village is still houses to many Koreans so there's a lot of signages requesting the tourists to keep the noise level down.  Do also note that the alleys are quite steep so may not be suitable for the elderly to visit this place. Overall, a beautiful place to visit but remember to keep your noise level low."
58,2.0,"Not as exciting as I hoped it would be, but it was December and the middle of Winter, which also made it unpleasant.The architecture and village layout is fascinating, but unless we missed the right spots and location, there was not much to see.Please research before you go."
59,4.0,we toured this village and went thru the whole village with its peaceful courtyard. we learnt of its history. highly recommend
60,4.0,"A hilly neighborhood with hundreds of traditional houses or hanoks bating back to Joseon Dynasty, this Bukchon Village which is in the north-central part of Seoul lies between Gyeongbok and Changdeok Palace. Though most of these Hanoks have been converted into tea houses, restaurants or guest house, art galleries, some are still held privately. Lot of efforts have gone into these hanoks to keep the original form intact. The village also has an old well called Seokjeong Full Moon well which in ancient times was the main source of water for the entire village. It is believed that this well provided clear good drinking water only for fifteen days and unclear water for the next fifteen days. The village women is said to have also believed that drinking this water helped them to bear a male child.Not to be missed, the attraction requires lot of walking so for those your are regular walkers  may find it a bit difficult here.This place can be easily reached thru the city bus or metro. The visit to this place can also be clubbed along with G Palace."
61,4.0,Reachable via metro orange line and off at Anguk station and about 10-15 minutes walk north and you won’t miss the place. It’s crowded and hard to take a good photo but if you’re lucky it’s a nice nostalgic place especially if you’re wearing their traditional hanbok dress! Be Very careful when you rent the dress since every additional ornament is chargeable. People are warned not to make to much noise since the place is actually residential but most tourists can’t resist making loud voices! It is advisable to come here during week days to avoid over crowding.
62,3.0,"Maybe because there were just too many tourists when we were there to take any nice photos. However, still interesting to know that these traditional houses actually have residents staying inside."
63,4.0,"Old heritage house built hundred years ago . Close to the palace where still have the residents live in. Good location for many tourists to change to korean costume and take picture in this village. Nothing really big deal to me once you have visited to china. However, too many through out the year and hard to talk a good pictures in my view.."
64,4.0,"You get to spend approx 1.5-2hrs to see local traditional houses.Besides, you can rent the Hanok from the shops and take some nice photos.Along the way, you can get see the high school featured in goblin Korean drama"
65,4.0,"Do take your time to explore the neighborhood. Wonderful architecture and feel of the place is amazing. Plenty of nice eateries. But do be respectful as you walk around the residential area. People still do stay in those houses. Being Respectful includes not talking at the top of your voices. Seriously, no one enjoys having so many tourists /outsiders thronging your front yard whole day long.."
66,4.0,"This is a village with traditional houses beautifully conserved. These are both owner-occupied as well as converted into shops selling jewellery, souvenirs and restaurants.  You can also get a walking map of the Bukchon Hanok Village from the tourist centre nearby. Definitely worth a visit. Do note that the elderly and those who have difficulty in walking will find this place challenging."
67,5.0,A nice photographic view of traditional Hanok houses. Not allowed to make noise as this is still housing area to some.
68,3.0,"Although it is considered as an iconic historical dite in Seoul, the truth is that this street is quite overrated, crammed with tourist, and the people living in this area are so tired of tourist visiting this street that they have posted “keep quiet” and “do not come in” signs all over the street.The whole visit is uphill so, if taking a stroller or wheelchair along for the ride keep this in mind.The ice cream shop at the first turn of the street, near the entrance, is quite good."
69,3.0,A really lovely area in Seoul where you have traditional Korean architecture.A wonderful place to go for shopping and eating. We just strolled about and tried out some of the superb Korean bakeries.Easy to get to on the metro.
70,4.0,A nice place to see because it is surrounded by high rise building.  Hanok village is a traditional korean house.  You can feel korean tradition in this place.
71,3.0,This showcase village depicts ancient korean life with mannequins in an old setting. It's free admission but the entrance is a bit difficult to find.  We stumbled upon it.
72,4.0,"Bukchon Hanok Village is a residential place with beautiful old houses. It is quite a walk from the train station and still an uphill walk to see the houses. Walking there, you'll pass by mamy shops with interesting souvenirs and other items. You can also rent a traditional outfit for a little cost.There were several tea houses in the village.The houses were beautiful and reminiscent of the olden times. It just feels quite wrong to walk around a village where private people still actually live. Tourists are not too welcome there, as evident in the signs around.We stayed for less than 10 minutes and left."
73,5.0,"I love the cleanliness of bukchon area. You can easily find a good spot to take a picture. Get your phone or camera and take a selfie 😁You can rent hanbok, a traditional Korean dress with 12K - 15K WON for an hour and feel like a truly Korean 😉But remember dont make any noise coz actually this village is residential area.Not far from this area you can find many cafes and restaurant where you can eat to fill your empty stomach after strolling around the area or just have a cup of coffee or tea to reboost your energy."
74,5.0,We enjoyed walking through the streets of the village and seeing the traditional houses.  We appreciated the presence of tourist information officers who guided us and even gave us a map to find restaurants.
75,5.0,Beautiful village indeed to walk around. But please keep your voices down around this residential area. You definitely won't like flocks of noisy people at your door front everyday. I heard that the residences there actually requested their government to ban tourists from entering that area due to some rude tourists actually go knocking the doors and entering their premises without permission.Please behave so that more people can enjoy the beautiful walkways of Bukchon.
76,5.0,"This is actually a residential area of the locals, you will see some aunties standby at the road side to make sure every visitors are keeping their voice down and not to distribute the residents. Some road ups and downs so wear comfortable shoes because it actually involved a lot of walking including slopes and downhill road. There are shops provide renting of traditional Korean costumes, it is indeed a nice place to take photos with the costumes on."
