,title,text
156,3.0,I may qualify this area as traditional...if you are a big fun of culture palaces then you should definitely visited. They are many hanok the traditional korean houses....you can take pictures inside the house also there's a palace nearby...you can also rent the Hanbok before going there from Hanbok shops nearby ... it's a very quite neighberhood where you can find nice restaurant we have tried an italian one which is very good....also don't miss a shop of traditional croissant...they're so much delicious they taste like a little drops of heaven
157,5.0,"This is a small village of traditional korean houses (Han-ok). This area was the place where government officers lived during Chosun dynasity, because of its location close to the Kyungbok palace. With an one hour, self-guided walking tour around the village, you can enjoy a scenery of korean traditional houses on narrow alleys. There are several shops where you can rent korean traditional outfits for your memorable picture. There are many attractive cafe, restaurants in Sam Cheong dong, a village near Bukchon. In addition, this place is close to other tourist attractions such as Insa dong and Kyoungbok palace. You can visit here after of before visiting these nearby places."
158,5.0,"If you imagine, pre war Seoul was filled with these traditional Korean houses you will find in this area. All lost for a more concrete solution, but here. On weekends people rent the traditional Korean clothing (Hanbok) and roam the streets which adds to attractiveness of this area, nearly nestled between the two major palaces of Seoul. There are many nice cafes and tea houses where you can relax from the busy streets and enjoy the inside of a Hanok.Do not forget to bring your camera and enjoy this glimpse into the past."
159,5.0,"Bukchon is a gorgeous neighborhood full of beautifully restored historic hanok buildings interspersed with hipster cafes, small artsy boutiques, and traditional Korean restaurants. There are two parts to the area. West Bukchon is bordered on the west by Gwanghwamun Palace and contains arts-related attractions like the National Museum of Contemporary Art, the Hyundai Gallery, and many others. West Bukchon is full of established boutiques, restaurants, and cafes. Many people take photos along the high palace walls and in front of White Birch Story Cafe because the popular K-Drama ""Goblin"" was filmed here. This is also where you'll find Artee Riders pedicab tour company - book a tour and enjoy a glass of vin chaud in their cafe, but leave room for a hottoek (Korean deep-fried doughnut filled with cinnamon, sugar and seeds) at the stand across the alley. West Bukchon also has the huge, flagship Wood and Brick bakery and restaurant, which is definitely worth a visit for excellent salads, sandwiches, pastries, and coffee. East Bukchon is just across the busy road called Bukchon-ro and is bordered on the east by Changdeokgung Palace. This area has the most picturesque streets and lavishly restored hanok houses - you could spend hours wandering the hilly alleyways taking photos everywhere. There is also a main shopping street in this area, that has more hipster, independent establishments like industrial-chic cafes and a bespoke tailor/whiskey bar called Knockers where they play Frank Sinatra and is run by the most stylish father-son duo you'll ever meet.If you only have one day in Seoul I highly recommend spending it exploring Insadong, Bukchon, either or both of the major Palaces, Gwangwhamun Square, and maybe pop into Jogyesa Buddhist Temple. They are all so conveniently located and everything is easily walkable."
160,4.0,"Don't fool yourself into thinking that this place is very close to the palace. It is quite a bit of a walk. Recommend taking a taxi. Taxis are much cheaper in Seoul as compared to a lot of other countries in the East or West. The village is on both sides of the road and there are a few points from where you get good photos. Steep climb and not stroller friendly, No baby changing stations.The place is pretty though. We had our GInseng chicken soup in one of the nearby restaurants which was fab."
161,5.0,"I recommend you to rent hanbok (traditional korean costume) & take tons of photos! Love getting lost & going through back alleys. You will find lots of quaint cafes, boutique shops & the amazing Korean building architecture which takes you back in time!"
162,3.0,It is nice to walk around and take photos in front of the traditional houses but not much to do here. There are a few shops but not very many and when I have taken guests jere both trips have been short. This would be a good site to take a guided tour if that is offerred to get a better understanding of what you are looking at.
163,4.0,It's a residential area. Nothing much to see but old houses. Nice cheap stores in the area. Close to some palaces. Clean streets.
164,5.0,"It's amazingly beautiful place! So aunthetic and quite. Also, many interesting traditional coffee shops and museums here."
165,4.0,"If a semi heritage self tour is what you want to do, this is one of them. Old houses and new houses with the era architecture. (Although there are new styles). It is a walking tour so be prepared.  It should be mentioned that this place sits on a hill, so there is a good deal of climbing. We were there during the winter and I would imagine the place during the summer where it would be hard finding a shade. There are places selling snacks in the base of the hill, but again, it is a walk."
166,5.0,Did a small walkabout the area as it wasn't too far off GYBHK palace. Nice quaint place for pics and even rent traditional wear and snacks.
167,4.0,A lovely village with many old traditional Korean houses.  Saw many tourists wearing hanbok and took pictures.  it is a bit of uphill and downhill climb but worth it since the view is good!
168,5.0,It have many historical buildings and the structure are unique. It was well preserved and very clean. Many tourists came here to visit.
169,5.0,Been to Seoul many trips but this time tool the effort to visit. It will be a sure stop next trips. Such a lovely place to spend the afternoon. The houses were magnificent and gorgeous. Found an ahjumma selling hotteok and it's simply divine. So so good. Only wish I could eat more than one...
170,5.0,"We liked the whole relaxing atmosphere of Bukchon. The houses were beautiful and we also chanced upon a  'shop' selling candles and perfumes/oils. Some of the scents were really unusual so we could not resist buying some. Overall, it was a relaxing afternoon for us and although we would have liked to wear a hanbok like some of the other tourists, it was too cold for us."
171,3.0,"We followed the signage to the observatory. It's on the top floor of a building in the area. Paid 3,000won/adult for the entrance fees. Quite a stunning view but it's not something that you will view for hours. We sat in the observatory area for half hour to rest our legs after all the walking,  took pics and left."
172,5.0,Go on weekend. It's very croud but very authentic! A lot o locals go there and there are places to rent traditional costumes for you to take pictures. I have amazing pictures of locals with there costumes. Some nice places to eat to.
173,4.0,"The village is located nearer to one of Seoul's major palaces, Changdeokgung.  You can get off at the Anguk, and start looking for groups of giggling hanbok-wearing girls (locals + tourists) making their way somewhere.  Chances are they're heading to this village for their cutesy photos.  This is a residential area where traditional houses are preserved for modern day use.  You'll find average looking houses interspersed with grand structures with formidable gates.  However, do remember that there are real people living inside these houses, so a little consideration for their peace will be much appreciate.  Silence is golden."
174,5.0,"We were staying in a hanok (Irang Guesthouse - highly recommended) in Bukchon Hanok Village. Hence we could explore the area and the famous 8 sights early in the morning, before tour buses arrive.The other advantage of staying in the village was that we can start from the top (near 3rd view), and walk down.  (So many friends who started from Anguk Station complained that there were many slopes to climb.)It was a lovely morning walk, and we found it interesting to meander around hanoks which are lived-in (and not museum pieces).  There was some construction near 6th view, which was a pity as this was one of my favourite views.Enjoy..."
175,3.0,Walked around this traditional village for about 2 hours. Checked out traditional houses which partly have been converted to restaurants and shops.
176,3.0,"It's too commercialised, shops everywhere. Shops are more attractive than culture. I'm not very impressed."
177,4.0,"From Gyeongbokgung Palace we walked to Bukchon Hanok Village. We got lost and good thing we found information center where they give you a map but they don't speak a lick of english. There are 2 areas of the village and we chose the left side entrance of the road. We rented hanbok for only 1 hour. Rental for an hour is 10,000 won while 5,000 won for the hair arrangement, 1,000 won for the peticot and another 1,000 won for the locker where you keep your belongings while you roam around the village. Many tourists flock the area in the afternoon so better be early if you want to have a moment on your own with no photobombers. The village is very quiet and the houses are picturesque. If only one owner of the house would allow tourists to enter his house then that would be great. We can see the actual beauty of the house inside out. It's also possible to see the inside beauty because there are houses that turned into a guesthouse but very pricey compared to other hotels. All in all its good."
178,4.0,"this place is private quarters for many locals so behave, be quiet and respectful. similar to walking through a french village, you could take photos of the unique architecture. bring good cameras. one of the road has namsan tower in the background"
179,5.0,"Enjoyed maze like street full of Korean traditional old houses. Amazingly people still lives in those houses. Watching roof tops at higher place was spectacular. If you are not sure about navigating street, join the short tour. But lost in the maze would be a fun too (if you have time)"
180,5.0,It was truly an amazing experience!The rental of the costumes were seamless and the lady was really helpful. The were information staff stationed at different parts of the village and they speak English and were extremely helpful.It was a beautiful village and worth the visit for anyone visiting Seoul the first time.
181,4.0,"This neighbourhood is where the traditional Korean houses (hanok) are located. Some houses are centuries years old and while most of these houses are still occupied by actual living people, some have turned them into shops selling teas, souvenirs, food, perfumes, etc. Good place to have leisurely strolls or people-watching while taking a sip of tea or a bite of pastry."
182,4.0,We cheated and took a taxi to the highest point in the village and then walked down ! It is a lovely little village with houses still faithful to the original buildings. We spent a few hours looking around and checking out the little museums and coffee shops.
183,3.0,This place is literally a neighborhood for residents. They just kept their houses looking like the old houses. It is advised to keep quite here. There is a bit of walk for you here but literally almost everything looks the same.I recommend you spend 30mins to 1 hour in this place.
184,4.0,"Couldn't find the place last year and would have failed too this year although we have the ""Korean version of its location"" to the taxi driver. Luckily came across the Seoul Hanok center where the nice lady there gave us a detailed map of the area including a suggested walking route to see all there was to see. The major areas were a bit busy with everyone wanting to take photos and selfies but the majority of the path was quiet and very peaceful to explore.Came across the ""observatory"" which is actually someone's rooftop home where he charges for access to take photos. This can be skipped though. Also found a nice Korean tea house along the way that serves excellent tea in a tranquil and beautiful Korean traditional house setting."
185,4.0,"After the visit of the palace we went to the village walking around the shops and houses. It offer variety of cosmetics, hand made shops which offer classes, coffee shops with nice atmosphere. Worth going for sure."
186,4.0,"The view was great and very ancient. Feels like Kyoto. If you have issues with legs, suggest to get a cab up there. The stairs will drain your energy."
187,3.0,"This is an area where ordinary people live. Many houses are in traditional Korean form, but not sure whether they are newly built or historical. They are all similar so after a while you feel so so."
188,5.0,"As a girl who lives in Seoul, here is one of my favorite places in the city. When my foreign friends come to visit, I never skip to bring them here. 1. Bukchon Hanok Village is traditional residence areas in a peaceful and calm atmosphere. 2. This area is connected to Samchung-dong main street where you can visit pretty cafes, cosmetics shops, art galleries, and fine restaurants! 3. There are plenty of shops to rent Korean traditional clothes called Hanbok in this area. With wearing Hanbok and walking around the village, you can enjoy the old town  100%."
189,4.0,"Bukchon Hanok Village, I was told, is the only Hanok area in Seoul that actually has people living in them as homes today, whereas other Hanok villages are made for tourism show purposes and are not lived in.   We didn't get to see inside of an Hanok but just to walk around the area was pleasant enough. There were several quaint cafes and boutiques that made the place feel like a cool hangout area.  The area is pretty large. Be prepared to walk a lot to cover them all,"
190,4.0,It is an interesting experience walking on the streets of this village surrounded by traditional korean houses. There are even visitors dressed in hanbok. I feel like being transported to joseon dynasty.
191,5.0,"Today (5/10/17) our next stop is Bukchon Hanok Village. We came here by subway from our Hotel (Nine Tree Premier) stop at Anguk Station. Take Exit 3 at Anguk Station and just go straight, the village located around 600m from Exit 3. There are few shop provide rental for Hanbok on your right sight heading to Bukchon. You can rent your Hanbok before proceed to village.Few restaurant also available at this area. We have our lunch Korean Restaurant just outside Exit 3.From this Bukchon Hanok Village you can walk to Geongbukyong Palace or just go back to Anguk station & take subway to Geongbukyong Station which is on the next stop.However we did not go to the palace, instead we took subway to Yeouinaru station for Hangang ARA Cruise."
192,3.0,"Nice glimpse of a traditional korean village.  Unfortunately, there are a lot of ongoing construction/restoration during our visit.  You can enter some houses and have a feel of korean tradition.  Be on the lookout for quaint coffe shops, art studios and activities in the houses that are open.Tip: you can rent a Hanbok/traditional Korean dress and roam around in traditional attire for a ""full"" experience :)"
193,5.0,"Our favorite neighborhood in Seoul. Old meets new in this friendly and inviting neighborhood. Easy to get to by metro. Spend the morning exploring, then go find a great spot for lunch!"
194,5.0,"A very iconic old neighborhood in seoul. Lovely small alleys and hanok houses. Lots of young people wearing Korean costumes, and it makes the place more picturesque"
195,5.0,"It is worth spending a few hours here meandering the small streets, and you get great views of Seoul in some spots.  There are a few houses that are open to visitors, and there are interesting small shops running through the main commercial street."
196,2.0,It is not strictly a village. more like few Streets off a main road. Probably will need to ask someone to locate it.We visited this on a rainy  day. Got down at anguk station took exit 2. The village is supposed to be on the left about 500 meters away. However we could not find it so ask for a Korean couple who pointed across the road. We still could not see it and we were lost. A middle aged Korean lady was walking towards the opposite direction from us heard our conversation with the couple. She accompanied us and showed us the nicest part of the village. For this she had to walk in opposite direction  for more than 1 km as well as had to get wet in the drizzle.I suggest if you are going there get a map of the village from one of the information centers around there.
197,4.0,"bukchon hanok village is the place to take photos and soak in the cultural atmosphere of South Korea. its unlike the hustle and bustle of the city or myeongdong but very quaint and peaceful. be careful not to disturb the residents who are still living there, but do say hi to them if you meet them. an absolute visit for cultural and architectural buffs :)"
198,4.0,A nice place to visit & do try the pumpkin toffee if you can from the old man selling it from a bicycle. The toffee is really delicious. You can only get it here!
199,4.0,We stayed in a Hanok for 2 nights in the Bukchon village. When you visit Seoul I would really advice to stroll around in the Bukchon village. It's great to leave all the high buildings and the busy live behind and walk between the traditional houses and visit some  shops. And when you stay some nights I would also recommend to sleep in a Hanok and experience the traditional live over there including the great Korean breakfast (like we had in the excellent Cheong Yeon Jae Hanok Hotel).
200,5.0,We walked here with our son who lives in Seoul. We enjoyed a very quiet and peaceful view of traditional Seoul culture. The streets are steep so be careful if you have problems walking.
201,3.0,"I had chance to stay the night at Bukchon Hanok village and was a bit worried about how to find the place. However, I used the Airvan Service which brings me to the destination from ICN and that just shorten my travel time. The neighborhood is really cute and beautiful with traditional architectures, Hanoks. As it is known for it's traditional houses, there were so many people walking around even in Hanbok. I loved how the traditional and modern buildings coexist together in this busy city. The Hanoks made me calm and everything looked so peaceful."
202,5.0,"There is no bad time to come here. Day, evening, fall, spring, it has little treats around every corner and everyone seems to enjoy being there or discovering it."
203,5.0,"Bukchon Hanok Village take you back in time to olden Korean houses and structure.  Very picturesque and quaint to walk along the area to see the houses, street lamps and roofs.  What is incredible is that people actually live here.  Make an effort to visit as you will not be disappointed."
204,5.0,"It's quite a hike to get to Bukchon Hanok Village but the view is worth it! Look out for the guides in red shirts to guide you to the village.The traditional houses are stunning and the neighbourhood is peaceful. If you have some time, pop by into some of the stores there.Good to grab a banana milk and some snacks while on the way:)"
205,2.0,"Just ordinary view. I suggest you to find a restaurant with a fixed price that show in front of it, or you should pay the expensive price like we did."
206,5.0,"We walked throughout the village. There are many shops selling different items, from clothes, shoes, art items, etc... loads of restaurants and cafes too. Different from city shopping."
207,3.0,"Here one can see the traditional and modern korean structures side by side, Narrow allies, well maintained traditional building structures.it's an amazing view."
208,4.0,"We originally planned to visit this village around 2pm after our gyeongbokgong palace visit and ginseng chicken lunch.However, the scotching hot sun is really unbearable for us and we decided to visit here around 5pm. Houses are beautiful and built on inclined pavement. There are lots of signs to remind visitors to lower their volume. Quite a unique experience despite the hot sun."
209,4.0,"You can take the subway line 3 (orange) and get out from Anguk station at exit 2 or 6. Go north towards Buchon-ro. There at interesting quaint shops along the way, and some Sundubu restaurants the local visits. Walk about 100 M or so to the intersection and Bukchon village is a little  further up to the north. Turn right 100M to Changdeokgung Palace or turn left a 120 M to Gyeongbokgung Palace. You will find plenty of Hanbok rental stores and I recommend 3355 Hanbok rental for their cleanliness and service. Do be very quiet in consideration of residents still living in the ancient houses. The structures, doors, roofs, walls are very interesting and make good photo back drops. It is not necessary to go where all the bus loads of tourists are led to. There are some more further up and opposite the road."
210,5.0,Nice to see but still missing to renovate some of the houses there and it will be perfect. Nice places to see and drink and eat. Very charming anyway. Nice pictures to do but recommend it on the night mainly. Thanks
211,4.0,"Strolling through the neighborhood on a Sunday, when lots of Koreans are in traditional dress, is fun. But having informaiton about what to see, provided by the Visitor Center, would make the visit even better. So don't plan to go on Sunday!"
212,1.0,We use Google maps to find this place.We walk along the road of some of Hanok village but some of it has been modernise.Definitely will go again to find the right place.
213,5.0,"A place where you can find Korean traditional houses. Felt I was transported to a different time. Considering how ultramodern Seoul can be,really nice to find a place like this! A must visit for tourist. An Iconic village! Wearing our rented hanboks, me and my daughter enjoyed roaming around this beautiful village. We felt like a local!"
214,5.0,"We are from California and are in a hanok right now!  It's so beautiful inside. If you get a chance to rent one,  do it! We have had lots of people knock on our door, asking to look inside.  I don't mind though."
215,3.0,"tough way to walk uphill in the hot summer weather.most of the houses are closed, cannot view the interior.only can take photos from outside. after a while, all of them look the same."
216,5.0,"To find this easily, go to the number 8 must visit spots in Bukchon which is available in all maps. The place is hilly but worth it. There are many tourist here but you can still capture the hanoks. If you are into kdrama (personal taste) this is not where the filming was shot. It is on the other street."
217,3.0,"This community is on the slope of a foothill. We followed the google map and got off the bus at wrong stop and walk back to the village. The sign was hard to understand the best way to visit the village. Confused us a lot! The authority should improve the sign to make it easier to understand and please...in English! Almost everything here cost you money, take a look at the signs carefully..."
218,4.0,Beautiful traditional houses and quaint little streets with nice views. Shops and restaurants too. Had great Korean BBQ lunch!!
219,4.0,"Most of the houses in this village had been renovated but they maintain the outside facade, so it is very interesting to walk around the narrow alleys in this village. Each house has different main gate design."
220,5.0,"Love the little allies here surrounded by Hanok - traditional Korean houses, one can find a few DIY jewellery shops as well as little cafes and Korean eateries. Try to be there around noon time as most shops open after 11. If your schedule allows, book for a Hanok Stay, well worth it!"
221,4.0,Went here after a visit to Namsan tower. A lot of hype from people about taking selfies in a hanbok. The site offers a glimpse of the past with a lot of alleways to get lost in. Enjoyed the walk then found some pretty good shops with a some good deals. There are a few boutique places to visit but the coffee shop with its cold brew equipment was great. Try their homemade cookies for snack whike walking around. Then going further down a few good souvenir shops. When tired there are a lot of taxis to hail and taxus in korea is cheap although they can be a bit of a maniac.
222,5.0,We walked through here with a tour guide so it wasn't so confusing which might have made the trip nicer than it could've have been if we were on our own but we had a great time in the Hanok Village. The homes were beautiful and we got many beautiful photos. We even made a stop where we went inside one of the homes that was on exhibit to show tourists the size of the inside of the houses l (which are tiny by the way-I don't know how people live like that). It was a very lovely walk through and lasted about an hour. However it was a bit of a walk to get to the village so if you are not up to a 20 minute walk or so with an incline I would not recommend the Village to you.
223,5.0,"This place is near by Palace (around 20' walking). The area is totally different from the Myongdong. You can discover the houses in traditional styles stand beside the ones in modern but the general is so harmonies. At the end of the Main Street, you can see an university which is built with the style of Europe."
