,title,text
83,5.0,"Changdeokgung Palace is huge. English is on some signs. Rent audio headphones to move at your own pace - the map tells you which number to punch in. They are due at 5pm so return them before you go on the last Secret Garden tour or ask your guide to call ahead. The beautiful SG tour is up and down several hills. Scholar trees are all different, to represent the variety of academic fields. Some of these trees are hundreds of years old. After a while you forget that just past the wall is a modern city."
84,5.0,"I nearly thought I had to skip the secret garden as I missed the online booking, only fifty slots per time slot per language per day. You can not enter without buying the tour tickets. But I read that they have fifty tickets on sale on that day as well so we went before opening to queue and managed to get tickets. I would advise getting the integrated palace pass as it is more worthwhile for visiting all the palaces and Jongmyo. As long as you take the guided tour it wouldn’t seem like a blur of palaces. Each one had its unique features and place in history.In spring the flowers are lovely and the architecture layout here I feel is the best of the palaces. It is a lot of walking for old folks to do and a bit of uphill and downhill especially at the last leg of the Huwon tour, so wear good walking shoes. The guide does give breaks at each point though and there is a toilet inside. The cafe and souvenir shop in the palace grounds is really nice do check it out. No food served though."
85,5.0,It’s my 2nd visit to this UNESCO Heritage sure. It’s the more beautiful of the palaces I have been to in Korea. The architecture and placement of flora & fauna makes it a wonderful place to get pictures and envisioned what it was like living then by the the royals. The Huwon Tour took 1.5 hrs on top of the 1-2 hrs you need at the palace and go on weekdays when it’s less crowded to ensure you can get tickets for the tour.
86,5.0,I always love historical places with structures basically kept the same through the years. You get the feel of the way things were by walking through the grounds.
87,4.0,"Most palaces in Seoul look alike. Although lacking the grandeur of Gyeongbokgung, Changdeokgung boasts of being the most recent palace to actually have been used and of having a huge garden (forest, actually) right behind it.If you only have one palace to visit, I'd recommend Gyeongbokgung -- unless it's in the fall. They say the Secret Garden is the most beautiful during that time.TIP: Those who wear hanbok can enter the palace free. You can also avail of the Royal Palace Pass for 10,000 won that gives you free entrance to 5 palaces (including the Secret Garden)."
88,4.0,Very huge palace! You can get lost walking around in here but it was so beautiful with lots of history. nice place to take pics!
89,4.0,"If you're looking for some souveneirs for for your loved ones & friends,this is a place to consider.You'll find a lot of things here from cute korean items to trendy outfits."
90,5.0,Went to the palace with my girls and friends and we had fun going around the place and take photos. It was not crowded when we got there and we were able to go around the place easily.
91,5.0,"In case you have limited time and cannot decide between Gyeongbokgung palace or this one -> I'd clearly recommend this one (Changdeokgung) over the before mentioned. Reasons: 1. mostly not as crowded2. Wonderful garden (especially in autumn and spring// In summer more shade then Gyeongbokgung!3. A bit closer to the part of the city with traditional houses and many neat coffee shops.4. Closer to Insadong5. Closer to Jongmyo Shrine6. Neighbouring Changgyeong palace is worth a visit, too. In summer there are night tours through the beautifully lit up premises. You need to reserve tickets beforehand!What you should do at  Gyeongbokgung however is to watch the change of the guards. However you would not need to pay any entrance fee to do so. Enjoy your stay!"
92,5.0,"We were astounded by the size and the beauty.  So colorful and ornate.  It's hard to imagine the time and labor that went into creating something so beautiful, especially since it would have all been done by hand."
93,4.0,"During out stay in Seoul we had fine yes very cold days, on our last time we experienced a snowfall at Changdeokgung Palace.  We didnt get to see the Secret Garden but still was very worthwhile a visit.  Its a great historic site, to admire the architecture, and another thing i noted was some of the trees were named which is a nice also, as being winter most were dormant."
94,5.0,A must-see-visit. You'll feel the history by roaming its wide parks and corridors. You can even see the throne room.
95,5.0,"A visit to where Korean kings lived and worked, and get a sense of history. Entrance fee is only 3 usd, free if you are over 60. Better find out the times when they have free English tour guide before coming. Take advantage of that to enjoy the tour better."
96,4.0,"Not quite as grand or beautiful as its neighbor to the west (Gyeongbokgung), this palace nevertheless boasts its own charms and serene architecture. For example, it does offer a bit more history and authenticity as it is quite a bit older than the other palace which was only recently rebuilt. A major part of the palace are the hidden gardens which were closed when we were there. I can imagine how spectacular those would be on a beautiful day and how much they would add to the experience."
97,5.0,"Changdeokgung Palace is one of the two largest and most visited palaces in Seoul. They are similar in many ways - well-preserved, beautiful, with extensive grounds and many buildings to explore - but Changdeokgung has much larger grounds, which you can tour if you have a special ticket. When you first arrive, you can buy an entrance ticket to the palace, and at the same time can ask for an entry ticket to the ""Secret Garden."" This allows you entry at a specified time but doesn't cost anything extra. I've gone twice and once they just let us in at that time and we were free to wander at will. The second time, there was an English-speaking tour guide who showed us a few of the most important sights within the garden. It is amazing how quickly you feel immersed in nature, even though you know you are in the center of a bustling city. It is so quiet and serene - just the thing when city life gets too overwhelming. Definitely wear your walking shoes - the paths are smooth and wide, but the garden is very large and hilly so it requires a bit of stamina to see it all. Young children or anyone with limited mobility will find it tough to see the whole thing."
98,5.0,It's like walking in to a period movie seeing all the ancient structures where kings and queens used to live.  Korea has an impressive way of preserving their culture and this place really gives you a slice of how ancient Korea was.  It was just a bit too cold to explore though during winter as the weather when we were there was at -9 degrees C.
99,4.0,"This historic palace was the seat of power at one time and was built in the 1300's. The pomp and pageant including the changing of the guards to the palace entrance is still maintained.  The palace and various royal activity houses and the gardens is spread over a vast area which occupies the central Seoul.  The plants and various flora were in full bloom and looked stunning.  It was very tiring walking between various buildings and gardens but there were places to rest and eat.  To see it properly one would need to spend a full day, but we only had a half day so the visit felt very rushed."
100,5.0,"As part of our tour package we visited this place. It is a UNESCO World heritage site. I saw the main hall, the king residences,  the queen residences and members of the royal families where they have stayed. All buildings are in harmony with the environment surrounding them. Truly a historical site worth coming to visit. Thanks"
101,5.0,"More serene and beautiful, but less grand compared to Gyeong... palace.Make your way to the Secret Garden for series of pavilions. It was predictably dry due to the winter season.Must be a pretty sight in spring, autumn and summer."
102,4.0,"Changdeokgung Palace is greater than Jongmyo Royal Shryne, but even more beautiful, bigger and glamorous.It is right behind the Jongmyo, so it is worthy to go there as well."
103,5.0,"Changdeokgung palace is one of the most beautiful palace complex in Seoul. It s absolutely a must to visit the secret garden if you go there. I would recommend to book in advance the visit through their website as the visit is limited to 70 people, and there are only 3 guided tours in English per day. Recommended season would be fall."
104,5.0,"Changdeokgung is one of my highlights of my week long Seoul trip.  Absolutely fabulous!We were lucky that our hanok host helped us prebook the Secret Garden Tour.  I heard tickets are hard to get (especially during Autumn foliage season) and can get sold out as fast as within the first 10min the system is open for booking.Our guide was entertaining and shared many stories about the royalties, as well as the palace architecture.  Now I understand why some of the doors are built so low...The pace of the tour was relaxing.  There were some steps (upslope) towards the end but nothing difficult.  I don’t consider myself fit and/or athletic, but I had no problems keeping up with the group.  My two little kids managed very well too!You may want to visit the loo before the tour.  There is only one toilet break during the 90min tour.  No outside food and drinks allowed.  So perhaps a snack before the tour would be a good idea (if you are visiting near lunch time)."
105,5.0,"It was a very nice tourist place to visit. They have a secret garden tour that costs extra if you don’t buy the combination ticket. It’s a guided tour that takes about an hour ands half. It’s quite a bit of walking so make sure you’re up for it. Overall, the palace was nice and the grounds were very scenic. For me most of the palaces in Seoul are very similar to each other and that includes this one too."
106,5.0,"If you like watching Korean drama, you should come visit this place.  Very easy to go to thru the subway"
107,4.0,This was a backup residence for Korean Royal family. It's well maintained. The change of guests show is interesting. I think that's about all.
108,3.0,please do not compare the palace with Indian counterparts. The rooms are spacious but the furniture are not that elegant as found in India. Korean history is depicted and those have an inclination towards history may love it. Place is crowded with both foreign and local sight seers/tourists
109,4.0,This palace is located as well in Jongno adjacent to Gyeongbokgung - only a few minutes walk away. I love this palace because I feel like it's massive than Gyeongbokgung and is less crowded. It's possibly because there is no ceremony happening unlike the aforementioned.
110,4.0,"We arrived around 10.15 am on thursday.  It was easy to get there by subway. A little walk following the sign, we were asked if we would like to enter and join the secret garden Engligh tour, starting 10.30 am. We were excited to join.  The tour guide showed buildings in the secret garden with little tips of the palace."
111,3.0,"It is a Unesco World Heritage site. It is very similar to Gyeongbokgung Palace. You only need to go to one of the Palaces. However, the Palace is calm and peaceful."
112,5.0,This is a must-see if you’re in Seoul. We were lucky to visit during the holiday and got to see a special demonstration as well.
113,4.0,"It was good experience to visit the palace  (it was free for tourists because it was mid autumn festival) and the secret garden (fee applied with English tour guide). The palace has many entries and it was in in city which was good. The structural of the buildings were in good condition and very details, even there were lots of small allies that unable to enter but did not cut the fun to take selfies and pictures. The secret garden was so exclusive but need abit of walking up and down, after all not too bad because the tour guide was in slow pace allowing guests to walk slowly to see, look around and experience. The structural of those buildings were in good form and able to know how the King relaxed, the views of those big lotus ponds, trees, water and breezes..which was good experience."
114,5.0,"During our second Seoul vacation, we decided to go to this palace and enter the Secret Garden tour. It is so beautiful inside. It's worth the time."
115,5.0,"An UNESCO World Heritage Site, built during the Joseon Dynasty in 1405, Changdeokgung Palace is both a highlight of Seoul and a must on any history lovers itinerary. The gardens are beautiful with mature, think 300 year old, trees. The palace itself is historical and a good look at Korean architecture from that era. I love how the palace compounds blends so well with the surrounding nature. Recommended."
116,5.0,"A beautiful preserved palace. Authentic and bring you back to the past. We waited for the free English tour. Please check the website for timings. The guided tour helps in understanding more about the palace areas. Easy to manoeuvre around with children. If you want to visit the secret palace, it's better to reserve a place online first on the website. The secret garden is worth a visit and a very peaceful place. However, there are many steps at certain parts so it may be difficult to move with the elderly and kids in strollers."
117,5.0,"First of all, palaces in Seoul aren't something spectacular nor in fantastic sceneries. That's not what they pursued in the past. Gates might be the biggest structures. And maybe some temples on mountains or on cliffs will be better for wallpapers. Tourists expecting those might be disappointed after visits. Nevertheless, there are people who have been so impressed on them and Changdeokgung is one of the best.- location: Locating in a less crowded area and with less reputation than Gyeongbokgung, Changdeokgung is comparatively quieter and more comfortable to take a look. Gwangjang Market, Jongmyo Shrine and Changgyeonggung Palace are near and good for connected package in a single day.- The true beauty of Korea's palaces is a harmony with surrounding nature. Trees, rocks and even views around are parts of the palace. Sophisticated roofs of buildings are also nice.- The tour is walking outside and watching. The good weather is very important.- There aren't many buildings and visitors can't enter inside.- Guided tours only during weekdays. Free visit on Saturday. I think slow travelers will prefer visiting on Saturday.- Secret Garden: Called as Huwon(後苑 Backyard Garden) or Biwon(秘院 Secret Garden) in the history. 5,000 won to have a guided tour. This takes about 90 min and there are several buildings and pavilions in the forest. The old tree near the way out shouldn't be missed. Right next to the entrance of Huwon, there's the entrance of the other palace, Changgyeonggung.- The gift shop has tons of quality gifts comparing to most other folk shops in Seoul. Prices are high as they need to be.- Events like night specials will be also nice. They have illuminations and great performances."
118,5.0,"Changdeokgung and Gyeongbokgung are the two palace highlights in our opinion.  We timed our visit with the changing of the guard, which is very interestin to watch.  The place is not too big or crowded, and the written guides are helpful."
119,4.0,"This palace was a great place to see the Chinese remanence on Korean culture! This place is a symbol of Korea's historical culture, but if you look closely, you can see things that were influenced by china."
120,5.0,If you're going to select one palace - this is the one.Many different buildings in this palace area - all with slight differences to suit its purpose.Definitely do the Secret Garden tour - so much lush greenery and a very scenic/peaceful walk through the garden - I would have loved a study/library in a garden growing up!Look up the tour times before you arrive to make the most of your trip. A few cafes and coffee places across the road from the Palace once you're done with your trip.
121,5.0,"We walked very slow here to experience this world heritage Korean palace. It was built early 1400 & the whole place is still in good condition. It is grand, big & every corner and few steps are film killing spot. Every building has its own ancient days function & read the explanations are recommended. This is the place you should really come if you are in Seoul. Please walk slow & experience slowly.我們走的很慢的在這個世界遺產的韓國歷史上的宮殿，1405年建築的皇宮還維持的很好，很壯觀、很大、每個轉角和走個幾步都很值得拍照，每個建築物在古代都有特定的功能，應該要讀一下建築物的說明；真的很值得來，也應該慢慢走、細細體會。"
122,5.0,The Palace grounds are very beautiful and English Guided Tour fantastic.  Learned a lot from this visit.
123,5.0,"its nice to be back in spring time,try to rent thier national dress, as you can rent them for 5t won the entrance of the place is 3t won."
124,4.0,"One of the most wellknown heritages in South Korea. It's listed in UNESCO. The area is big. If you wanna enjoy more about this palace, you should go to the secret garden. Because, personally, I feel like the palace layout is quite similiar to other palace. This place is also safe for children. It's really hot in summer. Make sure you bring umbrella or portable fan with you. Wearing heels is ok for the palace, but I don't know about the secret garden. It cost 3000 won for adult. For young children under 7, it's free."
125,5.0,"sitting in the heart of the business district, it is hard to miss this little gem. walkable and within range of so many other things, it is a garden in the middle of the urban sprawl."
126,5.0,"You should not miss this place. It shows the style of Korean last dynasty at is splendor.Do not miss the ""Secret garden"": you need to make a reservation in advance and you can choose between English, Japanese and Korean guide:  it worth it because the guide gives a lot of information about the way life was in those gone days. I can imagine the garden would be even more beautiful in Autumn or in Spring."
127,5.0,"Magnificent palace with a beautiful, jaw dropping garden! A must visit iconic spot in Seoul. A UNESCO world heritage site. I was trully impressed by the beautiful landscape, pond, intricate designs of the palace itself. A unique experience."
128,5.0,"The Changdeokgung palace is a fascinating place to visit with the architecture and the Secret Garden. I went with a Hanbok I had rented from OneDay Hanbok, so I was able to get in for free (but you still have to pay for the secret garden tour even if you are wearing a Hanbok). There is wifi throughout most of the grounds, and there are a lot of nice places to take lots of pictures, especially if you are wearing a Hanbok. Just make sure to crop out others who aren't wearing Hanbok :)"
129,4.0,"A really beautiful palace, it was a lot bigger than i expected. Took the free English tour, which was about an hour. The English tour runs more often than published on the webpage. Highly recommended to follow the tour so that you can get a proper history of the palace as the design of the rooms are about the same. Go for the Huwon tour as well! The garden was really pretty.Took about 1 hour each, be prepared to do a lot of walking as well as stair climbing."
130,5.0,This palace is beautiful but do not skip the gardens.  The garden is beautiful and peaceful place and you can almost hear and feel the history of Joseon dynasty here.
131,5.0,"It's a very nice place if you're interested in history and Korean culture. If you only have time for one palace in Seoul, see this. The surroundings are more close by and in my opinion prettier than Gyeongbokgung, and you must see the Secret garden. Make sure to book a guide to the secret garden online the day before (you can book a ticket the same day at the palace itself but it's a bit risky during peak season). I would recommend getting an audio guide for the palace itself if you don't want to wait for an English guide."
132,4.0,"The palace is definitely worth a visit with many beautiful buildings spread across the palace grounds. I mostly enjoyed the Korean teenagers in their traditional clothing posing in front of the palace buildings with selfie sticks in hands. While at the palace, enter the people culture museum (free entrance) next to the palace."
133,4.0,WE were here during the early morning. Not too crowded. There were numerous buildings throughout the palace. We were just in time for the military ceremony. The colorful costumes of the guards were on display.
134,4.0,"Less crowded than the main palace Gyeongbokgung, it is the perfect place to take pictures with no one in the background. Went in late May. Also where you can visit the Huwon Secret Garden. Admission to the secret garden is separate from the palace. Tickets are limited so it is advisable to book online."
135,5.0,The palace is very beautifully preserved. Every detail has been taken care of. I love the secret garden tour and I would visit this place again.
136,5.0,"We went on 10:30 English tour of secret garden.  90 minutes of walking hilly areas well worth the effort.  Then after we went to palace which was self guided, less crowded and more fun on our own.Found some things not on the tour book such as sun dial."
137,3.0,We had already been to the other palace so we found this a bit repetitive and nothing new. So one can choose to ignore if short on time. Also do note that it is closed on Monday so if you do plan to visit plan accordingly
138,3.0,"I dont really understand what is the hype about? I'm sorry, although it is a beautiful place, I do prefer Gyeongbokgung.The great thing about this place is that it follows the natural contour of the land, so be prepared to do a lot of walking. The grounds are huge! but you would need to pay an extra ticket for the Secret Garden. For the elderly, it's not such a friendly place because of the natural topography.Recommend you to come here if you have nothing else to do. Also, get a guide to fully understand the history of this palace."
139,5.0,"This is the 2nd palace i would recommend going to , besides Gyeongbokgung. This palace was the working palace for most of the Joseon dynasty and contains a lot of history and stories. When walking around please notice the number of layers of the stone foundation. Only royalty or important nobles could have 3 layers , others could only have 2 or less. pleas also notice the chimneys at the back of the buildings ( and not on top of the buildings). They provided underfloor heating from the earliest times. Here is a tip , try to join a free walking tour of the palace , it only takes 2 hours and its most entertaining.  go to the visitkorea site to look for these tours. They are done  by volunteers who dont want tips or payment. so bring some chocolates as gifts. but their knowlege is immense and they tend to be retirees who do this for a pastime."
140,3.0,"Second palace after gyeobokgung,building structur same like gyeongbokgung.in the back of this palace there is secret garden(huwon gongwon).must buy tiket again 5000krw and must with tourguide.you can choose it's depend on time and language."
141,5.0,Recommend to join the guided tour of both the palace and the garden without which is just a stroll in the park without appreciating how the architecture changes with time e.g. Driveway at one of the buildings.  Was winter so was cool to make those walks.
142,5.0,"Beautiful & super big palace, you have to walk a lot but you can't miss.The Korea architecture is really good with use of bright colours onto the building.It's really good to see local people visiting palaces in colourful traditional dress !!Must visit place !!"
143,5.0,"The palace is lovely but the highlight is the secret garden.  You need to join a guided tour, which isn't something we usually do, but the tour guide was interesting and easy to understand.  We reserved our places on-line, which was easy to do and can be done up to 6 days in advance.  Tours in English are at 10.30, 11.30, 2.30 and 3.30.  You do need to allow yourself 15-20 mins to walk from the main entrance gate to the start of the tour.  If you are planning to visit the garden then you really should buy a combination ticket.  This cost W10,000 (less than £7) and includes entrance to the secret garden as well as entrance to four palaces and the royal shrine.  Given that Changdeokgung Palace and Garden costs W8,000 together, the combo ticket is excellent value.  You need to take your reservation details to the main ticket office to exchange it for a secret garden ticket before entering the palace."
144,5.0,"Part of our trip is to learn about Korean history, hence we visit this Palace and were glad we did. The Palace ground is huge but we managed to covered all. Worth visiting"
145,4.0,A nice place to know the history of Seoul or South Korea.  Much better if you have a guide so that they can explain every aspects in the palace.
146,5.0,"I appreciate Korean Palaces so much because it shows how much they treasure their history. It was well preserved and strictly kept clean, and thus it has become a highly respected place. I wish the Philippines valued its history as much as Koreans did. :("
