,title,text
0,5.0,"It was free for the Christmas for all palaces . Changdeokgung has more intricate buildings than the larger palace in Seoul, despite the smaller sizes.Definitely worth a visit while in Seoul."
1,4.0,A huge place of Korea history in this place. Worth visiting. U can see lots of people wearing Hanbok costumes and taking photos here.
2,5.0,"We chose this palace to visit its biwon/secret garden. There was a discount if you bought combined entrance tickets and joined english speaking guide tour. After finished visiting a mesmerizing garden, we walked to gyeongbokgung palace to watch royal guard changing ceremony at 2p.m. for you to be able to do this, it is advisable for you to join changdeokgung palace tour at 9.30 a.m and subsequently secret garden tour at 11 a.m. the tour will be finished around 12.30 and you have ample time to return your rented hanbok."
3,4.0,"Visited the palace first before Gyeongbokgung.  Read reviews that this palace was designed to be in harmony with the environment and after arriving there, it can be observed as to how it is.  For a Palace, it is certainly not imposing as the Gyeongbokgung one and certainly no surprise why many princes chose to have their palace here.   Unfortunately, I did not follow any guided tour for the front part if the palace, thus may have missed much interesting snippets.  However the guided tour to the ""Secret Garden"" is a must.  Only entered with a guided tour, they are conducted at different times for different languages.  I say it's a must so when you visit, u can imagine how the palace designers have made much effort to be a environmentally harmonious building.  Do make a point to visit it."
4,5.0,The Huwon Secret Garden Tour is highly recommended for its gorgeous autumn foliage!!!  Only 100 tickets are available daily of which 50 are reserved for online booking. u need to create an account in order to book your tickets.The tour is highly restricted & u are not allowed to wander off by yourself. A guard will follow your group to ensure that everyone stays together.The guide is humourous and interesting. This tour is a must-do if u are in Seoul!!!
5,5.0,The palace was amazing and the architecture overall is really nice. Unfortunately we couldn’t go into the secret garden because the tickets were sold out. But the small lake and the rest of the park around the palace was really beautiful especially with the changing leaves of the trees.
6,4.0,Use the side entrance— no one is there and you don’t have to wait in the really long lines at the main entrance. For me and nieces it was 6k won. Game changer.
7,4.0,"We visited this place with two children.It is beautiful place and lots to see Highly recommend.Give enough time .Lots of walking .We took English speaking guide,Bit disappointed as she spoke very fast and did not allow group together to catch up.Go early as not to miss changing of guard and visit to Gardens. ."
8,4.0,"nice place for photoshoot with your hanbok.with hanbok, you go inside for free.i booked a secret garden tour and its nice but do this only if you have time. garden of morning calm is far better."
9,4.0,"This palace is huge. Slightly bigger in area then Gyeongbokgung but this is a UNESCO heritage site. A secret garden tour cost additional 5000W to the entrance fees of 3000W. The tour is conducted hourly and take you into the inner part of the palace compound with a guide who gives further insight and explanation. Here you will be able to see more pavilion, ponds and gardens. The tour takes 90 minutes and involved walking up and down the hilly path."
10,5.0,The palace has nothing special but is good for the Korean Traditional dress called Hanbok experience and photos. Just accors  the road ( opposite to this palace) there is a shop for Traditional dress rental. They charge around kRW 15000 for 2 hours rental for dress. They provide all facilities like rentals lockers within this price. Ladies hair dress is additional KRW 5000. Overall a good experience to go for this. Please also note that in case you are wearing the Traditional clothes the entry fee to palace is waived off. The place is easily accessible through public transport. The palace may be hot is summer and mostly uncovered in case of rain. So better carry an umbrella in summary or rainy season. No F&B option in palace. Better to carry your water bottles. They have washroom inside.
11,4.0,"Really enjoyed this trip, always like to tour round places like this, and this time it was a family tour, some of our members spoke Korean so we didn't need a tour guide"
12,4.0,"This is an absolutely beautiful palace, with gorgeous gardens. It is extremely peaceful and a wonderful place to spend an afternoon.We took the English guided tour and loved it. The palace is large and well cared for. You can't go inside the buildings which is too bad. I originally thought they were too  old but in fact most of the palaces in Seoul are reproductions. Every time Korea was invaded the palaces were torn down.The reason I didn't give it 5 stars is the lack of accessibility for wheel chairs. They do provide wheelchairs but the one I used was not well maintained; it was extremely difficult to push and part way through the tour I had to turn back because of a staircase."
13,5.0,"This is the secondary palace, but has more sections that are authentic and not as rebuilt in the 1980s.  Really gorgeous and also like a nature hike in the middle.  The Secret Garden is a must-do part of the visit. The English-speaking guide who was assigned for everyone (you can't walk solo) was terrific, one of the best guides of my Seoul visit.  We found the palace fascinating and gorgeous, and it's not very far from Bukchon."
14,4.0,"A very beautifully decorated and in many ways a spectacular place. Old and full of history. Certainly worth a visit. The secret gardenis nice, but on the guided tour, which you must take to visit, you see mainly small temples and buildings, while the garden itself is really more a densely grown park. A little dissapointing. As is the palace surroundings which really are just grass and gravel. Very little you can see of the interior of the palace, so it is relatively quickly done unless you have a strong interest in 17c Korean architecture."
15,4.0,"Honestly by now I have gone through most of the palaces in Seoul and this one impressed me with its beauty and diversity. I do have to mention that to get into certain parts of the palace you need to pay again, but it doesn't lessen the value of the palace. It is simply beautiful to be there and very meditative. Simply go!"
16,5.0,"Visited with the student volunteers from Meteor Youth. The palace grounds are beautiful and the official hall with the emperor seat is stunning. Do make sure you book the tour for the secret garden. I would recommend you do the 90 mins tour of the secret garden first then visit the palace after. The gardens situated behind the grounds of the palace is huge and boasts many pavilions with beautiful ornate carvings, each with a different design. Do note that the tour entails a lot of walking uphill so be prepared. Another thing to note is that entrance to the secret garden and palace requires different ticket. The palace tickets also have different timings ie day ticket and evening tickets. I was glad I went with the student volunteers as they were able to provide commentary throughout the visit."
17,5.0,The different palaces and the Korean architecture is very fascinating. Very beautiful place and it feels like travelling to the past as I was walking and seeing different palaces.
18,5.0,"This palace is not smaller than Gyeongbokgung, but with the secret garden maybe the most beautiful one. Still always many tourists and local people, but not as crowded as Gyeongbokgung. Many photogenic spots, quiete enough to make good interesting instagram photos."
19,4.0,Glad that we sign up for this moonlight tour. The atmosphere at night was so different from the day where it was much more peaceful except that it can be quite scary if you're walking alone. It's so beautiful at night walking around with a lantern on hand. Get to see more of it and understand better from the guided tour despite having tour this place in the last trip.
20,5.0,"Our family went there as part of a group tour. I strongly suggest you get a guide or someone who is well versed in the palace's history. Seeing the place without knowing its history or ties to Korean culture is such a sad experience. And of course, there are so many places to walk around and gets pictures. From architecture, flora, staff in traditional costumes among others.We didn't get to rent or walk around in traditional korean clothes. That would have been awesome and probably the only downside we experienced of our visit."
21,5.0,"If you’re looking for a little history with beautiful scenery where kids can run around, this place is for you. Lots of tourists rent old Korean royalty costumes and explore the grounds like that, taking pictures. It’s relaxing and very pretty, signage is also in English but you could rent a live or audio tour if you want to learn more. A budget-friendly enjoyable experience."
22,4.0,"The place was beautiful, it was big and we weren't able to go around the whole place. There was a different payment for the palace itself and the secret garden, we decided not to go inside anymore as there were a lot of people in line for the tickets. It's a must-see if you love watching history K-dramas."
23,2.0,the hanbok renting opposite the palace offers worst experience for us for their services. did not recommend
24,5.0,"Nice place to see and understand about Korea architecture. Starting from the gate which  oposite the main gate of Green House, to the Museum and then straight to the palce. Incredible about the culture and structure of Korea"
25,4.0,I came here around 9.30 am and it wasn't crowded. The entrance ticket is 3000 Won for palace only and 5000 Won if it's include the ''Secret Garden'' area. The design is not too different with Gyeongbokgung Palace but nice to spend some time here.
26,1.0,"One of the attraction to visit, it is also close to shopping area and night market, close to train station and underground shopping area."
27,5.0,This palace is one of the Joseon Dynasty king's favorite and it is much beautiful and calmer than Gyeongbokgung since it is near the secret garden. It is the only palace in Seoul that has granted UNESCO World Heritage.
28,3.0,"Lots of building but all of the same decor, A lot of the place was destroyed by the Japanese and been refurbished. Still worth a walk around expect to spend around an hour. Changdeokgung place is adjacent to Changgyonggung Place with an inter connecting gate, there is an entrance fee for both places. So ideal to tie in at the same time. Over 65's have free entry on proof of age to both place.You can pay extra and have a guided tour of the secret garden which takes around 1.5 hours."
29,5.0,We decided to stroll through the gardens in full Hanbok.  We rented them from the little shop across the traffic lights from the front gate.  15000KW for 2 hours.We then wandered the palace grounds (free entry) taking pictures.  We were also asked to be in many other pictures from other tourists as we have very blond hair and blue eyes.   It was a great experience.The gardens were beautiful with Cherry Blossom blooming everywhere along the pathways. Well worth the visit.
30,5.0,You stroll around all the buildings and rooms where Royal family members once lived together with their own garden which is very unique in Korean garden design. You can go there via Metro line #3: Ankook station from where it takes 10 minutes' walk.
31,4.0,"Nearly didn’t come as we were already so tired from previous days including an earlier visit to Gyeongbokgung. Boy, am I glad I came! This to me is more beautiful and felt more authentic than Gyeongbokgung. As there were less visitors , we were able to wander around quietly at our pace. There also seemed to be better signages and explanation of the various venues at Changdeokgung. However some places were closed for renovation/ restoration. Could feel the weight of history on this place and to me, it felt sad and desolate. Did not manage to see the Secret Garden but will do so next time."
32,4.0,"I would recommend going here and visit it. It was worth it, and it was many things to look at. Definitely worth it"
33,5.0,Awesome to see the change over of the guards at the palace. Was a very special moment of history. thanks
34,2.0,"I have brought my family to Japan, Indonesia and Thailand... This palace is average and nothing fancy. My kids loved the changing of the guards ceremony, we went at I think 4pm. Nothing fancy..."
35,4.0,"Our walking tour of the secret garden in 昌德宫 was really enjoyable. We registered on-line to get the 10.00am slot. The weather was fantastic because it had been raining the day before. Besides the Autumn colors of the tress, our well experience tour guide told us stories and history of those traditional buildings. Our stay in insadong also gave us great convenience we can just take a 15 minutes healthy morning walk to the ticketing office of the Palace and the secret garden."
36,5.0,We went as part of half day tour of Seoul. The changing of the guard was a spectacle and all the people in traditional dress was something to behold. Our guide Jenifer was a very friendly person with good knowledge of the attractions we visited. Well worth a visit
37,5.0,Arrive early to buy tickets (or buy on-line) and catch the English Tour (other languages are available at different times). Be sure to also buy tickets for the Secret Garden extension.
38,4.0,This place was really cool - but would have appreciated it more if there were less people around! It was nice seeing an actual palace and the place was really huge! We only stayed here less than an hour because we had to return our hanboks. When you visit here it would be better if you have at least 2 hours so you can explore and enjoy the entire area! Also it would be a lot better to plan coming here not on a peak season like summer to avoid the crowd!
39,5.0,"Feel the uniqueness of beauty in Korea that does not seek glamor. Did you ever know the greatness of the Republic of Korea, which has never invaded other nations and has maintained a single nation for more than 5,000 years, despite constant foreign invasions?"
40,4.0,my mother and i visited the secret garden in autumn and it was really beautiful. i would recommend a short stroll along the palace before spending more time in the secret garden. please take note that you have to buy another ticket to enter the secret garden!
41,5.0,I went with my family   We toured the beautiful Palace and enjoyed the grounds and the Authenticity of the Palace
42,5.0,"I and my daughter walk along here, then we go outside from this palace, to  rent Korean dress 15000 Won  and more for rent 1hr or more. Many beautiful dresses with hat, handbags and ribbons."
43,5.0,"The palace and grounds are both commanding and pleasing to the eye. The secret garden tour was absolutely stunning. It was late November, and there were still leaves on the trees. Gorgeous reds, oranges, golds. Quiet walk with immersive views for contemplation and enjoyment. THE #1 highlight of our visit to Seoul, and there were many."
44,5.0,visit this palace to tour the huwon secret garden at an extra 5000W price. The gardens are quiet and beautiful.
45,5.0,"This palace had several entry points. We had to line up a bit for the tickets. There were so many tourists inside. This time, we did not have a guided tour.The palace was simple but beautiful but it was quite hard to find a quiet spot. The grounds were huge and the trees were beautiful during our autumn visit."
46,4.0,"We did not take a tour as they were all full when we got there. The buildings and the grounds are very pretty, however, they all do start to look the same if you have no idea what you are looking at. I would recommend waiting to take the guided tour if you can't speak the language so that you can appreciate what you are looking at."
47,5.0,"The palace itself is still okay. The gyeongbokgung palace is more grand than this.But the best part of this palace is the secret garden. I visited during autumn Nov 2019, it was beautiful as it truly shows the colour of autumn. My guide told me that the tickets to secret garden is not easy to get. Even he has to go pretty early to get them. This is the place we tried on the hanbok. There's 1 hanbok rental shop right across the street over the main gate. Hanbok rental is around 20,000 won and 5,000 won for hairstyles."
48,4.0,"If you are interested to see the autumn leaves in a palace setting, ensure to book the secret garden tour via online which is available one week before the actual date. This palace is not as pack as the Gyeongbukgung & has a nice garden with the autumn colors in place."
49,4.0,We miss out the secret garden but overall is a must visit place. Not bad and have a nice photo session but this is not the best palace in Seoul.
50,5.0,"We came here on Sunday and its not pack with people. The palace is huge.. We venture the entire palace only to find out that there is a visiting hours for SECRET GARDEN (another ticket is needed).We did not visit the SECRET GARDEN which i feel is better due to visiting hours (pls check on the tours for language ie. Japanese , English, Chinese etc)Must visit place"
51,5.0,The English tour guide was excellent and made the visit so much better. Worth a visit. Wish I had taken time out for the secret garden guided tour too.
52,4.0,"This was the first palace in Seoul we saw due to the Secret garden tour.  Tried to reserve online but it was closed; no problem buying tickets at the door though (you can’t visit the garden without a guided tour.) There’s a fair amount of walking and stairs for outdoors (we were fine, ages 23, 58 & 70) and it was the largest palace garden we saw in Seoul and Kyoto.  The guide was one of the best English speaking guides we heard over 2 weeks: she allowed ample time for photos but kept us moving along (a lot of ground to cover.)"
53,5.0,"Absolutely worth the trip!  When you are in the gardens it is hard to believe that you are in one of the largest cities in the world.  It is peaceful, serene and relaxing."
54,4.0,With all of the Hanbok traditional clothing rented out to visitors it feels a bit like a time machine ... well except for all the cell phones. One can picture yourself there hundreds of years in the past. Certainly added to the full experience.
55,5.0,"The grounds of this palace are quite extensive and walking through it on a very hot day proved to be a challenge. For us, it was one of the top things to do - but do pick a coolish day if you can!"
56,4.0,One of the attraction that will be recommended to you when you visit Seoul... A lot of walking and kind of viewing a lot of empty rooms..
57,5.0,"It is a very nice place and there are also Sakura trees that make the place look even more beautiful. However, you cannot enter the secret garden unless you are with the tour guide and you are not allowed to eat or inside the secret garden."
58,5.0,Great palace to visit. Summer in Seoul is hot mid day so it is a good idea to go as early as possible. Nice place to take photos.
59,5.0,Its a must go place. Travel guide explained every thing precisely. You can get a good idea about Korean dynasty.
60,5.0,"This palace isn’t too crowded and the best compared to others. The main attraction is secret garden. You may pay extra to entry the secret garden. You can entry secret garden only if you join the tour that are provided in this palace. You may book the tour one befoe, online thru changdeokgung’s website. Better you book the tour since there are only 100 people to be allowed join the tour every 2 hours (check the timetable on website)."
61,5.0,Well restored palace structures and a real sense of history palpable throughout the grounds of the site. Wife and daughter rented Hanboks nearby and toured the area while being photographed. Highly recommended destination for all travelers while in country.
62,4.0,A smaller Palace and a quiet one; not too crowded. The Secret Gardens of this Palace is the main attraction and are not to be missed out. The tour to the Secret Garden is a conducted by a Palace tour guide and these start on specific timings (please check at the ticket counter)
63,5.0,It's really enjoyable trip into the garden shown from ancient view in peaceful & joyful moment together with my lovely family~~. Beautiful sunshine made a tremendous view over the pond reflecting the shining particles from the surface made us feel like in the paradise~~.Be there & walk in slow while you're feeling the inner peace in this beautiful garden.
64,5.0,"Great atmosphere. Nice canteen, museum well displayed and plenty of photo opportunities with locals strolling around in traditional clothes."
65,4.0,"One of 4 palaces in Seoul and I would say in terms of scale the most magnificent one.  However, all of the buildings are either closed or empty inside.  Are the ancient Koreans sitting around in an empty room all the time?  I'm not sure, but the experience could of been greatly enhanced if the buildings actually have things in it for people to get a glimpse of life of ancient Korean royalty.Finally, the main palace within this palace the front door that you can see the emperor's throne was blocked off for ""Korean language tour only"".  So if you're a foreigner you're NOT allowed to get the best view to see inside the palace.  The only reason this is a 4 star and not a 5 star."
66,5.0,We love the beauty of all palaces. Hanbok costume brought us back in times. Beautiful set up & we had so much fun there.
67,5.0,"There is a lot here, and there is no way I'd appreciate this place if I just walked up independently.  We went on a private guided tour, and it was magnificent.  There are a lot of details that we would have missed if we did it on our own.  Totally worth the time to see this place."
68,4.0,"Nice place to visit once but not more. If you wear a Korean traditional costume “Hanbok”, the entrance is free ! Otherwise it will cost you 3000/person"
69,4.0,We went June 2018. Got the tickets for the secret garden tour the same day.  Highly recommend the secret garden tour.  It's the prettiest area. The landscaping is very pretty. Took us about 4 hours to tour the palace.  Much longer than I anticipated. Many tourists dressed in hanbok. Wear comfortable shoes because the palace is huge and lots of walking. Pack a water bottle because it's hot.
70,3.0,"small palace , not much things to see when compare to China Palace. not worth to go as need to pay entrance fees."
71,5.0,"You should try the traditional cloth and you will find next to this palace many rental cloth shop, you can rental and wear it and have lovely picture in side the palace( your inter will be free of charge if you wear the traditional cloth)"
72,4.0,Its history in the middle of the city. Nice place to walk around and its a really big place. The weather was good. Watched the changing of guards at 2pm and it was a nice thing to see.
73,5.0,Nice palace to spend the afternoon walking around. The buildings have been freshly painted and look gorgeous.
74,4.0,"We went for the 10:30am Secret Garden tour on a hot June day. We find the tour a bit slow for our pace. The garden itself was alright. However, we find that the morning/noon sun was quite draining. And there were some uphill and downhill that we need to climb. It might be difficult, if not impossible for people who have mobility problems. The garden itself and the scenery was very nice, but after touring the garden for 1.5 hours, we were not so keen to look at the palace anymore (as we have seen the bigger one the day before).  Overall, I would recommend this for those who likes to look at architecture and learn about history. But probably it won't be very interesting for young kids."
75,4.0,"This is a unesco world heritage site, a very huge area where several palaces were built bu kings of the jeoson dynasty."
76,4.0,"The place is great, full of historal lessons. The structure is simply amazing for it's unbelievable architectural design!!! Come on and visit to appreciate the place!!! Thanks for the enthusiastic effort from our tourist GUIDE!!!"
77,4.0,"Was a scorcher the afternoon we went and we really felt the heat and the crowd! Your bus after your bus come to the palace as well as domestic tourists alike. The palace is nice to walk around, would suggest waalking shoes as the paths are cobbled or sandy.It is quite impressive and still in good condition. Grounds are huge and backs onto the mountains. Very nice."
78,5.0,Very quiet place to visit as compare to other palace in the area. Good location to take any photograph
79,5.0,"We visited this palace on an organised tour.  There were no lines, everything was easy to understand.  The trees and gardens were amazing.  Well worth a visit."
80,5.0,we came solely for guard changing ceremony but later turn out other activities very intesting. room the area for 3 hours and a worthwhile visit.
81,5.0,"Rent a hanbok, dress up and spend a few hours here. Great free museum, good people watching and the changing of the guard is spectacular and happens every couple of hours. A beautiful piece of history. A small fee for the garden section, if you are over 60 show some ID and get in free."
82,5.0,"The real highlight is the secret garden. Do not miss it. So pretty and so worth the tour. In my opinion, far more worth a visit compared to Gyeongbokgung."
