,title,text
147,4.0,"2nd visit to this palace. But 1st time going for the Secret Garden tour. Just have to do online reservation in 1 week advance for which language the tour would be conducted in. Reach the palace at least 20 mins before tour starts to secure booking.Went during Spring time, and trees look bare. Scenery would have been beautiful in Autumn. Secret Garden tour took around 1.5 hours to finish and there are up/down slopes to take on which might be tricky for elderly. It's still manageable to walk at your own pace, just that will be missing out on the introduction of the corners. Friendly tour guide are more than willing to share and answer queries which you might have for the sites. Would love to be back during Autumn!"
148,5.0,"this is probably the second famous palace tourist will visit. entrance fee is USD2.60 for adult and free for children below 6. the secret garden is only allowed with guided tour, make sure you book ur tour at least 1month in advance. cuz it normally sold out on the day itself. Otherwise, just freely rom around the garden is very relax too. suggest to visit in spring.. there are 2 big peach blossom tree which is very nice for photo taking"
149,5.0,A great experience as part of the Korean culture. It's interesting to get the guided tour in order to understand what each building was for. Also a tour of the secret garden is recommended. Very  beautiful but even more so with spring and specially in fall.
150,4.0,This palace not as big as Gyeongbokgung palace but its connected to Changgyeonggung palace. If you want to go to Secret Garden better use Hanbok (Traditional Korea T-Shirt) because its free
151,4.0,"This is one of the Unesco heritage sites one should visit when in Seoul. It is the palace where the last remaining members of the Korean monarchy lived until the 1980s. So you will be able to see how they lived here during the 1900s to 1980s and witness the traces of modern contraptions during that era. Although the infrastructure of most of the buildings within the palace are not original as the original palace was destroyed during a fire, the new structures (still pretty old since it was rebuild in the 1700s to 1800s) are magnificent. I absolutely love the colours and design of the rooftops of the buildings within this palace. There is also the secret garden which is really beautiful and perfect for Instagram and offers you an insight of the life of the Korean monarchy. recommended to join the free tours that is provided (subjected to different timings for Korean, Chinese, Japanese and English). Separate secret garden tours are charged at extra fees. If you intend to visit more than 3 royal palaces in Seoul, would recommend to get the Royal Palace Pass to enjoy more discount on the entrance fees to all of the palaces in Seoul."
152,5.0,"Nice palace to visit , it's huge, many pavilions, tickets are3000 won each not all pavilions are openYou can't actually enter the actual pavilionI was excited to see some furniture pieces and rooms but nothing really ( unless we totally missed) only the main pavilion you can see the huge throne where the king used to sitNice place to visit but enough once"
153,5.0,We went there to explore the unesco heritage and we were pleased to be able to understand better the Korean history and culture. The palace is really nice and well maintained and you can visit it with a free guided tour booked on seoul information centre website If you have time for only one palace maybe not this one thought
154,3.0,There are other attractions inside this palace but you have to pay for them e.g. the secret garden. Maybe this is more beautiful during spring bloom or summer. Not so interesting during winter.Bring a stroller if you have young children.
155,4.0,"We enjoyed our 2 hour visit on a sunny morning in late-March. The first cherry trees were in blossom beside some of  the palace buildings, and everyone was taking photos beside them. There were lots of visitors but the place is so big you can easily get away from the crowds. We enjoyed seeing locals in Korean dress, it helped us imagine what the palace looked like when in use. After lunch we walked around Bukchon village and had a great day."
156,4.0,"The palace was nice and was interesting.  Not sure if they do it everyday, but while we were there, a lot of people dressed in historic local attire, both male and female, were there and it was very neat.  Very friendly people and willing to take pictures with the tourists without having to pay.  When they close, they close and they have several people rounding up slow moving people pushing them toward the door..so don't plan to get there late and overstay."
157,3.0,For tourist who likes touristy and history - the place to go.Walked the palace and discovered many interesting facts too. Worth going!
158,3.0,The palace is located around the city and easy to go to there and rich the area.The palace is also wonderful
159,5.0,"This palace is across the street from the Great King SeJong. It's a long walk so take some walking shoes. There is a National Palace Museum of Korea inside on the left. We found some pretty cool souvenirs you can't find anywhere else in Seoul! You can peek over the wall, and there is the Blue House. If you book in advance, you can visit the Blue House too. We got cancelled because of the demonstration happening during our visit."
160,5.0,"1) One of the most beautiful places in Seoul. Great palace of thousand doors and windows and a Secret garden.2) Open (spring) 9:00–18:00. Closed on mondays. Best time — weekdays evening (16:00–18:00).3) Admission fee is 3000 won for palace and 5000 won for garden (require palace ticket).4) Access to the Garden is allowed only with guided tours. The last English tour starts at 15:30.5) Good cafe (no food, only drinks) and a shop."
161,5.0,"This place has a nice park. And the beautiful  buildings. The weather was cold enough, but The Sun was shine."
162,5.0,"This palace complex is a good example how Korea preservs its history. Very well conserved. Those palace are a historic mark of the glorious period of Joseon Dynasty in Korea, from 1392 to 1910. Its offer two english tours in the morning and two or three in the afternoon depends on the period of the year. For foreigners is mandatory to take the English tour."
163,5.0,"While Kyeoungbok-gung is a workibg quarters for the King, this place is the actual living quarters for the royal family.  Much restoration has been done to correct Japanese mischief during the occupation.  It's a cosy and pretty place, a palace"
164,4.0,"Really impressive from an architectural viewpoint, with a number of different palaces for the King, the Queen and Concubines. The Secret Garden is a joy (extra charge though) and should be at its best in the Spring. Great place to escape the turmoil of modern-day Seoul."
165,4.0,"Really like this palace. I bought a combination ticket but it was not enough for me, I went 3 times! Go early in the morning 9am on a weekday and you practically get the whole palace to yourself. Walk around and immerse in its beauty & serenity. Definitely join a guided tour to know more about the grounds. Check their website for timings for various language guided tours. We went for the 10:30am English tour. Very nice. It ends just in time at 11:20am for you to catch the 11:30am secret garden guided tour. The secret garden is only available on guided tour, with extra ticket, so check online for secret garden reservations or go early to book a spot at the ticket counter. It's worth a visit so don't miss out. Although many buildings are new, as the originals were burnt down during the Japanese war, it's still an interesting place to visit. Recommended!"
166,5.0,"very beautiful palace, however, you have to purchase separate ticket if you want to visit backyard garden. i personally think the garden is not so special during winter. they do provide free tour guide in chinese, korean and english. very good service. if you have time, rent traditional korean costume from shops outside the palace will make this trip more memorable. and if i'm not wrong, you can enter this palace for free if you are wearing Korean Hanbok."
167,3.0,"Interesting, but quite a walk not recommended for elderlies. Might be great on summer as flower are bloomed."
168,5.0,"We visited Changdeokgung Palace in November and the fall foliage was beautiful, especially in the secret garden area. Make sure that you get the ticket that admits you to this area, which is at the back of the palace grounds. A must-visit site when touring Seoul!"
169,5.0,Visited the palace because of the secret garden which requires a booking. The secret garden is big and spectacular. How I wish to be the emperor back in the times to enjoy the palace
170,5.0,Smaller and quieter than the other palaces.  We were travelling on our own and had booked tickets for the secret garden tour online.  This was truly one of the highlights of our trip.  You don't have to be very fit to join the 1 hour walking tour but they do expect you to stay in the group and not wander off during the tour.
171,5.0,Nice and quiet palace for great photo. Joined the secret garden tour. Good stamina is essential as there are many slopes and kinda steep. The garden is very beautiful though some works is going on at certain places. Lovely maple and ginkgo tree in the compound. Great experience to figure out how was the old times royal family life. Impressive!
172,5.0,"It is better to buy the Combination ticket that costs W10,000 and gives admission to 5 sites and Secret Garden. During peak seasons, it is advisable to book for guided tours via their online portal. The schedule for the guided tours are listed online for easier planning. You can also walk around the plalace ground except the Secret Garden. The guided tour of Secret Garden is highly recommended. Our tour guide was excellent in presenting the history and features of the Secret Garden."
173,5.0,"In this palace, there haveany trees and surrounding was awesome. I believe if during Spring or Autumn, you could see beautiful colors of flowers and red leaves surrounding this palace. A secret garden a must visit spot besides having a massive long walk to this garden of silent. A little pond and resting place will be good for a snapshot or wefie or selfie is memorable. Apart from this wonderful place, there's a little cafe that you can drop by to check out beautiful souvenirs. You can have a cuppa too! Trust me, this is really a nice palace that I love to visit again next time. Thanks to our private tour guide from Top Korea Tour, Juno who explained the historical part of this palace and we were like adventurers exploring the place in and out. Found a little secret locked place~you can find out yourself when you are there.My mom was cooling resting at the cafe enjoying the view of trees. Totally different feeling from other palaces. For those who appreciate history or architecture designs, you would love what you see. For others, just visit this place to get to know more."
174,4.0,"It surrounds with high level of wall, and locates at the heart of the city, really fusion with modern buildings around. Be alert that, it close on Monday. It is calm, scenic and comes in solid culture ambience."
175,3.0,"We visited in October 2016. It was a special day that day when admission was free for the palaces.  So we went to all 3 that day.  We discovered this at the first one we visited.  It was a cool day and overcast.  We figured it was good the admission was free because unlike other castles and palaces, all three of the palaces in Seoul are just empty buildings.  We enjoyed the walk around the lake and the forested areas."
176,4.0,"love the architecture of this palace. however there is no guard changing ceremony here. overall is a good place to visit when you are in seoul. To go here, the a subway to Anguk Station (Line 3) Exit #3."
177,4.0,This palace is neat to look around...not much on display but the area is nice with some fantastic scenery. Whilst there we learned that it is in the process if being rebuilt and so not much of it at all is actually historic.
178,4.0,The size of the Palace is average but the buildings are quite well maintained . The secret garden though  not much to be seen but can see that it was once quite a beautiful one.
179,4.0,"Our second palace to visit and a must since it is one of UNESCO's World Heritage sites in Korea.  Visiting it, we understood why.  The buildings are so colorful and well-preserved.  We even got to enjoy tea inside one of the rooms near the royal kitchen which had been converted to a cafe.We did a DIY tour which was not difficult as signages abound and there was sufficient information for all the structures.  We also visited the Biwon (Secret) Garden afterwards.  The guided tour was very informative."
180,4.0,"This property was a good tour. They have several English speaking guides and tours throughout the day.  The guide was knowledgeable and I recommend you take this tour as the guide had a few free tips that were of interest. The tour finished in 50 minute and finished just outside the entrance to the secret garden. We didn't have enough time to fit in the secret garden on this trip, but not because of the tour length as it ended near the secret garden about 10 minutes prior to that for starting."
181,4.0,Visit this place on a cold windy day. Great scenary with historical houses but most of them is the same.
182,5.0,"The palace grounds were expansive and the trees and leaves on the grounds were coloured beautifully in shades of red,yellows and orange in Early december. We have signed up for the secret garden tour which proved was great as the guide was very informative on the history and description of the area. The gardens were also equally beautiful with the historical buildings and a backdrop of autumnal flora and fauna. This would definitely be on my must visit list for Seoul.I would advise visitors to look up secret garden tour timings in their language prior to their visit as you can only enter the secret garden as part of a guided tour group. The grounds and garden are filled with plenty of steep steps and slopes - would advise those with walking difficulty to give this a pass as it would be hard to move around. There is only a small shop beside the gift shop offereing coffee and light refreshments - visitors would definitely have to head elsewhere for food."
183,5.0,"When a went to soul I know I can find to many places to visit, but this temple is a nice place to go"
184,5.0,Situated within the busy Seoul city. Lovely sight with the maple leaves turning yellow/red. Recommended the best time to visit would be in autumn and don't forget to spend a little more on the tickets to visit the Secret Garden. It would be more meaningful to go with the guides (since you paid for it) as he/she will do some explanation of the different points and the history of buildings.
185,5.0,"You should visit this palace in autumn especially its secret garden. The view was magnificent. You have to walk a lot, though hence proper shoes is recommended."
186,4.0,"We bought tickets for this palace along with tickets for the secret garden tour.  Unfortunately, the tour guide for the secret garden had somewhat stilted English (and was thus a bit difficult to understand) and the tour was quite boring, so we just ventured out on our own after a while.The palace is humongous so be prepared for a very long walk.  Also note there really isn't much food you can purchase within the palace itself except for some drinks, so be prepared for that as well.The palace does get a bit repetitive at times, although the nicely manicured grounds do make up for it."
187,5.0,There is a secret garden in this palace. This palace is less crowded than gyeong bok gong. Visitors should plan the trip ahead with perfect timing for guided tour.Entrance fee to palace:3000won (free for those with hanbok)Entrance fee to secret garden:5000wonDefinitely worth a visit!!
188,5.0,"Palaces are a must-visit attractions when we are in Seoul, Korea!We are allowed to snap photos in the palaces. Some of the palaces does charge nominal fees but most of them are FOC."
189,4.0,If your going to tour one of the palaces make it this one. Its the biggest and most scenic I would say. Make sure to time it properly so you can watch one or two of the guard changing ceremonies. Spend some time walking around and then relax a little by the absolutely stunning pond in the compound. Great way to spend a couple hours.
190,5.0,"This palace is so so beautiful in the spring with cherry blossoms and in the autumn. You can visit this palace with the Huwon garden (3,000KRW for entrance fee and 5,000KRW for the garden admission fee)."
191,4.0,"Beautiful palace, cheap price and fantastic location. Go go Insadong and Bokchon village after and then have lunch or dinner!"
192,4.0,Great location to gain insights into the history of Korea. Need a good guide to introduce the area and bring history to life.
193,4.0,"The palace ground is huge, but retained the old Josheon dynasty feel. A site where they shot some of the scenes for the famous Jewel In the Palace Korean drama. Worth visiting - I reckon it is better than Geongbokgung Palace."
194,5.0,"I visited Secret Garden which is located in the back side of this palace. It is called ""Bi-won"" in Korean, and which means ""Secret Garden"" because this place was allowed to special persons only in Chosun Dynasty.English speaking guides are available. There are several time section and Koreans can't join English section without foreigners company. Secret Garden is available only visitors who reserve it in advance."
195,4.0,"If visiting the Secret Garden, it is quieter and less crowded than Gyeongbukgong because you must book a tour to enter.  In my opinion, this is a top site to visit in Seoul.  The garden is small but pretty and tranquil.  It does not compare at all in terms of splendor or grandeur to the imperial gardens of China, but does have its own unique flavor.  It is clean and well-preserved.  If you can, plan to spend a bit of time relaxing there.  There are a number of small pavilions set up with books there to chill.  A very nice touch.  wear your hanbok for free admission."
196,5.0,This palace is really beautiful and peaceful. It is possible to see many Korean visitors with their traditional Korean dresses and that is absolutely lovely. It is a must see in Seoul.
197,4.0,"I really enjoyed the fact that this palace was within the city and near a train station. It was a relaxing walk in the palace - although most of the relics are reconstructed, it still gives a good idea of how life was in the past! My family and I decided to take the Secret Garden tour. It is really beautiful and great for photo taking."
198,3.0,"I loved the architecture, the layout of the land and of course the history of the Palace. It just seemed a bit dusty and it is very inaccessible by wheelchair or stroller even though there are ramps."
199,3.0,"We went to Seoul in June, it was quite hot, I had high expectations about Seoul but so far it was just an average trip that didn't have much attraction. We went to Changdeokgung Palace. I like places with history and story attached to it. I enjoyed the food but didn't love it. I guess enjoying/loving your travel will depend on the places that you go. So maybe next time I will try the outskirts of Seoul."
200,5.0,make sure you do the secret garden walk!we had a wonderful time!a bit hilly but we managed a buggy fine
201,4.0,"Easily access by subway ( Angguk station, exit 3). Entrance fee was 3k won and secret garden was 5k won. Closed on Monday. You can see many locals and tourist wore hanbok. Worth to come."
202,5.0,"This palace is open at night for certain period of the year.  It used to be at the center of heavy and noisy traffic with a zoo.  Now it is relatively quieter neighborhood.  Without a zoo.  One amazing development is all the walkways are accessible to wheelchairs.  It opens at 7 at night.  As it is less popular than another palace in downtown, it is less hubbub. You can enjoy a great walk feeling the spring air.  No street vendors.  Only some security guards as guiders.  It was always there, you can find.  I hope more spaces would be open and it would be connected to Secret Garden and Royal Family Garden.  It would be then two-hour walk.  As of now, it was about 30 minutes walk."
203,4.0,A nice place which you should go visit one for taking pictures. Also interesting to see the guards changing shift
204,5.0,Beautiful palace and so many stories to unfold. Rated the most beautiful palace out of the 5 grand palace.
205,5.0,"Very beautiful palace with a secret garden(separate ticket needed, giuded tour only with freindly giudes who speak English fluently). A good souvenir shop with refreshments and rest rooms."
206,4.0,We attended the 10.30am free English guided tour and it was very informative.  We then went to the 11.30 Secret Garden tour - good but we abandonded half way through to make another engagement - beautiful gardens.
207,4.0,"We saw the changing of the guard which was a lovely sight,we also got to dress up in national costume and have our photos taken with the guards."
208,5.0,"Which is smaller than gyeongbok palace but it's beautiful palace! Inside the complex, you can find Huwon, UNESCO site! That is really beautiful and you can find the finest scenery of old korean building and nature together! they are harmonized! Plus, you can hear awesome explanation from special tour guide! She was friendly and knowlegable about Korean history! For tips  to visit here, elderly is not good here, need to walk at least 2hours for changdeok palce and Huwon"
209,4.0,"This was an insightful outing.  Nice to visit and learn of anther culture, time, place etc.  A good walk in the fresh air as well."
210,4.0,"My first time to visit Korea's palace and it was amazing. We took a lot of pictures at the entrance as there was some men who wearing the tradition Korean customs.   It was a pity that we didn't spend much time at the palace and wish to try the Korean customs.  We also didn't have time to visit the secret garden. For me, I will visit this palace next time."
211,4.0,"You need to arrive fairly early if you want to do the secret garden tour after the palace tour. English-speaking guides take the tour around the palace at 10.30am and the secret garden tour kicks off at 11.30am. We turned up a bit late so although we had the palace tour, the garden tour was sold out and we had to wait until 1.30pm for that. Luckily our hotel was very near so we nipped back there as there isn't really another two hours of activity once you have toured the palace. The talk was very good at giving an insight into court life, meaning when we later went to Gyeongbokgung Palace we didn't feel it necessary to join a guided tour. Word of warning to the infirm, the garden tour has some quite steep climbs and quite a lot of older and more overweight vistors found the pace a bit intense, especially in the heat. It's also worth buying the four-palace pass if you intend to visit all the palaces in Seoul. We only did these two, but I'd recommend them both. Gyeongbokgung is much bigger and also contains two fantastic museums. A real must visit."
212,5.0,"I enjoyed visiting this gorgeous palace. It has so much architecture and history! The day we went was free entrance and we only had to pay for the English-guided garden tour which lasted an hour. When visiting you can see some Koreans dressed in traditional clothes. It can be very humid and hot so stay hydrated! Also, you can take beautiful pictures so I recommend bringing your best camera. Highly recommended if you are in the area!!!"
