,title,text
0,4.0,"Beautiful little stream with people walking and jogging around. However if you go there during the night, it can be a bit scary as the street light is not much in terms of quantity and brightness. But don't worry as local people here are very nice and friendly. It is also peaceful to walk during the night."
1,5.0,It is quite nice man made attraction at the middle of the city. People just walk along the stream enjoying scenery.
2,5.0,"You won’t miss this if you’re walking from kwangjang market. Pop by for a quick photo, beautiful reflection of the sky in the stream."
3,5.0,It was a great/beautiful walk down the stream i usually dont walk around but i appreciated this beautiful scene i embraced it and will do it again.
4,4.0,"Magificant light festival along the river, whenever you go to Seoul it’s akways worth checking what’s happening on the river. Lots of bars and restraints nearby"
5,5.0,"Located in the Centre of the metropolis, the walkway gives a sense of calmness from the fast paced city. No festivities while I was here but I’m sure events would be well decorated."
6,5.0,"A must see place in Korea, it is located in the middle of tall buildings but it’s amazing how they preserve the place. It is indeed so rich in culture. A huge place to visit. You need at least half a day to visit all the sites in the palace. When you wear the hanbok costume, the entrance is free."
7,3.0,"The famous stream was next to our hotel and of course having seen it in so many korean drama, we had to take a look. It was just a stream and on a hot summer day, many tourists were seen soaking their feet in the water. Nothing much to do here."
8,5.0,"My Korean friends have told me that Cheonggyechon Strean is exclusively for couples, but is not the case, of course, you will see couples walking around and having a romantic moment but you can go check out the stream with friends and family too. The best thing is you can take off your shoes and dip your feet in the stream. Since is summer, many people go there and they bring their snacks and beer to have a relaxing moment. Here is where the lantern festival takes place in November, if you are in Korea around that time I highly recommend you to check it out. You won't get disappointed."
9,3.0,I didn't know what was the big deal when everyone told me I have to visit the steam. It's a very long walk until the end of the stream - you don't have to walk all the way. The view is better in the evening. Apparently it used to be road. And the government decide to make it a stream. I think that's a fantastic idea! I appreciate the stream even more
10,5.0,"I went there around 6.30 pm so that I had an hour walking along, and then saw the sky changed its colour"
11,4.0,It is indeed a place worth visiting.  We strolled along the stream and stopped to sit at the side to enjoy the breezy wind and get some sunlight during the spring season.  Don't forget to bring some titbits and a bottle of hot tea with you at your next visit.
12,5.0,"We were here first at night, and everything was decorated with lanterns because of Buddha's birthday, so it looked really awesome. But also during the day, it's a nice place to take a walk."
13,4.0,It was a nice break from the hustle and bustle of the surrounding markets. There was a water fountain.
14,4.0,We stayed a bus ride away from the stream so we appreciated the nature amongst the bustling city when we arrived. The Stream is set lower than the streets surrounding it which separates the area a little better and as we walked down on a Saturday morning we were able to take a nice break before we headed out to busier parts of Seoul. It was a peaceful area and was nice to relax in.
15,5.0,We decided to walk from Gwangjang Market to Dongdaemun Market (about 20 minutes) and it was such a peaceful walk. It felt like we stepped out of the city into another place.
16,4.0,"For art lovers , then you could stay here. We had our own photo taking . Nice place to stroll around. Watch out for announcement of festivals , it would a much better environment."
17,4.0,"I’d suggest going early in the morning, and walking along this stream. No traffic lights here! Also in the evening, along some sections, there a small laser show. Actually quiet peaceful by this stream.Only negative, needs more signage, so you know where to exit from, or which street your at."
18,3.0,This stream run from North to South. You can take wal both side of stream if you like get a bit rid of bustle of city. During wal along of stream you ja spot wall some info about history of this area.
19,3.0,"Although the stream was unimpressive and small, its river bank has been spruced up and decorated with caricatures, paintings, plastic models and structures, which help livened up and made the riverside ""interesting and attractive"". Clean and uncluttered, the tagline then was ""I Seoul U""....."
20,5.0,"This is a great oasis in a very busy city, and is perfect for a contemplative walk, a jog, or just to sit and soak up the atmosphere."
21,1.0,"South Koreans don't like to pick up their litter. In an advanced country like this, everyone just throws their garbage everywhere. It's sad."
22,4.0,"This place is transformed to be a very beautiful area during christmas season.. all the lighting and christmas tree make it amazing at night. If u go to seoul on December, its a must see.."
23,3.0,Displays of lanterns along the stream.  Nice place to chill out and enjoy the lovely lights after a day of shopping!
24,3.0,Unless  u are a couple which is food as it's dark.  If not go in the morning between 9 to 12 PM as you will be able to see the change of guards. As  night time  unless there are some events if not . There are not much lights to see much of the  beautiful history or this stream which survived wars
25,4.0,Lovely way to get away from the streets and still get where you need to go. The sound of the water and traditional music was a nice change from the cars when walking the busy streets. There was still a lot of greenery in October.
26,4.0,"Yes, try to stroll a stretch along this stream. Really gives you a break from the city traffic and noises..."
27,4.0,"nice place to walk in the evening, when the lantarns are in the water arround the festival periods it is just perfect"
28,4.0,"During the day, the stream is just there amongst the hustle as it is close to the markets.At night, it comes alive with lights that give it a unique feel. There is a water fall with lights at one end and then you follow it down where there is displays of light here and there.There are stone steps across the steam if you want to cross over.  I enjoyed walking below the street level with the stream next to me while you are surrounded by office towers."
29,5.0,"Wow. What a great place to go for a stroll in this noisy, big city. I lived in Korea many years ago and it’s hard to believe this river was under my feet. It’s a lovely place to walk and take a break."
30,5.0,This is such a lovely place to visit in the hub of a busy city. We strolled along the stream in the evening and it was just lovely and peaceful.
31,5.0,I usually go to S.Korea in the winter time so there are always light installations at the stream.  It's very nicely designed and perfect for photo ops! If you're in S.Korea I totally recommend this as a place to check out.
32,5.0,"Buy some street food and bring it here with a loved one or someone you're trying to woo. It will make them fall for you just like in K-dramas. Even better, if it's raining, make them share an umbrella with you."
33,5.0,"I am shocked by the fact this stream is so clear that you can see fishes. The water is so cold. Try putting your legs there. It's refreshing! And, don't forget to cross the river. After a long day, spending my time at this stream heals me a lot."
34,5.0,"This is a lovely place to take a quiet stroll, and makes for a nice alternative to the sidewalks above. It's well lit at night as well."
35,4.0,"Lovely little stream, the history behind it as well is also fascinating. Nice and cool with lots of shade on hot days, and not too busy either."
36,4.0,"Offers light show, a good walk or place to dip your feet during summer. This park caters to all. A good walking distance from Myeongdong Shopping Street."
37,4.0,"This is about the most peaceful place in Seoul that I could possibly think of. Spring and fall are great times to visit, and the stream also plays host to the Lantern Festival in November. Usually a lot of space to relax, unwind, and contemplate."
38,4.0,I love this place but too bad I always went there in the afternoon. Hope i could visit there at night later
39,5.0,"Having a walk beside the stream in a hot summer afternoon, you feel cool, quite and relax.   It is really a marvelous water work, turning a dirty sewage into a clear stream."
40,5.0,"Its refreshing, in the middle of the road you cant believe that you can find a clean water and solemn park."
41,5.0,"This place comes alive at night. Night bazaars lighting up the place, and busking groups spread across the area.The area used to be a place of waste, but then it was rebuilt as public place with a stream flowing in the middle. Stairs are provided for people to sit down and spend times with loved ones. You can even dip your feet in the stream as it is very shallow.You can find friends, lovers, and sometimes family just sit beside the stream, chatting, eat, and drink beers.The place is near Gwanghwamun area, so you can also enjoy buildings and night lights."
42,5.0,I'm a nature lover that's why i love this stream. Its sound and the cold water is sooo refreshing. A must go place after a tiring all day seoul touring. :)
43,5.0,"Very cool manmade underground stream.  Often there are concerts , markets or other events held at the beginning of the stream"
44,5.0,Beautiful man made stream and love the rainbow lights. Landscaping along the stream are beautifully done. Must see
45,5.0,"Its so refreshing and calming, listening to the flowing water.Nice place to take a rest when you get tired walking."
46,5.0,"Have a stroll down the stream with your loved ones, family, alone or a best friend. Super relaxing and the whole vibe is sure to get you in the mood to want to lay your mat and picnic somewhere cosy. If you’re lucky you might spot cute ducks waddling in the stream. Recommended, highly. If you love quiet places to spend quality time with your loved ones or alone."
47,4.0,"Little fountains. waterfalls, lots of places to sit but it's all concrete. If you are walking by the area, you would enjoy it for 10 minutes"
48,5.0,"Had to visit this stream in our tour, but before that you will pass Kyobo, which I think the biggest bookstore I've seen in my entire existence yet. And after there you'd see this stream which is a very nice place, but yeah nothing much to do here."
49,5.0,A small canal about 10 km in the center of Seoul. The canal has been rotten in the past. Now it is the public park and it has waterfalls in the big city center between many tall buildings. It make us relax.
50,5.0,"After many activities of shopping and eating in Seoul, this river offers freshness and tranquility. You can just take a walk or run (if you want) along the river. It is FREE and refreshing! There is also a coin spot for you to make a wish in this river. Such a lovely place 💙"
51,5.0,"A nice way to move through the city, quiet and pretty. There are a few places you can scan with your phone and get translated information on the plaques/exhibits."
52,4.0,Its better to go there at night. The river is beautiful with some of light decoration. Many people visited here especially couples. Many foodstans too.
53,5.0,"Was fortunate to visit during the lantern festival that promoted the 2018 winter Olympic games.  Fantastic experience, especially since I had assistance from really friendly locals to help put my lantern together to send it downstream"
54,3.0,"Read some reviews about this place and this is my comment: Timing.We were there at night during the Christmas week and there were some human traffic about, but not overly heavy that we were not able to take pictures of the stream and the Christmas deco placed. However, the particular night we were there, it was pretty cold and it was 10ish so we did not complete the entire walk, just after some Santa Claus blow up dolls. For those intending to visit this place, some things to consider:-a) time of the dayb) season - maybe there are more things to see during certain seasonc) potential festivals - eg Christmas, Lantern Festival, New Years, etc"
55,3.0,passed by the stream many times but i only went down to take a walk this time round. many parts were still covered in snow.. (there was heavy snow abt 1-2 days before i reached). nice place for a stroll and taking photos but it can be cold and somewhat slippery depending on the weather.
56,3.0,In a busy city of Seoul there is a walking stream path. While it isn't anything special the stream path was good to get away. There are lanterns that lights up at night time
57,5.0,"This is definitely a site to see! No entrance fee, walkable from Myeongdong, 15 mins. It's amazing how the old unused canal has been converted into a nice green eco-rich area.  You can stay here as long as you want, sit, read, eat. Beautiful place!"
58,5.0,Peacful place in the middle of the city. On warmer days I would definitely spend my time here eating food from Gwangjang market.
59,4.0,สะอวด สวย เดินเล่นได้ แม้ว่าอากาศเย็นก็มีคนมาเดิน ออกกำลังกาย.  ไม่อยากคิดเลยว่าจะมีบรรยากาศธรรมชาติที่สวยงาม สะอาด ท่ามกลางแห่งshopมากมายNice and clean canal. Let’s stop by for walk after shopping or conference.
60,1.0,"We found the stream easily enough but after following it for the awhile, we still hadn’t encountered the “main attraction”.  As a featured sight, it will help tourists if the exact point of the stream worth viewing is indicated."
61,3.0,"We visited the annual November lantern festival along the stream. While it is a nice walk with the autumn breeze in the evening viewing the different lanterns, the long distance we travelled to visit it didn‘t seem worthwhile"
62,4.0,"This stream running centrally in Seoul, is innocuous by day, but in the evening is lit up with a plethora of lanterns and lights, and is most attractive."
63,4.0,we went at night which also happened to coincide with the lantern festival. beautifully lit lanterns along the stream. jam-packed with people and there were people to direct the public to only move in a single direction. nice place...very lively atmostphere
64,4.0,We happened to be in Seoul during the autumn lantern festival. The stream is festively decorated with a variety of lighted displays. It made the stream so festive with the full moon backdrop. So worth battling the crowds.
65,3.0,"As our airbnb was along this stream at Jonggak station, it's almost a daily event for us to walk passed. I would definitely recommend walking along this stream to get to Myeongdong instead of taking the subway. It took us about 10 to 15 mins with a few traffic lights to Myeongdong shopping area. Like most tourists, our initial days were spent taking subways, climbing up and down the stairs just to change train at Seoul station. The stream needs maintenance. Too much wild plants growing on both sides. Lights at both sides were dim and not many street lights available on street level. Can be dangerous for a lady walking alone at night. There were many exits along the whole stretch so do note which exit you are going."
66,5.0,"A calm from the storm, if you want to walk and get off the normal city streets, this is the place you would like to go.  Great for a run or bike ride.  It really is a beautiful amenity that can easily be missed in the busyness that surrounds you."
67,5.0,"Today was an unusual quiet Sunday as most people have left the city for the October Golden Week holiday. The walk was very enjoyable without shoulder bumping shoulder or endless young children running. The serenity of the stream after Euljiro-3-ga is almost like a fairytale oasis. A lot more greens and wild flowers on both sides of the stream. There are also fish, birds and even stork."
68,5.0,"I love hanging out in this area, it's giving me kind of peaceful feeling. It's surround by office building, and rows of tree. I believe it would be wonderful in the autumn. The water so clean, you can dip your feet into the stream."
69,4.0,"This stream is a rejuvination of Seoul. Years back, an elevated highway buried the stream. It is easy to see how you can while away an hour or two of your time at this place. Watch out though where you are stepping, especially when getting a good shot of the waterfalls where the stream begins. My foot fell into a gap and got my shoe wet. Safety first! 😛"
70,4.0,"Very cool usage of urban space. Not much to do there but walk around or stick your feet in the river. But if you have some time between sightseeing, I would recommend getting a bottle of soju, some food, and having a quick picnic by the stream."
71,5.0,"I like walking around along Cheonggyecheon Stream during the summer nights. I have some friends who work near there so we meet up somewhere in one of nearby restaurants and we take a walk afterwards and catch up with one another. Sometimes, there are some artists who sing there and some exhibitions that worth having a look. Often, couples walk arm in arm and everything seems very romantic."
72,4.0,"Lovely long peaceful walk, clean water with heaps of different fish, stepping stones, flowers. Great place for a jog, or a break from the city bustle."
73,4.0,The stream is good for visit both daytime and at night. It was a leisure stroll along the stream at daytime especially during weekends as parents like to bring their kids there for fun. There are many coffee shops along both side of the stream for rest after the walk. Evening visit is more interesting as  the lantern lights floating on the stream are on. A good photo spot for evening scene.
74,5.0,This is also one of the spots in Seoul where you can get away from the chaos of the city. After a long day spent on a city tour this is one of the best places to go to chill before you go back to your place. Check the schedule of the lantern festival in November. We were able to catch it and it was really awesome!It can get a little crowded but still a good space to walk around with friends. You can also space out while staring at the stream if you are really tired. You can also chance upon a hot air balloon and a busker.I recommend doing this at night especially during the lantern festival!
75,5.0,"Perhaps one of the more surprising parts of downtown Seoul, this is a haven from the skyscrapers and traffic. Very popular with locals at lunchtimes and going home, it deserves a visit from anyone seeing Seoul."
76,4.0,I enjoy walking along the stream. Even better if you go with your love. at the end of the stream is a nice scene to watch and enjoy.
77,3.0,"If you are near Dongdaemun, just go for a nice walk. Evenings are good and lightings would be there mostly.  Very peaceful area even though it's in middle of the city.But there is nothing else amusing and don't make it as a destination for your Seoul trip."
78,5.0,It was a good long walk from one end of the stream to the other end and it was cooling enough to walk the entire way on a September night in Seoul without breaking a sweat!Many people come here for dates and it's a good place to bring your partner for a romantic night out. Many food places around so you won't be left hungry.
79,5.0,"Probably one of the most endearing parts of Seoul, this former sewer was recovered and turned into a well thought out walking park.  We loved the crowds playing in the water on Sunday and the enormous mural of the funeral procession (actual numbers!).  The next day, I travelled away from the giant corkscrew on the smaller, more rural side of the creek, which was just as fun.  Made it all the way down to the Eastern gate - a lovely walk."
80,5.0,"In Seoul, everything is fast and modernBut this stream brings back calm and less pollution to your bodyYou can run, bike, enjoy a walk, have a dateEverything is so peaceful next to that cute stream, especially on Lantern FestivalI recommend it :)"
81,4.0,"Nice to find a place like this in the middle of an urban jungle! I think that hether or not you will appreciate it depends on the time that you visit. Visit early in the morning if you appreciate the calm and quiet -- there will barely be any people at this time (at most, maybe a handful jogging or exercising in the area). If you would like to see the place full of life, go in the late afternoon to evening (there are also usually bazaars by the stream at this time on weekends)."
82,5.0,good for a nearby morning stroll and perhaps a nice soak of feet during summer LOL. would be good to check out for exhibition as the plain stream can look plain. LOL
83,5.0,"I absolutely love visiting the Cheonggyecheon Stream! This is a place I could've visited every day during my week in Seoul and still enjoyed it. My first experience visiting the stream was on my second night in the city and this was during the Seoul Performing Arts Festival. We were dead tired when we arrived here, having spent most of the day at the Gyeongbokgung palace premise in the intense sun, but this place uplifted our spirits almost instantly! I never thought that I'd love a crowded place as much as I did, but this place just blew my mind away!"
84,5.0,This is just a walking district with the stream beautiful street made around a simple stream that crosses the city. On both sides there is a sort of embarkment for walking people. In its begging few portals go down from the embankment upper area to walk by the stream. In the night it is nicely lighted with great ambiance around.
85,3.0,This stream cuts through the city but otherwise is pretty unimpressive if you come from a place with lots of natural water.
86,4.0,The Cheonggyecheon Stream used to be covered by roading but was dug up some years ago to reveal the stream. Nice place to have a wander particularly during a hot day. Many people sit with their legs in the water relaxing and cooling down. During the Lantern Festival the stream has many lanterns and displays and looks absolutely stunning. A nice little oasis in the middle of the city.
87,5.0,"After a day's tiring tour of the city, we went here and dipped our tired feet in its cold water even if it was summer already. What a relief!! It was enough to recharge and to scour again its surroundings. I suggest you navigate the entire stretch especially at dusk and you will see how this place is teeming with activities. There's even an exhibit under the bridge and there was this cool sax player who played several songs to the delight of those sitting around with their dates."
88,5.0,"Took a walk along the Cheonggyecheon stream after dinner and it was so lovely. It felt a little surreal to see the towering skyscrapers line the banks of the stream. There were different activities along the banks, such as light shows, musical performances and art exhibitions. It also seems like a popular place for dates as we saw many couples seated along the banks! A perfect place to stroll, relax and chill at night!"
89,5.0,We liked this place so much that we actually went here twice. It is very calming and looks the best at night
90,3.0,"Interesting to note about that the river was cleaned and rebuilt as an attraction for Seoulites to enjoy strolling. However, there is really nothing impressive to see while strolling on the river banks. Just take photos from the top and it's enough."
91,5.0,"A beautiful stream which is great for walking alongside. The waterfall is best place to start and an awesome location for taking photo's.Art alongside the walls, historic references and stepping stones to cross the stream. Above you can here the traffic of Seoul going about there business and in the evenings the surrounding buildings light up with colour. Some of the bridges have beautiful art underneath them.Take some bug spray if you are planning an evening stroll after a hot day.You have to visit the stream if you are in Seoul."
92,5.0,"Love this place, been here in 2014 and again in 2017. Made good memories each time. Really good to just stroll with a friend or sit around and eat food or drink beer."
93,4.0,It was nice to visit this place at night. It's actually SEOUL Lantern Festival when we got here. One of the most famous sightseeing spots in Seoul.
94,4.0,"Walking along the river is a much nicer way to walk to where you want to be right in the middle of the city.  Walking back however we wanted to stay out of the sun.  The path on that side was narrow with walkers out during their lunch breaks, in groups, and not easy to walk around/past."
95,5.0,It is a nice leisure place to spend an afternoon. Many local residents taking off their shoes immersing their feet into the stream. There are performers busking along the stream adding colors to the place
96,5.0,Please visit for having a break during a day. You will never be disappointed. Family friendly place.. You can sit down and put feet in.
97,4.0,"For me this place is special, we stayed here few hours, very scenic, clean, and just a few blocks away from our hostel. Very clean, you can stay here as long as you want, a public place but maintained well."
98,4.0,You should not miss a walk along the stream at daytime and after dark. Look at the local people enjoying this atraction at the city center and admire the initiative
