,title,text
196,5.0,"Spot families, couples, and friends strolling this accessibly stream.We walked here from Gwangchang Market. A pity we didn't finish walking the entire stream."
197,4.0,"Although it's great for a walk or for jogging, the vegetation around needs urgently a hand. Come here for the sunset or at night when the lights dim with the bridges. Also a picnic here would be a super romantic date."
198,5.0,this stream run through seoul. many people come here to relax or meet friends. also its recommend place for dating where you can see many couples hanging out and street musicians play on their guitars. at night they have light show on water
199,5.0,"Really beautiful stream in the middle of the city! Great place for a short or long walk, enjoying all the art all over the place. I went there during day time, which is a pity, because I bet it would be something really amazing at evening."
200,4.0,"We stumbled across this walk on our way to a supermarket in the evening, plenty of people enjoying a stroll alone, with SO or friends."
201,4.0,"Cheonggyecheon is among the places where both, tourists and locals enjoy having fun. Especially, on the nights, you will see lots of couples walking around, so if you are looking to have some peace from the busy city of Seoul, this is the spot.If you go around the whole stream, it will take you close to an hour, but overall it is worth the walk.If you go on the daytime, it is more quiet as there is a lot of elders walking around."
202,4.0,"This is shallow stream about 15~20 feet wide, with walking paths on each side, connected by several small small bridges spaced out along its length.  It cuts through a major part of the city, following the path of a natural stream that was at one time covered up by concrete and later uncovered to make this attraction.  At Christmas time and other festival times, the city makes light displays here that are quite nice.  Then, I would say this is for sure a place to come and take a few pictures.  At other times, it is a just a calmer place to walk - no cars, traffic lights etc.  Generally speaking, I think the nicest time to walk here is in the evening, when they turn on the everyday lights (under the water, and along the pathway).  It might be a nice simple break after a busy day of sight seeing, and after a nice dinner.  You could just walk a little ways, and sit for a while with a coffee (when it is a bit warmer).  Kids might be entertained for a short while, but it is more of a place an adult might appreciate.I have visted in summer and winter.  It the summer time when it is hot, it feels a little cooler walking beside the water.  In certain sections there are bushes and trees that give some shade.  Many sit on the edge and put their feet in for a while.  In the winter time / colder times of the year, it is not as appealing, because the bushes and trees are brown, and the stone is a little chilly to sit on, so you are not so inclined to mozy along and relax. You could possibly take this walk/coffee break in connection with a concert at the nearby Sejong Arts Center, or in connection with a tour of the nearby main palace (10~15 minute walk from the main starting point). The Myeongdong shopping area is nearby as well."
203,5.0,"Walking along the paths by the Stream just before Christmas with lights and light shows is an unforgettable experience. It is very popular with Koreans who come to take photos, meet friends and enjoy the carnival atmosphere. Originally this was a run-down area but it is now one of the not-to-be missed sights of Seoul."
204,4.0,"The stream is a good visit for a morning or a couple of hours in the afternoon. You can start near the city hall and walk all the way to the East. There's different parts with some more nature feel or modern urban feel. What I missed was the connection to the street and maybe some places to have a drink. But see this as a nice quiet stroll along the river, that happens to be in the middle of the city"
205,3.0,"Nothing spectacular except when there are decorations or particular themes being displayed at Cheonggye Plaza/at the start of the stream. If it's on your way from one attraction to another, it's worth a quick stop for some photography."
206,3.0,"It's a cool place to walk by if you happen to be nearby, mainly at night. Not necessary to walk all of it, with just a Km you can appreciate it more than enough."
207,3.0,"We chanced upon the place on our way to Dongdaemum. Earlier, our host has advised us against going there as there is nothing much in winter and he's right! However it offers another type of tranquillity and charm in the busy city area with its half frozen stream and spacious walkway. Worth a drop by if it's on the way but would not have purposely make a trip there during winter months or when there is no ongoing festival."
208,4.0,"Even if you just want to take a walk across the stream, you will reach other part of seoulwithout having any Idea. Mak sure to check it out during Lantern Festival (it looks fab espacially for kids)"
209,3.0,"The Cheonggyecheon Stream is definitely best seen at night. I went in January (windy, cold, unpleasant) and during the day. There wasn't much to see and had I not been in the area already, I would have been highly disappointed."
210,4.0,"Went a couple of days before Christmas, so it was lit up nicely with many lights (snowflakes, flowers etc.) There were so many couples! The waterfall at the end was also very pretty."
211,5.0,Amazing place in Christmas! It's decorated with a lot of beautiful lights even if you go not in Christmas you will also enjoy it!
212,5.0,"Took this walk for the first time last Labor Day 2015. I was all alone, but thoroughly enjoyed the experience. Would highly recommend it to anyone. good walk with a friend or girlfriend, also for anyone interested in Korean history."
213,2.0,"I know it had the best of intentions, but it's not that nice. It's rather random exhibits sponsored by various countries."
214,5.0,"This is a great place to visit for a relaxing afternoon. The stream has many lovely shops and restaurants next to it. During the warmer months, you can sit and put your feet in the stream. I have been many times and I enjoy it without fail."
215,3.0,"The photos definitely make this look nicer than it is. There were unlit Christmas lights and figures which were still in the stream, which took away from the experience. It would prob be cooler at night. The wishing well was cool, and so were the stepping stones. But it was underwhelming compared to the photos."
216,5.0,"I went to Cheonggyeochon Stream during spring season and it is located near Dongdaemun. At first, I just accidentally saw this places in the afternoon and it is really beautiful. When night came, I visited this river once again and it's still as awesome as you can imagine. The water is really clear and you can just sit on the bench of the river and put your foot in the water, it might be simple but it's sooo refreshing! you can see many couple spending time near this river because somehow this place brings you a romantic feels :D a must visit in Seoul!"
217,3.0,"Took a walk at this peaceful and calm stream with a friend. It is located very near to Dongdaemun shopping complex, Pyeonghwa market and Dongdaemun market. Took some pictures and enjoyed the peacefulness and calmness of the stream. Not to miss this stream if you are nearby Dongdaemun shopping complex."
218,4.0,Its an amazing feat having a clean and clear stream at the center of a busy city. We had a walk on this famous stream in the morning and it felt really good. The sounds of the water and the man-made water falls really calms you down. The water is so clean in fact we saw Koi and other fishes. Our Tour guide told us that it's better to visit the place at night especially during summer where there are lots of people just hanging around. Worth visiting !!!
219,5.0,AMAZING! DAEBAK! BEAUTIFUL! I suggest you should visit the stream at night or more good if u visit on Christmas or the latern festival! Romantic and really beautiful!
220,5.0,This place i s nice to stroll along either in the morning or in the evening. its more quiet in the morning as at night this place is full of dating couples esp in Spring. There/s a lantern festival here during November.
221,4.0,"Best in the evening in May around the time of Buddha's birthday when the lanterns light up the walkway beside the river. Amazing solo walk, and also for some relaxing picture taking. Calm"
222,4.0,"I was there when it is having lantern festival. So beautiful, suitable for all people. i saw a lot couples, families or friends. This is one of my favorite spot in seoul."
223,4.0,Visited in Nov and managed to catch the annual lantern festival along the stream. A long stretch of various lanterns and light instillations. A must visit during this time!
224,5.0,"Before my visit to Seoul, many friends have recommended visiting this stream. So I set aside half a day to visit this stream. It's a beautiful stream situated in the middle of a city. It was nice to walk along the stream to just relax and take a break from the busy days in Seoul. I walked along the stream right up till the waterfall where the stream began and where everyone there was taking photographs with the waterfall.Recommended to anyone who would wanna take a breather from all the busy streets and see a long beautiful stream."
225,4.0,"Cheonggyecheon Stream was once a dirty river, now it is the main attraction of Seoul. This place is beautiful day and night. U are lucky if u travel in November during a lantern festival. It must be so beautiful at night."
226,4.0,This is an easy walk from the palace on the way to Myeongdong and some time should be spent here. There is a Lantern festival whole of November so that's a bonus.
227,5.0,This place is a must see place when you visit seoul especially at night. This place is near seoul city hall and city hall subway station. Many young people go this place at night to hang out whether with friend or with their couples. Often you will see a bazaar held in this place also music performance by locals.
228,4.0,"This stream is less natural than many think - water is pumped into it from elsewhere. Still, and despite lots of concrete, it makes a nice break from the crowded urban surroundings. Part of it is a wetland and it seems to have attracted quite a lot of wildlife considering where it is."
229,5.0,This place is definitely on top of my fave place in Seoul. The river is the best place to have a break after a long walk around Seoul or around the markets... Kekeke
230,5.0,"Come here at night with lovers, family, friends, everyone can enjoy this view. Just don't forget to bring your camera."
231,5.0,I went there during November while there is lantern festival. Beautiful lantern and creative activities available. It's very nice to walk and enjoy beautiful lantern.
232,2.0,"Went here in the night to see the lanterns, but this was very over rated. It was ok to have seen it, but not something I will recommend to go to."
233,4.0,Visit on November and you will witness more of the stream's beauty with the lantern display during the festival. Nice to stroll around and then head at Gwajang market for some street foo to taste.
234,5.0,Perfect place for a walk. Must see when in Seoul. At night it's all lighted up in magnificent colors. You can get good food by the sides of the stream and wonderful bars with good service. It gets really cold on autumn and winter! Be prepared.
235,4.0,"Obviously, as the name goes, it is a stream, but it makes for an enjoyable walk. It is quiet, and at night the lights give it a different feeling, that during the day is lacking. Good though for a run outside the busy roads and streets."
236,4.0,"Near dongdaemun market, dongdaemon design plaza, and JW Marriot Seoul Hotel. Cool, quite and romantic river in the middle of city. how to get here, please go by subway or metro line 4 stop at dongdaemun station exit 8 😊"
237,4.0,"On a Saturday evening as dusk starts to fall, I find myself walking with local friends showing me the famous Cheonggyecheon Stream in downtown Jongno-gu in Seoul.The place is a buzz with people of all ages enjoying the walking and art.The stream was created in 2005 as an urban renewal project to bring water, trees and art to the community.It is now a great success with many interesting displays of art in the stream, on its banks and interactive art works for the kids to enjoy.A great place to wander on a sunny day for a few hours."
238,5.0,One of the best place in Seoul. The water stream is so relaxing. I can never imagine there's a place like this within the Metro. Don't miss this.
239,3.0,"nothing special to describe this place, just a nice place to take a rest after a long walking day. Too Dark, i think need to put more street lamps."
240,4.0,Do check it out if you are in the area during evenings. Pretty with the lighting and good for an after dinner walk.
241,4.0,We passed by during the day and thus did not see the wonderful lights but it was equally pleasant. The stream was nice to stroll along and relax.
242,4.0,And to think that at one time this stream was covered up... This is now - after early 21st century project completion  - a beautiful and unusually appointed urban space. Lovely place to stroll and relax. During our Seoul stay it housed a recycled art exhibit and on a sunny October day our stroll was breathtaking beautiful!
243,5.0,I came here after Gwanghwamun Square and Gyeongbokgung Palace. These place are in one area so you can reach all of them in the same day by walking to each other. Recommended!
244,5.0,"It's got to be my favourite place in the entire city of Seoul. Agnes and I were there in the late afternoon, we strolled along the stream for 2 hours and enjoyed the stream set against the sunset. It is absolutely beautiful. You'll have to see it for yourself ^^"
245,5.0,"I work just across the street from Cheonggye-cheon, and here are quick tips for 2-3 days tourists.1. If you are rushed by time, consider visiting here at night time. It's got a fine night view with lights on the buildings nearby.2. The stream itself is some miles long, but it's all artificial and the best part is the starting point.3. If you like tracking, you may consider walking through the stream from Gwanghwa-mun to Dongdae-mun, it would take about 30-40 mins normally.4. MOST IMPORTANT : Don't even try to get into the stream when it rains. The stream has a function of city sewerage for heavy rains, and it easily pours out especially in the summer. When it is closed, don't go, and when you see the rain, don't go downstairs.5. Drinking & Smoking is strictly prohibited : up to $100 fine"
246,5.0,"Came to this stream to see the annual lantern festival throughout the month of November. Warning, it place does get really crowded, be sure to arrive early so you can be one of the first people to walk through the lower level of the stream area. Unfortunately, when I came, it was extremely crowded and the line to go toward the lower level stretched for miles. Eventually after 30 minutes of waiting, we finally decided to leave. You can get a couple great shots from the upper level. Along the upper level, there are food carts aligned all over. I purchased grilled octopus and cuttlefish as a snack. If you're in the area, be sure to try some!This steam features other types of advertisements once the lantern festival came to an end, including latest technology mascots, etc. I definitely enjoy walking here when it's less crowded in order to enjoy the sights and for a late night stroll."
247,5.0,"I wished I had realised how close I was to the stream earlier.  We didn't head here until the last day of our visit in Seoul.  As it was Chuseok, they had the green umbrella's up and it was beautiful at night.  We took a few awesome photos and the weather was beautiful! There were a few buskers around as well to lighten the mood..."
248,5.0,"When i was young, 청계천 was covered under concrete road. Over decades it's created to the very new landmark of  city Seoul. I've witnessed all changes, newly made history. When i walk along side 청계천, i feel like time traveling. There are lots of cafeterias,restaurants,snack vendors, and constant events. You can enjoy  relaxed break time in the midst of very busy city life."
249,5.0,A wonderful example for al of us. How to get back to nature. The benefits for the city are enormous and a delight.
250,5.0,"How a central water feature can enhance any city! This is also the case for this canal, inaugurated on October 1st 2005.We saw the stream in the day-time and there were people around (tourists, passers-by, office workers taking a break) and we saw it at night, all lit up, and it was even busier with couples and families enjoying a little rest and unwinding.The stepping stones and the wishing well are great fun  and it was a pleasant rest from the busy city.Highly recommended for the ambiance.Try to see it in November if you can; we were told about a Lantern Festival then."
251,4.0,"We dropped by before heading to the palace. It was great place for photo taking. Sit by the stream, it is quite relaxing & calming. There were cute umbrellas hanging above and some parts of the stream."
252,4.0,"Pragmaticly married a storm-controlled facility with natural environment and creative architecture. The stream resided within the busy city-centre, yet a stroll along the stream return you to quiet  nature without the noise of city automobiles."
253,4.0,Always love the evening stroll throughout this stream. The colourful lights and the breezy wind bring you at peace.
254,5.0,"Beautiful huge stream that stretches through the city. Worth seeing during the day, but walking along it at night is a must. Starts with a waterfall at the west end and meanders across the city with trees and small parks as it goes along. Very vibrant area at night, lots of people, always exciting and beautiful things going on."
255,4.0,This was a nice way to walk if you want to get away from the crowds.  Not sure I  would walk alone at night.
256,5.0,"Took a stroll along this stream on our way to Insa-Dong. What a beautiful mid city experience. Clean, fresh water, dragon flies and damsel flies and filled with fish. Stepping stones at regular intervals enable crossing. Well marked with exits for orientation. Add to your must do list."
257,4.0,A lovely place to stroll through the city. In the fall there is a Lantern Festival that is lovely and definitely worth a visit.
258,4.0,Thsi was one of the highlights for us while we were in seoul. It was so relaxing to just take a stroll along the river and see the light show and the artwork along the walls. It's a nice break from the running from store to store. The lightshow is also something I would definitely recommend for everyone that has the chance to see it
259,5.0,We absolutely loved this spot! I would have gone there every day if I could! I loved that it seem to be full of locals as well and just so beautifully relaxing. Definitely a wonderful place to cool off your tired feet from all of the walking and hiking you will likely be doing in the city.
260,5.0,A beautiful and relaxing experience right in the middle of Seoul.  It used to be a belt highway and the city converted it into a walking stream.  Worth every penny.
261,4.0,"I really like this place, it's beautiful. basically it's an artificial (?) river in the center of seoul and it's a very good place to chill and hang out with your loved ones. you can also find street musicians performing here at night."
262,5.0,Very lovely place to go and walk around and relax. Very peaceful and beautiful. We went during the day although I wish we had stayed to watch the sunset and the lights come on. Very close to dongdaemun plaza which is also definitely worth visiting.
263,4.0,"Interesting to see how many people congregate under the many bridges simply wasting time, eating or playing various instruments."
264,5.0,This must be one of the best urban rehabilitation projects anywhere in the world.  You can walk for miles/km through wonderful greenery from Kwanghwamun all the way to Dongdaemoon and beyond.  Every city should have something like this.
265,4.0,"Cheonggyecheon stream effectively divides various neighborhoods of Seoul, and the amazing thing is that many subway stations are situated around the stream itself. Just to name a few, Jonggak, Jongno-3-ga, and other Jongno stations, Dongdaemun station and so on. While the festivities around the stream area are mostly in summer time or the beginning of September in the fall, and around the Jonggak and City hall areas, you can effectively stroll along the stream from the source at City Hall station, and then walk all the way to Dongdaemun from there, which takes a few hours, if you like to walk slowly. Otherwise, you can just sit down at a corner along the stream, soak your tired feet in the cooling water in summer and fall, or have an open-air picnic with friends around that area."
266,5.0,"Bench marked from San Antonio's Riverwalk, except the riverside restaurants so less crowded by restaurants but feels more artifical place than Riverwalk. Actually the water comes from the mountains in north of Seoul and in old days this place was stream for everyday people's use. it's a nice place for having a short walk during lunch hour and enjoy an urban life differently."
267,5.0,The stream is very peaceful at night I enjoy it immensely I come here often especially in the summer nights
268,4.0,The Restoration is an example of urban life. It is well designed and you can also try your luck with throwing coins into a specific place. There are a large number of youth and couples hanging around and some bands are playing music. A good place to stay for a while.
269,4.0,"It's a great way to cross the roads via the stream like an underpass, where you get to enjoy the breeze and hear the sound of the flowing stream. You get to step on stones to get across, interesting activity for kids and the young at heart."
270,4.0,"Cheonggyecheon stream is a little piece of heaven in the middle of the bustling metropolis of Seoul. Down by the stream, if it weren't for the tall buildings you can see above you, you could well believe that you're in the Korean countryside next to a babbling brook. There are some large rocks in the middle of the stream, which make for a wonderful photo opportunity if you take the time to climb onto one of them. If you have time, walk down to the southern end of the stream and up to the bridge over the stream to see the statue of Jeon Tae-il (Chŏn T'ae-il), the 22-year-old labor activist who set himself on fire to protest the appalling conditions for workers under the dictatorship of Park Chung-hee in 1970. At the north end of the stream, check out Dongdaemun, the Great East Gate of Seoul. There are also some interesting side streets near Dongdaemun that will give you a feel of Korea before the great industrialization launched by Park Chung-hee."
271,5.0,"One November evening, my friend took me here to see the lantern festival and I was totally blown away. It was so beautiful, but because of all the lanterns, I have no idea what the actual stream looks like, but its a lovely area for a nighttime stroll."
272,3.0,There were breeding mosquitoes everywhere. But still it's a nice place for you to sit down by the stream under several bridges.
273,5.0,"Visited this place twice. First time was on 1st March, it looks peaceful and beautiful and weather was great for a stroll. Went back again on November, it was towards the end of their lantern festival. The entire length of the stream was decorated with beautiful gigantic lanterns of historic characters. Very beautiful indeed. Highly recommend to visit at least once if you are in Seoul."
274,4.0,We stumbled upon this stream on a night out in the downtown area and it was stunning when lit up after dark. There are points where you can cross by bridge or by steps so it's quite fun to walk down. Really impressive!
275,5.0,"We had our hotel around this area and we used to go for walks around the stream on evenings. This seems to be a popular place for the locals as well and is definitely a teenager dating spot for the locals. You get really nice pictures here after the sunset when the light turn on and theres always music playing as well. Nice and peaceful in the middle of the hub of the city. Lots of food joints, restaurants, cafes and shops around."
276,4.0,"Walk in the side of the stream, is nice while enjoy the scene. It's a long walk, so if you wants to enjoy the stream, don't forget to prepare your walking shoes and camera. It's beautiful in day or night. A lot of people enjoy the beauty of the stream."
277,4.0,"You'll hear some Koreans talk about Cheonggyecheon as if it's one of the wonders of the world, which is going a bit far, but it is a very pleasant place, right in the heart of the city, to take a walk and get a bit of something more natural than concrete and steel. It's particularly nice in the evenings when it's very prettily illuminated. It's easier to appreciate the local fondness for it if you remember what was here before. When I first came to Korea, the Cheonggyecheon development was just beginning, and at that time a congested street and an overpass stood where now there is a stream, trees, ducks, and people strolling contentedly in the sunshine. It's a spectacular improvement."
278,3.0,"Unusually and interesting place to see.  People sitting around enjoying each other company and the hear the soothing sound of running stream.  Colorful lanterns lit the stream below.Careful because the ""walkways"" are uneven, you can trip.People also come here to drink and eat.  I must say they do take their rubbish with them.What a wonderful idea!"
