,title,text
99,4.0,The stream is located at the Dongdaemun area and many kids play around at the stream. It is a nice place to sit down and take a break after a long day of shopping at Dongdaemun!
100,5.0,This is a perfect place to get away from the hustle and bustle of the city even though it is positioned right in the city! Very relaxing and some amazing artwork on some parts of the walls as well. Keep an eye out in the stream for wildlife! I spotted some very large fish and also turtle!
101,5.0,"Great spot if you want to walk in a calmer setting in the center of Seoul, some parts aregreen with trees and really beautiful."
102,4.0,"I just visited this past week as I wanted to see the famous paper lanterns on the stream in preparation for May 3rd's Buddha's Birthday. The walk by the stream is quite long which is nice; however, wgen I went it was really crowded by the main lantern areas so it was difficult to walk around. However, the mkre distant paets were not so crowded. The only issue I have is that the staircase to go up and down might be difficult for the elderly or those with knee problems such as myself. I was able to avoid the stairs on the way down taking a ramp close to the entrance but had to take stairs on the way out - or I would have to go all the way back to the entrance. I would like to give it 3.8/5."
103,5.0,A nice river with fresh air and clear waterA nice pathway to walk from Dongmyo station to walk to Dongdaemunyou can save money and exercise at the same timeYou can breath in fresh air to purify your body and become restful.Suitable for those embrace the nature.
104,4.0,"We came to this place by subway, green line and stop in sindang station. After that, walk about 250 meter.The stream located between highrise building in the middle of the city.The place is calm, local people used to come here just for relax, meet up with friends or family, have a little sport.There's a small waterfall in the end of the stream. The water that run through the stream is clean and clear.It's so refreshing, sound of the birds and the water accompany us enjoying this place. Some trees stretch in the edge of the stream, made beautiful scenery."
105,5.0,its a very nice place to go and relax. Sit by the stream and enjoy the calmness. good place for photography and people watching. the stream is 8km long. A great place for family and kids.
106,4.0,The area became very lively during that festival. Colourful lanterns were being displayed along the stream . We had an enjoyable walk that evening.
107,3.0,Well it's a small stream running through Dongdaemun. Not very clean so I quickly abandoned the idea of a stroll along its bank.
108,4.0,A good walk to walk.. quiet  walk with good ambiance. . Recommended for a quiet walk..Overall simple canal.. nothing special. . But its very close to Myongdong so on the way u can have a look at it
109,4.0,"There are few reasons for my review title: a) Regrettably I wasn't w/ a boyfriend [not on a date]; b) my feet hurt from walking all day; c) it was freezing cold temperature. Otherwise, it would have earned  a pretty perfect score. I truly wished I was with a nice guy; enjoying a Spring or Summer night walk along the stream. That would be pleasantly romantic indeed."
110,3.0,"Was there in the morning. While it had a nice view and serene to walk through, I think it'll be better done at night to see the lights. There is nothing to see otherwise unless you do one of the Seoul walking tours which will provide you with some information along the way."
111,5.0,It was winter when I went there but I have enjoyed snow fall there and it was so exciting. Glad to be there!
112,5.0,Chenggyecheon is right by Gwanghamun (the area with King Sejong and the statue) - and so it's definitely worth checking out. I've gone during the day and during the night and both are GREAT times to walk the area. At night they light up the waterfall at the end of the stream and it's absolutely beautiful - such a nice treat in the urban setting of Seoul!
113,4.0,Located in middle of seoul near gwanghawmun square. Very clean stream and have historical story about this.
114,4.0,"Cheongey-cheon is pretty much historical stream located along the middle of downtown Jongroe. The more you know, you can see more. To see the historical changes of this stream, I recommend to plan to visit this place including Cheongye-cheon museum together.If you plan to drop by Ming dong (Myung dong ?) for shoping or restaurant, it will be good to have a chance to walk along the stream...If your hotel is in the downtowm Seoul near this stream and want to take a walk in the morning or evening, absolutely this is good place to have.  Also I recommend to seniors as well."
115,5.0,"Cheonggyecheon stream is not famous for how it look, but it is famous how they made this canal happened. This is a symbol of success in escalating the normal canal into stream park where people hanging out."
116,4.0,"It's amazing how this stream makes me feel peaceful inside a busy city as Seoul. I would just sit there for hours and read my book. The wall decoration is nice culture art.If you wanna get some quiet time, go there."
117,4.0,It's very relaxing and romantic spot... I just loved it... walking around with a coupe of coffee following the stream of the river can make your day
118,5.0,"This is a very beautiful place to visit. If you've seen it on TV, it's just like it. A must-go place."
119,5.0,"Great to go for a walk in the evening. Go there walk a little, find a nice spot to sit and have a good time talking with your friends or your love. Very relaxing area... Super beautiful."
120,4.0,"this place is surely nice , but if you went at night you will see a lot of couples there . what i did with my friend we went to the grocery store to get some snacks and some drinks and we picnic there . its a good place for it"
121,2.0,"This stream on an average day is just a stream. Since it doesn't stink, I guess one would enjoy a leisurely stroll along the paved banks."
122,5.0,"I completely forgot about this area and I stumbled across it as I was heading to an office nearby. This month they have their winter decorations up. My little one and I took many pictures there. I had expected it to be more crowded, but there weren't many people at all. I went there 4 years ago and it was still as beautiful as I remembered. A great tourist spot so be ready with your camera. I wouldn't suggest letting your children run loose because there are no guards to protect from going in the stream. They have a walkway that they built that I don't remember being there before. Usually you can walk on the rocks to cross the stream. The Christmas decorations are so lovely, please go and enjoy."
123,4.0,Lovely place to stroll and chill on a cool day. Take the time to unwind and soak into the beautiful scenery surrounding this stream.
124,5.0,Nice place to see lights at night. Photo taking should be done in the afternoon to have a nicer view of the surroundings. It is a nice place for a stroll in winter where there will be no insects! I went to this stream a few months ago also and that was during the end autumn and it was a horrible experience as there was endless amount of flies. I had to walked out of the stream just to avoid all the flies.
125,4.0,"A stream that is right in the middle of Seoul, a great place to stop by in the evening after work, dip your feet in the cool stream and watch the sun set over the giant buildings."
126,3.0,"I see ao many review about this beautiful place. Full of light it says. But when i visited it, unfortunately  just ordinary light.  So,  please make sure about the time to see the beautiful light"
127,4.0,"An extremely long stream running through the city, this is the perfect place to unwind after a long day of sightseeing. Order some takeout, sit by this stream and relax!"
128,5.0,"it's was during korean lantern festival, held for 3 weeks, ended on 20th Nov 2016. huge lanterns in many designs were floating on the water. the stream is always my favourite spot for visiting; beautiful, clean and well maintained.awesome view during daytime and even spectacular during nighttime.do go for a walk if you are around the area, you won't be regret."
129,4.0,"Originally a drainage ditch, it was once covered over but has been opened in recent times and is like an urban canal with walkways on either side and stepping stones across.There are numerous quirky sculptures and other artistic features.Well worth a short walk."
130,5.0,"As a local here, I always enjoy a little stroll at night after having dinner with friends. I would not suggest to visit here as the main purpose, but even if you do, a lot of touristic sights are along the stream. My favorite course would be to start from the main starting point which is by Gwanghwamun and walk your way east strolling until Jongro5ga, where there is a local market called ""Gwangjang sijang(market)"" where you can stop for many delicious street food!"
131,4.0,Not sure that there is much to see here other than when a festival is on. We were there for the Lantern Festival and it was very colourful with lots of different lantern themes.Very organised in that you are directed to walk in a certain direction only.
132,5.0,I went here around evening on weekdays.. not much tourist or activities on february (maybe its winter there). We freely taking some pictures along stream.. also have a wish well there.. throw some coins and make your wish.. ~ gudluck..
133,5.0,little interlude in seoul  very typical of korea.Trees and water keep the temperature down to enjoy some time out and nature
134,4.0,This stream is well maintained. And it's very clean. You can take a stroll along the stream. At night it's lighted up and it's a very beautiful scenery.
135,4.0,If there are no events at night . Would advise to go in the morning to see what are the writings on the wall
136,4.0,"A calm and relaxing atmosphere in the middle of the city.A lot of local couples go here to cool their feet in the water. You can just walk around and enjoy the atmosphere, or you can sit down and do the same, it's always a pleasure!"
137,3.0,"It is a nice stroll from Samil-daero or Myeongdong. But I found that I missed a lot of the above the ground sights if you stroll below. It is better to peer down from the cross bridges, and there were several of these."
138,4.0,"The Cheonggyecheon Stream isn't as scenic as the Yeouido Park, N Seoul Tower, but it is a great place to relax and chill, simply just to breathe in the fresh air and take photos."
139,5.0,Unique place and very creative! Love how korean people maximize their public place to be a tourist spot. Better visit at night for the light
140,5.0,"Loved this stream as it was located in the middle of the city in between roads and buildings. Seoul has done a great job in preserving its rich culture, heritage and nature amidst rapid globalization. We started off at the beginning of the stream near to City Hall or Gwanghwamun station. Walked all the way to Gwangjang market. A must-see destination."
141,5.0,"The way Seoul took advantage of their own city spaces is just amazing, and this stream is a must see. You definitively can´t miss it."
142,4.0,I would say this is actually one of the most memorable places we went to in seoul. Ot's such a relaxing place to just stay at when you've been tired all day walking around the city. Many locals seem to like this place too and this is a good place to chill at if you want to interact with the locals. You can dip your feet at the stream. Although I didnt try it.myself cause I was wearing shoes and didnt feel like taking them off I bet it's refreshing. Plus! This place is free no entrance fee or whatever.
143,5.0,This is a wonderful public space that was once a neglected area and had a freeway over it.  It was a major initiative to restore the health of this water and create a wonderful public space;  the project started a movement around Korea to restore unhealthy waterways.  I was there in the August heat and the shade created by the bridges is a great place to relax and take refuge from the hot sun.  It was a bit overgrown and needed some maintenance but it was enjoyable and I felt I was in a unique setting.  If you like interesting urban spaces I would recommend incorporating into your trip.
144,4.0,It's a long stream located near the DDP so you can plan your trip accordingly. I would say that it's a very nice place to take a stroll at especially at night because that is when the lights are switched on. Many couples hang out here.
145,4.0,"Start you journey from Gwanghwamun Sta. exit 5 (subway) and find a river down from the street. The river start from the waterfall. It happens to be the source of the water that along for many kilometers onward. This is great when you walk and sit around first 1km, spent the time to stroll along the river but actually you can walk far more than 1km to another area but the view lesser nice walking away from the starting poin.Anyway it was a good place, when the evening comes ... the lights turned on, than you'll have another environment. Good place to photo as well."
146,3.0,Its a nice little stream in the middle of the city. Dont plan to walk the entire stream since its pretty long. Do visit it in a combination  with insadong and Gwanghwamun Square. A nice trip is Gwanghwamun Square - Gyeongbokgung Palace - Bukchok Hanok village - Changeokgung Palace - Insadong -  Cheonggyecheon Stream
147,5.0,"This was a great idea to unearth/un concrete this stream and turn it into an urban water park - below the streets.  It is lushly landscaped, kid friendly, and in some places, so quiet.  A MUST SEE!"
148,3.0,"My local friend brought me here. It's a stream running through the city. Only locals come here to hang out, and Thts exactly what we did. The stream is flowing with fishes. You will see many people coming here with their children or couples Jst sitting around having chats. It's a place to chill ."
149,5.0,"Great place to walk around, especially at night.  Very safe.  Lots of couples walking around.  Spots to sit by the stream.  You can cross it at several locations.  Nice way to spend an hour or so."
150,5.0,I visited Korea when there was a lampion festival. We can enjoy the festival alongside the stream. So beautiful.
151,5.0,The walking beside the stream is very relaxing. During both morning or night you will be happy to be there.
152,3.0,"It's a stream below road level in the middle of a busy downtown area. Its like Paris gone wrong. Its a tiny stream that is carved out in the middle of mainstream Downton main road because it used to exist earlier. To me it's an oddity. However, it must be nice for those who live there. It seems to be imposed and not organic to its surroundings."
153,5.0,The water river is so clear and the place is beautiful during the night. I just can't stop staring into this river.
154,4.0,"This is a nice stroll to take at night, lots of artworks and interesting spots to take photos. It looks safe, and there are stores to shop around the area, If you are coming from Dongdaemon and going to Insadong this is the best route to take."
155,5.0,"In the midst of high building and city noises, cheongecheon provides an area of rest and tranquility for those needing a break. Its a lovely walk to take whether day or night, or simply go there to dunk your feet in the water for some relaxation. Its a place where you can go with your friends, family, lover or even alone for some peace. I highly recommend this place."
156,5.0,This is a wonderful part of Seoul. Visit during spring and fall and you can enjoy the many restaurants and shops in the area.
157,5.0,"This stream is a great place to stroll along, with lots of places to sit down along the way. You can also cross over the stream over stepping stones at many locations. It is also a great place to go for a run, especially early in the morning when it is deserted."
158,5.0,"You can rather go with friends to do a small walk or also if you enjoy running go there.There's allways people walking, but running almost always foreigners. Among the way you'll find some fitness machines designed to help olders be fit ( you van use them no matter your age for free)!!!"
159,4.0,It's really amazing that such a place just a few meters below street level can really have a different feeling.
160,5.0,"I went there twice, once during the day and another time during the night. During the day it's really enjoyable. Even on a hot day you can cool yourself down by holding your legs into the stream. But don't walk around in it, the security(?) will whistle you our ^^ During the night you might bring a date. The lights are really romantic and if you go alone you might feel lonely between all the couples xD"
161,4.0,"I visited Cheonggyecheon Stream with a friend the other night. It's a nice place to get away from the heat and bustle of Seoul. You can walk on street level above the stream or down below. Everything seems well lit, and even under the bridges it's not the least bit unsafe feeling. There are a bunch of stores and restaurants nearby. One note: it's a long stream, so getting directions there can be confusing. We went to Dongdaemun station and walked from there: it's very close by. (Although I'm sure there are other transportation options.)"
162,2.0,"This idea is brilliant and genius I love it.Then, the uneven pavement is just horrible and the bush is a total eye sore!They should really put more effort into making it a garden park alike zone."
163,3.0,"i visited this place last 2014 and i just wanted to rate it. We came right out of Insadong for some shopping and we could not figure out where we wanted to go next, so we just walked and walked until we saw the Seoul Tower. Funny as it may seem, we walked towards it like kids not even thinking about how far that place is and how high it was situated. :D So on our way there we saw this stream. I saw it somewhere while researching for itineraries so i joyfully pointed there and went there for some pictures. It was very nice seeing a clean stream in the middle of a heavily populated and progressive city. It's truly a touch of nature in the city! I would definitely recommend for you to visit this when it's near a place you are going :) Plus i heard there are times that this stream is decorated  with lights :)"
164,4.0,Nice and serenity place to hang out with your love one.You should find the stone with heart-shaped. There's a lot of fun and romantic too.
165,3.0,"Unfortunately, nothing special wad there while both of times me being tat this place. But the place is kind of romantic to spend time with your sweetheart."
166,5.0,"This place is good to enjoy a walk with your partner, family or friends. The scenery is rather romantic at night with all the lights and the waterfall area is a nice place to chill, just listening to the sound of water is calming. Very popular spot with tourists and locals."
167,4.0,"If you have had your fill at Gwangjang Night Market, or are waiting for the all night shopping in Dongdaemun, you might enjoy a walk along the Cheonggyecheon Stream. This stream, although man made, runs through many interesting neighbourhoods of Seoul and ends near the square of King Sejong the Great and Gyeongbukgung Palace. I would recommend walking along the stream at night, as you can sometimes find street musicians set up under the many bridges, or come to view the beautiful lights and waterfall near the end of the stream. If you walk down the street from Dongdaemun or Gwangjang your way will be illuminated by many of the lights, and you will be dazzled once you reach the end and can view the square with the Palace and statue of Sejong the Great."
168,5.0,"During my time in Seoul I loved to take walks down the stream, it's romantic during night and I loved the sound of water. In June there is a festival that takes place there."
169,4.0,Taking a walk along here is a relaxing way to spend your day. It's located city central and is a very easy and peaceful walk
170,5.0,"The stream starts with a lovely fountain where you can get nice pics. Take some snacks with you, walk down the stream and chill in the sun or shadow enjoying the water cooling your feet. The stream is really long and not worth walking all the way down, just take a metro or taxi when you have get enough of walking."
171,4.0,It is such a pretty place to stroll. Not do pleasant if it's on a very hot day though. Go in the evenings. On the weekends you get to listen to talented buskers singing. Quite a romantic spot for couples too.
172,4.0,"A nice place for a stroll and a rest by the stream. Lots of couples and families enjoying the outdoors, feeding the fish and dangling their feet in the stream. Some nice places for photos as well. Surrounding shops and cafes  looked interesting, but we didn't have time to explore."
173,5.0,"I went there during night time while holding a hot toffe nut latte in hand. It was breezy and cold. Walked with my friend along the stream and crossed the stream on man made stones. There are lights lit in the waters, and nice landscapes to be enjoyed. A nice place to walk on during winter nights. Thumbs up!"
174,5.0,I enjoyed the walking path - located nearby Myeongdong. One could consider taking a stroll on a cooling evening to enjoy the pretty lights and peaceful stream along the path.
175,5.0,"Among many things we can do during the summer night, taking a walk along the Cheonggyecheon Stream is one of the most recommended activities. Gentle breeze cool down the late night heatwave of the metropolitan city. If you want something very unique activity, you can borrow hanbok, traditional Korean costume from the K-Style Hub, located near the beginning point of the Cheonggyecheon and walk along the stream. You will be the focus of photographers and visitors."
176,5.0,"a nice break from the hustle and bustle of myeongdong. go for an evening stroll, lots of locals do it too."
177,5.0,"To get a rest, to walk among, to take pictures. We even saw a heron that looks to be a resident in there!"
178,5.0,Love it....its just near by with Dongdaemun free ease to move around n shopping mallVery scenic view of stream n very clean ever i've seen..Love it..
179,4.0,Visited the stream at night. There's a lot of resting area which is perfect for hang out and gather after dinner. Loads of trees which keep the place green and relaxing in the city centre.
180,5.0,Historical yet modern spot to chill and relax or just do a selfie session and walk along the stream path. One of my fave spot in Seoul. Still very windy on early May though for you who cams from tropical country don't forget to bring your jacket.
181,4.0,"Not really a stream. More like a canal with sidewalk on the side and street art. If you happen to be walking in the area, you might as well walk along the ""stream"" instead of street level. I read that sometime, there are festivals there and at night, it is lit up. I was there on a regular day so I was not that impressed."
182,5.0,Lovely place to wander for a stroll in the middle of bustling Seoul.  Loved the relaxed environment and although it is fully man-made it was still a peaceful place to relax in.
183,5.0,"it was very glad to see a river in the center of the city, with small waterfall and many color lamp and cold and clean water there, so peacefull"
184,5.0,"A beautifully done water stream, in the middle of city center, just behind the city hall with kilometers of walking path, both sides. In some places, it is possible to cross the stream and walk back or climb up to the road. It is always crowded, well lighted and very safe.  It's a place to relax, walk, listen to music and to chill out while watch beautiful people. ~! One of the most visited spots in Seoul."
185,4.0,"I went during the Lotus lantern festival in May, and the area was lit up at night with glowing lantern artwork.Even if you miss that, I think the area is nice for a walk and a coffee."
186,5.0,"Since I was there during the lantern festival, the Stream was decorated with lanterns and there were many lantern platforms on the water. Nice stroll in the business area"
187,5.0,"if you want to just take a walk without being bumped by fast street-goers, better come to this place at night and feel the cold air.."
188,4.0,We only covered a short distance after walking from the palace. Its a nice place to have an ice-cream :)
189,5.0,This man-made stream starts in central Seoul with an attractive waterfall and extends for about 11 kilometres with numerous bridges.  It's a good place to relax or walk. Certainly a successful and attractive project.
190,4.0,How nice to walk along this lovely  tranquil stream and watch the fish in the middle of busy Seoul. Only problem when we were there was the midges .
191,3.0,"its pretty cool how this used to be a waterway, and then it's being transformed into a pretty stream. go there for a short rest after all your shopping."
192,5.0,This stream which stretches for miles across Seoul .Went there at sundown and walked along the promenade on the sides.very relaxing place .At night there are light shows at vantage points.On exiting this place there are a lot of restaurants and shopping places to visit too.Very beautiful attraction in Seoul!
193,4.0,"this place often holds events. It is very romantic for couples , and very cosy to chat with friends.Great to take photos.  There is a lot of places where you can sit too. But be aware when night falls , I would suggest to have a good mosquitoes repellent , it is seriously a pain."
194,4.0,"A little too hot in the day, but nice to just stroll by if you happen to be in the area at night. Not much in the way of street activities though, compared to other riverfront precincts."
195,5.0,What a fun place to walk around during the day and especially at night.  Most cities don't have anything like it.
