,title,text
279,4.0,"this is quite close to the myeongdong area; and we just walked down from the street and sat near the stream. its nice and clean, and peaceful. you can just sit here by the stream and relax a little. something great to have in a city"
280,4.0,"We decided to take a walk through the Cheonggyecheon Stream from Insadong Street and enjoy the scenery. It is quiet and clean area & at one point, we nearly forgotten that all this is right in the middle of the bustling city, not rural area. The water was very clear and we saw fishes swimming upstream, as well as a pair of ducks foraging for food. It was daytime then and we were told that by night, there will be more activities going on. There are some events going on, so check the calendars with the information center for the schedule."
281,4.0,The stream is located right near the Dongdaemun Night Market area so it makes a nice area to just stop and relax with coffee after a long night of shopping and drinking!
282,4.0,Its a place to relax and take a dip in the stream. The water was cool n crystal clear. Enjoy you coffee while the stream right in front of you.
283,4.0,"Cheonggyecheon Stream has a remarkable history.  Originally, it was a stream that drained a good part of old Seoul, eventually surrounded by shacks and primarily fouled by sewage.  At the headwaters at the western end was Mugyodong, which was a hive of cheap eateries and bars, that served as meeting locations for student anti-government organizers.  The prior Park Chung-hee fascist government solved the eyesore and political agitation center by paving over the stream and building Korea's first long-distance overpass.  Eventually the overpass started to become a dated, crumbling example of average urban planning while the concrete buildings built along the sides of the paved-over stream started to become increasingly ugly structures.The remarkable solution was to tear down the overpass and tear out the pavement to recreate the original stream with fresh water.  The water that flows through the stream is not natural but pumped into the system from the Han River to the south with the wanter eventually returning to the Han River upstream.The project has received several well-deserved international awards for creative urban renewal.  At the same time, it has been criticized by urban archeologists in how the project more or less bulldozed through several important sites in the reconstruction.  There was some attention made to the historical value of discoveries, but not adequately so in many historians' perspectives.Regardless, today the stream is a real joy for Seoul denizens and visitors alike.  In most seasons, the stream is particularly a joy to visit in the early morning hours or at dusk and into the evening when the architectural lighting found at the west end headwaters at and near Chedongycheon Plaza, near Gwanghwamun, is truly beautiful.Often special events - both cultural and political - are held at the Plaza, so it often seems there is always something happening there.  And during the hotter months of summer, one can find individuals, dating couples and even young families literally cooling their heels like Korean Tom Sawyers and Huck Finns under the various bridges.   Watching kids and adult wade about, one can almost forget one is in the very middle of one of the world's largest cities."
284,3.0,"I visited a few days ago (late May 2015). My (local) friend took me there, making a stop over at a monument erected for Jeon Tae-il (d. 1970), a South Korean worker and workers' rights activist who committed suicide by burning himself to death at the age of 22 in protest of the poor working conditions in South Korean factories. His death was a catalyst for the labor union movement in S. Korea.Learning about his life and death was more memorable than our walk by the stream, which was full of gnats, and a little hot in the middle of the day. Unless you're close by, or visiting Pyeonghwa market, I wouldn't make a trip out just for this place."
285,3.0,"If your near gwanghwamun, it's a nice detour. Some years ago the city renovated this stream which was a polluted dumping ground. Now It's a nice place to have a lunch along the stream. Be aware that there are a lot of bugs (flying gnat like bugs) all over the stream area in the spingI don't go out of my way to go there because, while it's nice, it's not that big a deal. If you go by the entrance near gwanhwamun where they have the man made water fall it's pretty. Take a few pictures, have a light lunch then move on. It's only interesting there when there is a festival like the lantern festival where they set up beautiful lantern displays along the stream."
286,5.0,"This place is one of my favourite! This is good mixture of nature scenery, fresh air and the busy city. It is so relaxing every time. I really envy the Seoul citizens they have this place. I visited it at the day time - it is a refreshing place at the hot sunny days. At night it is full of musians and installations, so it is also lots of fun."
287,3.0,It's ok but I wouldn't go out of you way to visit this.  Maybe it's the time of year I visited but there wasn't much water in it! Might be nicer at night when it is lit up.
288,5.0,Just what you want to see in the middle of a bustling metropolis!  A nice change of pace down by the stream. Take a stroll to contrast the hustle and bustle of Myeongdong
289,4.0,"This place is in the travel book of Korea. Its center of town. Near City Hall, Myeongdong and so on. Easy to go by subway. I went there by subway stop at City Hall Station then walk along the road and taken photo. Here always have event and workshop. A lot of tourist. So I think you should visit here at least one time when you are travel in Korea."
290,3.0,Many people walk along the stream and stopby. Take off your shoes and soak ur feet into the stream water. The icing cool sensation relax ur tired feet after a long walk or exploring Seoul. There's wishing pool where u can make a wish.
291,5.0,"A stroll in a park with clean and calm water, nice place to walk and feel the cool breeze of the metro"
292,4.0,"Actually I just walk by but this design really attract me a lot , nice ! And lovely ! Some details like the flowers, rock, and water...."
293,4.0,I was there early morning & it was quiet.  Took about 20 mins to walk from my hotel.  The lower part of the stream were not maintained with grasses growing wildly so at first I could not believe that it was the place.  As I walked further up & saw the mini water fall & only then.  It would be nice to see you in the evening but I didn't have the time.  At least I know where it is & will visit in during the nite next time am in Seoul.
294,5.0,"It is was great to end the day walking along this stream by night. It is relaxing,romantic, and it is free! What else can you ask for."
