,title,text
163,4.0,"This indoor/outdoor amusement park is quite pricey, but if you came after 4 pm, you can buy discounted ticket for 26.000 won. Indoor section is most likely for children, but it can be fun for adults too. While outdoor section is filled with some sorts of adrenaline pumping rides. It also has a giant skating rink, but you have to purchase different ticket from Lotte World ticket.Lotte World is easily accessible via subway, since one of the subway station exit is within Lotte Mall."
164,1.0,"We went to Lotte World on a normal working day, no school holiday or something like that, thinking that we would not have to bother with too many visitors and queues. However, the park was overcrowded. They let in masses of pupils who were blocking the attractions in endless queues. An American teacher working in Seoul told me while we were waiting in one of the queues, these were school kids on ""field trips"". Well, remembering my own schooldays in Germany, me made our field trips to museums, cultural organisations and other boring stuff, not to fun parks. So much for the ""hard working"" korean school kids and the ""demanding"" school system in Korea.Many attractions were closed, or got closed during the day, which made the queues even longer.Not worth the high entrance fee - only if you are a korean kid on a ""field trip""."
165,5.0,"I loved this place!) if you are adults go straight to the opened part or the park. You will find many funny, cool and even scared games. But lines are every time, weekdays too. We came there around 3pm but it was enough to  enjoy the most interesting attractions. So you won't regret if you visit this park. Enjoy!))"
166,3.0,"My husband and I decided to visit Lotte World on our last day in Seoul.  We went on a Sunday in the late afternoon, hoping to avoid bulk of the crowds.  This was not the case.  We were warned that it would be busy but with only Disneyland to compare to, we underestimated how popular Lotte World would be.  The price of admission was fair, about $25 per adult if I remember correctly. GET A MAP - this place has so many levels and rides everywhere it would be easy to miss something without getting a free map at the info desk. We didn't get to go on too many rides as waits were were up to 2 hours on some of them.  The ones we did visit were great! Well worth the money just to see the largest indoor amusement park in the world.  If I were to visit Seoul again, I probably wouldn't go back to Lotte World unless it was in the middle of the week when crowds would be lessened. The size and detail of the park is amazing, but I only felt it was average for the waits and crowds even late on a Sunday.  Food selections are OK but not fantastic,  prices for souvenirs are less than they would be at comparable parks in the US."
167,5.0,"It's a MUST-DO in Seoul, especially if you haven't been exposed to the amusement parks. Not crazy fun like Six-Mountains, but you don't have to pay $80 for a day either. You pay $60-70 for Disneyland HK and Tokyo, but I paid only $20; there were plenty of deals to cut the ticket price cut to the half. It's not definitely like dreamland (Disneyland or Universal Studios) or extreme ultimatim (Six-Flags), but I made sure to visit off peak hours, so that I didn't need to queue for a while. The portfolio or rides and equipments were very well balanced, from family to epic-high stuff, and the mixture of indoor and outdoor. Food inside is quite good but pricey as any other amusement parks. There are gourmet restaurants outside the park, so make sure to come out and enjoy the food and shopping. The parade & circus show are something kids love about. I'd visit again. Make sure to avoid weekend or summer time, when youngsters come any time and cause a long queue."
168,3.0,"very confusing, disorganized and disappointing. Most announcements and signs are not repeated in English, some attractions include stories or set phrases... well, we'll never know.There are a lot of games and attractions that are not included into 1 day pass, it gets frustrating when you already get excited about going somewhere... and it requires separate ticket line and payment.A bit too much food places as well, but it is understandable - food is everywhere anyway =))All in all, it's worth seeing if you have some time and money to spend and aren't much of adrenalin junkie. The park had its own special features and has very nice and elaborate decorations."
169,2.0,"I have been here twice,the first time is quite exciting as I enjoyed riding all the thrilling games,Gyro Drop,Atlantis etc..but sadly I have to queue up more than 1 hour just to play 1 of those games. Compared to others theme park, this is not worth your time as you have to be patience enough just to play a game. I went here just because it is famous in drama series like Stairway to Heaven, Athena and variety show, Running Man. Second time I went here, it was raining and I can only play indoor games. In term of entrance fee, it is pricey and not worth it. Plus no more discount for foreigner. Disappointing."
170,3.0,"Took a good look at the infamous ice-skating rink as seen in Boys over Flowers and that was it. Did not take a single ride the entire 4 hours that I was there (It was part of a package tour) because every ride had a snaking queue which meant a wait of at least 45 mins on average. Most of the rides are meant for kids, except a few like Gyro Drop which is located at the outdoor section. Nice place to stay for 1-2 hrs but not a place I'd go back to again unless I have kids with me."
171,2.0,"as it was a bitterly cold day, we decided to visit lotte world late in the day as there is a discount ticket after 4pm. we queued ip for a few rides, but whilst eaiting for another, we were asked to show our tickets. we were stunned to be told that the ticket we purchased simply allowed us to walk around but not go on any rides. people do this?? we had been reassured when we bought the tickets that they were valid for all rides. we waited for the staff to leave and rejoined the line and went on the ride without further incident. its expensive if you by a day ticket and frankly not worth the money."
172,3.0,"First time visited an underground themepark. Staffs are friendly, but not all. Visited there during winter so some of the attractions are closed. :-( Most of the rides need to queue for super long, around an hour. But overall experience was good."
173,3.0,Its crowded all the time and its a place where the kids are running around doing whatever they want.. I got a chance to go for free because of a card program my friend had so it was ok cause i didnt have to pay anything to get in. The lines to go in are long and the rides are ok but they were doing alot of renovations and most of the things were closed off and no access granted to other things.. I was disappointed but we made the best of it. There are alot of other places better to go than Lotte World.. try everland its alot better in my opinion.
174,1.0,Bought a ticket on a one-by-44000 KRW. This ticket with all the attractions. Very much to people. It is difficult to walk around one people. Queue on the rides a half or an hour of waiting. Not a day as many tickets to sell. People do not have time nor the rides and eat. Waiting in the cafe for an hour.
175,1.0,"I visited lotte world today and was so disappointed. The queues for any of the decent rides were over an hour long, I left having only been on one ride. A huge waste of money!"
176,2.0,"Lotte World certainly does not live up to the hype. No thrill rides, long lines, etc. Totally not worth it! The only redeeming quality of this attraction would be the Folk museum."
177,5.0,"My husband and I went here by ourselves (37yrs old) and loved it.  Lots of it was very young but was still great to be around. What a fantastic amusement park. Like nothing I have seen before. Worth every cent of the entry fee.  My husband loved the museum.  It was very interesting, and great for the adults to kill some time while the kids play. Although it is great for the kids too.  I just loved seeing the kids having a ball. The ice rink in the centre of the ground floor was awesome, we watched loads of little kids getting their skating lessons.We got a suprise at night when the laser show started. We had no idea it was coming and there were pyrotechnics, a huge screen telling a story and massive flames around the centre, and of course we had no idea we were standing right next to one and got the fright of our lives.The outdoor part was fantastic. We went outside at night time, so some things were closed but still great. Live bands; the list just goes on and on.  This place is fantastic and I highly recommend it.  The variety of activities to do is endless.  Let your inner child out and have a ball.We never made it to all the shops but they looked great. You can easily spend a whole day here. We chose to stay at the IBIS Seoul Ambassador nearby and caught a taxi to Lotte world and back.If I know anyone going to South Korea, I always recommed this place as a MUST!!"
178,5.0,"The attraction and the show are fantastic. No wonder, disneyland and universal studio don't want to open their heme park at seoul. The size is big, you can spend a whole day at this place."
179,3.0,"Lotte World is a place where dreams go to die, and are reborn in mediocre rides and junk food.  The lines are long, but the people-watching is fantastic.  I kept expecting the indoor part of the park to start falling apart at any minute.My wife and I were there for an entire day.  Our first ride was Sinbad - a subtle and horrific hat-tip to Disney's ""Pirates of the Caribbean"" ride.  It was fantastically awful, and when I was finally splashed by the water, I expected it to burn through my clothes.  Our second attraction was an insect/rain forest mashup that featured lots of empty insect viewing cages and many children that perhaps should have been in some of those cages.  Then we ventured outdoors, for the real fun......Of waiting in line for 2 hours for ""Atlantis.""  Actually a pretty good roller coaster - the ride consists of going in and out of a man-made mountain, and has two main runs.  Again, not bad.  However, the other rides (all 8 or so of them) all had very long lines, and we were getting cold, so we ventured back inside.Our finale consisted of a tea-cup inspired ride that had a large cobra in the middle, and revolved just quick enough to entice the junk food our of your stomach.  Not bad, but perhaps a ride to be taken earlier in the day, before food consumption.Many of the indoor attractions and rides cost a little extra.This is a genuine piece of Korea, and while many foreigners might scoff at the rides and general condition of the place, the people-watching is superb."
180,4.0,"Entry after 4pm is discounted, and foreigners also get a 15% discount. It was pretty busy with teenagers and families on a Friday night. Be warned that some rides close early in the evening, so plan your trip well. The rides are fun, with Atlantis being the best! Although there were some very long lines, there are plenty of places to eat, drink and hang out. Yes, it's lame, but you'll have fun!"
181,3.0,"Well, we are not kids any more but we still wanted to go there for a visit.The exciting rides outside were good but having to wait good half an hour for one. Depends on if you are very keen on them. We were not.The indoor rides were average as they are very slow moving. Either for younger kids or accompanying by parents to ride.The parade from different stories were highlight of the visit. You must see this one."
182,4.0,"If you are travelling with young kids or teenagers, a day out at the Lotte World with the family should prove to be decently good entertainment and fun for all."
183,5.0,"It was very fun, there are lots of games, and shops and food. it was really nice, had a great time there. but the waiting time for the game is quite long so we did not get to play all the games that we want to play."
184,2.0,This amusement park is not worth the price of admission. The rides are geared towards young children.  The adult rides have extremely long lines and not very exciting.  I will not go again~
