,title,text
0,5.0,A great place to spend time with your kids whom will love the adventure and thrilling of rides everywhere. It is similar to Disney Land & combination of Universal Studio but only Korean Style. Many amusement park indoor and outdoor were pack with teenagers and even children’s in all walks of age. Lovely to see explore and have fun to feel how it is it to be like kid again. 💕💕💕
1,5.0,Skip the extra fee for the horror tomb Skip the extra fee for the horror Skip the extra fee for the horror tomb
2,1.0,I don’t want to come here again for lifeEverything was suck and I can’t understand their rule of riding some Don’t wanna recommend here to anybody
3,4.0,"We got our tickets online with a magic pass 5 options. Basically you can choose 5 rides and cut the queues without having to book the timing like the magic pass on the main website. The entrance tickets are also discounted on the third party website. Apparently it is a promotion only for foreigners. So you have to bring your passport.The park itself was great fun. There were lots of rides for all thrill levels both indoors and outdoors. Atlantis, Gyro Drop, and French Revolution, were some of the more thrilling rides I remember riding. Definitely worth using the pass for. If you visiting with young kids I did see there were some rides that were only for young kids. The park really caters to all ages. For the Instagram mets there was also an area inside near the VR attractions for taking selfies. The selfie studio is set up with sets and props as well as tripods for rent. We loved taking pictures with the various backdrops.We happened to be there for Halloween, so there was also costume rentals and face painting (extra costs) near the entrance. There was even a haunted house set up. Not to forget the Halloween parade. We saw that they even has some of the park guests who were dressed as princesses participate. Lots of food affordable food available as well. Food stalls as well as set restaurants and food courts were available all over the park. There seems to have been no issues about bringing your own too. We brought in our own water.When it was time to go we exited into the Mall and we glad to find that there was a Lotte Mart around the corner of the exit. So manage to squeeze in a little grocery shopping before having to head back.Overall I felt it was a fun place to visit for the whole family."
4,4.0,"Lotte world is a nice amusement park right in the city. There is a indoor section and an outdoor section so even on rainy days and in winter you can still go and have a good time. There are plenty of places to eat and drink in the park. The inside part has balloon shape cars that go around the ceiling and a wild indoor rollercoaster.  There is a stage that has performances several times a day. Between the park and the metro station there is a big shopping mall. So you could go the park, go shopping, eat and never have to go outside. Great for those cold rainy days."
5,5.0,"There is an indoor and outdoor amusement park with lots of rides, including trill rides. The VR rides are really good. Plan to spend the whole day there as half a day is not enough."
6,5.0,"Still halfway through the day but this adventure land is paradise for the children. Recommended for families. Awesome 3D VR experiences. Bigger indoor than expected. Still yet to find the outdoor segment. Floors aplenty of amusement games, food stalls and activities."
7,5.0,It’s a beautiful shopping 🛍 mall and very big too but little far from the center of Seoul many good restaurants and shop !! Good for family with children too !! Best way to get here by taxi 🚖
8,1.0,I'm writing this while still in the queue for our second ride. We have been here for 4 and a half hours now. I was afraid it could be crowded so we went on a Monday and I bought a 5x Magicpass which i could not use a single time because all seats have been booked out almost immediately for all attractions which are popular.I think its only worth a visit if you are totally into waiting or if you come with children because the attractions for small children seem to have less waiting times.
9,4.0,"This is a whole world of entertainment. Outside park, inside entertainment, food hall and shopping ,shopping ,shopping. It was amazing to watch the people having fun and enjoying all the possibilities to be entertained. For us it was a little bit to loud. We are not used to that common notices!However what a fine location to enjoy life!"
10,4.0,"My husband and I went to Lotte World for a day date! We had so much fun! The lines can get very long (like all amusement parks); however, the rides were fun and well kept!"
11,2.0,"We went there on a Monday, in the morning. But the amount of people queuing was unbelievable. The waiting time was at least one hour, up to 3hours. The most popular rides have longer waiting time, ofc. During 6 hours spend there we took 3 rides total. You can buy a magic pass, but that costs extra 100k and you can’t use it on all rides. And let’s be honest, 50$ for the regular ticket is not so cheap. Also, you have to pay extra for some of the rides/attractions. To sum up, I don’t recommend it neither will I go there again."
12,2.0,"Ok, we were here on a Saturday night which is probably not ideal as it is very busy. The rides are mainly for little kids, so, nothing too exciting for adults. We wanted to go on the hot air balloon ride but the queue was 2 hrs. We queued for about 1/2hr for the monorail ride but because it’s winter, half of the ride route was cancelled, so, it was a very short one. Some nice photo ops outside at the Disney looking castle, so, make sure you go out of the building & walk around a bit. We were lucky that there was a Christmas parade - this was the highlight of this visit."
13,4.0,"Very strange place, but a fun time had overall. Initially when entering the park, the place seems very small. All of the big attractions aren't immediately visible. Take a few minutes to locate all of the major rides/attractions inside and outside of the park. Some of the lines can be very long, but hey, most theme parks are. The indoor section looks very dated and there aren't as many spectacular rides. Roller coasters are a blast. Lots of food options too! There is enough to see for an entire day so plan ahead. Not a bad option for a day at a theme park."
14,5.0,Reminiscing back our childhood days at this place. Was so fantastic that you would say to yourself its nice to be a kid again.
15,4.0,"Sweet little theme park that is not overblown. Good for kids, big kids and adults who are kids inside. Great way to enjoy a day.Lotte World theme park is not overly crowded. Most rides will require about 30-50mins++ to line up for. Indoor activities are quite numerous but are aimed at younger audiences. Be warned, some 4D rides can get you very dizzy. Outside is fun but can get colder at night. No extreme thrill rides such as a crazy roller coaster and some rides are notin operation. App/Web is not updated about status.They have some theme (halloween) but arent as committed as other parks. Lotte mascots are not as relatable to foreigners."
16,4.0,"We had a spare day during a recent tour of Korea so decided to spend it at lotte world. Got some tickets online (with a massive discount) the night before, collection was easy. Was pretty amazed by the spectacle of the whole site really, rides are designed for kids rather than adults but we found the outside ones a but more adult. Very much enjoyed our day but it was very busy with long lines for all rides. Food and drink was farely priced considering it is a theme park. Is it a must see thing in Seoul, maybe not buy none the less we did have a great day."
17,4.0,"i rally wanted to go to lotte world when i was in Seoul and when i did i didn't regret it, it was magical and fun. it was very busy but it was near Christmas so it was expected and i did go on a weekend there were very long lines for rides and we only managed to go on 3, but they were well worth the wait.the food was really yummy we had some of the food off the stands and went to the Korean restaurant in the magical kingdom are both were really delicious. beacuse the rides were so busy we decided to go and do all of the 3D rides which were so much fun!  there we 4 or 5 i think they were only 5/10 minutes or so long but so good!overall i would recommend people to go to lotte world just not on the weekend or at peak times!"
18,3.0,Lotte world is good for Kids at heart .. Still fun but if you been to universal or disneyland you will be disappointed..Good thing with Lotte world though is mall is just right there too with a bunch of places to shop for .. But entrace is quite expensive if you buy there in the spot find some cheap ticket online..Food wise its good theres various selection.Jamsil station is right there as well and they have lockers on the train station ..
19,4.0,"Besides waiting 2.5 hours in a line up for a roller coaster wearing virtual reality goggles, the first thing we did getting off the ride was get back in line for a further 3 hours to do it again. It was a memorable time but allow yourself a full day."
20,5.0,"I read couple reviews before going and I kept asking myself what would people do there for so many hours. I know now, after leaving when 11th hour passed.This spot just keeps throwing fun at you and it won't stop.Ticket price is about 50k won per adult, but what you get inside makes up for the price."
21,4.0,"Admittedly, I'm not sure if we got lucky or whatever, but it was a Tuesday. There were kids on their field trip there but despite that? there were no lines. Majority of it is indoors with a train that goes around the indoor area and around the outdoor area, too. That said? it was rather fun, and this coming from a guy that doesn't particularly enjoy  theme parks. Just be aware that the B3 entertainments with the VR and ice skating? know that those do NOT come with your entrance, so don't be surprised if you need to pay extra for those."
22,5.0,Lotte's department stores are incredible with up to 17 floors of every type of merchandise you could wish for. It is not only a store but a real experience with marvellous facilities for keeping families amused whilst bargain hunting. British department stores could really benefit from seeing how these work
23,5.0,"I have been to many theme parks around the world, but i had a lot of fun in Lotte World, even though the rides are not extreme at all. Its just a fun place in general and something different to do when you are not busy doing all the cultural activities. We ended up going after 4pm to take advantage of the cheaper tickets as we didn't think we needed a whole day anyway. We spent around 5 hours here during a weekday and we managed to visit all the main rides (although one or two rides were out of service). The only problem we had was that we enjoyed trying to cram in as many rides as possible, that by the time we finished up, we realised the park was closing and all food and snack shops were closing up. You wont need more than 5 hours here in this park and its very easy to reach by MRT. And also, just take note, around 8pm there is a parade that happens inside which is quite cool, but it means a lot of the rides will close down for the duration of this 20-30 minute parade."
24,2.0,"Had time to kill. Lots of young kids, good for them. Queues were long (on a week day) and rides maintained but need updates."
25,5.0,"We were here for a day and there is so much to do!  We were in the area mostly to see the Cherryblossom Festival so it was a convenient place to park. The amusement park looks awesome but we didn’t go inside. The lake next to the mall is beautiful and it was a great walk going around both sides. It is lined with cherry blossom trees this time of year, and my wife was in heaven.  The mall has a lot of high-end stores and was interesting to visit, but we were there for the restaurants and shops in the lower levels after the walk around the lake. Definitely recommend if you are visiting Seoul."
26,5.0,Fantastic quality and service excellent food and great staff at super modern complex with indoor and outdoor options!
27,2.0,"I had heard that Lotte World is one of the busiest amusement parks in the world (apart from Disney and Universal Studios parks). So we decided to visit it.  Honestly, it's not a good amusement park. I would advise people to not go. I have not been to Everland, but surely it can't be worse. The only reason I can think that Lotte World is busy is that it is in the city centre area beside 3 or 4 big shopping malls, so I guess people who are around find it convenient to visit. But I can't imagine anyone going for more than 1 visit. And I don't recommend that anyone visit it even once.The indoor part of Lotte World feels like a bunch of mediocre amusement park rides have been shoved into a shopping mall on 3-4 floors. Making matters worse, there is a bit of a bad smell around the space. We went on a few rides in the indoor part (a dinosaur shooting one and a flight simulator one) - they were somewhat copies of Disneyland rides, but not even 1/4 as good. The outside area of Lotte World was not very big, connected via a bridge over the highway. There is a castle in the middle (copy of disneyland), and the main ""thrill"" rides seemed to be the rides that either go from side to side (like a ricking ship ride) or that spin. We didn't go in tot the haunted house as I read a review to avoid it. We went on a Monday and the wait for those average-looking ""thrill"" rides was 40 minutes. Those rides remind me of old-stlye travelling amusement parks that go to various cities with basic rides. Really there is not much more than that, from what we could see, at Lotte World.It was a real letdown. We left very early."
28,4.0,Went there during rainy day.spend more time inside then outdoor.the 3D movie rides are not good..too childish n non exciting.some rides need to pay eg haunted house..not included in ticket price..love the hot air balloon ride..the outdoor rides cater more to the adventurous adults.the performance was cancelled due to rain and most rides closed as well..but can really spent whole day here.location is very good.directly outside subway station.love the korean cultural museum most.
29,2.0,"If you're planning to go to Lotte World, i suggest you not unless you're going for the kids ride only! This place is suuuuper crowded even on a Monday! So crowded and most rides would cost you minimum 1 hour to 2 hours max waiting in queue!I went there around 10am+ and i was only able to play 1 ride and that 1 ride had me waited 2 hours in queue. Yes it was a fun ride but will i go for another ride and wait for hours? Hell no!And the Magic Pass app is a useless app, can't reserve any rides at all! Wasted my hald day there."
30,3.0,"As a 'foreigner', you can get very cheap tickets from Trip Advisor, Klook, etc. We got some from Govoyagin for 28,000. The problem we found was that it didn't include the three Magic Passes which enables you to skip the queue using either an app or the vending machine outside the ride. Going on Lunar New Year Eve, it was particularly crowded and most of our time was spent in queues. There was even a hot air balloon ride inside (much like a Ferris wheel, really) which had a queue of 100 mins!!! In sum, it was interesting, cute, had some cool VR rides (did the three 'Wild' ones), but it was an exhausting day. PS. Skip the haunted mansion... Wasn't worth the extra 6,000 won."
31,5.0,"Really this place is totally unexpected. Right off a subway station you get a mall, amusement park, skating rink with a shooting range in the basement. It's so many things in one small space and the execution is good! When I first heard about it I thought it would be childish or cheap feeling. I was so wrong. The amusement park is better than some I've been to in North America. What a great place to have a date!"
32,4.0,"Used to visit the park a few times as a child and then as a teen, enjoyed it a lot. Of course, Lotte offers high-quality entertainment, but now the park is too crowded and you have to wait for 40-60 minutes to get on a popular ride. Tickets became too expensive recently, btw. Well worth for the first time visit or for families with children. I was also really pissed off at Lotte corp. for clothing Lotte mart at Jamsil station. It was the only place to buy some Korean food and snacks to bring home."
33,1.0,Too Long queueing - not worthy for coupleOne day pass not worth it.During winters out door park are closed
34,5.0,"After we pre-booked our tickets our I worried myself a bit after reading some poor reviews but we had lots of fun! Lots of teens/children but we are both in our late 20s and still had a great day. Don't spend money on the mini zoo (the animals are so poorly looked after) and be aware that some things will cost extra. We arrived early on a wet, overcast day which seemed to help as we had little to no wait time on most rides. As the day went on we could see wait times were massively increasing so would strongly recommend going early. Check out the folk museum and don't forget to get a park map as many rides are upstairs, downstairs or outside"
35,4.0,"It's one of the most interesting amusement parks of S. Korea and conveniently accessible, as far as it's located inside the city.However it is really overcrowded!!In order to enjoy your time there and to avoid wasting the most of your time, waiting on long ques, try to avoid -if possible- weekends and holidays!On the other hand, using the fast-pass can save some waiting time, but it's availability is very restricted."
36,1.0,"Such a disappointing park. If everland is a stripped down version of disneyland, this is a stripped down version of everland in a shopping mall.If you have to choose between everland and lotte world, dont choose here."
37,4.0,"The big draw for this place in Korea is that it is partially indoors. There is a very expensive shooting range here, too. The lines for the rides are usually really long..."
38,1.0,"I understand there are queues on theme parks, but I have never seen anything like these 2+ hour queues. Managed to get to 3 rides but none are the popular ones. mainly outdoor where is was sun baking us. it was extremely crowded when we went and staff were not helpful trying to manage the population."
39,4.0,We didn’t go inside the Lotte World. Anyway there is a beautiful lake walk around. You can admire the world’s 5 highest building from different angles and even go into the top at extra cost.
40,4.0,Very popular with local people. Connected with Lotte hotel and shopping complex. Can easily spend a day in this area.
41,3.0,"We are not huge Disneyland people, but this was a fun adventure.  More of a kid and teen activity, but ok for adults.  Pretty pricey, about $30US/person, but if you're into rides and games, it's fun, especially at night.  They even have an ""Electric Light Parade""  just like Disney!"
42,3.0,"First off, this is nothing on the scale of Disney, which it seems to want to replicate (Magic Island in place of Magic Kingdom, marching bands and cute characters wandering about for photos). The park is good, but perhaps a little pricey for what it is. The rides are on the same scale as say Legoland. Don't expect anything that will leave you wanting to ride again. There are some food outlets which vary in quality. The high points are the water log ride, the Zombie VR area and the Korean Heritage area. There is a huge shopping mall attached which should suit every need. Annoyingly you would need a more expensive day pass to be able to enter the park, then leave to go shopping, then re-enter later on, even though it's all the same Lotte complex. As the title says, this is definitely not a must see place (I only went on my second visit to Seoul) but if you have a spare day on your itinerary and you like theme parks then perhaps this would be a good idea. Try and find a discount coupon as a foreigner you'll get 20% off for up to 4 adults!"
43,5.0,"We booked a ticket on the internet and saved a good amount. The theme park is absolutely amazing. Rides are a combination of adrenaline and smooth. The overall park is a Disney style theme, a must for families.I didn't think the park looked ""old"" at all. Very well organised and definitely value for money. You will have a very good time. This is coming from someone who has three world class theme parks in their city."
44,1.0,"We visited the Lotte World amusement park expecting a ""Disney-like"" experience. The park is expensive and underwhelming."
45,4.0,"So here's the facts you need to consider:Best to go during the week whereby you can purchase tickets at a lower cost.Next. Arrive as close to opening time as you can to ensure short lines.If not happy about long lines, purchase a Magic Pass (a fair bit more expensive) that takes you to the front of the queue. Note that once queue's build up substantially - which they do - many of the rides close the expensive Magic Pass. In other words, get there the earlier the better.Weekends are terribly busy meaning long lines.Lotte World truly caters for all ages (not necessarily those over 65 who Lotte World believe are too old to go on some of the rides!) with a myriad of toddler, child and adult rides.Now to what really upsets me: You'd think that the entry fee would cover everything (aside from food etc of course). Well, it doesn't. Indeed, there are many areas requiring you to spend extra! Take the Ice Rink for example; it is completely autonomous to the adventure park, even though it is right in the middle of it.You can have a great day at Lotte. It really comes down to what you make of it."
46,4.0,"I recently attended Lotte World, and was impressed with the variety of rides on offer.  All ages would enjoy this amusement park, as it caters to those who like placid activities as well as adrenaline junkies.Unfortunately, we went at the start of August, when Korean holidays were on.  Accordingly, the lines for most of the rides were very long.  For example, I waited over an hour to ride the French Revolution. Surprisingly, one of the best things about this theme park was the Italian Restaurant.  The Margherita Pizza (albeit expensive) was, quote possibly, the best pizza I have ever had in my life!I would definitely come again, but only if it was outside the busy period of school holidays and weekends."
47,4.0,"If you like amusement park, this place can be a good option. I've been here three times. On the weekend, it is super busy. Lines will be so long. The longest time I waited in the line was 2 hours."
48,5.0,"We just came to window shop and my wife checked all the designers store. All the beauty products under the sun is here, plus more. Duty free shopping is also available here, very convenient for foreigners to shop. The food section is unbelievable, anything you want is available both local and imported items. The quality and availability of food items in this market surpassed the US supermarkets."
49,4.0,"Don't expect a Disneyland kind of experience but with the right mindset this can be a fun place. Don't pay full price, there a discount coupons all over Seoul and if you visit after 4pm you pay a reduced price, combined with a discount coupon the entrance fee is reduced by almost 50%. The place is open till 10pm so you have lots of time to explore. Most of the rides is standard carnival stuff but they also have a couple of rides which are brave attempts to copy Disney. They do not succeed but it is all very charming and we laughed about it. Staff is for the most part friendly. Stay till 8pm for the excellent light parade!!"
50,3.0,1 hour from central. this indoor & outdoor park is big. with many rides. whether you visit in weekend or weekdays it is extremely over crowded with locals. you have to wait 30-60 minutes for most of the rides. we have spent 5-6 hours and hardly enjoyed 7-8 rides. we have spent whole day standing from one queue to another.You have to pay money for many rides. and many rides are boring and mostly for kids. so not worth standing in queue for long time. few restaurants inside.
51,5.0,great experience in Lotte World Adventure and Aquarium! one of the most memorable trip of my life! ❤️❤️❤️
52,2.0,"Shops and stalls all selling the same thing its outrageously tedious and time wasting , improve you life and give it a miss."
53,2.0,Im quite disappointed with lotte world. If you are two adults thinking where to go between lotte world and everland I think everland would be better. The lines are insane and its very hot inside I'm not sure if they have an air conditioning or its an outdoor with roof. 🙊  but if you really want to go there I suggest that you go after 7pm the ticket prices is much lower and its enough to go around the area and the lines are a bit fast by that time.
54,1.0,"If I could give it minus one star I would. Wait for rides are massive, 140 minutes at 2pm in school time for one of the less popular rides. Over-priced, over-crowded - left me feeling underwhelmed and under appreciated as a paying customer. Would rather have paid best part of 40 pounds for someone to slap me in the face with a wet fish. At least cost wise​ it would have been better value than this complete rip off. Don't bother with the App to reserve rides - doesn't work. Hardly a surprise..."
55,4.0,"Not as many exillerating rides as many of the outside parks have to offer and we experienced really long lines, however it is very much worth a visit and we had a blast. A rollercoater ride inside is pretty hair raising. Try find foreigner discount days if you're a visitor, it can make a big difference price wise."
