,title,text
56,1.0,Too many peopleNo opportunityNo management. Even..at least. you should wait for 100min to enter the Ghost House.Here will be the worst experience of yours.
57,2.0,"If you want to visit a crowded department store to spend thousands of dollars on over priced designer labels, go for it. I walked through as a curiosity to see what kind of person would pay enormous amounts of money for clothes and accessories made in China but stamped with some designer name. I can afford it but would never spend thousands on a purse or shirt."
58,4.0,"We went to Lotte World on our last day of our holiday. Due to the rainy weather we were stayed at the indoor theme park. This is great for all ages, especially for family's. We took the subway to get to Lotte World."
59,3.0,"I had fun with my friends here. The lines were much too long, and my friends didn't know what they were doing, but it was still really cool being here. The food is crazy expensive. We had to search for forever to find the one ice cream shop that was more reasonably priced because it was EXTREMELY hot seeing that it was summer. It's half inside and half outside so that part was super cool. It was my first time seeing an amusement park inside. We ended up finding the ice cream shop. Since it's half inside you could go on a rainy day, but I would suggest going when you can enjoy both parts of the park. There are many rides that are copies of Disneyland so I would compare it to that. Not very thrilling, but everything was very cute. Couples everywhere. Must-go-to if you love amusement parks. We ate at the Lotteria outside before going into the park."
60,4.0,"West Edmonton Mall eat your heart out, give or take 800 shops and a kids entertainment centre. They have a shop for anything you can think of! If you love shopping, this is a must see!"
61,4.0,"Outdoor attractions was thrilling, by the looks of it (we only rode one because we felt a bit old and our hearts couldn't take the rides, haha). On the inside there was an ice rink in the middle and VR attractions were everywhere, the quality was amazing. We spent most of our time inside the Fold Museum because we went to do pottery painting and at the same time, learnt a bit about their culture."
62,4.0,We spotted this while roaming around the Lotte shopping area. Though it was 4pm but we decided to go in and explore this indoor and outdoor adventure park. We even got a discount as they offer discounts after 4pm on the day Pass.  There was a waiting of almost 30-45 mins on all the popular rides but it was worth waiting in the queue. We loved the V. R roller coaster and air balloon ride.  If you have the patience of waiting for 45 mins per ride then its definitely worth buying a day pass to spend a few hours in th evening. Outdoor theme park is also beautiful with lots of rides and amazing view of cherry blossom in the spring season.
63,4.0,"I've been to Lotte World many times and I have to say I am never tired of going here. Its fun, cheap (with coupons), and has pretty cool rides. The only downside is that no matter when you go there will always be a line. Even if you go on a school day you will see students in their uniform skipping. Expect to stay the whole day here. They also have themed parades and shows that are pretty cool"
64,3.0,"We went on a weekend. Overcrowded with people and queue ranging up to 30mins for rides.They have an outdoor and indoor theme park. Indoor rides are less exciting. Outdoor rides are heart-pumping.There are restaurants and cafes, as well as souvenirs shops in the theme park.This theme park is more for kids and young people. Not suitable for middle-aged and above."
65,2.0,"This indoor theme park would probably be really enjoyable for children under 10 and their parents. As two adults, we found majority of the rides quite tame. The rides that looked like they would be more appropriate for us had massive queues of over 2 hours (on a weekday) and the magic passes had all been used. We used the discount coupon from the airport bus ticket but it still was an expensive day due to the limited appropriate rides."
66,5.0,A very nice attraction specially for kids and kids at heart who wants to enjoy a modern carnival-like atmosphere. Consists of many fun and exciting rides for all types of ages.
67,3.0,"Good Attraction, but you need to rethink about your trip plan!!This is my 2nd time visiting Lotte World, bought the discount ticket (30% off) from Trip Maker through my guesthouse, and I went there on Saturday and omg that was a disaster!!!! Arrived there at 11am and left at 8pm (7 hours), I have spent almost 4 - 5 hours ONLY lining up and looked at my phone :(No doubt the rides and everythings are cool and entertaining in the Lotte World, both indoor and outdoor, but there are sooooo many people; For the most famous rides like Gyro Spin and Atlantis, I have spent 45 mins queuing for each lel.I don't think I need to describe how fun it is in the theme park since they are more or less the same seriously... yeah Lotte World makes you feel joyful and excited when you step in the indoor park, but for real, when you get closer to the ride and once you spot the end of the queue, and start lining up, and wait for 15 mins, and wait for 30 mins, still a long way to go, I am sure you will get mad. (I was with my boyfriend and we were getting more tired and even stopped talking...)I strongly suggest my fellow travellers, try to avoid visit Lotte World on Friday/Saturday/Sunday!!!!!My first visit to Lotte World back in 2014, I paid full-price and only spent 4 hours there becasue I was so fed up with the queuing. Thought it would be better for my re-visit after 2 years, still the same..smh"
68,3.0,This place is best for kids and kids at heart.Typical amusement park with korean taste.Not the best but ok.
69,2.0,"We came here early, just after it opened and there was already ques for 60min(there are signs which tell you approx waiting time). So we though we would go on a few other rides and the ques would get shorter. Big mistake. by lunchtime there were lines for 120min, then a few hours later they reached 170min. You cant leave the park once you are in, and the lunch area was so busy that we had trouble finding a seat, and it was just the two of us. Can't imagine bringing a family with kids. We ended up waiting in some lines, and did enjoy the rides we did go on. I wouldn't recomend though"
70,3.0,"Conveniently situated near Jamsil Station, it has both indoor and outdoor theme park. The queues were quite long and you will need to queue more than an hour for popular rides. The Cinderella performance for Christmas season was fantastic; beautiful costumes and dance routines. There is plenty of shopping choices and restaurants right outside the theme park as well.If you are not a fan of rides and do not have patience for queuing, then I suggest you give this place a miss."
71,2.0,"This place really is incredible to view. The design and overall appearance of the precinct is nearly breathtaking. It is a shame however that unless you're willing to stand in lines of at least an hour, you can't really do much. Any of the attractions that are really worth going on are minimum hour sometimes significantly more. The locals didn't seem to mind and perhaps that's a cultural thing but lining up for an hour then having a five minute ride, only to line up for another hour wore thin very quickly. I could only imagine it with a couple of kids (although again, no local kids seemed to mind from what I could tell!). Steep entry fee but it probably is worth a look just to actually view the place."
72,4.0,If you have kids go there you will have fun with them. If you want to get 20% discount use MasterCard to get the tickets at the door.
73,3.0,"The theme park is big, but is not attractive enough for adult to come for second time.  And sometime need to queue long...."
74,5.0,About:Lotte World is divided into an indoor Adventure theme and a Magic Island theme outdoors next to Seokchonhosu Lake.Magic Island is where the prominent dazzling Magic Castle is located also the venue of exhilarating different rides.Tips:When visiting Magical Island during winter remember it gets very cold as surrounded by lake so gear up.There are different tickets prices and if you buy cheap one; the admission one that will not get u any free rides remember.Best to buy day pass.Other tickets are cheap that is from 4pm to 7pm or the 7pm to 10 pm one but in winter it gets dark pretty soon and gets very cold especially during night so u will not be able to enjoy. Better to buy day ticket n visit during day and if want can use at night time too.The day pass is 52000 Won and After 4pm is 41000 Won. The General Admission after 7pm is 18000 Won.
75,5.0,"a lot of funs here... suitable for all family, couples and all age ranges.will visit again!! love it"
76,1.0,This place was disappointing. The collection is not great and the prices were very high. I have not enjoyed this place.
77,4.0,"Directly connected to Jamsil station. Theme Parks, underground shopping & Lotte Mall are all interlink. There are lots of shops on the way to the park entrance.  The One day ticket price at 52,000 Won is a bit expensive. There is a Master Card Promotion of 20% discount, but unfortunately we only have Visa.The theme park is consists of Indoor & the outdoor - Magic Island.   The Indoor theme park have many attractions suitable for children, but most require height limit of 110cm & the friendly staffs actually carried around a stick with height limit! We tried the Balloon ride, Pharaoh Fury, Wild Jungle & Wild valley which are average.If you are a theme park fan, the outdoor rides are much more exciting! We tried the Comet Express which is pretty fun & exciting & not scary. There was a long queue on popular rides such as Gyro Spin, Gyro Swing, Bungee, the Atlantis. Some of the queue last as long as almost an hour & we went there on Monday.  Though you can use Magic Pass to reserve ride & skip the queue, you can only use it once in 2 hrs. Hence, it is better to come on Weekday."
78,4.0,"There are tons of tourists. The amusement park has many photogenic places.Good for families, couples...etcDuring winter/ weekdays, I think some of the attractions are shut down due to weather and maintenance. So I could not enjoy many of the famous attractions there.If the weather is too cold/hot there is an indoor place where you can enjoy attractions under cool environment.Lotte mall and other places right beside lotte world are worth visiting.Tons of shops and restaurants around."
79,3.0,"This theme park is in operation for many years, the facilities cannot serve the increasing demands. All the facilities are full of goers queuing up. Some facilities have to wait for over 2 hours but only play for 5 minutes. It's surely not worth to spend lot of time in waiting and waiting. I strongly hope the park manangemrnt should plan to redevelop the park to cater for the high demands."
80,5.0,"I really enjoyed the indoor inspire theme of this attraction considering we traveled during summer. Although it was crowded during that time because of the school breaks, i enjoyed their facilities and was glad i got to visit stairway to heavens set location!"
81,5.0,"For us ex-pats, this was a great place to enjoy many things besides shopping. Great first run movie theater, great restaurants (American and other international offerings)."
82,3.0,"My husband and I spent a rainy evening at the inside portion of Lotte World. We don't have kids, but still had a pretty good time. While we were there, it was more adults than children there. Overall it was an interesting experience. The little arcade is fun, and they have some tame rides that are also fun. I wouldn't spend an entire day there, but it's a nice experience for a few hours on a rainy day."
83,4.0,"You will be able ton find in the place a (mini) Theme Park (like Disney), a department store and an indoor ice-skating rink!"
84,4.0,Although it's mainly for kids but the rides were quite thrilling. It's an nice experience and I enjoyed my day there.
85,4.0,"So we decided after venturing to the Aquarium to try out the adventure world. it is definately a place where everyone goes. its in the place to be. Warning the weekends best to avoid, think all locals come down for a great time and its a great time but be prepared for the very long queues but you can purchase a Maxi pass thats like a jump the queue"
86,4.0,"It is a wonderful entertaining theme park for family especially for those with children.  It is really much better than those outdoor theme park in summer time.  However, it is very crowded during weekend.  Suggest come here during weekday.  Then, you will have more time to enjoy all the games."
87,4.0,"Had fun there using the magic pass which is a must, too bad I only had two. We really enjoyed the folk museum. It was great to see Korea historically and to learn about the country. Due to the time we went, we didn't get a chance to see the outside nevertheless it was great as an overall. I would definitely go again."
88,4.0,"Lotte World was spectacular. The park was awesome, alot to do and see. All kinds of cafes, restaurants and shops. We went on a weekday, but still the waiting times for the rides were not less than 1 hour. Even 2 hours on the more popular ones.We were there after 4 pm, so 10 000 won cheaper for the tickets. And by paying with mastercard, we got 20% off."
89,5.0,"My husband and I have had such a blast and have enjoyed Lotte World twice now in our 2.5 years in Korea. They offer different pricing depending on the length of stay:all day, after 4, after 7 so there are some choices available. There is an outdoor and indoor section to the park. As a foreigner there are ways to get discounts so it is best to do some research for available offers. The lines can get pretty long, but this is a universal truth. The best time to go though is during Chuseok or Seollal, as these holidays offer discounts for foreigners usually and offer the least crowds (these are family holidays and most people leave town). Also, most rides are actually not in plain sight so the park is much much bigger than it looks!! Use the map so you don't miss anything, like their underground roller coaster located on Magic Island (the outdoor section)."
90,5.0,I don't really expect it will be this big. You will ask to download the application and you can reserve any rides for free! You can reserve only 3 rides so use it wisely. The coupon discount also in the phone application. There is a parade. Your kids can be part of parade but I m not sure how. There is an ice skate as well. Some rides are for kids and some are really scary ( outside). I recommend to go during weekdays and in the morning to avoid people. You can spend the whole day there. It s do easy to get there by train. My favourite ride is bumper car and 4d movie.
91,5.0,Nice Place. Very big building. I have never been to an adventurious place like this before. Our hotel is near. So i everyday come here!
92,4.0,"Nice modern mall. Not many choices of restaurants. There's an indoor theme park good for those with kids around. Personally, we prefer Hyundai departmental shops."
93,4.0,If you have children this is great......they will have a great time. Of course it isn't as amazing as disneyland but it is so much fun and isa really big park ......it even has a castle! You could certainly spend a full day exporing even if you dont go on the rides.
94,5.0,"purchased one day pass, we downloaded the magic pass which we can avoid the long queue, well we did not stay long, we already tired after few games, we were a middle age couple who trying to have some fun, apparently we had fun, but for sure we will not come back for second time."
95,5.0,"Every time I think i've been to the biggest mall in Seoul, we stumble upon another one. This one is no joke, it has everything all in one place. Great food options, great name brand stores across all price ranges. Lots to do and see if you don't want to be outside or the weather isn't good. Doesn't hurt that there is also a theme park right across the street, as well as a large outdoor lake to walk around."
96,5.0,"Got 50% discount coupon from the website and it was a super cool theme park. There are so many rides both indoor and outdoor, plus shopping and eating! The view was great too as it was the full bloom of cherry blossom, thus you can enjoy the nature and have fun at the same time!"
97,4.0,"We were visiting Seoul and our hotel had a shuttle to the lotte World - we not dropped there, We did not feel ike paying 45$ for the rides even if for a week day it is probably ok as there is no much lines. Walk down the skate rink and watch all these future speed skater olympic winners.. Then walk yourself out, cross the street and walk toward the castle, you can enter the beer garden (baden-baden) and enjoy a Kloud (the only acceptable Korean beer IMO) in the sun..."
98,5.0,If you want to take the rides of both Indoor & Outdoor Parks you need to be there very early since the queue will be long.For people who don't want to ride any indoor or outdoor rides but wants to see the view then you can take the 4pm entry which it is less cheaper.If during rainy days you can enjoy the Indoor view & rides but obviously not the outdoors.
99,4.0,"You need more than a day to explore the whole place. From mall, restaurants to amusement park. A nice place to visit. Various popular international brand shops and international cuisine restaurants."
100,3.0,"Definitely a great place for kids and families, as long as your kids don't mind the wait. My husband and I went by ourselves over a holiday weekend because they had a 50% discount for foreigners. The lines were just unbearable, but I suppose this is Korea. Because half of the park is indoors, I felt very overwhelmed by all the noises and people. If you can go on a weekday when the lines aren't so long, it's probably worth it."
101,4.0,"This place was fun, but very crowded on a rainy day so lines were extremely long! I mean hours long which made it less fun. I would go again though for sure."
102,5.0,"We loved it here! It's like an indoor Disney World for all. So much to do and see from ice skating, roller coasters, shows, food, and so much more. Place was huge. The staff were all helpful & accommodating. Definitely one place we will go back to next time we are in Seoul. Highly recommend!"
103,5.0,"Like my visit here , its like wonderland though i can t take any rides this trip is still worth it .Theres just too many people queveing up for the rides..too bad"
104,3.0,Went with my boyfriend. Ride lines were ridiculous some over 1 or 2 hours wait. We just enjoyed our own company and ate around. Next time hope to go when less busy. Expensive price to get in. My boyfriend said prices had gone up in ticket. Overall good experience.
105,1.0,"Awful awful awful. We spent a lot of money to get in (plus transportation) and the wait for each ride, even the kids' rides, were 120 minutes minimum!! There was little to do and it was a total bust. We were very disappointed!"
106,4.0,They claim to be the largest indoor amusement park. While easily believable I wish they have added more rides or optimised their quee management system to make lines shorter.
107,5.0,"I am 50 and went with my friend and she is 50, she lived in Korea so this was pretty special for her.  Definitely a neat attraction for families and I can attest to this by watching all the little kids having a wonderful time with lots of squeals of delight.  The parade is really neat and there are lots of rides but I am guessing it would be pretty expensive.  There rides are quite like Disneyland, they are trying their best, and their ""theme"" and ""characters"" were a little odd for me (being from Canada) but for little kids from anywhere and the locals, I am sure it would be special.  We walked the whole park, it is quite large and to be in doors is rather amazing."
108,4.0,"If you visit Korea, and you're either an amusement park aficionado or have kids, go to Lotte World Amusement Park.  The usual guidelines: go EARLY!  and There's always a discount coupon available (that is, don't pay full price).  Although it got quite crowded in the afternoon, the queues in the morning were reasonable when we went.    We often got a bit lost, but eventually we found helpful directional signs.  The stage shows had surprisingly well-trained (Russian?) dancers in absurd costumes and kiddie narration in Korean.  The food and souvenirs were reasonably priced; and there were plenty of places to sit or stand and get your bearings.  The ice rink at the bottom served as an orienting and comforting center to the place.  In all, it is stunning to have such a space in the middle of a huge metropolis!  Plan to spend the whole day, and more."
109,5.0,Lotte world was just awesome. You will get everything under one roof. I bought ReFa massage device from there. And collected from airport. Feeling Awesome.. I would like to visit here again and again.seoul is just awesome👍
110,2.0,"We went during peak season and there was so many people lining up for every single ride. There are magic passes for three rides and you can reserve a time for quick access and avoid the queue. However, we found that most of the rides had their allocation exhausted and we"
111,4.0,"It was a rainy weekday, so when we arrived after 4pm for the discounted evening tickets, our attendant was super nice and offered us an additional 30% off since some of the outdoor rides were closed. Total paid for 2 was 56000 won which included the Magic Pass, great deal!  The"
112,4.0,"Lotte world has so many different options for the visitor, museum is incredible. Food available from all different aspects of the world, very modern."
113,4.0,"This small but exciting amusement park, you can enjoy all exiciting ride. However, it is a little bit expensive."
114,3.0,"Stores were high-end, and much more international merchandise - the prices were not for the budget traveler.  Insadong had great low prices in the many street markets, however, Lotte World was a fun place to stroll and grab lunch."
115,5.0,"I just simply can't say anything bad about it. Many people here compare this place with other huge amusement parks in the world. Well, it's a different place. Don't expect it to be the same. It IS in fact the largest indoor amusement park thus it's very popular so it's normal to have so many people there. Yes, the waiting can get too long but it's no different than in any other popular amusement parks. It is expensive too but the variety of the rides and other games, the pretty views, the shows and the overall magical mood of the place totally makes up for it. There are many cheap restaurants and some souvenir shops inside. Also, if you go to their website, they usually have discounts, especially around holidays (Christmas, Halloween) and for foreigners, also, you can just buy the afternoon ticket. All it takes is a little research. It's better to go on weekdays to avoid the crowd. I think it's more about the mood and less about the rides. Been there 3 times and always had a good time!"
116,1.0,"Billed at the largest indoor amusement park in the world. Such a let down. Very expensive to get in the door ($33 a person) and that includes NOTHING, you have to pay for all rides inside. If you want to go ice skating there is a rink here, but you have to pay a fortune to get at it. Inside is all small children stuff outside is more adult, however it's really packed with pre-teens hanging out in lines that are two or more hours long per ride. I would suggest skipping this unless you really want to throw your money away, have tons of time to burn or have a very small child to bring with you."
117,4.0,"There are few indoor theme parks and lotte world is just the one, the big one. With so many interesting activities for children and even adults, lotte world is so crowdy! I have to say that I really like it, even though I an adult."
118,4.0,"We were lucky enough to be in Seoul close to Thanksgiving and they had a 2 week foreigner special (50% off tickets!). So we went to check it out. Definitely a cool place! Not too many adult rides but there's some good ones - but be prepared to wait an 1hr+ for some, but try to get some magic passes! Pretty cool to see the inside with the multiple floors - the largest indoor theme park in the world! The outdoor area is also really nice. Some rides we really liked were the: balloon ride, french revolution and Atlantis (pharaohs fury was unfortunately closed, and the flume ride was too long of a wait)! Probably wouldn't have come if we had to pay full price, but had a great time. Also: with your ticket you get free entrance into the folk museum on the 3rd floor! Actually really cool and they have a miniature village section with great models. Not too many people visit the museum, but def worth checking out!!"
119,4.0,"My first time in a balloon ride and like any first timer,, I more than enjoyed the ride, being an indoor theme park, the space was limited compared to outdoor theme parks like Ocean Park, Disneyland, etc.  I also enjoed the Pharaoh' revenge ride.. Also too oir lunch inside.."
120,4.0,High end shopping mall with tax free prices and nice food court...but it is expencive compered to so no bargins or good deals...but ask for a extra discount on very expencive items...
