,title,text
206,5.0,"An institution in Seoul and a must see. Lots of choice between food, souvenirs, bric a brac and ginseng. Market stalls encourage you to come in but there's no pressure. Very little room to bargain as prices are quite low already. Be careful of the motor bikes that do the deliveries in between the swarms of people. Great place to find value and pick up bargains. Some of the shops off the market were huge - we went into a stationery / toy shop and it was probably 4 floors. Went back again the next day so can easily spend half a day here."
207,4.0,"Like many of the markets here in Seoul, this is a truly unique and exciting experience. There are  number of ways to enter the market and all give you a fun view.  This market is overflowing with seasonal clothes on the main strip and all kinds of shops and restaurants in the alleys and the alleys off of the alleys. This is one of the fun clothing markets in Seoul. I recommend it and will definitely return to this market"
208,3.0,Visited in the morning.  Had breakfast at an alley selling knife cut noodles.  That was an interesting experience and quite delicious.We ventured into the basement selling all kinds of things from chilli powder to fabric and that was when we got totally lost and could not find our way out.  It was like a maze!
209,3.0,"We went to Namdaemun at around 6pm, not yet hungry but I'd say that was a good thing, this market is kind of run down, sells a lot of pseudo fake products, various ginseng, clothing, limited street food, was really missable compared to other areas nearby."
210,5.0,"Really buzzy and safe to visit. Great street food and shops. Coffee shops abound in Seoul, it has the most of any city. Shopping opportunities are really good and prices excellent for a capital city. Easy to get to in the subway."
211,3.0,"Used to get good deals here long ago. No bargaining now and shop keepers raise their prices when they know you are tourist. Not much traditional crafts to be bought here anymore. Mostly flea market type clothing, bags, shoes, sunglasses, hair accessories. If you want to see what a traditional market used to look like this is it. Beware of your wallet and purse."
212,5.0,Bought souveniers here for my family and the prices are really cheap compared to other tourist places eg:Itaewon. Can get good bargain and its good to bring calculator if u dont speak korean. The sellers are very nice too.. Really enjoyed my time here. Pls take note they close at 5pm..
213,3.0,Avoid going there if you dont like overly crowded places. Things here are not exactly cheap as they say. It is definitely popular among the locals and the tourists but didn't work for me. There are endless options to eat and shop and wander around. Good place if you're looking forward to purchase souvenirs. Good luck!!! :)
214,4.0,"This is a fairly big street market with lots of things to buy!!!  There's food stalls, restaurants, clothes vendors, souvenir vendors!!! You name it, it's all there!!!  Enjoy!"
215,5.0,"you can shop for anything and everything you wantyou can also eat here and try the food alley - reasonable and home cooked tastewe went here twice, on a weekend and on a monday. less people on a weekday which is good :-)sellers are also friendlier than i expectedtourist information officers are also available in the area so they can help you out"
216,5.0,"Cheap shopping, bargains. Not solace for couture shoppers. Street Food stalls and lots to look around and take in. Great time for anyone wanting to just go walking and wandering."
217,4.0,"The place is near Hoehyun Station.  The place is huge and can easily get lost.  The place sells mostly local stuff of all sorts.  I especially like the fresh street buns there.  It tastes like Chinese meat buns and dumplings but the one with vegetable has Kimchi in there and all the buns are so delicious.  We went for the buns twice!  In fact we'd prefer the buns than the hotel breakfast.  Also we love the waffle and Americano (coffee) in a modern coffee shop there.  It is a good place to see this important part of Seoul and to know a little about the lifestyle by experiencing the market.  I will visit again if I ever go to Seoul again.  There are children's toys in Namdaemun market but they are not the type you expect from ToysRUs.  I find that for shopping, the market is similar to China because most of the stuffs are from China.  So do expect that when shopping there, but it's good to have a look no matter what."
218,4.0,"The usual fare you would expect from a market, food, clothing, souvenirs... Lots of foods to enjoy. We spent around 2hrs here just wandering and sampling."
219,4.0,Cheap shopping. Still you can get to buy the same items at insasong and myeondong with the same price.
220,3.0,"Being from Asia myself, this market did not appeal highly for me. Street food looks good but I only got to try the hotteok. Found some nice backpacks but passed up on them. Found the same ones in Insadong for half the price."
221,4.0,"I stayed near (7 min. walk) Namdaemun market for about 4 days last year while on vacation in South Korea. We ended up going to Nandaemun every night to walk around. Every night we saw something different (we also visited once in the day and found a really good beef soup place). This is, simply put, a great place to eat, shop, and eat some more. Note that English is not widely used in South Korea (in my experience). However, we were surprisingly able to communicate in Mandarin with most vendors and most of the beauty supply stores. My mom was able to negotiate a little bit with each vendor (store or stall). However, I'm not sure what the standard is and how much you should expect to negotiate. Most of the stalls will not take credit card but most of the beauty stores will (and if you spend more than $30K KW, ask for a tax exemption receipt!)Note, if you walk by in the morning there are folks selling breakfast. Very good place to grab something to-go for later. My mom is not super abled physically but this place was flat enough that it was easy for her to get around. Plus, most of the food stalls/restaurants had seating, so there are place to sit and rest (provided you buy food and eat!)"
222,5.0,"Made a mistake to first visit in the night...its more happening in the day. I stumbled on this massive and bubbling market when I was looking around for the cable car to go up N Seoul Tower. We were drawn by all the sights and smell. It's a beautiful showcase of Korea's best in one place. Had a meal at one of the shops, reasonable and filling. Must go and with a good appetite."
223,5.0,My guesthouse very near to Namdaemun Market..just walking distance less than a minute. You may get a T-shirt (for souvenir) 3 for 10000 wonRecommended..
224,3.0,"This market has everything that you want to buy. We went here in the morning while some sellers preparing their things. We met some ahjumma's money changer. At one corner, you can find kalguksu. If you have time to look around, then this place is perfect for you. But if you don't have so much time, better don't go this place."
225,4.0,"get your usual tourist souvenir & stuff here..t-shirts, keychains & the like. may be a little expensive than similar markets elsewhere. good experience nonetheless. Surprisingly for Malaysians, some of the sellers can speak a little malay!"
226,4.0,"Having visited Myeondong, Insadong and Dandaemun  Market, we believe this is probably  the best and balanced market for tourist in terms of pricing and completeness. If you have very limited  time, this is the one you must do to complete  your Seoul trip. The sellers are reasonably  friendly, with one even brought me to public washroom (quite  a walk away from his stall) as I could not understand his English. Merchandise  include clothing and souvenirs, but not many food stalls. There are more street food at Myeondong  night market, however note that we visited  Namdaemun  on day hence this may not be fair comparison.Again, English is quite limited here, but we manage to haggle few thousand  wons off from some stalls. Tips: 1. Go for stalls for haggling as you have better chances there , harder to haggle at stores. Note that you need to pay cash for stalls. Prices we believe is lower than Insadong 2. Look  around deep into market before negotiating  for  price. Those stalls near the street usually  more  expensive  than  the one at center of marketSummary, great place to be in if you like street / flea market type of environment. Haggle if you like as that's would  be a nice experience  to try ☺in Seoul markets"
227,4.0,Good place to get local goods but you need to bargain. There nice and trendy stuff to buy there but most of the retailers don't speak English although some spoke mandarin. We bargain using the calculator and there was no issue at all.
228,3.0,Market opens till 5am so does sone nearby shopping Centres.  Famous for its stalks n street food. A must try.  Can get most suff 'tourist' would want.  Be prepared to walk.  Women's clothes abounds.
229,2.0,"Made a special trip here on a Saturday night just to be told its closed.However, if you need Christmas supplies the Christmas decorations stores are 24 hours."
230,3.0,"Near to our hotel and therefore we went there few times.  Many stores and variety of stuff to buy.  Since is a must go place in Seoul, worth making a trip there."
231,4.0,"I have visited as a tourist and as a local and each time I was overwhelmed by the sheer size of this place. Easy to access on the green line but once you are in, be prepared to get horribly lost! Don't just stay at ground level - each building has 5 levels and each level has its own specialty.It will take days to see the whole thing. Lots of touristy stuff but lots fashion, jewelry and ginseng too. Found some amazing pottery."
232,4.0,"We had planned the visit to Namdaemun for the last day of our trip, so that we need not carry out purchases with us throughout.  Namdaemun is a large market offering a great variety of stuff, from kitchen/ household wares, clothes, food, bags, shoes, etc.  The prices are reasonable, nevertheless, one should still bargain.  As the place is quite large, comprising of different multi-storied buildings, alleys, etc.  If one has a specific item to look for, he/ she should approach the tourist information counter or persons dressed in red stationed at the junction of the market and ask for directions so as not to go round in the market aimlessly.  I am surprised and impressed by the availability and professionalism of such assistance.  However, it is noted that this market is more suitable for the more matured.  Younger teens might not find this place interesting and would still prefer Myeongdong more."
233,1.0,"I sometimes work out of an office building across the road from this place.There is nothing much to see, buy or eat. Consistently disappoints everyone who visits. Tourists have this idea that this place is somehow representative of the 'old' Korea. It isn't. Move on."
234,5.0,"There is plenty of shops within the market and they range from clothing, accessories, shoes, food, ginseng etc."
235,1.0,"Went there late night, and were utterly disappointed by the inflated prices set for foreigners. With such strong reputation, I personally believe they should improve many things from shops to attitude. Once they know you are a foreigner, be sure to be hacked. Do bargain if something really catches your eye. Would never come back to the market, especially the whoesale area. Expected much better quality and experience, terrible experience. Really sad to know of this fact"
236,3.0,"My girlfriend found a few things she liked for rather low prices (we just came from Japan, so everything seems cheap here). For low quality clothes it is a good place, but I didn't found any souvenirs I liked. I expected the market to be much bigger, but within an hour or two we saw most of it."
237,4.0,"A vibrant bustling marketplace with lots of different shops and laneways to explore. Namdaemun is more rustic than Myeongdong, so don't go expecting bright lights and trendy interiors."
238,4.0,"This market is very friendly and has all sorts of typical Korean produce and souvenirs but at a good and often negotiable price! You can buy numerous traditional teas like jujube and ginseng for example and also parasols, fans, chopsticks, bags, pottery, jewellery, clothes. It is a non-threatening environment and you can also get cold drinks, smoothies, fresh juices, etc. there."
239,5.0,"Loved this market.  Such a variety of goods can be found here - clothes, household products food, paper products, jewelry craft making supplies, hair accessories - you name it, it's here.  During Christmas, there are even ""western"" Christmas decorations. Parking is available and not too expensive but we usually walked there from post.  It's uphill from Yongsan but downhill when your backpack is full of goodies. Lots of inexpensive clothes on tables if you don't mind digging.  Slightly more expensive stuff is folded or hanging up.  If you have time, a must see to experience.  And yes, you can haggle at the outdoor stands, not so much in the fixed clothes stands."
240,5.0,"you cant finish to shop in one day,there are every kind of goods,and so many shops in building.only dissapointment is this market close veryearly unlike other korean market"
241,4.0,"If you want local korean items & traditional ones, visit this market.It is cheap and you can bargain also."
242,5.0,"Very good collections of clothes, gifts etc. Return home like a Korean, by dressing Korean. I don't mean the traditional way, but the latest style as seen in K-pop."
243,4.0,"I have been here with my mum, she is not a big fan of shopping but even she thanked me for taking her here. You can find everything you can imagine, with good price. Especially traditional korean gifts are the best of quality and price. You can buy amazing bookmarks for 1000-2000won, which are 10.000won at the airport! You can haggle with some of the shoppers but mostly they don't welcome especially if you are not paying cash."
244,4.0,"Namdaemun market was an interesting place to visit. We walked 400 meters west from the Seoul central train station up the hill and found this market by dead reckoning. It was not very crowded on a Sunday afternoon, but that may because of the current MERS scare. The market had a little something for almost every age group. Leather goods, fabrics, clothing, sunglasses, food, etc. It'll be a great place to go get gifts for birthdays and Christmas."
245,3.0,Crowded streets with tons of shopping for everyone. They have little street shops and indoor markets. I buy blankets in Korea because their cotton is unbelievable. The food is fresh and delicious and won't disappoint.
246,4.0,"The market is quite a maze.  I've been there several times but I still get lost.  Ask for a map at the information kiosks if you want to keep your bearing.  We went mostly for the cheap eyeglasses and we were not disappointed.  I stay away from the first floor shops since they seem to be more expensive than the second floor shops.  I'm not sure though if they are able to speak much English.  We got 5 pairs of teen and children's eyeglasses for 50,000 each including eye exam, frame, and lenses.  They finished it less than an hour.  While we were waiting for my pair, we browsed around and had lunch at a kalguksu restaurant which was very good.  We also saw Running Man t-shirts at 3 for 10,000 so grabbed 6 of those.  If you are able to go to other markets for food, you should go there instead.  They don't have as high of a quality for dried squids, etc. as the Jungbu Market."
247,5.0,"Full of shops and local food. I you are adventurous to explore local essence for place, this the way to go.This place is quite difference than other places in world in sense of locally made material. Authentic Korean made stuff with reasonable price is available here unlike any other tourist city where you would find things made of China.I would recommend couple of things here :1) Visit flower market, amazing verities.2) Check ornaments, hand bracelets (handmade)3) Souvenirs made of sea shell (specialty of Korea)4) Local foodIt would take whole 1 day if you would like to enjoy.Regards"
248,2.0,"HUGE market and cheap items. From clothes, bags, shoes, everything almost here and are cheaper compare to Myeongdong and Dongdaemun. However, place is not clean and some sellers are rude. We experienced being pushed for just standing next to her stall (we were just checking our maps). Sorry, not really a good experience for me. But it doesn't mean everyone's like that. Love the people here, I love the smiles on their faces.Tips:- Try to bargain if you are buying many items from one store.- If the seller already agreed to your asking price, buy it right away. Not nice to haggle, then you turn your back. Some shoppers are like this, and sellers are unhappy.- Learn simple Korean like asking for price (igeo eolmayeyo = how much is this?). Most cannot understand and speak English.- Women's apparel are on west side of the area. Check your maps and train stations exits so you'll not get lost. Hard to rely on maps on this area."
249,4.0,"I usually don't enjoy too much these traditional markets. I'm not so much into buying too much souvenirs, and traditional markets are usually the place to find tourists, rather than Korea people actually shopping. However, Namdaemun still was a pleasant experience for me. First, there are actually quite a few locals going about their shopping, so it doesn't feel too much like a tourist trap. Also, as I stated, I don't usually enjoy traditional markets that much, but for someone enjoying them, they've come to the right place, as the place is exactly what you could expect, selling all sorts of products at an affordable price. But what leads me to rate this place 4* instead of 3* is the size of the market. Many tourist markets around the world are one big street with a way in and a way out. Namdaemun however, takes out an entire neighborhood, with entrance doors on all sizes. It's really gigantic and one could easily get lost there. The market also includes huge buildings, each large, with many floors, and some of them connected via catwalks. There is truly an amazing variety and quantity of goods available for purchase at a fairly affordable price, and shopper enthusiasts could spend an entire day there without being able to get a full view of what Namdaemun has to offer."
250,4.0,"A big place that sell textiles and range of clothing. I really fancy the seafood just outside the market because it is really cheap, fresh and tasty. Visit namdaemun market can sum up visit to other market except myeongdong. All in all, i recommend this place."
251,5.0,"This is the place to go for all the cheap stuff. Most are probably made in China. But if you want to get t-shirts for 3 for 10000 won or 1000 won socks, this is better place to shop. Just like Myeongdong, lots of street food. It's fun just to walk around and see their average Korean market day. Also very clean and no gutter smells."
252,5.0,"Excellent spectacle frames.  Compared to U.S., lighter and more stylish at less than 100 dollars.  I recommend Hanaro optical by Gate 5.  Would defer the lens prescription to my local home optical though.Excellent hanboks for children, lacquerware, and comforters.  High quality lacquerware with mother of pearl inlay jewelry boxes from 15 to 300 dollars-- equivalent to those sold in Insadong for at least half off.  Toddler hanboks for less than 70 dollars the going rate retail.  I recommend building C, 2nd floor.I went by myself and compared prices with locals who said I was not ripped off despite being a terrible bargainer."
253,5.0,"- delicious street foods such as the seaweed love letters, black sesame pancake and ice creams- cheap but beautiful knitted sweaters and cardigans- quality and affordable brooches- my must visit place whenever I comes to seoul!"
254,3.0,"Coming from the Philippines, I could compare this to Divisoria or Baclaran. No branded items, daily necessities, clothes, shoes, socks, you need it, you'll find it there. Food stalls are everywhere as well. This market is worth a visit."
255,4.0,"Like any large city, Seoul has many dichotomies and one of them is the new and the old...perhaps a better description than ""old"" would be ""original"".  Like all things new, there is comfort and orderliness but it lacks the all important ""flavour"".  That is not the case with Namdaemun Market, it has flavour in spades.  Namdaemun is the historical southern gate to Seoul.  So you can well imagine the congregation of sellers and buyers that would gather here to transact over hundreds of years.  The corridors are narrow and lined with independent merchants operating small stalls.  Merchants selling similar items tend to congregate in one area, fruits and vegetable, dry food items, clothing...etc.  Casual eateries dot the market throughout.  Some of them are very good offering traditional Korean fast foods like noodles, steaming broth soup, dumplings and other delicacies.  It is an experience!  Well worth spending half a day just wandering through the many corridors.  And if you tire, you are just a few blocks away from something modern."
256,5.0,"This market is so much fun!  EVERYTHING is for sale here and at a pretty good price.  From housewares to snacks to beautiful clothing and it's EVERYWHERE.  Be sure to give yourself lots of time to explore this maze of a market and don't worry about getting turned around, it's not that hard to get your bearings once you find a main road.  Come hungry, the food is excellent!"
257,4.0,Spent a day wondering around the market and underground stalls. Try the food places in the middle of the market.... really good food and really cheap.
258,2.0,"Most of the women who sell jewelries at Lengdang market (is that how it's spelled?) are extremely rude.They gave me and my sister dirty, angry looks when we asked how much they cost and answered in a rude way. Perhaps it's because we are from Malaysia, a third world country, so we disgust them. :(Also, a lot of jewelries are for wholesale, and when I wanted to buy in bulk so I can make a little extra income by selling the rest at home later, they said that it takes a week to make them. Of course, there are some ready made bulks but they aren't as pretty as the ones you need to pre-order first."
259,4.0,We were staying in a hotel which was not far away from Namdaemum Market and therefore we got there on foot.  Namdaemum Market is a good place to enjoy Korean cuisine as there are a number of restaurants which sell traditional Korean food.  Don't worry about language barriers as some of them have both English and Chinese menus.  Some restaurants put their food on the tables in front of their doors and therefore you may have some ideas about what to have before walk in.  Some food stalls open at night in the market and they sell Korean barbecue food which is part of Korean culture.  We had barbecue for dinner there to experience how Korean people live.
260,3.0,"The street market here is nothing great. But if you are looking for bargains and not too bothered about quality or brands, this is the place to shop. The market is divided into different sectors selling different products such as sportswear, women's clothing, children's stuff. Lots of street food here to try too. Personally, I'm not impressed by this place."
261,2.0,"We 1st went there on a Thur night (8pm) and the place was deserted.  Not sure why but perhaps the market is closed on certain days.  We went back again on a Friday evening (9pm) and the situation was not much better.  Some sellers were already starting to pack up their stuff (at 9pm on a Friday night?) The food stalls looked interesting but we did not try them. The clothing and misc. souvenir products (e.g. fridge magnet, pouch, chopsticks) sold there were mainly made of poor quality and not quite worth the price.  Some of the stalls owners weren't very friendly either. However, we did managed to purchase some delicious dried squid and preserved persimmon from one of the tiny shops in the vicinity.  They weren't cheap though. I find other Asian street markets in places like Taipei and Bangkok much more interesting. We left Namdaemun Market and walked to Myeongdong, which was much more exciting and buzzing with people. However, I didn't see many souvenir shops / stalls at Myeongdong.  If you want mass produced, run-of-the-mill type of Korean souvenir, Namdaemun may be a better bet.  If you are looking for something more refined and unique (e.g. handmade art pieces), check out Insadong or Buckhon."
262,3.0,"Went on 01 Jan 2015. Quite a number of stalls were closed. Stall owners were not friendly at all. Hard sell, no discount, Do not speak common language. Anyway, walked further down, the stuffs get slightly cheaper. Would prefer the underground shopping mall where prices are stated. Not really cheap for shopping, if ones have been to Bangkok, Taiwan, etc..."
263,4.0,"It was slightly snowing when we went.  The place were awfully crowded.  Small shops lined the streets.  Many smaller stalls filled up the space in the centre portion.  Souvenirs, winter wear, shoe-shops, accesssories, street food, everything you could think of, were there in those many shops and stalls.Haggling was possible.  All eight of us ended up with new winter boots/shoes^^  Price was reasonable (my husband bought a pair of good winter boots for KRW55,000 while I bought a humble pair of winter shoes for KRW30,000.  My daughters' boots were about KRW45,000 each).  One downside was that the shopkeepers all couldn't speak English.  We had to use a calculator to communicate.On the whole, I'd recommend tourists to visit this busy area.  There's so much to see and buy."
