,title,text
0,2.0,"It was supposed to be a ""treat day"" for the kids to go to the toys street but to our horror, there were NO TOYS!Needless to say, the kids were utterly disappointed & so were the adults."
1,3.0,"If you live in a country where there is no big markets stalls like this, then this may be an interesting place to visit."
2,5.0,Great place to shop. Tons of people from different countries. On the spot money exchange. Yummy street food. Shopping off the street and can readily bargain.
3,5.0,"Visited the traditional market which sell traditional Korean cooked food, fresh food and other items like electrical appliances and clothes. Tried the dumplings, fried tempura, corn dog and others. Food was fresh and delicious. Definitely worth a visit."
4,5.0,"It is somewhat like dongdaemun. But nearer to Myeongdong, right beside Shinsegae department store. We encountered snow whil shopping there. Price of stuff are relatively similar to Myeongdong but higher than dongdaemun."
5,4.0,"Bought my breakfast there almost every morning. There is this particular shop that sells Pau. Hot and nice. There was another Ahjumma who sells Ham, Cheese and Egg Toast. Very good for a chilly winter morning."
6,4.0,Always enjoyed walking and bustling with the crowds for good food and shopping. Namdaemun market just grows into me with her charm of eclectic mix of goods and awesome food choices.
7,5.0,"Here you can find most of Seoul famous street foods and shopping area for clothing, hats...etc, but most stores usually close earlier by 10pm."
8,4.0,"This place is worth looking at. Especially the  jewelry building with hundreds of small shops.Anyways, not really a place where I would go shopping"
9,3.0,"Looks mostly like any market anywhere in the world, with some exaptions. Nice to walk through, but dont spend more then an hour tops"
10,5.0,"Everything you could want from Korea is available-at this market. Hundreds of outside vendors selling food, clothes, trinkets and so much more. If you are in Seoul you must go to this market."
11,4.0,"It is a traditionalMarket place with shops and street vendors .  We bought some socks , sun hats and dried fruit.   I also saw some knock off clothing and bags along with fur coats .  There were also food vendors and we got to try some traditional korean soup. Overall an interesting placeTo see for those who want to experience a more local vibe"
12,5.0,"Loved the market. One can easily spend half a day window shopping or shopping and trying out some street food. Pity that we got to spend only a couple of hours there since we were specifically looking for luggage. Would have loved to browse through the shops much longer and walk around. Definitely go there while visiting Seoul. Price wise, I did not see any great deals, some shops are open to bargaining and some are not. Nothing was really marked down. Nevertheless a great place to browse and look at things that you do not need :)"
13,5.0,So there is the day time shopping and night time shopping. If your looking for kids clothes you can come after 10pm to 5am. On #6 you can find many kids clothing stores. The key to getting a discount is buy more than one piece. I think the minimum is 3 and up. So we bought on this trip maybe 9 of the same kids sleep sack different colors and sizes to give to friends and it was much cheaper. For example a kids hat I bought was 15000won each but if I buy more than 3 it’s 9000won. If I buy three I save 3000won and get 3 hats! Anyway this is the deal and for accessories you need to buy by the dozens and many styles. The last time I came I bought hairpins for my kids and friends. They come out to 50cents each very cheap. There is usually less people at night and this is when the wholesale customers come so just be aware to get deals you must buy more. Also make sure you bring cash. This also helps since most money exchanges close before 10pm. Good luck shopping.
14,5.0,"We visited Seoul again after few yrs back in 2017,2016 & 2012 via Singapore.We went to Namdaemun market few times whenever we were in seoul and there are many things here & have many choices to choose especially a shopholic like me ^^ This year our second homestay located near to Namdaemun gate 5 and we love walking just across it."
15,3.0,"It is extremely huge and you’ll probably get lost, it goes underground overground and the streets go on and on. Anything you can imagine you will find here. So big that I actually lost interest and left with only some watermelon.....maybe it’s some twisted Korean reverse psychology so make women shop less."
16,4.0,"We bought some magnet souvenir and keychain here. We ask the information and they were very friendly. We loves the souvenirs. Overall, Namdaemun  Market is very good place to buy souvenir"
17,5.0,"A leisurely 15 mins walk from Myeongdong. Love the street food available. A great place for sight, smell and taste. Ate traditional korean bbq. It was fantastic and very reasonably priced. There's a small lane lined with small restos selling mackerel, beef soup etc. So yummy. There are stores selling cheap souvenirs to clothes, eyeglasses, contact lens. You name it they got it here."
18,3.0,"I believe this place is cheaper than Myeongdong, but not as interesting. You can go here if you want to shop at a really low price. We were able to buy a lot from here, and most of our souvenirs came from this market."
19,4.0,Lots of fun with so many different shops! Don’t miss out on the socks! So many choices! A fun environment!
20,4.0,"We stayed in Tmark Grand Hotel just opposite this market and my wife went crazy shopping in here for clothes for our daughter, so many stalls to choose from, so many new and stylish clothes for our kid. Bring lots of cash or stick to a budget, try getting some discount and it works sometimes.In the evenings there are many food stalls selling all kinds of snacks so you will never go hungry."
21,3.0,Namdaemun is a shopping area which is overwhelming. While it is conveniently located and shops are inside airconditioned buildings seeing so many stalls one after the after from one floor to the other can be overwhelming.  But the goods sold are definitely cheaper and you could probably find some good bargains.
22,1.0,"Place to shop for souvineers and snacks. Variety street food, fishcake, lobster tail, waffle, ice cream, and more."
23,4.0,"Visited on a Sunday afternoon. The place was full of activity, with shops selling everything Korean one can ask for – souvenirs, clothes, all varieties of Ginseng and other medicines....and of course an endless choice of food. A great place for bargain hunters and those who enjoy browsing. One must have plenty of time to look around – there is so much to see and discover. The food stalls in particular are a great attraction – one can have a full meal just sampling the items being made at the live counters. It is  on the City Tour Bus Route – just hop off soon after you start at Koreana Hotel and spend as much time as you want, before hopping back on the Bus and carrying on.....! A great experience indeed!!"
24,5.0,"Like any market ... a great place to find soooo many great treasures!  A lot of people in the Market and so many ways to travel within the market but there are info booths to help you out and also people in red jackets in the ‘intersection’ areas to help you.And don’t for get to ask for a deal! A great place to buy souvenirs! Oh, and you have to try the homemade dumpling booth ... there are a few but see the pictures for the one we went to!  Absolutely delicious!!"
25,5.0,Anything you can buy asking interpretation staffs who walk around the market for visitors'/foreigners' help if you need their kind service as free of charge.
26,4.0,"Although I didn't buy anything there, it's a great experience to browse the different items for sale. As I was walking around, I found the dumpling people are talking about in Tripadvisor. I bought all types of dumpling to try.....yummy! If you eat there, you can help yourself with the danmuji ( yellow pickled radish) which are placed beside the stall. There are no chairs and you have to stand and eat. Along the lanes are small restaurants. If you are adventurous, you can go in and try the local food. If you stay in Myeongdong shopping area, you can walk to Namdaemun market  - less than 900  meters."
27,4.0,Cool market. Not the modern market but the old school market selling both new and old school stuff. Lots of stuff to see and experience. Overall a nice experience.
28,5.0,"A must visit place in Seoul, this market is the largest one in Seoul covering over 16 acres. There is very thing here, be it cloths, toys, stationary or street food and a best place to buy Souvenirs for your near and dear ones. There are lot of shops specializing in selling refurbished cameras and accessories. If you are buying anything be ready to use your bargaining skills. And if you do not want to do any shopping, it is still worth visiting here."
29,5.0,"Come here if you want cheap gifts, t-shirts, fridge magnets, key chains etc. If you are into accessories, head to e-Lengdang 2nd floor. This is a heaven for accessories."
30,2.0,"Be careful where you eat, my daughter got a bad stomach here.She ate the round patty with vegetables inside, Try and eat the street food that is made freshly in front of you,"
31,4.0,"Went there by bus number 3 from Namsan Seoul Tower, 6 stops only. Quite a big market, as went during winter month of December, too cold to stay too long. Have good kimchi buns, fish cakes soups & food Valley with seatings to eat in comfort. Many shops to see, can bargain a little if buy more. Not all welcome bargains."
32,4.0,"When you start walking into the market, for those who have been to Bangkok Chatuchak market, there is a sense of deja vu. This place similarly has different section for clothing, accessories, etc. You must look for their food alley which serve very local food. Compared to BKK, this market is slightly more spacious so one won't feel as claustrophobic."
33,4.0,Thoroughly enjoyed strolling around this area and we bought some lovely souvenirs at the handicraft center.From crane bird boxes to Korea fridge magnets and chopstick-holders 😀Did not yet find a great place to eat local food but we’ll try again tomorrow!
34,3.0,"Actually a typical local market that people here to look for bargain. Sometime you may not get a good bargain either as you must know how to bargain. Lots of clothing, shoes, food and food stuff. Nothing special but is enjoyable to walk around and enjoy the atmosphere. One of the stall that selling the hot steam bun is really good.. Long queue and prepare to wait for your food."
35,2.0,"Okay market, but same thing over and over again.   Gave 2 stars for the food only, great Korean BBQ.   Okay experience just to tick the box, but you get the gist of it after 20 minutes."
36,4.0,"We arrived in the early evening on a Monday, and noted that some of the shops on the peripheral were selling produce that locals were buying.  Walking along the vibrant streets in Namdaemun Market, you will see many shops selling souvenirs, clothing, etc, as well as street stalls selling local food.  Worth a visit to see a street market in Seoul."
37,5.0,"Good to come in the day as you can catch many good deals in the many stores here. Fresh food sold in the Market, stationary stores , great gift giving ideas all in this one place-  a whole sale centre where you can buy almost anything including costume jewellery, wedding gifts, korean handicraft souvenirs etc"
38,5.0,"Cheaper souvenir and more choices. From keychain, mirror, pen, shirts and many more. Compare to Myeongdong Market. Can find halal Kebab within walking distance from the Namdaemun train."
39,3.0,Namdaemun is a market that mostly sells clothing. There are a few other types of shops sprinkled in but the majority are clothes and shoes. The quality is similar to what you can get in the underground subway shopping but prices are higher than what you will see at the subway shops.
40,5.0,The place where one could buy cheaper souvenirs than elsewhere. Grab anything that is cheap here as I regret for not buying much from here
41,4.0,"Went on a Sunday late morning. Seems like some of the alleys are not opened. An alley called the accessories alley is totally quiet and empty, the pushcarts are all covered up and the shops are not opened. However the Main Street is busy, with all the food stalls selling the different local food items. Many of the pushcarts are selling the same items but some are more patronised than others. Even if you dun know how to order/eat, just observe the locals and follow what they do. Besides food, there are many stalls selling imitation branded stuff. Some are such bad fakes- the words Tommy Hilfiger printed on a hoodie with another Brand’s logo. Reminds me of night markets in Bangkok. Have yet to explore the Kulguksu lane and the fish lane, but both looked busy."
42,5.0,"This market is packed with many locals and tourists. There is an assortment of food and drink (both restaurants and street food), fresh produce, garments and clothes and many others.There is a portion with many stores selling all sorts of cheap accessories and raw materials to make accessories and embelishments."
43,5.0,"Huge market with various things. All the stores are in their own building. They sell hair accessories, jewellery, kids clothing, ladies clothing and many more. Took the metro and stop at seoul station, walked the seoullo walkaway towards Namdaemun market"
44,4.0,"This place is for an older crowd... comparing to Myeongdong street market. Authentic, has its own charm of traditional Korean market. Buy anything under the sun. Lots to eat. KPop mania items. Pots, pans, great bargains."
45,5.0,One if our favourite spots to visited day or night. Crazy variety of street food at great value. Also interesting to shop for souvenirs and do some bargaining.
46,4.0,"The market is clean and easy to Find. IT has good places for clothes, accessories, eye glasses and souvenirs. Some local Food stuff are also available. Prices are cheap and a lot OF locals are here for marketing OF their Daily needs. We were only a handful OF Tourist present in The morning. A good place to feel The local pulse OF The City."
47,4.0,We visited this market area one morning while waiting for Shinsegae department store to open.All the clothes and “jewelry” looked like cheap low quality stuff.The food stalls were ok. There was one food stall that sold fish cake that was very popular.
48,2.0,"You can easily get lost inside this market. It's huge and most of the shops look alike. It's a shopping area mainly for clothing and personal items. If you are just buying a few pieces of clothing, I guess you are better off shopping in other areas like Myendong(?) where you can see more variety of goods to buy."
49,3.0,Seriously i doesnt really like this place but since i m in korea why not. My kids like this place. Locals buying here cos i think it cheap but nothing after all.Place pack with ppl n cars
50,5.0,Get Ho-Dduk in the front of Gate 2 entrance - honey filling and japchae filling.  Then walk up the street (into the market shopping area) for about 200-300 yards and get dumplings and donuts.
51,4.0,"My family and I went here to get souvenirs for the rest of the family. The best things (I guess!) that I got here were the brooches. There is a building with one floor full of little shops with the staffs making all sorts of jewelleries and ornaments. Brooches,bangles, bracelets, rings, you name it, are all here. Then change to another level and you will see they sell  vintage decorative stuff for your homes, tshirts and baby clothes. Maybe you can bargain (I didn't cuz I never really know how to lol) and get yourself a good price for the things you buy. Take your time as namdaemun market is a big area."
52,4.0,"On the last day of my trip, I went to Namdaemun Market to get some souvenirs for some people back in town. I wanted to get some beautiful brooches for my mom and most people know E-Lengdang in Namdaemun market is where you can get really beautiful brooches. I’d like to recommend one shop that sells brooches. The seller was very generous and had given us 3 free brooches after we bought some from her. She had told us that she uses real swarovski crystals for her brooches. The more expensive the brooches are, the more beautiful it is. Her shop is on the second floor and it is number 404. I have provided how the shop looks like and how beautiful the brooches that she sells! If you are looking to find beautiful brooches, you may visit this shop. Her brooches are the most beautiful I’ve found in E-Lengdang. Have a great trip!"
53,3.0,"Mostly cheap made items such as clothing, toys and ornaments. We did not really enjoy it that much as we couldn't find the unique locally made items we were hoping for."
54,3.0,This market is nothing but most of China made cheap goods.Only very few local made items are sold.A sweet made of flour and honey is the speciality and should be tried. It's even more amazing to watch how this sweet is made.
55,5.0,"Great day and night, cheap fresh food, souvenirs and general cheap items for sale.Safe friendly atmosphere with no pressure to purchase."
56,4.0,"Close to Myeongdong, this is a great place to pick up traditional artefacts and souvenirs at decent prices. The market opens late but is closed on some days - so check before you travel."
57,4.0,"This is the best place for souvenirs, we compared Myeongdong, Insadong and Namdaemun. Namdaemun is the cheapest among all these locations for souvenirs including t-shirts, key chains, magnets, masks, etc..."
58,4.0,"A big traditional market where you can get practically everything here..from children clothes, slippers, bags and souvenirs.. A lot of food carts and is good place to try all Korean snacks..Easy to access by train."
59,3.0,"This market was located opposite our hotel so it was very easy to access. The market seems to sell pretty much everything including clothes, kitchenware, fruit and vegetables, cooked food, hats, shoes, souvenirs etc. The market is actually quite large and there is a part called ""children's market"" but it had already closed by the time we were there. In front of the market along the main road are many shops selling camera gear, new and used lenses and camera bodies including all the famous brands so I think this was the main place for cameras in Seoul.Despite being quite a large market there are far more interesting markets in Seoul such as the Dongdaemun Market for fashion and the Myeong Dong Street Market which was very lively and seemed much more popular."
60,3.0,"We went here for clothes shopping. Store owners do not allow you to try on the clothes they are selling, so having a tape measure with us helped us to decide whether an item was the right size. A lot of the stalls were pretty expensive though (we spent most of the time by the clothing buildings near Hoehyoen station, Exit 5). Just found less than a handful of stores with the prices we were looking for, and ended up with a couple purchases. Even in the summer, there were still stores by the road selling fur coats! Would have wanted to spend more time exploring, but the heat of the day got to us.There's a lot of stores selling dried fruits, vegetables, even meat! I saw dried okra, dried peppers, dried strawberries, dried octopus (both spicy and not spicy)... the choices were endless!There's a road with stores selling stationery, wrapping paper and gift bags that had pretty attractive options. We saw a couple of skincare stores as well in the area - not sure if the prices are good compared to Myeongdong. There are information booths, but the one we saw was closed during lunch break."
61,5.0,"We went to the design plaza first, highlight was my daughter got to play the piano outside! Then onto the markets... its 4 storeys of fabrics,  ground floor lovely quilts, outside are zips and brocades, top 3 floors all material. Unless you are geographically minded, but it when you see it. I found a beaut green linen, decided to look around first and couldn't find the vendor again. Also, no places to sit or have a cold drink inside so be prepared. It was 33 degrees c when we went and even with air conditioning my kids were too hot and grumpy to go all around the building butI had no choice but to take them. Fabulous selection, patterns etc. Next time I'm finding a baby sitter"
62,3.0,"I would say this market is fairly traditional. A lot of gods, a lot of fake brands, narrow lanes and crowded. If you want to buy clothes from the market, or well, from most places, be prepared! Take your measures beforehand and bring your tape-measure! There are no such thing as a dressing room or trying the clothes on ;).The market felt big with numerous small isles both directions from what we called the ”main path”. As with most makets, it is a lot of ”same same” , meaning the same goods over and over. All in all, it was an experience but to us,  Dongdaemun market with Gwangjang market next to it was better."
63,5.0,"Namdaemun market was good. They have lots of clothings,toys and accessories for children. Their price for kids and adults clothes are reasonable. Souvenirs at namdamun market is cheaper compared to other places. Basically of all the places like Myeongdong street, namdaemun is better in terms of cheaper price and more variety of items. We enjoyed our shopping at namdaemun market."
64,4.0,"Our hotel was just 10 mins away, so we usually go through the Namdaemun market everyday.  It’s one big market that sells the same or similar things.  The market was confusing at first since every stores looked alike, but after a few times of getting lost we finally figured out the directions.  From this market is about another 8-10 mins walk to the other popular M market.  There were also a few food stands but not sure if it’s good or not."
65,4.0,"Food and shopping are the best. Local food and wholesale is found here, walking distance from Mydeong shopping area, grab a sandwich along the way, shoes n shirts at cheap price. Be prepare to walk and enjoy the fun of shopping, step into the aircon building and open another area to shop."
66,2.0,"2nd time coming here and still seem to miss the action. The last time we were too early coming before our flight, this time we were too late as most of the stalls and shops were closing. We were there just before dinner of about 7.30pm. The girls were disappointed."
67,4.0,It has something for everybody here and have sufficient variety that it is quite a good place to get everything.
68,3.0,"A traditional market for people of all ages. It depicts quite well the kind of lifestyle people have, from the young to elderly. The market sells clothes, household stuff and food."
69,5.0,"We spent about 1.5 hrs waking around and exploring the market. Plenty to see if you go in the morning if you like look at fresh produce and seafood. They sell lots of accessories, souvenirs and clothes but don’t expect high fashion and chic products here. The street food here is more traditional and tastier than in Myeong-Dong. Look for the yummy freshly made dumplings right in the middle of the market, they are cheap and delicious."
70,4.0,"Much cheaper here than in the supermarkets and/or Myeongdong for souvenirs such as seaweed, purses and Korean cutlery sets. There's loads to see here and can easily spend a morning here. They have a little food street too and the market is divided into different sections like kidswear, accessories, clothes, etc. We enjoyed strolling through the market and got a few last minute gifts. Worth a visit."
71,4.0,We had a lovely time at the Namdaemun Market. There were an assortment of wares on sales as well as street food to taste. A great attraction in Seoul
72,5.0,"The streets here are wider than Myeong Dong and prices of food might be cheaper too. Since we were travelling with stroller, we were not able to penetrate or go in Myeong Dong as the place was packed when we went. So we opted to go here instead.We bought some socks, belt, jeans, facial wash, and ate tons of street food. We loved the store that sold dumplings and meat buns."
73,4.0,"A diversified market. From clothing, bags, stationery, accessories, shoes, cameras to hiking gear.  They have it. They also have restaurants and cafes that serve very good Korean food."
74,5.0,"A very busy market in the heart of the city where toy get literally from A to Z.Qualitywise not necessarily to notch, but fun to browse through the narrow alleys and to take in the bit so familiar scents. If you have a tenancy to be claustrophobic, I would not recommend a visit during busy hours. At times you're blocked but people, hardly able to move forward or backward, neither left or right... and in parts underground. I enjoy observing the hustle and bustle of people and browsing for a typical Joann item (like brass dishes or similar)Generally it's mostly about clothing, but my size is never available neither my style. Very close by for larger wallets the first Shinsegae hosting upscale designer boutiques and a nice food section in B1On the other end of the market, the name giving Nandaemun, the former city gate and national treasure No.1 ( it sadly burned down ca. 10 yrs ago, but was restored to it's full glory)All in all go and visit as it's truly any experience!"
