,title,text
75,1.0,"We went to a shop there to get some dumplings (Gamekol Son Wangmandu as shown in the picture), and the staff was not welcoming to tourist at all. We didn't know Korean at all, so we tried to order by following the last customer's order, and to use body gesture and English to signal the staff we want to have what she ordered as well. However, the staff just grabbed our money rudely and ignore us totally until we repeated ask for someone to get our order. We were very disappointed as we have had very nice experience throughout our trip with others shops owned by Korean owners who know no English at all as well."
76,4.0,"Always visit this place when I’m in Seoul for the hotteok , buns and the children’s area with the wide array of good designs to choose from. It’s relatively inexpensive and there’s also shoe shops as well as street vendors who sell cheap tees worthy of a second look."
77,3.0,It is quite a large market and is spread out. Most shops were of accessories some weird and wonderful street food. The shops were cheaper than other supermarket. The market is easily accessible as it is in the middle of the city and surprisingly is open till late at night.
78,5.0,"Many people come here to get cheaper stuff, seaweed and baby/toddler clothes here!There are many eateries in this area as well and also a popular traditional eating place where you go jnto the market and sit side by side to eat! As the place is quite cramp, it is not advisable to have many things with you especially if have kids and strollers.There is also a famous brand nail cutter which can be found here. (If you know what I’m talking about!😬)There is an area which sells lots of baby/toddlers clothes and some area looks like those in Bangkok with lots of small shops within it."
79,5.0,"The place is always full of life. Food everywhere, lobsters, strawberries, chicken, pancakes, rice cakes, ice-cream topped with raw honey, fruits, grilled, steamed, boiled, anyway you can think off, they have it. Big and small restaurants, stand-alone stalls, stalls peddling clothes, bags, etc. Huge department stalls, brand name stores, all you need to shop to your heart’s desire."
80,5.0,"Cheap place to buy souvenirs especially brooches, fashionable socks and a lot more.  Highly recommended."
81,5.0,Very nice market with lots of things to see and buy if you need. You can find anything and everything you want. Be prepared to spend all day if you search for something special. I like it.
82,2.0,"1 hour just because I am walking with a 2 and 4YO. Found some unique street food and also a fruit shop (corner lot near Seoullo information booth) that sold cheap strawberries. If your intention is to buy souvenirs in bulk, then this may be suitable."
83,4.0,"Namdaemun market bustles on the weekends with laneways full of people. The more obvious shops are street stalls selling designer clothing knock offs and street food. Beyond those, there is also one street focused on high quality Korean paper and stationary. It worth a look for reasonably priced gift wrapping and gift boxes for that special occasion. Bulk birthday and Christmas cards are also available and great for kids birthdays. Location is the Western end of the market as you come down from Namsan Park."
84,2.0,"Closes early and repeats most of the stuff which Myeongdong has - but with fewer eateries. Trinkets are cheap knockoffs. Some of the skincare products and food products may be slightly cheaper, but it is probably not worth coming by unless 1) you are buying in bulk 2) have a lot of spare time in SeoulAvoid"
85,3.0,"I bought lots and lots of kpop merch, from Blackpink to Got7 to Twice, everything is available here. But, my main issue was that they closed way too early. I went by 8 pm and almost every store was closed or closing. It's still an awesome place to buy kpop goods :)"
86,3.0,We very much preferred the Myeongdong market over this one. This market is older but seemed to be just shirts and clothes not the diversity in Myeongdong. But we loved walking the streets and seeing the food and people.
87,5.0,"A really good place to visit if you're interested in the local lifestyle! There are lots of clothing, food and souvenirs to buy here. Pricing are low/acceptable as well! Some clothing can cost just 5,000 korean won and are made in korea. I would recommended this place for people who want to experience the local life. :)"
88,3.0,"We loved the food affordable and tastes good! Must Try the egg breadPotato with sausage Korean barbqEverything!But be careful when buying stuff likeThe clothing and hats, earmuffs etc.Please canvass first before buyingOur first night was terribleWe ate in a restaurant beside click hotelThey do understand English And we saw a group menu for 4 pax each Combo meal for 45,000wonAlmost 45-50 USDBut when they asked for paymentThey told us that the 45k won meal is for 2 adults and they charged us twice and we paid93,000won almost 100USD!!!we were 4 adults each table (3 tables)Since it was our first time and first dayWe did not complaint because we do not want a hassle on our vacation.Then at the street marketThe temperature on our first night reached negative 15-17 degreesThat our ears were freezing We looked for earmuffs immediately And this ladyGave us the price of 10,000wonI thought it was a good buyBecause the cold is not tolerable anymorewe were really upset the next day when My relatives bought same earmuffs at myeong dong train station only for 3,000wonOh well charge it to experience ;)Some people really take advantage to foreigners...Will Be wiser next time..."
89,4.0,"Namdaemun market is one of traditional market in Seoul. Unlike any other markets, they classified the shop based on what they sell. We went there to find things for kids. Unfortunately some of the shop were already closed, perhaps due to the weather. This market is known for its food's alley too. For noodle lovers, you should visit kalguksu alley near gate 5."
90,5.0,"the very first time i taste street foods. though, new to my taste, i tried it. i like some. perhaps, if i can see it always, i can eat it also they way korean people do."
91,4.0,"If you are looking for cheaper souvenirs this is the best places to get it. It is also walking distance from Myeongdong . Besides that, if you plan to try korean street food you can also try it here. Some of the street food prices cheaper than lots of famous places."
92,5.0,"The thing is, I'm a picky eater. I don't usually eat unusual foods but I had to try them here! You can also find silk, mattresses and all the sorts here in great material. If I had enough baggage, I'd buy tons of those!"
93,5.0,"If you are to bargain and wholesales, go here! Just keep bargain, walk around check for different prices. Even if they dont speak well english, just put a price on their calculator. 50% lower than what they tell you ;) Asian insights and intel knowledge"
94,3.0,"I decided to bring my family to Namdaemun Market for this trip. However, it was slightly disappointing. Saw a few YouTube clips to confirm our visit there. Basically, if you were to look for really cheap stuffs. There are many wholesale retailers there selling great varieties of items like fashion and home products, etc. As for food wise, I don’t see a great variety of food. We bought some red bean buns but didn’t finish them off. We ended up in a restaurant near exit 5 for our lunch. Can give it a try to patronise the restaurant that offer nice Ginseng Chicken Soup which located on the second floor of a building."
95,5.0,A must place to visit of u wanna buy gifts n souvenirs.  U can havr a good bargain and lots of things to.buy .
96,5.0,Go to line 4 and go out of exit 4. This a bustling market for traditional Korean goods. Street food is abundant and cheap.
97,5.0,"Some of the reviews mentioned this to be a night market, but not sure. A bit disappointed as this market was not the bustling place that I expected compared to other markets in parts of Asia. Most shops selling winter wear. In fact all markets and roadside stalls everywhere we went in Seoul seemed to be selling winter wear. Time of the year, I Guess. Food stalls were few and far between, though there was 1 stall selling delicious dumplings close to the metro entrance."
98,5.0,"my korean mum wanted that i see this market. It is not a tourist attraction and goods are for the everyday use for a korean household (which is very different from a western household !). It is fun to watch and eat street food ! You may not find something for the european taste as fashion is very different and sizes could be an issue (very small). Good buys in Korea for me are korean cosmetics, socks, dry food, teas, baby clothes (korean brands). Ginseng is very famous and expensive but not for everyone taste (bitter) !"
99,4.0,"The setup is similar to Malaysia's Petaling Street. Selling clothings, shoes, souvenirs, practically everything. Do try some street food if you are here. I bought 26 fridge magnets here for 10,000won. Also bought 10 nail cutters for 10,000won. Just to provide you an idea of the prices here. I didn't bargain...so maybe if you do, you can get stuffs at lower prices than me."
100,4.0,It's interesting to walk around and you can get some deals if you bargain in Korean although it feels like they try to take advantage and overcharge the tourists. We ate in food alley. The restaurants aren't very fancy but the food is authentic and good.
101,5.0,"If you are in Seoul, you must visit this market, the so-called the city's largest market. You can get almost anything here from clothing, souvenirs, purses, and food supplies. Many stalls are open into the wee hours of the morning. A very good shopping experience in Seoul. We managed to buy the Supreme clothing, souvenirs, fruits and also accessories here. There are lots of stalls & you will get lost easily finding your way out....definitely worth the visit!"
102,2.0,"The atmosphere at night here is a stark contrast to Myeongdong. It is dimly-lit and most of the vendors there look jaded and less enthusiastic about hawking their tired-looking wares. Though a few of their products there appear cheaper to Myeongdong ones, they do  not add up to much savings. The goods hawked are dated and nothing special. Not worth the trip."
103,5.0,There’s quite a bit of shopping done here despite the very cold and freezing weather. It was a good shopping experience. We went back a second time. The Korean ajumas are very nice and friendly!!  Will definitely revisit if I come korea again
104,4.0,Very good selections of choice of things to buy. And street food as well. Do shop around before you decide which shop to buy from. Same product might be selling at different price just a shop away
105,5.0,"I had not been here for almost 25 years, I could still find my way around and loved the hoetok sweet pancakes that I remember as a kid!"
106,5.0,It’s not your fancy and most urban market if you are going for that reasons. But if you want to experience the most famous street food and buy a souvenirs with a super reasonable prices so it’s your destination.
107,5.0,Nice place to go and experience korean street market.  U can walk from Seoul station either via sky bridge or exit 5 of line 1 Seoul station.
108,4.0,"This market is so huge that we got lost walking around this place. As compared to the nearby Myeongdong Street market, the prices are are cheaper but the place is not “classy”.  A section of this place is a wet market and there are many wholesalers. Recommendation:1. Go there during the day as this place become like a ghost town after 8 pm. 2. Clothings and jewelries accessories and bags  are aplenty.  3. Beside the street stalls, try going into the shops in the many buildings where you can find more and better merchandise."
109,5.0,"I initially went here to find Swarovski brooches but it turned out the place and satellite area offers a lot more. You could get cheaper korean souvenirs here compare to other tourist attractions... fridge magnets, nail clippers, cutleries etc... you name it. The Korean Swarovski brooches almost made me run out cash hahaha. we went straight to kiosk 168 at 1st Floor E-lengdang. The salesperson already know how to converse the prices in malay, so obvious malaysians go to her... there are hundreds more swarovski kiosks there ranging from brooches, bracelets, tiaras, watches and baju melayu buttons... so ladies bring enough cash!the cutleries such as korean spoon has so may design and way cheaper here. the place is open at 7am and closes at 5pm so be early."
110,4.0,"It's a tourist destination, therefore nothing is cheap here, particularly over the weekend. I see a lot of tourists with big shipping bags here, but I really don't know if they get a real deal. Lots of other tourist's destinations nearby, but are disguised by the luster of this market."
111,5.0,The market place existed very few hundred years and still going strong. You will find everything and able to bargain for it. It’s discovery experience if you know what you are looking for.
112,4.0,"Exciting market where the line ""shop 'till you drop"" becomes a reality. There are buildings after buildings of shops with clothing apparel, shoes, and everything in between. Haven for wholesalers too!"
113,4.0,"If you plan to visit Seoul, ensure this market is your first stop. You can get lot of local fashion attire here with cheap price compare to Myeongdong Street including children fashion. Price range start from 1000 won. Basically this market is just beside Myeongdong Market. Shinsegae Department Store is the divider of this two street market. If you travel with kids, just take a taxi, it only cost you less than 5000 won from any of Hotel at Myeongdong area.You can find souvenirs, kimchi & other local food here, clothes, bag & etc.Lot of restaurant also available along the street. Street food start around 3pm onward.Basically lot of choice & you may spend 3 - 4 hours here.If you looking for local foods, look for this shop (Sale Market No. 1), the guy very friendly & able to speak a little bit in Bahasa Malaysia or Indonesia. He gave us some discount, extra free foods & travel plastic bag."
114,2.0,There are many markets/night markets in Seoul. But most things are pricier than in Singapore. But in any country shopping should be one large part of your iteniery as this will keep ladies happy and best way to interact with locals. When you are tired there is no shortage of coffee shops to sit and relax
115,5.0,We have been living in Seoul for more than a year and have visited the Namdaemun market occasionally. There are several stores of interest and even if you don't intend buying anything just a stroll through the market will be interesting. Ensure you have cash on you should you decide on making purchases - smaller shops accept only cash.
116,5.0,"We visited this market few times. So much to see, shop and buy. The market has practically everything. We loved bargaining and shopping for socks. Do not miss the delicious deep fried honey/vegetables buns located at gate 2. There's always a long queue for these buns.When there, go to Gonggam restaurant for their extremely delicious BBQ meats. Lunch deal is extremely worth it👍👍👍"
117,5.0,Great shopping street Good price for goods one time visit not enough you will come again and again thanks you
118,5.0,This is an old market that's very famous in Seoul for cheap goods and eats. You'll find almost anything here. It's close to the center Myeongdong. Be prepared to bargain you might get things even cheaper.
119,5.0,We stay at Itaewon.Took the 421 bus line towards Seoul station.Namdaemun bus stop just after Seoul station.Different than Myeong-dong.Should visit to experience it.
120,3.0,"We headed here as soon as we arrived Seoul. We expected more after read the article from the guidebook. It is more wholesale market , from accessories, stationary to clothing. The price can be negotiated in some shops, so try to do first. The food stalls offer foods to the tourists so, do not expect the good flavor or reasonable price!"
121,4.0,"I always visited this market every time I came to Seoul. We can find lots of various things here: souvenirs, clothes, socks, hats/caps, umbrellas, bags, luggage, ginsengs, fruits, chocolates, home decorations, cosmetics, local food, etc etc. And, in many shops, you can bargain the price. I always had fun strolling along this market, having checked all the things, blending in with the local people and tasting the local food. For me, this market is a must visit market when I visit Seoul. :)"
122,4.0,"It's a traditional market, you can find a lot of snacks, souvenirs, clothes, etc. You can get cheaper price for wholesale."
123,4.0,A huge market with a mix of items from pots to shoes to clothes to souvenirs and foodstuff.Style is more suited for the elderly though there are a few stalls selling kids clothing and accessories. There's also a huge wholesale building selling women accessories but they are truly wholesale and wouldn't accept any purchases less than 10 pcs.
124,4.0,"We went here on day#2 our holiday in Seoul.so many stuff people sell here; fashion like a tee shirt,pants,socks,shoes,hats,jackets,etc.there're a mini restaurants with cheap price offer many korean foods and it's deliciuous.At the middle along Namdaemun street there's Tourist information,police office,and the shops which sell cosmetics such as : Aritaum,Ettude,Nature Republic,etc.This market open at 9am and close at 9pm.dont worry you will get free wifi here.You can reach Namdaemun market bu subway,get off at Heoyeon Station (Namdaemun Station)  exit 5."
125,4.0,Came to pay a visit since near my hotel. Not much things to buy and have small street food stores like myeondong too.
126,4.0,"We come here everytime we visit Korea because our interests change as our kids get older. No longer need the tourist trinkets, it is now for the clothes and accessories.  Our family loves the variety these markets bring."
127,4.0,"5 to 10 mins walk from MRT station. Best about it is I do not need to wake up early, yet still gets to eat and shop. Food here is traditional, cheap and really niceeee!!! Certain stores you can just seat in to enjoy your food. I vote for a twist donut store run by an elderly. She's alone, so customer needs to help to coat the fried donut with sugar and drop their money in the boxes. There's also a big hand made noodle store, the stock was light and nice. Customer can seat in to enjoy their food with complimentary kimchi. There's also fried food stores available. People there are friendly and nice. Worth going!!!"
128,4.0,"One of many street side shopping options is Seoul. You get anything and everything you want...From souveniers to clothes to bags etc . Bargaining options vary. Most places were fixed pricing , you can probably do a little bit of bargaining but not much. However there were other stores where you felt like bargaining a lot ( some bag stores etc) .most of the stuff is made in China like in all countries now. So you can compare prices vs India and then decide what to buy and what not ."
129,5.0,"Have been there a few times. I enjoyed the cheap and traditional stuff that can buy at there. Especially the traditional snacks, they usually sell cheaper outsider the road, but not in the market. And the category of the market is various, so worth spending time to explore this traditional market"
130,2.0,"Came here during dinner time (6pm), and there was nothing available! The stalls selling clothes and gifts were either closed or packing up. And the supposed ""food alley"" was empty. Was there on a weekday."
131,5.0,"Great to walk around and try some local street food. Busy, vibrant and great vibe. Loved all the different goods (yes, lots of knock offs), especially, liked all the cosmetics stores."
132,5.0,"A place to visit although there are areas that are very steep. This place sells mostly clothes which was not my primary interest. There are also seaweed souvenirs, cute plastic bags, stationary shops, local food produce and even house hold use stuff.They sell seaweed in a big bulk and some shops may be more expensive than others so remember to negotiate.  There is also tourist information area which is great. They are very helpful and can direct you to the right place. Manage to buy some fresh korean ginseng there and also had early lunch in a barbecue eatery."
133,5.0,"First time i go to Namdaemun market, just a view of them still open. That's because already 9.00 PM (Korean Time) but second time i go there, all of them open, and if you travellers want buy gift for your friends or family this is the right place to go. In here you can buy traditional gift too same like at insadong with cheaper price."
134,5.0,"From young to old, boys to man to the only woman, we all love this market.  Things to buy, food to eat (and not ex!) and warm benches to keep u warm! Only regret is too little time!"
135,4.0,"Much korean souvenir,kosmetik(aritaum shop),street food,ginseng.it's a cheaper shop than myeongdong.much of the seller can spaek chinesse.it's star from 10.00am and much close at 10.00pm.not open 24 hour"
136,4.0,"We went there to sea the tradition products like Korean red Ginseng and we found it there. There lots of different shops from clothes, seaweed , Ginseng and souvenirs. There are some shopping carts also in the middle. It is good market to visit while in Seoul."
137,5.0,"really worth your money shopping here... the prices were cheaper than other shopping places. you can find almost anything here. it is traditional market, and you can bargain too...  hehe... i came here twice the last time i visited seoul. when i came around 9pm,there's still some shops open though many others were already close."
138,4.0,"There are lots of local hawkers and almost every stall are selling same food, what I like the most is the salted fried chicken only dose you 7000won for whole chicken, so delicious, abit regret only have one, cause we can't find it at other place.If you want to buy some local snack food, you will find some there. Buy for friends or family it's a good choice, try to bargain abit before buy. (It's changed if compare last time, nowadays they not really willing to give you discount). But still insists never try never know. :) Nothing much can do here, only if you enjoy local food."
139,4.0,"Interesting night market with lots of food and of course clothes like socks and jeans, nothing you don't get elsewhere. Nice night out but you need to check the clothes you buy since they often wink out something out of the bag which was not what you chose!"
140,4.0,"A street where you can find great bargains from clothes, shoes, beauty products and street food find. A great place to bring bargain hunters and foodies alike. What I dont like about the place is the access. Its so hard to go down and up the underpass due to lack of escalators."
141,4.0,"if u are taking metro, get off at hoehyeon station exit number 5 i went to namdaemun for buy some korean souvenir such as key chain, refrigerator magnet, bookmark and so oni went to this market at the morning, i think they give more good price since morning still not crowdedif you are going to have a good price souvenir, u need to enter daedo buildingjust go straight from exit no 5 and you will find orange building on the right sidethey give lower price rather than souvenir outside"
142,4.0,Good place to find cheap stuff. Lots to see but had to navigate with a pram. Seoul not so pram friendly.  But the folks here are really friendly and tolerant of a crying baby.
143,3.0,"This market is actually about a 5 minute walk from Myeongdong were our hotel was located.   Is a relatively large market you do need a map, the good thing is that they have a help desk right in the middle were they give you a map a tell you where you can find food and other things.  We had dinner there actually it was the best Korean bbq ever!! but not cheap.  After that we walk a little and check some stores which also are not that cheap but if you walk around you can find some stuff for a good price, I particularly walk and compare prices.   I did buy three shirts for $10.  It was actually a good deal I guess it was because they were closing and it was the last sales of the day.   But I do recommend you walk enjoy every market in South Korea."
144,4.0,Many stores are not open when we went on Sunday. Wanted to go to the children store building but was closed. Cheap clothing and lots of sock street vendors everywhere. Snacks from street stalls were yummy.
145,2.0,"We came here and saw a korean bbq sign that lead upstairs if one of the market stalls. Went up and ordered and the bbq was average, and charged us exorbitantly!! I got one strip of pork for the equivalent of $20 usd, where the photo shows 5 strips. My 3 year old could have had 8 strips... same went for my son and his order... we thought that she would bring out more but did not, so we had to fill up on kim chee and sides that were topped up about 3 times. At the end it cost about $35 usd per person, which is expensive for korea... average meal would be about $5-10 per person usd... and this is no expensive restaurant."
146,4.0,this is the place if you want to find a cheap souvenirs and shopping. you can find a cheaper price for souvenir for your friends and indulge yourself in finding your own sparkling brooch and jewelry.
147,3.0,"Should visit once, no need to repeat. Gwangjang market is a way better option to see more local Korean food and stuff to see"
148,5.0,Love this place. Lots of things to see and buy. Can spend half a day walking around. Lots of cheap things to buy and enjoy the local culture. Good for parents looking for children clothing. Lots of cheap winter wear and accessories.
