,title,text
75,4.0,"The museum is so big and they have great collections of different ages. Personally I was expecting more for them to be the ''national'' museum and Korea has so many amazing museums all over the country. Other museums in Seoul like Samsung museum was more impressive and they carry sophisticated products. But it's still a great museum with restaurants(okay) and cafes(great tea room) for spending your whole day. There are exhibits outside too. They provide museum study tour for children too, we saw korean families bringing their children and the kids join the tour by themselves(get a lunch break with their parents) but I don't know if they have one in English."
76,5.0,This Museum is recommended to travellers who wants to know more about the history of Korea. There are also souvenir items to be bought at an affordable prices.
77,5.0,The National Museum of Korea will take you on a historical journey through the different ages of South Korea.
78,5.0,This location is walking distance from the Ichon and Seobinggo metro stops.  The museum has several interesting displays that are worth seeing as well as a kids section.  Next door is the Hangul Museum which is also a nice visit.  Enjoy both in one trip!
79,4.0,very good place to know korean history. kids can try to something and see some kind of show. there are many things to see.
80,5.0,"When traveling with kids, it is always good to know where to go with them, if the weather is not so good. The kids museum at the National Museum of Korea is one great option. Just be aware, there are time slots which can be either booked online, or on site. Once your time slot is over, you have to leave. Depending on the amount of people going in, you can go in a second time, but this might be dependent on your time and date (not in heigh season presumably). Kids can enjoy and learn hands on while at the museum."
81,4.0,"This museum is amazing. The place is simply massive. It includes exhibits not only from Korea, but from all over Asia. We spent a half day here, and only left because we were getting hungry. You could easily spend an entire day. Admission is free, and the location is easy to access from the metro."
82,4.0,Impressive array of Korean historical and religious exhibits. Beautiful Buddist sculptures and statues.
83,4.0,National Museum of Korea is subdivided into many areas. Exhibiting the different dynasty that ruled over Korea
84,5.0,Free museum that tells the young history of Korea.  I learned a lot from its time lined exhibit.  There was a free photos shots we could take and print for ourselves.  i.e. I love Korea.
85,5.0,Lots to see and learn. Is a good place to visit with the family.  You can easily sent hours admiring everything in the museum.
86,5.0,Easy to get to on the metro. Great museum with interning floors showing the countries timeline. There are cafes and restaurant and picnic area. You must talk a walk outside where there are outdoor exhibits in lovely planted gardens with pools and lakes. Very popular with Korean families.
87,4.0,Another grand installation in Seoul displaying Korean history in a grandeur setting. But the facility is not wheel chair friendly.
88,3.0,This is a very very large Museum.  That said the display space was about normal.  Each floor of galleries has it's own emphasis.  The shop has many wonderful gift ideas.  Admission is free of charge.  Now the grounds and the view up to Namsan are spectacular.
89,5.0,"Lots of beautiful pieces from Korean history and arts: buddhas, celadon, lacquered boxes, etc. Beautiful grounds, as well.  Restaurant serves Italian pasta, as well as Korean food."
90,5.0,"We had a 7am family photoshoot here with a professional photographer and found the surroundings of the museum to be very beautiful and well maintained. Clearly, the city takes a great pride in its museum. The scale of the enormous buildings are also something else to behold - truly impressive. Unfortunately, we didn't get to go into the museum itself as we had to leave at 9am but the surround park is definitely worthwhile as a visit."
91,5.0,Anyone interested in the history of Korea this is the place to visit. I had a great time exploring the exhibits!!! It had 3 floors and a place to eat at the top floor.
92,5.0,"Nice beautiful vase and all the treasures you can see. I can't remember it was free but it was pretty cheap at least. The building is new,  a small house on the lake is not an old one, but still beautiful at day and night! Nice museum! :)"
93,4.0,"Impressive building, free of charge and quite organized. There are few good coffee shops inside the museum with good views, prices are affordable considering free entrance to a good museum"
94,5.0,"One of the most impressive museums I ever visited, the accessibility of the museum is great, near a metro station.The museum is huge, you can spend here 4-5 hours easily.I really recommend the Calligraphies sections of the museum, there are some amazing art works there and also informative explanation on that unique art.I were there on a weekend during the summer vacation and it was great to see there local Korean families, couples and friends enjoy the museum silently and seriously as part of their culture, it was one example out of many to the uniqueness of the Korean people."
95,4.0,"I must confess that my knowledge of S Korea was limited to what we see on TV, so it was a surprise to see the rich customs, tradition and history in one location. It was a pleasant eye opener, and a great way to learn about this wonderful country and its people. Well worth a visit."
96,5.0,It was the most amazing and knowledgeable museum about Asian countries history there was different way to introduce the information by pictures or TV with vedio in korean and English it was for free
97,4.0,"We enjoyed the Children's section of this museum and the main exhibits were a nice look at some of Korea's history. Best of all, the museum is free!"
98,5.0,Art and relics are astounding. Well laid out. Gift shop is superb. Had a great time viewing prehistoric relics to well preserved national treasures.
99,4.0,"The museum is very nice, clean, and neat.Entrance is for free to the museum, and have scheduled free english tours."
100,4.0,"A good way to immerse in the cultural history of Korea. Very big, will take a lot of time. Grounds are also good to spend some peaceful time."
101,5.0,"Really is a must visit.  Spacious grounds and museum exhibits you'd be wandering around going wow, wow, wow."
102,5.0,Much to see here. You could easily spend a day enjoying this gem; from ancient times to modern day Korea. The building itself is part of the exhibit. It must be glorious when the flowers and gardens are in bloom
103,5.0,"This was on our agenda as part of our last minute trip to Seoul and one of the best places to visit. Step back into history of the Korean history, very rich in culture as well. For all my korean drama loving friends, this would provide a good lineage and background on some of the dramas depicting the past.We took the free English tour, and we were brought through to almost 2 hours of very interesting facts and lessons, something which we might not have gathered if we had just walked around the museum. Our guide was a retiree, and his English was very easy to understand. It is amazing to see his passion as he brought us through.The main exhibition hall was free for the public to enter. Noted also that there was a children's museum and a special exhibition (paid) that probably changes depending on the theme. You would probably need 2-3 days to finish everything, otherwise just review the map and zoom in on the sections that interest you."
104,4.0,"This museum is huge and provides a lot of information. I wish more was in english, but we enjoyed it. You need a few hours or a couple days to get through all of it fully."
105,3.0,Very impressive building and a credit to the nation for erecting such a building to house the priceless history. English text is light and enough for a quick viewing of the displays. More detailed texts for people not familiar with Korean history or time periods would add to the experience and also enhance interest in Korean history. Only gave 3 stars as we attended on a Wednesday and visitors were light. No more audio guides were available. Also there are no coffee shops available inside the main exhibition areas and this is surprising due to the amount of coffee shops available elsewhere in Korea.
106,5.0,Visited this place to get to in depth understanding of the nation from the history point; interesting enough to understand the transformation of the nation and people perspective of living here...
107,4.0,"My children, (15, 13 and 10), and I spent about 2 hours here.  It could take 1/2 day to thoroughly viewing and reading everything.  However, we've been to so many museums in Asia already, so we skipped many parts of this museums.  We only viewed the Korean history.  It's not only big and beautiful, but it's also free to the public.  We enjoyed our 2 hours there."
108,4.0,"Most subway is Line 4 Ichon. There is underpass linking the subway to about 100m away from the museum entrance, a nice thought for rainy or snowy days. The museum has three floors and many sits for you to rest (it is very big) and free drinking water at each corners. Korean history on Level 1. History of its links to Japan and China in Level 3."
109,4.0,"If it is rainy day or even beautiful on, it worth it, because park near museum is beautiful. Museum itself is very vivid. Typical stuff like ceramics, arts, caligraphy, buddhas, war equipment etc."
110,4.0,It was a sunny day and warm. Also field trip for the elementary age kids. They waved Hi for my camera :) Great history on Korea.
111,4.0,"The Koreans are very well known for their Love of country & this National Museum is a proud testament to that. A huge infrastructure, a well curated collection I can spend a whole day just walking through the collections. A nice museum cafe & huge museum store awaits your visit. I just love museum stores."
112,4.0,"I went to here next week and there's a nice museum.Many exhibits in a modern building with many children and their parents.If you are hungry you also can have lunch here just more expensive than outside .And I also met a couple on a bunch to a picture from India,really art date.And near the outside,there's a park that's a family park exactly.If you want you can go picnic with your family members."
113,5.0,The building itself is worth seeing. Built in the old USArmy base it is just a wonderful space to have a break from the  bussel of Seoul. We were there for three hours and only saw 1/4 of the displays.
114,4.0,"well designed, easy to get around, airy and spacious with exhibits well displayed. easy to get to on public transport."
115,5.0,We got there early in the day and spent many hours exploring the beautiful building. We learnt a lot about Korean and Asian history. We visited the restaurant over looking the lake and had an amazing meal. The grounds surrounding it are very pretty . It is well worth a visit.
116,4.0,"Plan to spend at least half a day at the museum. Lots of interesting art, religious artifacts, and historical info."
117,5.0,The museum provided us with a glimpse of the history of Korea and the way people lived before and after the division of the two Koreas.  It gave us the simplicity of their alphabet and language as well as their crafts.
118,4.0,Quite good - very big so you will need to allocate a few hours if you want to get around the whole place.
119,5.0,It was very interesting viewing history from another part of the world.    Plan on spending quite a bit of time here.
120,4.0,I loved how the museum was laid out! It took you through Korean history through objects and art work. The videos in between made it feel a little interactive and allowed some rest too. We went on a Sunday afternoon and found it quite empty!
121,4.0,"I spent a couple hours with my dad, especially on the 2nd floor. He is a lover of Chinese calligraphy, so he was in heaven. Don't miss the golden crowns of Silla on 1st floor and the Goryeo era pagoda."
122,5.0,Beautiful and spacious Museum with very interesting artifacts.We had an English guide to help explain history of Korea.  Everyone should visit to learn to history of this beautiful country.
123,4.0,"It is AWESOME, if you want history BOOM you got it. The Food is okay... I guess. But for history lovers it is going to be awesome."
124,5.0,"While the collection at this museum is fantastic and offers a great overview of Korean history, the building is equally impressive and a lovely place to spend a few hours.  Even the cafeteria is attractive and the food is pretty good.  The museum, especially the first floor, is laid out very well and walks visitors through Korean history - explaining the Dynasties and highlighting important events and leaders.  The collection of artifacts is impressive - my kids particularly enjoyed seeing the various types of ancient money.If you have children, be sure to check out the attached Children's Museum as well (reservations may be required here)."
125,5.0,Excellent museum with Free admission. The exhibits are pretty comprehensive. good in learning their history.
126,3.0,"Visually, this museum is beautiful and impressive, but I would not bother going unless you are interested in Korean history presented in a very traditional way.  Items under glass with labels giving some very dry information on them.  Very formal and cold.  Definitely not for children but probably better for adults with more background in ancient Korean history who can appreciate the items on display."
127,4.0,we had a great time when we visited the national museum of korea there are lots of galleries where each has it's own theme . the museum itself is informative and you will learn a lot .
128,3.0,"An acceptable attraction if you have a couple of hours to spare. The museum is free and easy to get to (it has it's own subway station) however I wouldn't put it at the top of my hit list if I was back in Seoul. The displays are interesting up until a certain point but there is very little variation in what you see. I saw a lot of pottery and weaponry but nothing interactive. However, the 12 story Pagoda in the center of the hall is worth seeing."
129,4.0,"Very large campus. I was there when they had a wing set aside for a special display on the Korean War. If you are a military buff, you HAVE to visit this museum. Armored vehicles, choppers and planes on display outside. Even the entrance to the property with huge statues dedicated to the war will keep you for 10 minutes snapping photos. I intend to go back again."
130,5.0,"its was  a great experience to visit this museum, well articolated and pleasent to visit. The rooms are very well organizated and the description is very well presented. Shops are very nice to buy items and things for kids. I will visit the museum again."
131,4.0,"There is so much to see and do here... the Buddah statues on the third floor, the three story pagoda inside, the ancient artifacts (local and abroad), art gallery, kids zone, cafe, large underground parking area, friendly staff (mostly), clean and cool on a hot day, performances etc.. really good place to just go unplanned, you won't regret it. No entry fee for general admission to museum exhibit, ₩10,000+ for special exhibits."
132,5.0,"This museum is huge! This three story museum has so much to offer from prehistoric era through  more current Asian art. There are paintings, pottery, furniture, calligraphy on scrolls, things from architecture, figurines and more.In the middle of the first floor is a large pagoda that you can't go in, but it's tall and impressive.As you go around it was nice that all the items had descriptions in English so you could really learn about what you were looking at. Also there was information about what things were going on at the time period that the art is from, such as during the Goryeo and Joseon dynasties. There were some gold crowns which surprised me some and some cool paintings. We particularly liked a cat painting, some of the ceramic decorated plates, and a samurai uniform.While it's a museum of Korea they also had artwork from India, Southeast Asia, China, and Japan. There were stairs, escalators (which my son thought was fun), and elevators to get between floors. There were restrooms on each floor as well. There was a food court and a museum shop to buy souvenirs. There was so much to see here you could easily spend many hours. We actually got tired towards the end and skipped a few galleries."
133,4.0,The visit gave us some idea of how the people have struggled thru the recent past but it is a colorful experience  to see how hard the people worked to survive
134,4.0,"Almost too big with too much stuff, too repetitive. I recommend going a few times perhaps a floor at a time. It is not of the same level as the British Museum or the Smithsonian but certainly worth your time."
135,5.0,"Everything about the museum is well done, and it's free to the public! My daughters (7 and 9) love museums, and they've enjoyed repeat visits. This experience is everything you might expect from a museum you might visit in Washington D.C."
136,5.0,"This museum was a complete package of artifacts spanning over 3-4 millenia of Korean history. Complete with prehistoric ones, of course! The flagship museum of South Korea offers a detailed look at the history of Korea and the Korean peninsula, top it all off with artifacts from various regions of Asia. A must-see!"
137,5.0,"big museums and family park with toddlers. there's a convenience store, 2 or 3 restaurants, English narration by headsets in the museums. u can access there by walk directly from Ichon station.if u have a stroller, no problem, there's an elevator."
138,5.0,Huge and beautiful. This has to be the most impressive museum I have ever seen. A must see. You will know why I boast when you get there.
139,4.0,"It is quite big, with a lot of things to see and it is for FREE.I think it is worth a visit. They offer some guided tour, so better check the schedule in advance. It seems the guide are  volunteers. I joined one tour and  I had the impression that my guide had no deep knowledge, but I might be mistaken."
140,5.0,"The museum is oversize, a huge repository of Korean culture and history dating back to prehistoric times.  It's almost impossible to take so much.  The audio tour is very poorly done and not helpful however, the displays are very well done."
141,5.0,"Great place to spend the afternoon. Admission is free and the exhibits are wonderful. Spend time in the outdoor garden, it's lovely."
142,5.0,great w a curator the museum provided. learned Korean history more than we read on the book. amazingly more collections than we saw 30 years before.
143,4.0,"It is big inside, antiques are not so many but all are in very condition and are arranged classically and interestingly.  Water clock is  a MUST."
144,5.0,"A great museum, but make sure you are on top of your Korean history before you visit.  The food court and gift shop are excellent choices - and stroll the grounds to see all the pagodas."
145,5.0,"I went here and it totally blew me away. One word; Amazing! A must see, great for both kids and adults to learn something new about Korea."
146,5.0,"We went early in the morning and spent the entire day...the only way to really appreciate it.  All displays are described in 3 languages - English, Chinese, and Korean.  If you just arrived in Korea it will give you an overview of their history (goes back almost as far as China's).  We had been in Korea for 2 weeks traveling from Busan so had a good background in Korea's history but this museum put it all into perspective for us...tied it all together so it would make more sense.  If you only visit one place in Seoul this should be it."
147,5.0,"It was well organized, clean and had amazing things to look at. The history was phenomenal. I would highly recommend this as stop."
148,4.0,"Recently built, this huge building is filled with tons of artifacts showing the rich history of Korea.  It's worth several hours BUT if you only have time for one such museum--and don't mind paying--the Leeum Samsung is better."
149,4.0,"Free as people have mentioned except special exhibits.  The space outside is nice too.  There are free lockers so you don't have to lug too much stuff around especially in the winter.  (you put in a small amount and get it back when you return the key).  Also for Running Man fans, they have been in this museum at least twice! so it will look familiar to you!"
150,5.0,History-filled place - great place to know more about the history of Korea.Accessible and located near the City's tourist spots too
151,4.0,You may take seoul city tour bus drop you right infront of the National Museum the building is unique with lots of information in there.
152,5.0,"Our family of three spend a whole day here. The exhibits were interesting and the guided tour was very informative. We got a glimpse into the history of Korean and its people, and got to know them a little better."
153,5.0,"Excellent place to start to understand Korean history and culture. The architecture is stunning, so is the view.  Admission is free and as the place is huge with 3-4 floors of exhibit, do allocate sufficient time (min 1 hour) to go through the exhibits without rush."
154,4.0,"The building is of gigantic dimension, and so is the exhibition. However, it's standard display scenography, not much interaction. Most exhibits have description text in English. Reserve at least half a day, if you seriosly want to ""see"" most of it."
155,5.0,"Even if the Museum were empty, you should visit this place. It's free, and the modern museum is colossal. The park it is located in is also refreshing and offers nice views of YongSan and NamSan in the backdrop. Fortunately, the museum is far from empty. What I really appreciated about it was the fact that there is no distinction between ""history"" and ""art"". It's neither a Fine-Arts museum nor a Museum of History, and each artifact (painting, object, portrait, manuscript) tells you a lot about the entire history and culture of Korea. Interestingly, all the artifacts are entirely different from what you could find in Western countries, as canvas painting and stone sculpture are almost inexistent, but replaced by local art forms (ink-wash paintings, ornaments, relics, calligraphy, ceramics), giving a different view and perspective on art production and techniques."
156,5.0,When I went here I I'm so overwhelmed about the Korean culture. They really value and they are taking a good care of their culture and tradition.
157,4.0,It's the best Museum in Korea. You can meet treasure of Art and culture. located in I-chon Subway station on blue line. hug park with so you can injoy go for a walk.
158,4.0,Thorough information on the history of Korea which I enjoyed. Don't forget to enjoy the scenic view outside the Museum and snap lots of pictures.
159,5.0,We had not visited this place before but so glad we did this time. Beautiful building and a stunning Korean pottery gallery that showed the most amazing collection.
160,5.0,"National museum of Korea was transferred to the current location in 2005. It really includes a huge of cultural assets. It takes one day long to view them in detail. Many locals, students and kids visit this place. Nearby there are Yongsan family park, War Museum of Korea."
161,5.0,We went early on Oct.3rd which was a holiday. Very few people when we arrived so had the chance to see alot in a relatively short period of time. Exhibits were awesome and the building was bright airy and clean. My wife was interviewed by two high school students doing a project on visitor's reaction to both the Museum and Seoul in general. Gift shop was well stocked and prices were reasonable. The museum in spacious.
162,4.0,"It's huge. It's almost as big as an airport terminal.  The exhibits were well curated, although it would be nice to have a diorama exhibit to show how the early Koreans lived. Would love also to have a replica Hanok village, as a light and sound exhibit."
163,5.0,"Given the brutal treatment of this lovely country through history, it is go good to see how much they have from their rich cultural past.Huge building, crazy cheap to enter, you can wander here for a couple of hours and still not see it all. A sophisticated, very impressive devotion to all things intellectual and artistic, Korean history comes to life here through the objects and you realise how advanced a culture it has been, when you look at the dates of things like the art and written materials"
164,5.0,"Its worth the trip to the museum.  It was free to enter and covers the evolution of the country, culture & prehistory.   Be prepared to spend a minimum of 4 hours .  There are also nice walking trails and areas for a picnic on the grounds around the museum.  They had a children's museum next door and special exhibits which you need to pay for but we didn't have time to visit."
165,5.0,"That's a really big complex of facilities at the same place. Only the museum is really big and has a lot of pieces of the Korean history as well some other countries. Outside there are other things to do, pagoda samples, a little waterfall, a park and others. I would take a tour or try to rent a mp3 there to hear about the items while you are there, i think it would be a better experience."
166,4.0,The items inside are  worth to see. There is a funny machine to take photos but we can't receive the emails with the photos. :( Disappointed.
