,title,text
0,5.0,"This museum is worth a visit both for the amazing building and the collections. The building is grandiose and the exhibition rooms are well designed. Everything is translated into English making it easy to navigate. The collections are remarkable, with the main focus being on Korean art from pre-historical times to early modern history. Easy access by metro. Allow enough time to visit the many interesting rooms."
1,5.0,"It’s close by all the palace and ancient village of Bukchon Hanok.Best of all, it’s free for all!?There is a comprehensive display and exhibits of korean history and culture and how people used to live.There were vivid and creative displays in for of real water fall and walls of Korea painting projected on walls."
2,5.0,"Sadly the app crashed and lost my review - good for kids- Timed, free entry for the kids museum, geared for 7 & under but no age limit.- free entry to the permanent exhibit- plenty of parking Recommend!"
3,5.0,"If you are into understanding and experiencing the evolution of Art, calligraphy and sculpting, this is a must do.If not, you’d better skip it.Very detailed collections of multiple era’s within the Korean geography. Surprisingly well kept. Especially the calligraphy from stone carving over papyrus to the first printed books.The museum souvenir store is a real gem."
4,4.0,We love to learn about the countries we visit and the museum was a great way to do that. It feels wide open and uncluttered and is easy to get around. The gardens outside are beautiful and not to be missed. We didn’t eat here as it seemed expensive (like all museums) so bring snacks. My 12 year old was bored but my two 18 year olds love it. Have a great day.
5,4.0,Free and worth visiting with Korean Dynasties and cultures.I luv the small cafeteria inside very clean and polite staffs
6,5.0,"The museum is big and has lots of interesting rooms with history of Korea. There is quite a great view of the N Seoul Tower from there and they have shops where you can buy souvenirs related to the antiques that you will see in the museum. I went to the museum on the weekend and I didn't have to pay an entrance fee, I guess the entrance is free on the weekends. You are allowed to take pictures of the different exhibition rooms they have but you are going to be requested to go through an X-ray security checkpoint before entering the hall where the exhibition rooms are. I highly recommend you to go to this museum if you are interested in the history of Korea and of course if you are willing to spend two to three hours there because the museum is huge."
7,5.0,We have been to this museum on two seperate visits . it is well done and explains th rich history of Korea. It is easier to understand the culture with a history lesson from the museum.
8,5.0,"Sadly the app crashed and lost my review - good for kids- Timed, free entry for the kids museum, geared for 7 & under- traveling Happy inside exhibit was great!Recommend!"
9,4.0,"Love the exhibits, the architecture and facilities at this museum. Please allocate ample time for this place, and do not skip the park."
10,5.0,If you want to learn about Korea and its extraordinary history go to this Museum. My family and I loved it!Please try the cafe on the ground floor-beautiful!
11,5.0,"Was able to spend two hours here and wished we could have stayed all day. Not only are the exhibits fascinating, but the building itself is very beautiful. The architecture is modern and sleek, but not in a brutalist unfriendly way. The lighting inside the building was amazing, and the fixture are very technologically advanced. One of the most beautiful museums I have ever visited. There is a restaurant and children's museum there as well."
12,4.0,"The National Palace Museum was housed in a massive building and was quite impressive as we walked towards it.  The opening in the center framed a view of Seoul Tower in the distance.Outside in the sprawling park were various ancient lanterns, restaurants, a bell and a large pond.  Inside were three floors of historical artifacts both curated and donated to the museum.  We started on the third floor and worked our way down with the hopes of missing the large groups of school age children that arrived the same time as us.  This worked well for the first hour.  The third floor contained a large variety of Buddhist sculptures and various pieces of art from around Asia.   Half of the second floor was full of donated collections and were a mixture of different eras and countries.  Not that interesting to us.  The other half covered the paintings and an amazing two story tall Buddhist scroll.  Dynasties and even older Korean civilizations were covered in detail on the first floor.  However, as this was a rather large museum we breezed through these displays as we were ready to get outdoors.  Overall, this museum could be split into a 2 day visit to avoid history overload."
13,4.0,"This is a great museum. 1) its free 2) the grounds are beautiful 3) the museum store has very inexpensive and nice museum gifts 4) lockers for your stuff 5) many nice artifacts from Korea and other Asian areas. We did not go to any of the special exhibits as we were a bit short on time, but we had a great visit."
14,3.0,"We were not able to enter the museum because we used up all our time playing outside and around the place. Although the building shouts CONCRETE, the setting is serene with nice pocket spots.  There were pine trees that dropped lots of miniature pine cones that my little granddaughter enjoyed collecting - this is why we ended up staying outside."
15,3.0,"We were told it is one of the best and had pretty high expectations. It was not so systemic as we expected. But at the same time, it gives some overview of Korean culture and history."
16,5.0,"This is a beautiful place to visit when you come to Korea, know more about the culture of this county. Nice to visit"
17,5.0,"The museum with the most heritages in Korea.With amazing flower gardens and huge pond, it's good for a picnic as well as history learning.- As everyone knows, the entrance is free except special exhibitions.- I was surprise to see it opens seven days a week.- The varieties of items weren't as much as I expected. But, it's still huge.- Don't expect much of luxurious and fascinating treasures because former Korean kingdoms have valued something humble. On the other hand, there are delicate and mysterious master-made items. - The location is quite away from popular touristic areas. It's not crowded on weekdays.- Exhibition halls are well-maintained. You can watch most items just by moving forward. And there are quite enough resting areas.- Free lockers, coffee shops, restaurants, etc. Souvenir shop is must-visit. There are amazing merchandises.- In April, there were many maehwa(Japanese Apricot flowers) blooming in the garden. It seemed there were more people outdoors than inside. Taking a walk around the building is recommended when it's warm.- To the east, it's connected to Hangul Museum and Yongsan Family Park. Both are good to visit as well."
18,4.0,"This museum is really big, so be prepared to spend a lot amount of time there, especially if you're a museum geek. The collection is really massive and quite complete."
19,5.0,"Even if this imposing museum is filled with exquisite artifacts, the unforgettable displays are set up in a way to be able to really appreciate and enjoy them. There are lots of benches to reflect upon and the explanations are well written. The lockers make it easy to store coats and bags, and there are many easily accessible bathrooms."
20,5.0,"A beautiful and action-packed place to visit.  The main collection is wonderful and free. The rotating exhibits will charge a fee, but they are also first-rate.  Plenty to do for adults and kids. The grounds are also a must-see."
21,5.0,"Show the work rotation, depending on the management of the exhibition Both of Korea And items from other countries borrowed to exhibit The formatting is very interesting. Anyone who likes a museum should not miss it."
22,5.0,Very good feedback and demonstrations of the people of Korea. The museum is clean and tidy. Good attraction to visit.
23,3.0,"Entrance is freeHuge exhibition space with many floorsHowever, most of the descriptions are in Korean"
24,3.0,"This is a place for people who knows how to appreciate historic artefacts - especially artefacts related to buddhism. Otherwise, I do not recommend this on your itinerary. Especially because the exhibits were rather niche. That said, it has a nice and clean environment. There were also 3 levels of exhibition halls."
25,4.0,"As a foreigner, I have been following Korean history. Not through the book but by watching Korean movies. Goreo, Joseon. All make sense via easy arrangement of the exhibition halls. Anti-clockwisely, it explains Korea history from early to modern."
26,5.0,Three story building housing many artifacts that give a full history of Korea from early time.  Reach easily by bus.
27,5.0,"Wonderful museum, can easily spend a lot of time here learning about Korea's history. Signs are in English on the exhibitions and there is a lot to see. The museum is free and also provides free luggage storage and free lockers, great for tourists. There is also a resting area in every few halls to take a break or wait for others in your party to catch up. Would highly recommend a visit here if you are traveling to Korea."
28,5.0,"Being able to learn about the country that I truly admire is one of the greatest feeling and probably achievement. This had made me appreciate more about Korea, its people and culture."
29,5.0,"Done up and managed very well, it is worth a visit for sure. Take your time moving through the exhibits- plan about 3-4 hrs"
30,3.0,"The museum is a fair bits walk uphill from the closes metro station. The giant pagoda inside is incredible. Lots of other cultural possessions inside from China, Mongolia, Rome, Japan to name a few. Very popular spot for schools and you'll see lots of children and their teachers all over. Overall it wasn't as impressive as I thought. The War Museum is a better choice with more ""interaction""."
31,5.0,"Fantastic museum from the outside in, well set out with stories, photos, artefacts and displays. Great start to those wanting more knowledge about Korea’s ancient past."
32,5.0,"The largest museum in Korea, it contains key artefacts that tell the story of the country. There are also educational and cultural assets here meaning there is something for all."
33,5.0,"Loved the museum, so much to see there, lots of information given on this beautiful country, must visit again."
34,5.0,There are plenty of reading materials that they provide in different language as well and it's all for free. They even have these stamp pad that you can roam around and complete as you go along the way. It's amazing seeing them in person as we always see it in the korean tv shows and movies.
35,4.0,We only spent part of a day here.  You need more than a partial day as we did not see a lot of the Museum.  I highly recommend seeing the Budda section.
36,5.0,"Highly recommend!  I would definitely recommend a guide.  There is a lot of amazing content. We hired a personal guide, and it was entirely worth it. The guide drastically amplified the experience. Even if you don’t have a guide, it’s still going to be worth while.  I’d plan on 2 hours per floor. We split it up in 2 days."
37,5.0,This was truly one of the best museums we have ever visited.   Extremely well laid out.   Fascinating.    Took the subway there.   Just a short walk from the stop.  The museum is laid out in chronological order of the history of Korea.    Learnt an awful lot.
38,5.0,"This museum is just beautiful!!!  Huge, well laid out, architecturally stunning.  We took Free English tour.  Since there is so much ground to cover I highly recommend the tour as it highlights some MUST SEES. 90 minutes long it goes quick but provides interesting insights.  Even my 10 year old was enjoying it!"
39,4.0,"A good place to bring high school students to visit the museum. However, no information about the Korean War which we are very interested to know more."
40,5.0,"We enjoyed this peaceful, amazing architecture and all of the many wonders within.  You can see so many different periods of Korean history here.  From the famous ""Turtle Boats"" of the 10th century through the Korean War and beyond.  A balance focus on events and culture.  Really a treat."
41,1.0,"We were so looking forward to seeing Danwon and Hyewon paintings in this museum. It was easy to take matro line 4 to get there. Walking through air conditioned tunnel, we thought it is a great design to avoid the sun light. The museum campus is quite big, well maintained and free admission. We asked front desk where are the paintings displayed. The answer is ""they are in the storage room, not in exhibit. We don't know when they will be shown""."
42,2.0,"There is not much too see compare with other museum in Seoul. Don't think there is value to visit if you have not much time in Korea,"
43,5.0,This massively impressive building in Seoul is home to a lot of South Korea's History. The building is made up of three floors and is spilt into a number of different chambers dependent on time periods of various kingdoms/empires including the Japanese colonisation period. There is however a lot of information so I would recommend either spilting your visit into a number of hours with a break in the middle or possibly a couple of day's. There is also a museum shop with lots of different gifts and also a cafe and a large exhibition/amphitheatre area just outside the building where they play music and perform. And best of all its free and easy to get to by subway or bus.
44,4.0,"This is my 3rd time here and I still enjoy it. However, I note that the exhibits hasn't changed much over the years. We didn't understand the English guide much but because he was so sincere, it would have been terrible to fault him."
45,5.0,"we went to the museum for a visit. we pre registered for an hour and a half tour. they have yours in several languages. it was excellent.  without this you just wonder around and it's too big. it gets you to the right points.  so my suggestion us,to do this your and if you want to stay, you can,stay longer."
46,5.0,"The museum was very nice and I enjoyed their collection of potter, and the restaurant inside had a good variety of choices, but I loved this museum for its extensive grounds. We wandered all over the park area and enjoyed the playground, walking trails, pagodas, and lake. I almost didn't want to go inside. We were there in the spring and the cherry trees were in full bloom, but it would be beautiful in any season."
47,5.0,"I do love a good museum but this one is particularly impressive. It is incredibly large, very modern, and super organized. All of the signs are in English too so there are no issues with understanding everything."
48,4.0,"Extraordinarily beautiful architectural building with views to Namsan Hill. The park within the Museum is really beautiful, though our visit was in the dead of winter, i could image how beautiful it would be in other seasons - some of the trees have their botanic names.  Highly recommmended for a visit, if not just for the park grounds. Comprehensive presentation of Korean history and artifacts, and some in the park also."
49,5.0,"For those who want to understand more on Korean culture, everything is excellent in the National Museum of Korea, including the exhibition, souvenir shop, cafe and the attractive musical performance. I will definitely spend more time visiting the museum when I have a chance to get there again."
50,5.0,"National Museum was one of the big museum that we ever visited, and need more than 2 hours to look every exhibition inside it. Just like any other national museums, it had the exhibitions about past time. But they displayed all the artifacts in good arrangement. Besides that, they also had Korean culture exhibition. To reach this museum, just take mrt to Ichon Station and follow the directions. It's free of charge. If you come with kids, we suggest you to also visit Children museum."
51,3.0,"The museum is huge, I'm not sure you can see everything in one day. This is great if you are interested in Korean history. I personally wouldn't bring kids here as it can get a bit boring.There is a lot of pottery and the colors are bland, so if you are tired from your travels don't go there, it will put you to sleep, but overall art and history lovers will like it."
52,5.0,"The place is easy to reach, huge and has beautiful surroundings and building structures. Entrance is free. The inside of the museum is spacious, clean and it has chairs and lounges for those who need rest after walking around the museum. It is separated into different sections for different period or era or timeline, which was interesting and systematic of them. Recommend to download the apps as it will guide you on your trip to the history of Korea."
53,5.0,Learned a lot while browsing the exhibits. Definitely don't miss this if you're a fan of history and art.
54,5.0,"This place is a must visit for history lovers, to see the stody of Seoul and Korea. With modern architecture and adequate space, the museum is fantastic."
55,5.0,What a fantastic lace to visit - free admission is a bonus.Good way to learn about the korean history and culture. Precious artifact presented in a very simple and effective way with good english translation.The building is modern and has a nice view of the city from it's perimeter.
56,4.0,"This is a beautiful, massive museum and is incredibly well done. However, we were a bit disappointed because it was basically full of artifacts  from Korean and Eastern history. My kids kept calling it the ""pot"" museum. I should have done more research on the museum because we were hoping for more of an all-around history/culture/artifact museum. For such a big museum, a lot of the items seemed repetitive. If you like historical artifacts this is the place for you! We also spent about an hour at the Children's museum area which was nice. It is meant for younger children (probably 8 years or younger.)"
57,4.0,"This museum consolidates so much of the Korean history in one place and has some amazing artifacts.  The halls are broken up by time period or dynasty and walk you through what occurred in this nation.  There are 3 floors of different presentations showing the culture and resilience of the people. The Egyptian tour was happening at the same time,  but the free Korean section was better."
58,1.0,Very boring. Nothing interesting. Just artifacts that describes nothing. War Museum was way more interesting and you learn way more from that museum.
59,5.0,"Honestly, I wasn't surprise to find an amazing amount of Artists performed at the Museum. South Korea, one of the best leader on the Art scene today. So, we found Contemporary sound installations, reconfigured and cosmology art, so trendy for present days. Thumbs up!"
60,4.0,"The architecture of the museum is spectacular.  Its like going to a really top class , 5 star Hotel than a museum.  They  have a really worthy collection of Korean history and other areas. But before coming to this museum i would also recommend the Palace museum and also the King Sejong museum under the King sejong stature. They cover the parts of history which is important for Korean drama fans . this national museum adds to the experience. i only visited the korean section but not the other floors. I think about 2 hours will cover the korean section adequately. There are lots of seats on each floor if you have parents who don't want wander around."
61,5.0,"We were in town visiting brother who works at Hangyan teaching music.  He highly recommended this museum for the architectural features as well as the art and historical items.  We were surprised at the  majesty of the space we were moving through.  It appeared the building was thoughtfully built to house the art so that you are able to take in the art without developing Stendhal syndrome., or feeling that you have seen too much.  Highly recommend making this a must see on your next tour to Seoul."
62,4.0,We came in the morning. The museum is huge! We saw Korea's historical development through the years from medieval to modern art. The three Kingdoms history of artifacts and relics were displayed.
63,1.0,"I'm not an artist, so to see pottery and paintings is just my stereotype of a boring museum and this fit my stereotype exactly."
64,5.0,"The architecture of the Museum is wonderful, outside and inside the building everything has been rightly, carefully and beautifully designed. Concerning the design and presentation of the exhibitions is excellent: very clear presented, easy to understand all the rooms and artifacts. The quality of the pieces is extremely good, magnificent and very beautiful. A must in Seoul that you cannot miss. Besides the entrance is free."
65,5.0,I like its architecture and harmonious space with field and lake under open sky. I had a chance to enjoy free orchestral music on Saturday. It was great.
66,5.0,Easy access through metro station via Metro #4.No entrance fee.Good to understand Korean history from pre-historic to 19th century.
67,5.0,"Among my favorite museums in Seoul. I regularly go there with family, friends or even just by myself. What ever your mood or the weather a fantastic museum to go to year round."
68,4.0,"This very modern and massive building is impressive on its own. The historical artifacts are abundant and well displayed, but the old- fashioned, hands-off approach is typical of most museums in the world (therefore, the kids lose interest quickly). There are lots of details (English and Korean) for history buffs, lots of art to explore, pottery, furniture, and more. The museum is free, there are reasonably priced restaurants and coffee shops to rest your feet in, there's also a reasonably priced and large store to get some tasteful souvenirs at. They have a special exhibit hall which we missed, so I can't comment on it - Egypt in Feb and March 2017. You need a least 2 hours to get through it quickly, but 4 hours would be better if you want to read details.If the weather is nice, don't forget to go outside and walk around the grounds. There are pagodas, sculptures, water features, a giant bell, and some nice paths to stroll on. Keep walking east and you'll find a large playground/park.It's all worth the visit."
69,5.0,We really enjoyed our visit at this museum.  We were thrilled that they had an Egyptian display as a special exhibition.  Really well laid our and easy to access every floor.
70,4.0,"Entrance is free, although you may need to pay to see the special exhibitions (usually from overseas). Kids museum too. Massive modern space, laid out over three floors, well presented and interesting exhibits. A bit like Ikea in that you follow a tortuous route, but keep your eyes peeled as there are some stunning artifacts tucked away just off the main path."
71,5.0,"This is a very well presented look at Korean history from early days to present. It is a beautiful space with amazing artifacts, and there is also a children's component (the kid's part requires a timed entrance ticket, so grab one when you arrive if interested). We spent a day here and walked through the whole of the exhibits, and our children (7, 9, and 11) stayed engaged for the most part. The grounds are beautiful as well. Overall, a great overview of the history of Korea, and a recommended visit for anyone living here or visiting this fascinating country."
72,4.0,"Good place to spend a few hours to know about Korea history and the treasures of Korea. The place is huge so we first took the guided tour in English to get an overview of the museum. Only after that did we start exploring on our own.There is pretty good view outside of Namsan so a very nice picture spot. Food court is pretty good.  As this is our first stop after landing in Seoul, it serves as a good introduction to Korean food."
73,4.0,"This building is very impressive and large, good to learn about Korean history and it was free entry on the day we went. Inside there are quite a lot of exhibits, but some are very repetitive and plain. One room of porcelain crockery doesn't really showcase much....all kind of blank with no motifs or designs. There are some things worth seeing but all in all it feels like the space could be used with a lot more exhibits. Good museum for Seoul, but on a global scale it's fairly average at best. Worth visiting if time to spare or interested in Korean history, but if pushed for time may be better places to visit"
74,4.0,"The museum is big - really big.  I only spent a few hours there before my legs started getting tired, but you can probably spend a few days here digesting all the exhibitions and artifacts in this museum.  One note is that it is a substantial walk (although some of it is underground and protected from elements) from Ichon subway station to the museum.What is interesting is that the outside of the museum hold some of the greatest views in Seoul.  There is a large man-made lake in front of the museum, as well as a large open area in the entrance of the museum.  There is also an area where you have a great view of Namsan Mountain and N Seoul Tower.The museum inside is very modern and expansive.  There is a lot of free space, though punctuated by a ten story pagoda in the lobby area of the museum.  There are three floors filled with exhibits and artifacts.  Definitely worth a visit of a few hours."
