,title,text
0,4.0,"FYI: This is a working fish market...wear sensible shoes (avoid flip flops, high heels and open toe shoes). I have really mixed reviews about this place.  Definitely good to snap a few memorable photos but I don't think the locals like it unless you buy something from their stall.  On the other hand, I also probably ate the best king crab I ever had with my spouse and his buddy. Part of the experience was rather uncomfortable. As soon as we walked in, there were people who started following us, speaking in Mandarin and pressuring to buy the seafood and take upstairs to cook on the second floor.  Probably close to no one there speaks a word of English.  I would also recommend to pay premium and buy something that is alive and swimming, not something that has been sitting on display on a bed of ice as we learned the hard way. The skewer of scallops that was on display on ice ended up hard and chewy.   The live king crab (close to $100 USD) was worth the price even though when you take it upstairs, they charge a cooking fee (we took it to Dragon Palace #17 where lots of people were eating...clearly a good sign)."
1,3.0,"Its a cool place to see, but I wouldnt personally go there again without someone that knows korean. When there, do not only check out the new fish market tho. Also give some time to the old one, which whilst is not as fancy. Its pretty interesting to see, and was for me more fun than the indoors market."
2,1.0,"The fish market is quite big and easy to go by train but we think can skip this place. We have a bad experience and impression of Korea on the second day of our trip. A lot variety of fresh seafood. The price of fresh seafood is ok but of course have to bargain but this is just the beginning. The worker/owner of the seafood stall will keep following and ask us to go to their restaurant. They don't cook seafood the way you want even we told them to. The cooking fees shown on board of the shop - KRW3,000 per person without soup and KRW5,000 per person with soup. Be cautious, they still overcharged us. The amount of seafood we bought is KRW65,000 but the cooking fees we paid is KRW79,000 whereby no soup and just steam all our seafood. How come they steam our oysters. We want to eat it fresh. We also noticed they only serve soup to Korea citizen and no soup to tourist. When we ask how they got the amount charged for cooking fees, they don't even bother to answer us. This really caused a bad impression for Korea tourism. Hope no one will be the next victims like us. Don't visit the restaurant No. 4."
3,4.0,"Her türden deniz canlısının bulunabileceği ilginç bir deniz ürünleri pazarı. Fiyatlar ortalamanın üstünde, fakat görülmesi gerekli bir mekan.Interesting market with any kind of sea product. It is possible only to buy, also it is possible to have them cooked immediately there. However, prices are not so cheap!"
4,1.0,"Never ever left a negative feedback on TripAdvisor but I have to share my experience at the Noryangjin fish marketWe did ask the cooking price in detail before picking this restaurant as one of the restaurant speaks mandarin. We were told 3000 won “sitting” fee for head and 8000 won for cooking king Crab if weight more than one kg. However, we end up being charged 20000 won for each stir fry, 7000 won per kg for king crab and 8000! won each for grilled prawn, 5000 won sitting fee. When we questioned the charging, another staff (who also speaks mandarin) said all the charges are correct and apparently there are 2 types of “sitting” fees.If ordering meals at the fish market, please be cautious. Make sure you have checked the cooking fees per dish beforehand and have the fees written down so there will be no disagreement later."
5,5.0,To see maximum activity you would have to come very early.The place is really huge and the diversity of sea food species is impressive. What a photo safari!My only regret is not having dared a plate of raw fish at 7 am.
6,4.0,"Visited this market very early in the morning, and could view all the different types of fishes on display."
7,5.0,"Highly recommended tour of the “old” AND “new” fish market. Our guide “T” took us on a tour of the fish market and some of the history behind the district. He was VERY personalable and informative. “T” was able to talk and negotiate for the fresh seafood and most important, have them prepare it how you like (traditional) way. If you like seafood, this is a MUST DO when in Seoul!!!  Unlike myself, I didn’t read the whole description of what we would expect would be included when booking... included are:- tour of old and new fish market- options of seafood your group may like to try (additional cost if you want something like lobster or in our case, some abalone and scallops). - choices of preparations of food you chose- ENJOY the food that was alive just minutes ago.Our group had a blast!!! And we are hoping that this tour will gain more popularity with those traveling to Korea (Seoul Hunters)."
8,5.0,"Red tai skin on and off, abalone, cut-live baby octopus, and soup made by the tai head/bones were the dishes we ate!  Always fresh and delicious.  Barely $100 us + $40 for prep at the restaurant (including beers/soju) and meeting tang soup enough for 4 people+.We always come here when we visit seoul."
9,4.0,"I swear to god, If u are seafood lover, this place is the paradise. U can enjoy all sea living animals but the prices are quite expensive. Be aware of not wearing slippers or flip-flop there because of fishy and wet floor, better with boots. U can't ask so many questions due to difficult communication. Bargain is acceptable but not for too much. It's better to go there only if u dare to choose alive sea livings to eat otherwise it's very difficult to make decision to choose. Ahh! I almost forget to review that restaurants in old fish market are poor in hygienic..."
10,4.0,In this market you will be crazy by seeing thousands of fish and other sea animals for sellLike the way they display And prices are so cheap
11,5.0,"This place is a must do in Seoul if you like fish. No Korean required. Here’s how it works. Walk in. Walk around. See what looks good. Don’t stop at the first place that speaks English. Once you settle on something, start talking. It’s all right to point, then gawk, then walk away if you want. If you pick a live fish, they will kill it there. If you want it sashimi style, they will cut it up. Pay for the fish. Then, go with a man who appears from nowhere and takes you upstairs. Don’t ask questions. He will drop you in a restaurant. Tell them how you want the fish cooked. Sit down. Drink. Cooked fish will appear. Eat. Drink some more. Pay as you leave. Thank me later."
12,5.0,"We had a great first time experience at the new wing of the fish market. (Go at dinner time! The restaurants are open until past 10pm.)  Probably because we took our time to shop around and suss out the ""market rate"", at no point did we feel ripped off, unlike some of the reviews. Arrived at 6pm via subway. After asking about 10 vendors, we found a more honest seller (stall 13 near south gate no. 2). She quoted significantly lower prices than the rest, but did not entertain much further haggling. We bought crabs, sea urchins, prawns and octopuses from this lady, and a huge platter of sashimi from the stall next door.A boy guided us to an affiliated restaurant called Hyun Dae. There, the Mandarin speaking lady boss came out and asked us how we'd like each item to be cooked. The cooking fee for each style was clearly stated on the wall, in Korean, so we felt reassured. The seafood came out beautifully steamed, grilled and boiled. The restaurant was full of local diners, including couples on dates, and office workers having after-hours drinks. So it did not feel like a tourist trap. The star dish was something we didn't quite buy from the market stall: my friend copied what she saw on a travel show, and got the restaurant to take the empty crab shells with some roe/cream left inside, and make fried rice with them. (Pictured) Best. Fried. Rice. Ever. I think this is a dish any restaurant at the fishmarket can whip up. So do try it. The restaurant bill, which included cooking fees, booze and side dishes for 3 persons, came up to 67k won. Overall,  we had an amazing dinner,  and would totally do it again if we ever return to Seoul.Directions: To get there from the station, do not take the overhead bridge across the train tracks, as Google will recommend.  Though it works, that route will bring you through a dodgy and foul smelling car park. Instead, go via the underground tunnel. It's newish, brightly lit and smelled fine (for a fish market)."
13,2.0,"I went on a culinary adventure to Noryangjin as some of them wanted to try eating live octopus. The place was easy to find and the market is certainly an interesting place to visit. It’s amazing how much seafood is harvested and eaten by humans :) I feel like we were ripped off though. We purchased a piece of tuna from the fish display and took it to one of the restaurants on the 2nd floor. Many of us think that they might have swapped our tuna for a different piece while it was being cooked. The piece we purchased was very non uniform and the one we received looked just like a well cut piece. This concern aside, the food was ok (not amazing) and the experience won’t be the same in a 2nd visit. IMHO a place for a single visit. Be careful with people and watch your fish as it may be swapped on you too."
14,5.0,I’ve been to many fish markets around the world and I found this one very interesting and photogenic because of its gloomy atmosphere in old building. The saleswomen were nice and not many tourists around. Loved it!
15,1.0,"We bought the seafood at reasonable prices but the cooking was very expensive.  We paid just as much for the cooking as for the seafood.  It costs 8,000krw/kg to bbq...and 15,000krw to stir fry.  We stir fried some items which was measly onions and carrots...What exactly am I paying almost $20 CAD for as we provided the seafood.Complete ripoff, stay away...you can get much better value at the various markets (Namdaemun market, Dongdaemun, etc..)"
16,1.0,"Overpriced especially at the restaurants, charged close to 70k won for cooking 4mini Abalone & steaming 5shellmeat. This is excluding cost of seafood."
17,1.0,"We bought shrimps, abalones, one medium sized crab, clams, a flounder, and a live octopus for W170,000 (3 people).  After negotiating, they took down the price to W150,000 (US$150).  Took the seafood to a cafeteria type of restaurant upstairs which cooked all of the above + 3 Cass beers for W86,000 (US$80).  All the foods were steamed and grilled, but the clams were made into a soup.  All these cookings for W86,000???   The next day, we went to fancy supermarkets and found that the abalones at Galleria and Shinsegae were sold at the same price as the seafood market at W40,000/kg.  What the point of going there if the price is the same as a fancy supermarket???Oh, the shrimps were not even fresh cos it stinks really bad after cooked!Not worth coming!  A tourist-trap, avoid at any cost!!!"
18,3.0,This place was a bit interesting to find. We had to walk through a tunnel that dumped us into an older and newer fish market. We went to the older one to get a look at all of the sea creatures for sale. We were able to order items and get them cooked at restaurants near the market. It was a unique experience and I recommend going for freshly caught/cooked seafood.
19,4.0,"From the metro station, both the active parts of the old fish market and the new modern market building can be easily reached. You can buy and sometimes eat at market stalls, but also visit one of the restaurants in the new market building. This place is open (more or less) 24 hours, but most active in the early morning."
20,1.0,"We (2) bought a sashimi plate for $38. A live big clam and an small octopus for $14. Raw oysters for $5. A dude took us to a mandarin speaker waiter restaurant called Palace Dragon or Dragon Palace. Ordered one soju, stir fried the clam, cut the octopus sashimi style and bbq the oysters. IT CAME OUT FOR MAKING THOSE 3 ITEMS FOR $55!!! Hella expensive and a rip off..and they didn't even gave me a receipt!! TOTAL RIP OFF IN THE RESTAURANT!"
21,5.0,"Went at 5:00 am to see all the live seafood and ended up by picking what we liked, taking it upstairs to the various restaurants, and they cooked it up for us to have for breakfast! We had fish noodle soup, fried rice with roe, oysters in an omelet, steamed flounder, etc. It was really good and though it sounds strange to have all that fresh seafood for breakfast, I am sure you will enjoy it as much as we did!"
22,5.0,It is not far as you can take 2 stops by subway from Seoul station. It is a big fresh fish market that sells everything those can swim. After buying seafood downstairs you are guided to upstairs where there are many restaurants that help tou cook. It costs a little bit more but it is worth as the food is so great. Try king-crab and sashimi!
23,5.0,A must visit if you are a seafood lover. But take note that there are the original old fish market and the new fish market (a newer building) just next to the old one. The price at the old market is definitely much more cheaper (about half price) as compared to the new market. Order whatever seafood u like from the stall and the ahjuma will call their restaurant contact to bring you to have the seafood cook and eat at the restaurant. Walk around to compare the price but majority of them sell the same things and you can bargain abit for better pricing.
24,4.0,"It's smelly, fishy, but if you want a fresh yummy seafood then this is the place to go. It cannot get any fresher. you choose a fish that swims in a big water tank and after 20 minutes the fish you chosen is on the table for you to eat. Big, loud, usually crowded, get there early in the morning for the best deals."
25,5.0,There are many seafood vendors to choose from and restaurants upstairs to cook your food.  There are comments about this place being expensive.  Yes....you are not going to get a live king crab for $50 here.  But it still will be a bargain compared to what you pay in the US.  Also if you are spending some big cash don't be afraid to ask for some free extras for the vendors.   Overall I would highly recommend coming here at least once for the experience and to get some super fresh seafood.
26,3.0,"This place is visited by their locals as well. Take subway to Noryangjin station exit 1. Walk across the bridge and you will come to this open air space/carpark, turn right and walk for another 3 meters. You will see a stairs with some Chinese words scribbled on the wall. 2 floors down and you will see the wet market. Prices are quite competitive. We walked 1 round and decided to settle for one of the stalls with local customers. Some stalls can communicate in Mandarin. 5 pieces of scallops ₩10000, 5 Xlarge prawns ₩10000, 5 small abalone ₩10000, 1 small fish ₩20000, 1 bag clams ₩10000. Simple cooking ie: bbq, steaming, stir fried (clams), pot of soup (fish) costs ₩38000. Whole meal costs us ₩98000 for 2 pax. Price did not include rice or drinks. I would say can come for the experience like witnessing your fish being killed in front of you etc. For cheaper alternative, go for sashimi style like most of the locals. You can't get to choose which shop to cook your food as it's all designated by the stalls."
27,1.0,Be prepared for lots of accosting from the stallholders when you set into the place. The seafood is pricey and bringing it upstairs to the restaurant for sit-in meal is even more pricey. Not worthwhile to pay for the experience. We had better experience at a seafood restaurant in Myeongdong - fresh seafood and better value for $$.
28,5.0,"Highly recommend this place if you are a seafood lover! Totally spoilt for choices here and the price is reasonable! First, you choose a stall and pick your seafood ( you pay for the price of seafood) then the stall owner will ask if you have a preferred restaurant in mind, if not they will recommend. Then they will take you to the restaurant and you can choose how you would like your seafood to be cooked! Steam, bbq, sashimi etc.. and you pay for the price of how it’s being cooked. It’s such an interesting experience for us! Do drop by! And it’s 24 hours!!"
29,5.0,"This is one of the most remarkable and unique experiences of the trip. There, you truly enjoy the Korean experience. A lot of young Koreans go there for dates or just to eat and drink with friends. If you like fresh and good quality seafood this is a total must! There is a metro station in front of the market so it's easy to get there. Note that there are two markets, the old and new one. I recommend to go to the new one since it's cleaner. The main idea here is to buy seafood in the first floor and then go upstairs (2nd floor) and go to a restaurant so they can cook it. There are plenty restaurants that offer the services, in fact I believe they only do that. They charge aprox 5,000 won per person so it's mad cheap. Also, while you are buying seafood sometimes you can find the ""agents"" of the restaurants upstairs so it's easier to talk to them rather than go upstairs without someone that can help you out. We bought: 1 kg of mid size shrimp 1 kg of live large scallops, half a pound of fresh salmon (in Korea you get very good quality salmon, they fly it in every day), 2 live flounders (1.5 kg each) , 1 live seabass (approx 2kg) for a total of 138,000 won (130 dollars). We were 8 people and we were all full. Note that you will have to negotiate always. Try to buy shellfish and fish from one person so they can make a bundle deal. You can deduct btw 10-20% of the starting price. The whole experience was amazing. Way better than see temples and palaces, this was truly Korean"
30,5.0,"Since last october, they moved into a new building next door.  Now 2 levels of seafood stalls and restaurants on the 2nd floor (now majority with tables and chairs vs. Floor seating).  We had rock tai/aji sashimi, abalone, chige with the tai bones...DELICIOUS!  Of course, everything is price negotiable for the seafood so give it a try!"
31,5.0,There are hundreds of vendors selling every kind of live seafood you can imagine. Pick out what you want and they weigh it for you. You can either take it home and prepare it yourself or let them take it upstairs to the restaurant where they prepare it exactly how you want it. You can't get fresher seafood than this!
32,3.0,"Expensive but unique experience. Walked around the market and eventually picked out a large crab. Had the runner bring it to one of the restaurants upstairs where it was steamed. Might not do it again, but as a unique touristy thing to do it was worth the trip."
33,4.0,Very little haggling. Take your time to shop around at the stalls for the best deal. Stay with your purchase until it gets to the restaurant. Use google translate as the restaurant owners are limited on English.
34,5.0,"Went there with some friends, including a local. This is essential if you want to experience the thing fully. We bought fish and had it cooked (some) in a top floor restaurant. Was great."
35,1.0,Not the first time here. Did it to re-experience from 3 years ago at the old market.Bought a large lobster & crab for $200.Then the restaurant (named Hwang Jae) charged me $60 to steam them.  $60??? WTF? Never again.The lobster was over cooked and the crab was way too salty.
36,3.0,"It's a great place with lots of options. Kind of far,  if you don't have a car. However, you can find cabs riding down the highway."
37,3.0,"A huge variety of fresh seafood. Interesting to see a fresh sea worm, red clam/coral. Abalone is a much And it's really delicious. Friendly vendors with very competitive pricing. No need to really bargain but no harm asking, we had free prawns."
38,3.0,"Warning! Bad English! The market is very close to Noryangjin MRT station. Walk out of exit 1 and you will find a bridge on your left. Cross the bridge and you will find the old market, so keep walking until you see the new building. If you want to eat, go to the second floor, there are almost 20 restaurants but they seem to sell the same food. One rule that you need to know is you have to bring your own raw seafood! People buy them from the first floor and bring to the restaurants. The standard seating charge is 3,000 won for one person which include fresh vegetables and dipping sauce. They will charge you for cooking but I did not remember the rates (standard rates for most restaurants). I bought only one tray of sashimi, no raw food for cooking so they charged me 5,000 won/person instead of 3,000 won!!!They have basic menus like fish bone soup that you won't need to have your own materials. I ordered one pot of soup and it costs around 10,000-15,000 won. In total I paid 25,000 won for the soup, two bowls of rice and seating for two people. Most restaurants, guests sit on mats with shoes off just like traditional Korean style."
39,4.0,Bargain bargain and bargain! That's the rule in all markets.  No need to feel shy :)Nice seafood but always in seafood price.
40,4.0,"4 of us ordered king crab 2.3kg with the price of 115k and plate of sashimi 20k, the owner bonus 3 pices of orange shell (dont know what it is) and 4 abalone cost us 10k. The owner helps us to discount on cooking restaurant. The female king crab meat is a bit soft not good as male king crab (more expensive)."
41,2.0,"We went with my friend last April 16, 2017 around noon. I agree, the seafood's are fresh and almost all stall have the same price. The second floor was closed like some abandoned facilities (kind of scary) and trash was still inside. We tried looking for a restaurant outside the market and found one.  If you are looking for some market experience then this will be okay but if you want to eat live octopus, there are decent restaurants that offer that menu."
42,5.0,"Noryangjin fish market is the largest and most popular seafood market in Seoul. You can buy other kinds of fresh seafood that are fresher at Noryangjin Fish Market at very low prices. The most common seafood sold are clams, king crab, abalone, shrimp, sting ray, sea cucumber, octopus, halibut, giant lobsters, eel, sea bass, snappers, sea urchins, salmon, and tuna...After buying your fish or seafood someone will direct you to a nearby partner restaurant, where you can find sit-in restaurants, they will cook and then serve them as a meal to you with due the separate fee you have to pay for condiments and cooking methods. How to Get there? : Getting to Noryangjing Fish Market is easy! If taking the Seoul metro, get off on the Noryangjin station (Line 1/Blue Line). TGo up the stairs and go straight to Exit 1 (look for signs for the Fish Market) and follow signs to a stairway leading down to ground level and from there you can enter the warehouse.*Note : Pay in cash! They do not accept you pay with credit cards."
43,5.0,Great place to eat the freshest seafood!  You can eat sashimi of great quality and quantity IF you negotiate hard!
44,5.0,"Although this place have a very strong seafood smell (like a typical Singapore wet market) but it is a must visit place for seafood lover when you visit Korea. All the seafood here are very fresh and after you bought the seafood from the store, the restaurant staff will guide you to their restaurant and they will cook the seafoods for you! 🦀🦑🐙🐟🦐"
45,5.0,We went here twice during a Seoul visit. The first time we bought some large prawns and abalone which we then had cooked for us in one of the restaurants upstairs.The second time we went all out for a huge snow crab with a big plate of sashimi. It was cooked and prepared for us upstairs. We ate in many places while we were in Seoul including Michelin star food but this was the best meal of the week!Well worth a visit even if you are not planning to eat but do eat if you have time - it is a great experience. You obviously pay for the fish and you then pay for the restaurant to cook it. I am not sure how this really works out but we paid about 25.000 won for it both times (plus drinks) for the whole party.
