,title,text
122,3.0,"The moment you stepped into Noryangjin Fish Market, a flood of merchants will start speaking to you in Chinese (which luckily we knew), showing you fishes and crabs which looks absolutely delicious. This was my 2nd time here at Noryangjin. The first time, despite the expensive price, the food was cooked well and the crab was succulent. This time when I went, it was a different restaurant instead. The food tasted a little salty and the seafood does not taste good. In total, we paid for the seafood, the per head count and also depends on the type of food you ordered (e.g. soup or grilled seafood) you will be charged accordingly. We paid a total of around USD100 for 3 small octopus, one crab and one fish. The seafood there is expensive but you can try your luck at haggling price with the merchants with some aegyo. lol.Anyway, this is a place I would recommend to first timers for the experience. But to get to try a lot of varieties, you might want to bring more friends to share the food."
123,4.0,"This market has a lot variety of fresh fish. In most cases the fish is still alive. Prices are very reasonable too. Of course being that it's a fish market, there is a smell. Also don't wear flip flops, because the floors are wet. The vendors are also very nice, and willing to let you try edible raw foods before you buy it. Not many speak english, but they do a good job communicating with simple questions. There is also a small restuarant, nothing fancy, that you can take your freshly chosen seafood and have them prepare it for you to eat. you pay a small fee of $2 for seating at the restaurant. Drinks, and side dishes is an additional fee. My friends and I enjoyed live octopus here for the first time. It was amazing."
124,3.0,"It's probably a place that's great for a one off experience, or going with ppl who has never been there, but not a place I'll revisit on my own.Local culture and flavor is fully felt there as we can't see this back in Singapore where we will choose our seafood and eat in fresh immediately. Also a first interesting experience in eating a live octopus whose tentacles can still move after dead haha.Be prepared to go out of this place smelling fishy!! Prepare some perfume or deodorant before hand. I think the price here is cheaper than Japan. Sashimi salmon was good too. Their scallop is abit different from the usual Japanese type though.Overall a good one off experience!"
125,5.0,"I first got lost. When you get off the train head out off exit 1. Go straight to the bridge towards the train tracks haha.. I wemt on the other one, which is pretty cool to explore if you wamt to try vendor food.  The market is on the bottom floor. Its big. The salmon is already caught up, so if you wamt to see some action order a flounder or snapper. These old ladies are tough and nice! I was able to bargain alot :) (you are supposed to bargain). The guys are not as animated as the ladies. I did try the live octopus. Its worth it whole not cut up :) ask for the hot sauce with your sashimi!!! Cheers!"
126,5.0,So fun!  Stopped at a random stall and pointed to live fish and shellfish (we didn't know what half of them were).  We carried them to the restaurant which prepared them (raw or cooked) for us.  With Soju it was a wonderful experience.  Highly recommend!
127,4.0,"Be prepared to get your feet a little wet and stinky. Driving is not too ideal during busy times as it can take literally an hour from the front of the fish market to drive to the side into the parking lot. The last tip is very important. There are a lot of really crappy restaurants and some good ones. Don't listen to anyone that is claiming all the restaurants are packed and to go to his restaurant. If he tries to grab your purchases, be aggressive and take your items back. Otherwise you will be like us and have 200+ dollars worth of fresh fish and lobster cooked into pure rubbery crap. I really wish I got the name of the place. It's on the first floor near an alley close to the bathrooms right when you get in from the parking lot. I believe it was Chinese owned, so if you want an authentic and honest experience, check out the restaurants upstairs.Even though the restaurant was a disappointment, the fish market still merits 4 stars as I believe if we picked a better one, our experience would have been significantly better."
128,2.0,"It is OK to visit this market if you have time.  My review here is a negative one on the restaurant (Ttosune Restaurant) that cooked our food.  If you want to enjoy and have a good memory of the Fish Market, then please be careful with the choice of restaurant that cooks your food.The market is in an enclosed building. You dine in windowless and mostly, small cramped restaurants in the upper levels. No sea view (in case you are thinking of being able to dine next to the wharf).Freshness and prices of seafood are ok but the spoiler is the ridiculous cooking charges. We were a party of four. We bought our seafood and were lead to Ttosune Restaurant where we were charged US$48 for the steaming of 2 small plates of shellfish, 1 plate of 1 crab (all without any seasoning), and a plate of stir fried squid. Even the diners next to our table (who are local Koreans) were appalled at the ridiculous prices. We tried to bargain before we were led in, but were told off by the impatient unsmiling lady boss and another ‘stern’ looking man, that it's a busy Saturday night and be quick to get to our table - we felt harassed. We only knew were were ripped off big time when we compared prices with the next table of local diners. They too were appalled by the prices charged on us. This really spoilt our visit to the Fish Market."
129,5.0,"a trip to noryangjin is not complete if one does not pick a live fish and be eating it in the next 5 minutes. the experience is surreal to be eating the freshest fish imaginable. the rows and rows of seafood, both live and not is sight to see and would make an awesome photograph and memory"
130,4.0,A must visit market if you love seafoods like me! ;) It is true that it is expensive... But it is worth it! We have a burp day!
131,2.0,"I was so excited about this place and finally got to go there with my colleagues, about 8 of us including 1 children. Well, why I rated this place so low not because of the ""Seafood"". The seafood sold here were wonderful, fantastic I would say. However, the low rating goes to the ""Cooking"". Such a nice and fresh seafood all wasted because the cooking simply terrible. No taste, over cook, etc... We bought prawns, abalone, scallops, squids, salmon, tuna and yellow tail sashimi. We decided to BBQ the prawns which has not much taste. For scallops, we opted to steam it and it was terribly done. Over cook and becomes hard and dry. Squid was fried and not much taste too. Abalone was raw as we decided to have it sashimi style. It was tough and not much taste too. However, it is really a very good experience for us or anybody to explore this place. I heard most of the locals(Korean) will go to this Fish Market to purchase the fresh seafood but will bring it home to cook themselves. Which now I totally believed."
132,4.0,"The fish market is huge - stall after stall of an assortment of live seafood. Hundreds of fishmongers try to sell you anything and everything. Prices are negotiable and it helps to know exactly what you want. You can then take your purchases to the restaurants adjacent to the fish market and they will cook it up for a small fee. We bought a few conches, shrimp, plate of oysters, salmon sashimi and mackerel (Cost about 50,000 Won and fed 4 of us) and was recommended by the vendor to one of the restaurants (I assume they're affiliated) saying they would give us a good rate on the cooking. (Turned out to be about 10,000 Won) Very fresh and tasty.Two things to note: 1) The market is very fishy and I can see how some people would be put off by this2) The vendors can be quite pushy trying to get you to buy something. It was a fun and interesting experience even if you don't end up buying anything."
133,1.0,"It's just some normal wet market which has many stalls that sell the same seafood. When you pass by the stalls, the sellers will use all kinds of touting methods to persuade you to buy their seafood. We were looking at some seafood at a particular stall, in which the auntie was telling us about how fresh their prawns were. Told them that we would take a look at other stalls first. The auntie was flustered by us as we did not buy from them at first. However, we went back to patronise her stall. 25000 won for 1kg of prawns. We were led to a restaurant (I've attached a picture) upstairs for our prawns to be grilled. We were charged 50,000++ won for just grilling of prawns + 1 bottle of soju. How ridiculous. Total paid is more than 75,000 won. The prawn we ate wasn't even fresh. Totally not recommended to waste time coming here."
134,4.0,"This is my second trip to Noryangjin Fish market and this time with friends. Very authentic local seafood place and easy to find using the subway Line 1. Love the energy at the market, the freshness of the seafood and the experience of eating seafood the Korean way.Two ways of getting your seafood: 1) First kind, you know what you want to eat and you have very good bargaining skills. You should head down to the first floor where all the fishmongers will try to sell you their seafood and you need to bargain hard, be firm, know what to get and how much you are willing to pay. Then go to the second floor with your seafood and choose a restaurant where they will cook your seafood with some charges. During my first trip, we had to bargain very hard and bought a snow crab, a flounder, a big prawn and a small octopus with a free sea pineapple (sea squirt) thrown in, costing about 80,000-90,000won. Then we paid about 20,000won (I think) for the cooking charges at the restaurant.2) Second kind, you want to eat a variety of food and couldn't be bothered to bargain for each item. You should then go to the second floor and find a restaurant that suit your needs and get your food bought and cooked all at the restaurant. My second trip was with friends who just want sashimi (raw fish), so we went to a restaurant that serves sashimi and the lady boss recommended that we ordered for 2 person's portion (even though we were 3 people) which was 70,000won. With all the side dishes (which includes octopus, prawns, shells in small portions and fish stew, and sashimi of different fish, we were able to eat to our hearts content. Both experience was interesting, just that I am not much of a bargaining person, so it was less stressful the second time round. Still, it was fun and definitely well worth the trip to Noryangjin Fish market."
135,4.0,"I went here at fall season last 2010, good temperature and not to crowded inside the fish market..I came with my friend at lunch time, first I took a picture around market and see how clean the market, after visiting and tasting on the spot then I try to choose some fish for ""sashimi"" dish then some for soup and the server ask me to go upstairs waiting the food, the room is too small but hhmmmm I enjoyed the food !"
136,4.0,"Located at subway Noryangin, choose your fresh seafood and take it to the restaurants within the markets itself. Fresh seafood out of tanks taste really different from those at supermarket. Not expensive. 3 abalones for krw10,000. The seafood is brought to the restaurant, and the restaurant charges a small fee for preparing the food. 3 of us had octopus, abalone, crab, clams... The service fee for cooking all these were krw17,000."
137,4.0,"Interesting experience with many different types of fresh seafood. Do try the sashimi which was very fresh.If you are brave enough, try the live octopus which grips onto your tongue as you chew on it.Be prepared to bargain and look at different stalls before choosing as the vendors will overcharge tourists."
138,4.0,"Don't, and I really mean it, don't go to the fish market wearing your best shoes. It was an impulse visit, I was already dressed and the whole time I was there, a tiny part of me died for my Ferragamos. To be fair, the market wasn't dirty at all. I think there was a conscientious effort from vendors to spray water on the floor and clean it constantly because the place was wet. (So I wouldn;tr wear scandals or flip-flops there as well if I were to visit in summer.)Also, I visited in spring so there was no unpleasant odours. Not sure about summer though. Coming from a country where wet markets have almost all been phased out due to hygiene and 'aesthetical' concerns, it was a great experience coming to the fish market and seeing whole, live, fresh seafood instead of the those gutted, cleaned, sliced and neatly packaged ones we find in a typical supermarket. There were rows and rows of stalls, all crammed with seafood. I have never seen a greater variety of seafood in my life. My husband swore that some of the sea creatures looked as if they belonged in scenes in sci-fi movies. If you come from a land-locked country, it will be a great place to visit. And I say, please don't be put off by the appearances of the sea creatures. Though some are absolutely nasty looking, they are usually the most succulent and tastiest when simply prepared. The seafood wasn't as cheap as what I would have expected. Then again, I fully expected the vendors to jack up the prices for tourists, Maybe you would have better luck with a Korean companion. For me, I will just have to wait until my Korean is better before I can try to knock the prices down. As most vendors carry almost the same seafood, we basically just picked out a nice lady and bought a whole fish, a kilogram of prawns and some salmon. Though the fish market can be quite a tourist trap, it is certainly convenient -- you don't have to sing for your supper. The lady's companion asked us how we would like our fish and prawns done. Then he whipped out his cellphone and made a call. In 2 minutes flat, a man showed up, took our seafood and led us to one of the small hole--in-a-wall type of restaurants at the back, crammed with salarymen types all pouring drinks for each other and coaxing each other to drink. We didn't even have to carry our seafood! We had the prawns grilled and the fish done 2 ways. Sashimi and the remaining parts were cooked in a spicy broth with kimchi, mushrooms, ginger, and green vegetables. For the sashimi, you can enjoy it dipped in a combination of wasabi and soy sauce (the Japanese way I supposed) or do it this way (the Korean way?): wrapped the fish in a piece of lettuce, added sliced garlic, chili and popped the whole neat package into your mouth. I prefer the latter as the chili really gave the fish a nice kick. The grilled prawns were good with some lemon squeezed over them and dipped in chili. We brought the salmon home and cooked them a few nights later. It was really, really good!."
139,4.0,"I was like a child in a candy store. Wanted it all!!! My Korean friend helped me calm my nerves with a beer and he obliged with ordering the best of all that they had on offer. Live Prawns, Oysters, et all . . . Some experience this. I tried the fish market in Busan and found that one cleaner / better!"
140,4.0,"Certainly a place to visit whilst in Seoul just to experience the vastness of the hall.  Most vendors seem to have similar stock, and we browsed around first, before venturing upstairs to one of the busier looking restaurants for lunch.  We certainly had plenty of food with our 'sashimi set menu', however the actual fish which we ate wasn't all that appetising, and more on the chewy side.  However, that was more down to what we ordered!Definitely a place to check-out whilst in Seoul"
141,4.0,"We had a nice morning over at Noryangjin Fish Market. Quite often though people approach you and offer you their most expensive fish (lobster etc) and you can bet that they will inflate the price you pay compared to Koreans. We didn't purchase anything, just lurked about checking out what was on offer. It gets pretty wet and fishy as you can imagine so where suitable footwear. You WILL smell of fish when you leave so as long as you are aware of that you shouldn't be in for any other suprises."
142,5.0,"Let me start out by saying that I had a terrible time at the fish market. My back was killing me, and my stomach was queasy that day. Neither of these things really lead to a fantastic fish market experience. That said, the market itself was pretty amazing. There was more or less anything out of the ocean that you might possibly be ale to eat, somewhere there, and usually a selection of vendors for all but the most eclectic items. If you like octopus, this place will make you sad.  There are tens of thousands of octopus there, either alive or dead. Poor creatures. Poor tasty, tasty creatures. You can pick out your ocean creature and then take it to a nearby restaurant to have it cooked and to have the side dishes made. Whether you plan to buy fish or not, just browsing is certainly an experience. It's super super easy to find from the metro, and is worth the journey."
143,5.0,"This is the best place if you are seafood lovers.  You can pick your favourite yummy seafood first and the shop will bring you to the restaurants area, and you tell them how you want them to cook for you.  Cannot miss the fresh BIG crabs and it's so yummy and inexpensive.  Not frozen one, they are all fresh. and if you are brave enough, don't miss the octopus.... though they are cut into pieces, it's still moving.... and when you put them in your mouth, you will say 'wow... ~  ^o^  Noryangjin market is a 'must go', if you always visit Tsukiji fish market in Japan,then this will be a good choice for you. The restaurants open for dinner time."
144,4.0,"What better way to start off my time in Seoul than a trip to Noryangjin Fish Market. You just can't beat the value and freshness. It's certainly not a fancy meal out, but if you like good food like me and don't really care about the ambiance then this is the place to go. Also, its open really early which is good for when you are suffering from jet lag and can't sleep. I like going to see all of the live seafood tanks. You can find pretty much anything that swims here.My friend and I arrived and as soon as we got out of the taxi we could smell the fish so I knew we were close. After looking around a little we settled on getting king crab, abalone, sea squirt, and prawns. We haggled for a good price, then the seller bagged up our ""catch"" and escorted us upstairs to one of the restaurants where they cooked it all up for us. Its recommended to tell the cook to ""butta goey"" (butter grilled) the abalone.We also got the maeuntang (spicy fish stew). This is usually made up from the left overs if you get a fish, but you can order it even if you don't get fish. Let the soup cook for a long time and the broth becomes a fantastic masterpiece so good that it may cause you to dream about it days latter and will become one of the things you crave after leaving Korea."
