,title,text
46,5.0,"Vin Merlot, Mrs Merlot and son young Merlot travelled by subway to this market for the experience. Vin hails from a long line of fishmongers, having started at the Melbourne fish market when he was 7 years old helping Papa Merlot.The great advantage of this market is that whatever you choose to purchase you can take upstairs to be cooked for you in one of the many restaurants. We arrived about 10am which was a non busy time with many vendors and restaurants having a mid morning break but still serving.The women vendors were dressed in pink aprons. We witnessed the full range of sales techniques from friendly and helpful, to a little forward but with good humour to plain pushy and no humour!!We weren't hungary but bought half kilo of prawns to have them cooked upstairs. I am surprised by some of the TAs views that it was expensive. Half kilo of good size prawns 14000Kwon (approx $AUD  14). Cooking price with green tea for three, plus condiments 16,000 Kwon (approx $AUD 16). We thought that was fair plus restaurant staff very helpful, despite little English but they somehow twigged we were ""kangaroo"".Then went back downstairs to the old market part to return to a fishmonger who had been helpful in explaining his products in limited English. Needless to say he was delighted and probably surprised to see us but we bought a large plate of sashimi 20,000 Kwon (approx $AUD  20) and a fillet of salmon a bit more than half a kilo for 20,000 Kwon all of which 4 of us have eaten tonight.Perhaps pick your time and we're closed shoes and you will have great time. A stroll down memory lane for Vin, highly recommended and a vwobderful experience!"
47,3.0,Go with a local and let him/her do the talking. They will tell you different more expensive pricing when they realize you are a tourist. You choose what seafood you want and they will take you to a restaurant where they'll cook what you chose at the market. It is interesting for a first visit but I wouldn't go again.The floors of the market are all slippery and wet so careful with your choice of shoes.
48,5.0,It's very big fisheries market in Seoul. Very convenience to visit by subway. There are 2 buildings (Old and New) and some items are different. It's better to visit the New Building first and go to 2nd Floor to meet visit the prospected restaurant and ask the staff or chef to go with you to select the items. He/ she can recommend you what kind of menu that suitable for each one.
49,3.0,"Nice fish market to walk around and seafood is fresh. But the restaurants on the second floor is quite pricy. 3000won to get seated per person and 10,000-15000 to cook a dish. Feels like a tourist trap as it standa"
50,4.0,"Great fish market consists of two parts old and new in a modern space. Do not hesitate to choose the live fish, which will bring in a restaurant. I suggest you should try the live small octopus. Enjoy the fresh raw fish."
51,5.0,"PRICE: We went to the old fish market (right next to the new fish market) b/c that's where it seemed like most of the locals were going. The only issue is that you have to speak Korean/Chinese in order to bargain properly in that environment. The prices are very fluid and rather than decrease the price of the seafood that you want, it seems more effective to try to get more of each item given a certain price (ie. 4 octopus for 10,000W rather than 3 octopus). Despite probably being overcharged (b/c we're very obviously foreigners with our cameras and all), the pricing was decent.QUALITY: All the seafood at the market is very fresh and pretty good quality. I personally think everyone should try the live octopus and the tuna. If you go early enough and ask around, you can get them to cut out a fresh portion of the entire tuna belly for a decent price (maybe 50,000W?).RESTAURANT: We originally went to a restaurant deep in the old fish market on the first floor, but the lady was very aggressive and wanted to overcharge us (3000W per person for seating and side dishes + 20,000W to cook the food after a lot of bargaining [we didn't buy that much food, plus the lady at the entrance of the market that we spoke to told us that she wasn't going to charge us for sashimi, so we could always go back to her as a fall-back plan]), so we left. Instead we went to a restaurant on the second floor (the middle of the market) which immediately charged us 27,000W to prepare all of the food for us (no bargaining needed!). Furthermore, the second floor restaurant was a lot cleaner and had a better overall ambience, so we went with the restaurant on the second floor."
52,4.0,It was an eye opener to see such wide varieties of seafood. You can choose from over 50 stalls. Most of them can speak mandarin but not so much on English.  Of course cooking of the seafood will be additional cost. I would recommend going to the old market as it has a traditional fish market feel.
53,5.0,Noryangjin Fish market is a must go place for me. Every time I go to Korea I must bring my friend and my family to there and eat seafood. I like this place because you can choose seafood on the first floor and ask people there to cook it for you. Also there are people that they can speak Chinese so there is no problem for communicating how the seafood are being cooked. I think the price is not very expensive (middle price) and the taste of the seafood is very fresh. Until now I can still remember the taste of those seafood which make me want to go visit in the near future.At last I would like to recommend you check carefully for the location because it is quite hard to find that place if you are not well prepared.
54,4.0,"A seafood paradise and not a place to meet if you are a seafood lover. Everything from Alaskan king crabs, prawns, scallops, etc are either alive or super fresh. A must visit!!"
55,4.0,"Went there 2 years before at the old market which was pretty dark and wet. Heard that a new market was opened in April and we decided to give it a try again.The new building was bright and spacious but most of the vendors there were Chinese which was good for us because we came from Hong Kong. After a good bargaining on seafood, we went upstairs and entered a restaurant that had most customers. We had King crab, abalone, sushi and octopus/fish soup. Everything was very tasteful and the price was far too good compared with Hong Kong."
56,4.0,"The market is full of all kind of seafood such as crabs; huge crabs, flounders, other fish, octopus....It is a huge market.  You can  buy fish,  or any kind of seafood and have them cook upstairs in any restaurant for a certain price.It is a little expensive I think and even to have it cook.It is one time experience..."
57,3.0,"There was an old and a new fish market. Went to both and opted to buy seafood at the old one. We just followed our guts and purchase our fresh seafood. After that, we were led to a restaurant and they prepared the food. It was a good experience especially with the live octopus (sanakji)."
58,4.0,"I came here once before the new wing is built. After reading the reviews from Trip advisor about the new wing, we decide to explore this. The new wing is further up the old wing of the market. Once you walk through the old market, you will see a new painted building( 2 storey tall). When we are there, not all the stalls are occupied. I guessed some of the old wing stalls have not moved to the nee wing of the seafood market. We decided to follow the Local Korean crowd. Though it was a Sunday afternoon, many locals are here to buy their seafood. We walked towards where most of them are congregated and start checking out the live seafood. There are no pricing listed on the seafood tank. So the best way is to dish out your calculator and start asking The price and punching the numbers. For those whom are new to this manner of ordering. Please note. 1. Order your fresh seafood from the stall at level 1/ basement. 2. If you want to have it cook and eat on the spot, the restaurants are on the second floor. The pricing for cooking is another additional cost. Some of it does by the weight. You may ask them to lower the cost of the dish is simple to cook. Example. We order the abalone and wanted it cook as porridge. The abalone is the cost we paid to the live seafood stall by kg. We also have to pay the Restuarant for the cooking cost - it comes out to 5000won per kg. 3. Other miscellaneous cost are the towels, small dishes and drink. There will be a runner that will bring you and your seafood to the Restuarant designated. I love my seafood steam, boiled and grilled. So I didn't make it complicated. As the runner is from China, we spoke in Mandarin and he gave the precise ways  on how our seafood are cooked. We ordered the crab, large cockles and abalones We have very enjoyable meal there as our Neighbour diner whom are Korean were sharing their sashimi with us and trying to communicate with us in his  simple English. I recommend only those who love seafood to visit this place. Just not be frustrated but do some simple calculation before you confirm your order in bulk."
59,2.0,"The fish market is pretty huge, with all of the stalls selling close to the same items. It is difficult to decide who to purchase from so make sure you take your time surveying before deciding. We made the mistake of not doing that and just buying from a random ahjumma. She had promised to sell us an octopus + a slab of salmon for 24,000w but however after catching the octopus, she changed it to 29,000w. We refused but she just got angry and shoved the octopus at us then proceeded to tell us to pay and leave. While my friend and I were discussing on what to do, she rudely told us to speak in mandarin (she could speak in korean and mandarin). The both of us decided to go with it because we didn't want to create a scene. So then this other ahjumma brought us to her restaurant in the 2nd floor. All she did was to provide us some cutleries, sauces, kimchi and cut our octopus for us. We were charged 10,000w for that. Definitely the most unpleasant dining experience we had in Korea. However the salmon and octopus were really fresh so that is worth noting. If you visit, be careful!!"
60,5.0,"Tons of stalls with all kinds of fish.  A good portion of the fish and shellfish are alive in tanks...Clams, anilines, snapper, flounder, tilapia, octipus, crab, lobster, eel to name some.  Huge prawns. You can buy it and get it cooked upstairs.  We don't speak Korean so this may be easier said than done.  But if you want fresh seafood...this is the place to go!!!"
61,5.0,"Fresh seafood at reasonable price . We picked our sole fish, shells, octopus, and fresh abalone (!) And then we eat them at a restaurant upstairs. The sole fish wqs eaten raw like sashimi. The rest were put into a hot boiling soup. WOW.  Everything tastes really good but it was really The abalone that absolutely made an impression ."
62,3.0,"Went to Noryangjin Fish market for lunch. My first impression was there are a lot of stalls selling the same stuff and can get pushy at times. Had a problem deciding which to go for to choose the seafood to eat. Anyway after randomly selecting a seller she got what we wanted, a king crab, scallops and prawns for the 2 of us. After weighing price was 68000 krw. Brought us up a floor to the restaurant to cook and after we agreed in the style of cooking we waited patiently for the food. Very simple style, steamed and bbq, plus a fried rice at the end with what's left of the king crab. Damage was another 48000 which we though was high given the little work and ingredients added. Ok, the crab was very good, fresh and sweet so at the end of the day, it was worth it. Would I go again...Yes for the king crab."
63,2.0,Old and dirty fish market. Was in 10 minutes ready. Hard sell market place owners. Not particularly worth the visit. The signs to the market was odd. You have to take the higher bridge to get there. During the afternoon most of the stalls were closed.
64,3.0,"It's a cool experience to walk around and choose fresh seafood, but all the sellers are quite aggressive and come up very close to try and get you to buy their stock. to the point where we were too scared to stop and actually look at anything closely because they were so pushy. There are two parts, one in the older more traditional fish market type and the other side is newer and looks slightly cleaner. I went with a local friend, and even she wasn't so happy with the experience. I don't know what I would have done without a local, but somehow we managed to order something and ate at the restaurant side, which is a bit of a walk away."
65,4.0,"Was there in early June 16 and they're expanding to a large more modern building next door but activity at the original is still very much there.  Group of three and wandered for a while and settled on the live octopus with large sashimi platter from a vendor.  The octopus was wrapped in a bag with sea water and we were escorted to a small restaurant where the octopus was chopped up and the huge sashimi platter was delivered.  Not cheap but not really expensive.  From our picked vendor had choices of 30-40-50,000 won sashimi platters and we took the most expensive because we were givin a bonus plate with more fish and sea creatures.  All said and done about 60,000 won (~$50 USD) for an incredible amount of fresh fish.  Finished it all, luckily my korean friend is a competitive eater :)"
66,3.0,"There is a new building new to the market, some of the staffs said they are about to move-in but still under some touch-up. We have been searching in the old market for 30mins, bargain is only for one lost cost fish but not like big crab and lobster. You may be able to spend the same money if you are dinning in a proper restaurant or even hotel."
67,3.0,"The market is now in its third location over the years -- this latest iteration is new, spacious, sanitary, and (until Noryangjin Station finishes its renovations) a bit hard-to-find.    Some sidewalk stickers guided us the roundabout route.  The old decrepit buildings are apparent nearby.  The new version is a bit sanitized--not much worry about getting dirty at all.  When we went, Thursday lunchtime, it seemed rather empty.  But the variety and freshness of seafood is apparent, really a good place for a seafood lover.  Lots of restaurants upstairs will cook your fish to taste; in a slow period (as with us), they may even take pity on a clueless foreigner and walk down with you to the stalls and help you order your king crab and octopus and anything else.  The crab was expensive but stunning (YOLO).  The raw octopus is indeed weird but palatable--literally sticks to the roof of your mouth!   Note: if anybody in the group does not like seafood or the sight of fish being gutted, go somewhere else that day.  Note also that there's not much English spoken, but they are very friendly and helpful.  I wish the government would spend some effort on tourism support there."
68,4.0,"An amazing collection of seafood stalls under one roof. Fresh fish and shellfish as well as iced. The procedure is this:1) bring friends if you are eating at the market2) find a local person to help you. Most Koreans will be more than happy to assist you3) decide on fresh or iced. Iced fish is great for soup or barbecue and much cheaper than fresh. 4) order about 1kg per person for shellfish for soup. Remember, your eyes are bigger than your stomach. 5) negotiate and make the purchase. Take the fish to the second floor of the new building next door. The table fees are about 3000 and the cooking charge about 10000-20000 depending on how much fish and whether it's soup of just steaming."
69,3.0,"Went there for the first time , heard good reviews from friends . There's many stores selling seafood. To Ensure your seafood is fresh , do only order the live seafood and those seasonal seafood which the prices are cheaper .Do not order those frozen prawns , clams , as these aren't fresh at all , and we didn't finish those seafood , very disappointing . Do bargain hard too , and ask many stores for prices quotation first before deciding . For the cooking , we had to pay 3000 won for the table service . On top of this , we order fish , abalone , prawn , all these individually dishes are charged separately . There's more charges depending on the type of seafood . The crab is in season now , do order the crab . Is this a must visit ? Compared to the Tokyo fish market , I still prefer the Tokyo fish market which is more authentic. This market is filled with many Chinese stalls and prices quoted for some stalls are extortion."
70,4.0,"An interesting place. In the process of moving into a new building that is a little more clean and hygienic looking, but take time to walk through the old market. A little Squeamish for those not used to, or willing to accept that this is about providing food and not a home fish tank for gold fish!Some fish were upside down and not swimming any more, but the overall feeling is that things are fresh as they are alive. Great topic for discussion with children about the food chain, and the spider crabs trying to escape.One of those places where you come away not really knowing how to feel, but also gives some insights into how people live and work in this environment and the surrounding street stalls of vegetables and more fish, but dried this time. A good hour spent."
71,4.0,"Noryangin is one of the Korea's largest seafood market.We can buy various fresh seafood in the first floor. We can ask the seller to slice the fish for eating as a sashimi.At that time, we only bought the fish and went to the restaurant on the 2nd floor. We requested the restaurant to make fish stew for us and we need to pay 19,000 won for 3 person. It's quite pricey😓, but it's tasted good"
72,3.0,"Was an ok experience, but would not come back again. Would have been better if we knew someone Korean to show us around and help haggle lol. Kind of knew we were being overpriced since we were tourists. Being Vietnamese, we were automatically thought of as Chinese tourists, and by the reactions of the people around us, I guess we were given a different (poorer) service at the restaurant after buying our fish."
73,5.0,"Came here w/korean friends, sought out a fish that we liked, got that fish executed and turned into sashimi quite fast right in front of our eyes and went upstairs to eat it like the locals do. Cool atmosphere, plenty to see and eat. I recommend tagging along with someone who speaks korean.. or at least learn how to speak ""shopping""korean before you visit."
74,4.0,"My friend and I really love seafood so, we wanted to visit the fish market and have fresh seafood.  The market is quite easy to get to.  Just take subway Line 9 to Norayngjin station, walk up to the exit and to the overpass.  I actually could smell grilled fish from there.  From the overpass, there was a sign that point to the right and to fish market.  Once across, turn left and go down the stair.  On the second floor balcony, you can see all the market areas with stalls full of seafood.Down stair, we browsed around to see what they had to offer.  The variety of the seafood was incredible.  There were so many things that we had never seen before or didn't realize that they were edible.There was only two of us so, we couldn't have many dishes.  We settled with fresh oyster, assorted fish sashimi and grilled fish.  We bought oyster and sashimi from one stall and fresh whole fish from another stall.  Then, the stall owner had his staff took us to a restaurant (more like a cooking tent) along the side of the market.  There, they prepared food for us and we ate there.  We paid them for the service and beverage.  The seafood was really fresh and delicious.  Try having sashimi and oyster with Korean chilli sauce.  It was delicious!"
75,5.0,"I was really impressed by the range and variety of seafood at the wholesale market. They're not only fresh but also cheap too. However the downside is that the restaurants actually charge quite an amount of fee to cook your seafood selections. A must-try would be sea urchins and abalone, which tasted really, really sweet and fresh!The wholesale market is located within a walking distance from Noryangjin station."
76,4.0,"Huge market, fresh products (but not everything). We can find lots of differents seafood, you can buy and ask them to cook for you but the service charge is not cheap. Have to try once if you visit Seoul."
77,4.0,"Second time visiting this place, amazed one more time. The prices of this place are not cheap (maybe because we are foreigners they over priced) but the quality of the food is good and you are totally sure is fresh. Hundreds of shops to choose from shrimps until puffer fish (yes!puffer fish and they have specialized chef to cook it). The must is the octopus sashimi (live octopus... well choped octopus that still moving). No need to visit early morning, all the fish are alive so anytime you go the product will be fresh. Amazing place to live the experience and enjoy a tasty lunch."
78,3.0,Lots of stalls selling mostly the same food. Jus choose which ever stall u like. Food is fresh but quite expensive.
79,4.0,"Noryangin in Seoul is well-known for three reasons first the fish market, then the institute, and last the street food. People here are divided into 2 categories.First, there people are visit the fish market. They eat or buy fresh seafood from the fish market. The fish market is a very big in Noryangin.The other people are the students. They are people from all over the country who come to Noryangin to study. There are many famous educational institutes in Noryangin. Their purpose for coming to Noryangin is to go to college and start their careers. People in Noryangin have little money. So many street food shops was born. Their food is delicious and cheap."
80,5.0,"This place is a blast to visit. Your dinner will be alive one minute, and on your plate (possibly still wriggling) the next. After negotiating the price of your fresh catch, head to one of the packed dungeon-like dining areas where the fish will be prepared for you. Best enjoyed alongside cold beer and sake with friends. Sashimi a must."
81,5.0,"If you're into seafood, this is a place to see. They have all types seafood. If you are going to buy anything its best if you know a little Korean."
82,2.0,"It was very interesting to tour the market, to see a huge variety of live sea foods.However, please just enjoy the tour but DO NOT buy the seafood NOR eat at a restaurant upstairs. They just wanted to rip off tourists, and overcharged a lot.Please be warned."
83,5.0,"It was my 1st visit to this famous market and it was absolutely worth it! The smells, the mindboggling number of stalls selling practically the same stuff. You just need to pick a stall, pick your seafood & bargain for what it's worth. Then someone will lead the way to a restaurant on the 2nd level where they will cook the chosen seafood anyway u want. Need to pay the restaurant service charges for the cooking & the side dishes, each person will be about S$5-$8. We chose live octopus, salmon sashimi, abalones (small, sold in set of 3 for KRW10,000) long legged crab & a plate of oysters, all for KRW50,000....a real steal!"
84,4.0,"Wander around the fish stalls and make your selection from an amazing array of choices. Then head up one floor and hand it over to any of the restaurants on that level. They will seat you, offer you side dishes and beverages and prepare your food for you. We had salmon sushi and steamed crab. We will add this place to our favorites in Seoul."
85,4.0,"Came here around 3am and there were crowds of people from local businesses participating in the daily seafood auctions. Although I didn't speak their language, I thought this was fascinating especially watching the octopus trying to escape their tanks or picking up the seafood for a candid shot. The fish market is housed inside this large warehouse like building with several stands aligned next to each other. The key is to bargain and make sure you ask around at a couple stands before making a purchase. I eventually bought 2 large crabs, and 10 shrimps for around $30 USD which is equivalent to ~40000 WON. When I asked the host at my hostel, he claims it was a bargain so I'll take his word for it. Once I made the purchase, they have kitchens within the compound that would help you cook your seafood to your preference for additional fees of course. I opted for steamed crab and shrimp for I love the nature sweetness from these fresh cooked crustaceans. Another thing to keep in mind, DO NOT WEAR flip flops or TOMs if you don't want your feet smelling like fish water."
