,title,text
84,4.0,I wasn't too excited about visiting this museum since I thought it was for kids. Well guess what?! My sister and I ended up having too much fun and stayed way longer than we expected. It was a bit crowded in the afternoon so we had to often wait for our turn to take pictures. Prepare to be silly and take funny pictures! This museum is so much fun that I want to go again. :)
85,4.0,"Our 7 year old had a great time posing for all the photos, and it was larger than I expected.  There is a bit of nudity in a few of the displays, but nothing obscene."
86,4.0,The paint and artwork is so well made. You can take the funniest pictures there. Really awesome 3D attraction. We had a blast. A fun place to visit!
87,3.0,"If you have some spare time and you are roaming around Hongae around, it is a good place to visit. Typical place that you will take lots of photos."
88,5.0,"Trickeye museum is some distance from Hongik University station.  It is at the basement of a building with the love museum which is not accessible to children.   Some of the paintings at Trickeye are faded due to people touching or leaning against them.  There is no clear sign on the floor to show the photographer where to stand to take the photos.  However,  there were photos on the wall so that we could figure how we should take the photos.   There is no reentry after you exit the museum.  However you should visit the Ice museum which is part of the ticket for Trickeye museum.  Make sure you are warmly clad.  Even with our winter clothing,  it was cold.  Not a big museum but nice to see an ice living room,  kitchen and toilet,  all carved from ice."
89,3.0,Have visited other similar places before. I would say this is not the most impressive one .  The place is also quite old.
90,5.0,Great combination of visual trickery. Easy to find and cheap. At this time of the year it was empty. Told that in high season it is very popular and busy. The ice area is also quite good
91,4.0,"The Trickeye Museum and Ice museum are in the same building, and the admission tickets include both places. The place isn't big but packed with people when we're there.You can really do some cool photo/illusion pictures. We had fun."
92,5.0,"Definitely a great place not to be missed if you are travelling with family with children.  Just need to let your hair down and have fun taking all the fun shots with family members. We had lots of laughter together throughout the tour. Entrance ticket was 15k₩ for adult and 12k₩ for 3 to18years old, which has access to both Trick eye and Ice museum. The ice museum comes with a slide that is a small thrill for both child and adult. The room is -8°, so definitely can't stay inside for too long. As we are with our children, we did not go for the Adult museum, which requires separate entrance ticket. A must try if you are planning a visit to Hongdae."
93,4.0,เป็นพิพิธภัณฑ์ ที่ไม่ใหญ่โตมากนัก แต่มีภาพ 3 มิติ ที่เกิดจากความคิดสร้างสรรค์ แล้วบรรจงวาดหรือขีดเขียน จนเกิดศิลปะที่สวยงาม เหมาะในการถ่ายภาพเก็บไว้อวดกันThis museum is not a big one but has many 3D painting that created with good ideas suitable for photograph.
94,3.0,I came here on my first visit to seoul in 2014. It was my first experience in a trick-eye museum. Lots of funny things to do inside especially for creative people. There's also an ice museum if I remembered correctly. It was really cold inside. An activity that you might want to consider when you are at the Hongdae area.
95,4.0,Not easy to find it since it doesn't seem like a museum at all from the outside . It's inside a regular apartment building. Got some cool shots though :)
96,4.0,"Our first trip to Trickeye Museum. We went there early and there was no crowd. Hence, we do not need to wait for our turns to take pictures. The place is rather small and we finished within an hour. The cleaner lady was so friendly and she even helped us take family shot."
97,5.0,"Spent an afternoon here and fun with the kids.  If you enjoy taking pictures you will enjoy this place.  Its fun, creative and sometime even challenging as you try to get your position just right."
98,4.0,"Good fun taking pictures! It was just crowded when we initially got there about 10:30-11 in the morning, since 2 tour buses arrived at the same time. It was hard to take pictures and it was warm with all the people. Admission was 15,000KRW and you could go in the Trickeye, ice and carnival museum. Their ice and carnival museum were small, but still fun. You had to pay extra to play the games in the carnival museum. As we were done going to the ice museum, we noticed that there were way less people. So maybe it's better to go around lunch time to early afternoon. They also have lockers available for 50KRW, it's very helpful since you only need a camera and you don't need to keep putting your things on the side when taking pictures."
99,4.0,"Trick Eyes is a place that you can take your picture with 3d effect on it. It's very famous, and have lot of branches in Asia cities.The place is kind of small, but it's very fun. We have lot of laugh when taking a picture and especially after looking at the result. They have a good explanatory with pictures in how you supposed to take the picture.In admission ticket, they also include admission to Ice Museum.Direction to this attraction : stop at Hongik University station (line 2, exit 9) > go straight 150m, cross the road, and turn left onto Hongik-ro Street > go straight 120m, and turn right down the second side street (in between TONYMOLY and Holika Holika) > continue going 100m to arrive at Trickeye Museum on the right.Instagram : @adjimantoro"
100,4.0,Great fun to take silly photos.  My kids loved posing and cropping and pasting to Social feed - always get lots of likes.
101,5.0,Trickeye Museum was a fun place for us to visit and take pictures. There was quite a lot of optical illusions and other picture backgrounds for us to appropriately pose and get photographed. Recommended.
102,4.0,"Conveniently located museum, reasonably priced. Try to go early in the day, as it may get crowded later on. Many interesting exhibits and do take as many photos as possible. Can combine a ticket with the Ice museum which is located within the same premises"
103,5.0,"This was an amazing trip with a family with kids 2yrs, 9trs and a teenager and grandma.Amazing tricky way to have a unforgettable pictures."
104,3.0,"I am sure when this place opened it was great, but it seems pretty run down. It was dirty, sticky, and there were pieces of the maze that were broken or missing. I felt like I needed a shower after I left. The kids enjoyed it of course. Just bring hand sanitizer!"
105,5.0,u will love it their are 3 museums together trickeye/ love / frozenu will like all of them please bring a camera for trieye + take many pictures.
106,1.0,Tourist trap and way over priced! My 13 and 15 year old went to it and they said some of the things are inappropriate.  Might be more suited for adults.
107,3.0,"It's a fun place to make use of yr camera ^^ if you hv free time & tired of shopping, then this can be a place for u. They hv 3 museums in 1 place ""Trick eye, Ice & Love museums"" (only love museum, u must be 18 above). I hv been to a few similar museums, this (is not) one of the best to said highly recommend to everyone but it wasn't that bad either. Two big issues i find really annoying are 1. not all scene comes with ""standing spot for you to take a proper shot"" 2. A few scenes are too close to each other, meaning u hv to crop a few thing out. Anyway like i said the overall isn't that bad, i would still recommend if u comes with young kids but don't put yr expectation too high. ^^"
108,5.0,"the museum is hidden in a busy shopping street. Sometime you may pass by without seeing it. I have a good time there. Beware that lots of children in this attraction so try to avoid the peak hour during the afternoon if you would like some quiet time. Beside, i recommend that you go there a later time of the day may be one or two hour before the closing time. That way, you may have a better surrounding for your photo. One last tips, try to get the ticket online to avoid the line. I booked from TravoAsia, u may download the app or go to their web site. they have discount tickets for many attraction, but they also update quiet often on the discount, Good luck and have fun."
109,3.0,The museum is located in a very moderate location with no parking facilities and without wheel chair access. It is not a proper tourist facility
110,5.0,"Love, love this place! The illusion tend to make you giggle as you see their effect in your pictures. Recommended, especially if you have great amount of time to kill!"
111,3.0,"When we visited the museum, my son was still sleeping in his stroller thus my husband did not enter the museum as advised by our tour guide it is not stroller friendly. There is one mirror maze which stroller could not enter in the museum."
112,5.0,"This place was seriously hilarious... I went with my parents and two sisters and my jaws were aching from laughing so much. The entrance fee was 15,000 won and it took us about 2 hours or so to see the whole place. It was lucky we went early because when we came out there were crowds (of mainly students and young kids). The ice museum was ridicously FREEZING!! It was minus 11!! We literally ran round the place and took as many pictures as we could possibly manage, went down the ice slide and was out as quick as a flash. For those (like me) who use DSLR cameras or even those with compact cameras, be aware of the fogging on your lenses when going into or out of the ice museum.There was so much variety of imaginative paintings, sculptures and other exhibits that were amazing and looked great on the photos and videos. There were lockers at the entrance of the museum that costs 500 won, which was a blessing because we carried a few bags.We kind of got lost trying to find this place and when we eventually finished at the musuem and were on the way back to the subway station, we realised we took the longest detour ever. So here's the easy way to get to the museum from the subway...From Hongik University Station, take exit number 9... walk straight until you get to a big road, with McDonald's on one side and Forever 21 opposite, turn left into that road. Take the first right (next to theTony moly shop) where there's a street of shops and keep walking straight, the moment you see a colourful statue of a man in a carriage, then trickeye museum is on the right hand side."
113,5.0,"TICKETS/PRICING: 15000 for adults (18+), kids are lower.The ticket includes both the Trickeye and Ice Museums.TRICKEYE: I honestly expected only a few photo ops here and there, BUT MAN, THERE WAS A LOT OF EXHIBITS! I don't want to spoil anything, so I'll keep it simple- there are lots of sculptures and paintings that are amazing, hilarious, and gorgeous. There are a few inappropriate ones, so take caution when bringing kids! When I went, there were waves of Chinese tourists coming in, so I had to wait to take a picture for some of the spots (just beware if you're going in the summer). Spent about 2 hours.ICE MUSEUM: You're given a blanket-poncho before going in because this place is super cold; negative degrees Celsius. It's a small exhibit, which is okay because my family just wanted to snap a picture and get the heck out of there! If you can't handle the cold, this isn't for you! I had some fun as there was a mini icehouse and a slide. Overall, quick but fun experience.OTHER: Before entering the actual museums, there are lockers (500KRW), restrooms with multiple stalls, a bubble tea shop, a dining area, game room (like a mini carnival), caricatures (15000-25000), and hanbok dressing (20000 for renting the dress and using the background settings for photos, 5000 for hair, 15000 for makeup). Personally, I enjoyed wearing the hanbok and taking pictures!- just another touristy thing to do! My sister got the caricatures and didn't like it because it didn't resemble her, so that was a downside. Overall, my family had a great time taking pictures with these amazing optical illusions! Afterwards, you can visit the Love Museum (adults only) or go shopping right around the corner!"
114,5.0,"Good for family , solo, group travellers. Fee applies for entry into the museum and the ticket is used also for entry to the adjacent ice museum. Trick eye museum has the spots earmarked from where the photographs are to be taken to get the tricked photos. Ice museum temperatures are near to -7 deg C. Those who have  allergy to severe cold are not advised to go in there."
115,4.0,"Take your camera and get ready to have fun. This museum was fun and had quite a bit of variety for all to include an ice exhibit. The ice exhibit was extremely cold and would have been better if they had coats or at least a warning, but it was part of the fun. It wasn't too large, so we weren't cold for very long. The remainder of the museum was fun and I recommend it."
116,5.0,"My sisters and I had fun taking pictures and laughing at the same time. This museum is very creative and well thought of. I hope that they 'll create more illusions in the future :)The staff were very helpful, friendly and accommodating. Because I enjoyed this attraction/ museum, I plan to visit the other branches as well :)"
117,3.0,"It was a fun and unique experience I guess. Wife wife and daughter enjoyed it.  There are many different places to pose, take photos, etc.  There is a little mirror maze to exit.  Don't forget to check out the Ice Museum.  It was different. Ice cold sculptures and a little slide just for kicks LOL.  The girls had fun so I had fun as well."
118,4.0,The kids loved Trickeye museum and taking all the photos. Ice sculptures on the same floor was nice too.
119,3.0,Go early. We went an hour before closing time and we were not able to see the carnival museum. Fun for everyone especially kids. 3D paintings are average; its really up to your drama skills to make the paintings alive and more interesting.
120,4.0,I liked the idea of the museum it was funny tricky and we enjoyed our time but we faced little difficulty to know how to take the right photo if there is a guide or better instructions will be easier
121,4.0,This was a fun diversion! I had never been to a museum like this before but we had a ton of fun taking photos and admiring the clever 3D optical illusions!
122,4.0,Lots of trickeye photo spots.  A good hour or 2 of photo taking.  Hardest part was probably locating the building.  Its within the alleys of Hongdae.
123,5.0,I loved every bit of this museum. It was so funny and our pictures turned out to be extremely hilarious. They have so many funny 3D images inside and you can get yourself clicked at every step. Don't go there alone as you would need a companion to get yourself clicked. There was an ice museum also which was perfect to go and have a look at. It was quite cold inside so we were simply in a hurry to click the photographs and come out soon. But it was definitely worth a visit. It took us about 3 hours to cover the entire museum. I would highly recommend this museum if you are seeking for some super fun in korea. I already have such lovely and funny memories captured with me. Go have fun guys. Good luck!!! :)
124,5.0,This museum was a fun surprise. It was included in our combo ticket and we thought we would give it a try at the conclusion of the Seoul Tower (since it is located at the base of the tower). Photography is encouraged and visitors become part of the artwork. Allow 45 minutes to visit both exhibit halls.
125,4.0,Very good for all sort of age. U can have fun by taking photo that look so real. Kid definitely love this place with so much activities and fun.
126,4.0,This is a great place to visit though a bit difficult to find. plenty of photo opportunities that made you worth your while coming here.
127,3.0,"It is a trickeye museum cum ice museum. Many photo opportunities.  Quite alot of tourists.  Discount vouchers are only valid for adults, not valid for children.  The museum is not very big, we exit within 1 hour.  We find the price more expensive than Alive museum."
128,4.0,"Took the kids here after walking around all day. Got there about an hour before closing. It is not the most obvious of locations and needed to use GPS to find the building. The building is set back in a section of streets filled with cafes and bars. But it's seoul, so we felt comfortable walking around in there late at night. Once in, go to the basement floor. The fee is a bit steep and you really need to work with the comers angles to make the pictures look like its intended to."
129,1.0,"The ""museum"" is 3D selfies backdrops with a 15000 won entry fee for it and the ""Ice sculpture museum"".  Not the kind of business model that would work outside of Asia, I think.... but twenty-somethings here love it."
130,3.0,Trick Eye is a good place to kill an hour or so.  The smallish space is packed with optical illusion backgrounds.  We had lots of fun posing with these and took heaps of photos.  We also visited ice world (same building and part of the price) which was very good.  We visited Trick Eye on a cold winters night.  The street shopping in the area are awesome but it was a welcome relief to be indoors.
131,3.0,"The museum consists of many backdrops where visitors can pose and in photographs it will look like they are floating on a magic carpet or in the mouth of a giant fish.  The kids (ages 8 and 11) thought it was hilarious, but it was sort of expensive."
132,4.0,If you like to take photos & post in social media then this is the place to be!!! It's a different kind of experience.
133,4.0,"I am surprise to see this museum is quite small if compare to Singapore's, One very significant different is there is an adult trick eye museum beside it, only for 18+, other than that I would prefer Singapore's one, there are bigger and more.However children will love this. Inside there are still a lot of funs.Outside the trick eye museum is a shopping street, lots of thing on sales."
134,5.0,"You will be surprise how creative you can be to have your photo taken... this doesn't apply to kids but also to granny! I can see almost every visitors will try their very best to pose for their picture to be taken... and most of the expressions are really creative!.Ice Museum is about -10deg inside and there is a slide made of ice where the kids will not get tired nor they will feel cold as they run up again to slide down... excitement and running up the ice-stairs keep them warm :)Nonetheless, do note that they do not allow re-entry for both Trickeye and Ice Museum."
135,5.0,The package comes with ice museum too.  Print out discount coupon that offer to the foreigners. Hongik university street is just nearby too
136,4.0,It was interesting and fun place to spend time with children and young couple. Essentially it is a 3-D templates that was designed such that you can use your imagination to create interesting photos. You need a creative mind to see all the angles and how it will turn out on photographs. Few samples were given but the challenge is for you to find new angles and ideas. Overall the place provides a lot of fun times with your camera and hand-phones. It is also I think better to go as group as certain props require more than 2 person to pose.
137,2.0,"Many recommended this place but I found it fairly childish.Some of the tricks are a little funny, but most are either silly , or rude, or simply boring.I ended up walking through the place fairly quickly.Not recommended."
138,4.0,A good place to experiment with your photography and test your creativity.  One has to invest a few minutes in order to compose a shot that will look so real when viewed on the screen.
139,5.0,"Just a joyful place with lots of to try. Don't forget to bring your camera with you. It could be adviceable to prepare for a cold...very cold experience, too...if one likes to do a visit."
140,4.0,"Great place to kill a few hours in a trendy college neighborhood. Take your camera and have some fun with the backgrounds and props. When you've had enough inside, stroll through the neighborhood shops and look for trendy, inexpensive items or duck into one of the many cafes and restaurants for a delicious meal."
141,5.0,Something fun to do and take pictures. They have amazing artwork ❤ make sure to take your time to look around. They also have an Ice museum make sure you wear warm clothes as it is very cold.
142,5.0,"This is a museum which is easy to find (located in Hongdae) and you can spend hours inside it.Apart from Trickeye, you can also visit the Love Museum (B1, just above Trickeye which is at B2) - but this is for adults only as it is a sexual theme museum."
143,5.0,Go as group of 3 or more as many things you meed the third person to shoot camera for the other two. One of the nice places in seoul one of the must to be seen.
144,5.0,"I LOVEDDddddd this museum. I took so many cool photos, got creative and laughed a lot. Got tired too of taking so many photos. There are two things you have to remember though: make sure you take a map when finding the place since its location is kinda hard to find specially if you don't speak Korean. Also, make sure to go there during the week. I heard weekends are crowded and you will have a hard time taking photos since it is a small museum anyway. But it worths the money. Definitely recommend it. They gave us coupons for restaurants near there too!"
145,5.0,It's way more fun when you don't need to wait a long time for each picture. It's a very fun place if you're willing to be silly.
146,3.0,"This is small museum, if you have 15000₩ just laying around somewhere and 5 minutes to spare this is the place to be. Not very much interesting stuff."
147,4.0,"Didn't realize taking pics could be so much fun til I visited this place. Saw some pics like these before but thought they were photoshopped. Turned out they only tricked my eyes. However, the distance between each pic is so narrow plus the crowd made it so challenging to get a good pic. Nonetheless, it was worth visiting. 1 hour is not enough so better prepare your batteries."
148,3.0,"Fun for kids, not worth $13 for adults. Make one take them in for an hour while other adults get a break in the cool college area."
149,5.0,"Great getaway in Seoul. It's hidden away and in the basement, but what a fun we had. Two kids 9 and 10. Bring your camera. You'll have plenty pics afterwards to use for invitations or postcards back home."
150,5.0,"the museum featuring 2-D and 3-D illustrations create opportunities for visitors to take a photo their companions in wacky situations. With that, 2-D paintings on the museum walls, floors and ceilings appear to pop out of the surface and come to life. Step inside the paintings to complete a visual narrative with your creative poses. At Trick Eye Museum, you’ll be creating unforgettable memories with friends and family amid fun and laughter."
151,5.0,"We were there with friends probably for 2-3 hours, very funny when taking photos out there. The museum were very crowed all the time. However we had a great great time together. P.s. After long photo trip in Trick eyes, there is a korean grill buffet nearby. That's my favourite!Tips :- Go at least 4-5 people, absolutely fun.- Do not shy to help people taking photo and ask them in return because they may wait for you to help."
152,4.0,Fun photo taking place.. but can be crowded.We took a taxi there but couldn't find the location initially.
153,3.0,"We visited the museum on a monsoon Saturday and it was fun for the afternoon. Since it closes late we got there at 4. The crowd definitely diminished by 5 but we went through with a lot of folks which is a hassle because everyone is backing into everyone else's photos. This museum is ONLY ABOUT TRICK PHOTOS, my husband didn't know that and was a little disappointed with the experience. My kids however couldn't stop the ""Mom, take a picture of me there"" bit! Some of the installations take a little thinking to figure out how to do a good photo, and thankfully almost all of them have ""sample photos"" which helps you know what to do. It's a good diversion but fairly difficult to find. Fortunately it's in a hip neighborhood with tons of restaurants, coffee shops and boutiques as well as retail stores so there is plenty to do as you try to find your way to the museum. The entrance is a small kiosk at ground level so definitely look it up on Google Maps to know what you're looking for."
154,5.0,"Being situated in Hongdae, keep a lookout for Trickeye Museum as it is located basement, and you will only see the staircase on the streets. Very interactive exhibits and they changed the exhibits from the last time (one year ago) I came. Worth coming a trip for families, couples, and friends. Lockers are available for you to keep your belonginsgs, bring only your cameras! (preferably no flash, ample light in the museum) Be quirky and expressive, keep those photos as a memory for this wonderful experience."
155,4.0,"I have visited several times over past two years and every time I go there are different exhibits. Not all exhibits were different but they do rotate a lot of them so is different each time. Best time to go if during the day on a week day. Evenings,  weekends and Korean holidays can be quite crowded, making it almost impossible to take photos. Photos of yourself and others in your group are the reason for going, so it would be pointless to go alone."
