,title,text
0,5.0,"Unforgettable experience! Museum located in unexpected area of Hongik Uni. Before entering u download an app in which U make photo or video. Better video because it will provide u with amazing special effects like in fantasy movies. Every corner of the museum has its own thematic venue. Kids shall be definitely happy. There is also an ice museum with ice sculptures but it’s too tight. Better come early in the morning as it will be crowded and u need a time and space to make quality videos. Better leave clothes and unnecessary stuff in locker box. 100% recommended even if u don’t like boring museums. It is more than museum, it is an adventure."
1,5.0,"The ice museum on the side is not really worth a visit, especially if you have seen ice sculptures elsewhere. Little kids would love it though.The Trick Eye concept is very clever - though sharing your photos with them might be risky. It is only 12000w entry, and a nice diversion from the shopping. Worthwhile even without teenagers. Future museums will all have this special effects capability. Clever"
2,4.0,"Had some trouble finding this attraction  because it is located in a building without a clear and obvious sign. After figuring out which building it was then also had the difficult of finding the entrance which is at the basement of the building, which it shares with another attraction. Spent about 1.5 hrs here taking various photos. The background was intriguing and allowed one to take various interesting photos."
3,5.0,I had such a fun with my three young kids.There are so many photo spots and it's a perfect place to visit with young kids.I will definitely visit again!!
4,3.0,Only some art pieces are 3d. the rest are normal. this is the 2nd time i come here. Feel so old the place has become.
5,5.0,A very good place to enjoy taking nice funny pictures. It’s good for ppl of all ages who just want to have fun.
6,5.0,We had such a fun experience here! Kids enjoyed it just as much as the adults. Make sure to download the free interactive app while you’re there. It will make your pictures come to life! Fabulous and well-worth the visit!
7,3.0,My family of eight visited the Trick Eye Museum June 2019. It was very underwhelming. First you download their app onto your phone and then take videos of friends moving in front of a picture. The app allows animated action to take place and when you play it back it is fun. The museum is in the basement of the building which also includes a giant freezer with a slide and ice sculptures. If you are looking for something that takes about an hour you might enjoy this. Personally I would skip this - not because it is bad but because it isn't great.
8,5.0,"I had such a fun time here with my wife and sister-in-law. So many cool and interesting backdrops to take photos with. It took us about 1 1/2 hours to walk through everything. There was also free entrance into an ice museum within the same building, which was small but still pretty cool! Definitely worth it if you enjoy these kinds of things!"
9,5.0,"Very interesting using a 3D Augmented Reality App ,  you can film a short video as you become part of the action. It is worth a visit if you have a couple hours to kill especially on a rainy day. Also, included was the Ice musuem  with some interesting ice sculptures in a giant freezer."
10,5.0,We visited the Trickeye Museum in Seoul and spent a few hours there. It has a downloadable app which activates special effects in most of their displays like a fire-breathing dragon. The app acts as a camera which you use to take photos with the special effects. The Ice Museum was basically a cold storage with ice sculptures which was even too cold for a Canadian! All in all it was great fun for CAD 20.
11,5.0,a wonderful few hours at this museum. full of illusions. they have free wifi and an app that helps you fully enjoy it so don't forget to download it for great pictures
12,4.0,"TrickEye museum was good! With the TrickEye app, it was fun clicking pictures and recording videos. Ice museum is a total waste of money/time."
13,3.0,"There were a few pictures which were neat, but several were confusing.  It was crowded and made taking pics difficult.  Would not recommend."
14,4.0,"Really fun and you can spend more than two hours to take the photos.  Please remember to download the app before you take any photos and also put your backpack to the locker, just 500 won.  Just take your wallet and camera is good enough."
15,5.0,"Great place! A lot of fun, its incredible that this is the first on america! Bring your hole family and a full loaded battery so you can enjoy it properly."
16,5.0,A really fun place.  We took our kids and they loved it!  Great technology makes it even better!  Would definitely go back again!
17,4.0,"The technology is better and better now.  The Trickeye Museum provides fantastic 4D app that allow taking wow pictures and videos beyond your imagination.  We did have pleasant surprises from using this fantastic app.  By using this app, dinosaurs are moving, angels are flying, pictures are blinking and more surprises going on ..."
18,5.0,Have visited this museum with my family and it was fun and enjoying. My kids like it very much and they were having lots of fun.😍🤗
19,5.0,it was a fun and interesting place to visit with family. My kids enjoyed very much. i strongly recommend this place.
20,5.0,Spend over 2 hour taking photos and checking the 3D animations. The mirror maze could be a challange as well
21,3.0,We had fun re-creating photographs. You can blend and interact with the paintings. The Ice museum is an extra treat.
22,5.0,"Make sure you bring camera, as there are plenty of photo ops in here for sure! Spare at least 2 hours To fully enjoy this one-of-a-kind experience. It’s 3D art and optical illusions at its finest! I’ve never seen anything like it. As an added bonus, the same ticket also gives you free access to Ice Museum and Carnival Street (all in the same building). It is definitely worth the price of admission!!! By subway: get off at Hongik University Station (Line #2), exit 9. It’s about a 5-10 min. walk from there."
23,3.0,Long walk from Hongik Station.  They have apps for a much more realistic picture.  You must have a companion to take your picture or bring a tripod to take your shot
24,5.0,There are lots of 3D wall paintings for selfie and group photos. The mirror maze was quite tricky and some paintings would become animated with phone application. Highly recommended
25,5.0,"It is very hard to write how much fun this place is, you enter a world where you are part of many 3D experinces its so real so when you are with dinosaurs blowing flames it is so real.We spent a couple of hours there and enjoyed every minute.Entry was about £12 best value ever"
26,4.0,"We had the Discover Seoul Pass (DSP) & made a trip here after one of our day tours (most tours stop at Hongik Univ stn). Easy to find & redeem as it's one of the attractions under the DSP, together with the Ice Museum.The counter staff was not friendly as we had questions how to download the app. Service was curt & no smiles from the staff there. They appeared impatient, maybe because it was near closing time.U need the app to enjoy the museum. It's kind of small & u can get through within 1 hr.It's definitely something different from the usual 3D places, and we were happy to have experienced the fun!"
27,5.0,4 days agoloved it! Will be going back. Can spend all day enjoying the museum.My son loved it so much he kept asking to go there again😍😍
28,5.0,"Plenty of fun, nice and helpful personnel, creative design and good value for the price. Thank you very much"
29,5.0,"I heard a lot about this place from other people and was so excited to visit this place. Recently visited this place and jaw dropped. The three hours I spend there wee full of fun, Laughs and lot of picture taking.Their Trickeye app on your phone is the Jem and adds a lot to the fun.To all the people and foreigners out there do visit this place at least fun. one of a life time experience"
30,5.0,"The place is amazing. I would suggest you to go there for sure. You can go with you family, friends and with anybody you want. It is a complete fun place. You can do lot of activities and use different tricks with 3D effect to take pictures. The museum his own camera app, which is great. You can use the app by which pictures come out with more 3D effect. It was a complete fun!"
31,3.0,This is an interesting place with 3 attractions in one place. However please note the Love museum is for adults only not for children.
32,4.0,This is kind of one of the fun place...You can take a lot of great pictures with the back drops if you can pose and capture the right angles....
33,5.0,"Go there and get some funny photos while in Seoul. Also, like the Ice Museum next door, one ticket, you can visit 2 museum. where kids and adults all enjoy, all made out of ice."
34,5.0,"Something absolutely out of the ordinary, you download their app and you enter this magical world of illusions and eye tricks. Our 9 yrs old daughter loved it and so did we!"
35,4.0,"Place to bring teens and pre-teens who are bored of the history museums, temples, and palaces of Seoul.  Fun place for adults also.  It was 90 degrees farenheit outside but below freezing in the Ice section of their museum so definitely wear the poncho."
36,4.0,Great place to take the kids. Make sure u download the app and charge your phone. It’s kinda hard to find because it’s in the middle of nowhere. Once inside it’s just amazing. The art and illusions are fun to experience and they even had a ice museum which was perfect for the summer heat.
37,4.0,This place is amazing.  The tricks your eyes play through the camera are amazing.  lots of fun.  There are 3 museums in 1 although one is adult only.  The ice portion is a great way to cool down on a hot day.
38,4.0,"Very nice place and amazing.. good for all ages .. everyone visit this museum will enjoy and fun .. .Ticket price for adult 15000 KRW and for child over 3 years 12000 KRW, Child below 3 years free"
39,4.0,"We got our ticket for trick eye and ice museum at klook. We enjoyed the different sceneries and taking lot of pictures with our camera and their APP. My android phone isnt supported for video, only pictures. At one time, my phone got too hot, so I had to let it rest while we just used our camera. But the effects were nice as well.For the ice museum, we brought our winter gear - jacket, hoods, gloves. So we were able to stay there a bit longer than others around 30mins only.It was sad that the korean costume shop in the facility has already closed. But still, we had fun."
40,1.0,Rubbish in every aspect and well over-priced! The museum is situated in an area of Seoul that is smelky and dirty. Don't bother!
41,5.0,"It's our first time to be in a 3D museum. I thought it was just for taking pictures. But in Trickeye, they have an app that makes the exhibits ""come alive"". Some of the signage where you should take your pictures to have that 3D effect needs to be replaced because some of it are already blurred."
42,3.0,A silly place to take your kids to break up the cultural stuff in Seoul. Lots of funny scenes to be photographed in. Great position for shopping and food once you have done it. A little pricy in my opinion.
43,5.0,"Amazing option to escape from all the saturated ""historical & cultural trips"". The children loved it.Funny pictures, memorable time and a repeatable experience. Definitely I will come back with my family and retake the same pictures in a few years to compare and relive our family history."
44,5.0,Fun and quick visit to this museum located in a lively neighborhood. Great to do with friends and good for all ages. Make sure you have a full phone battery and download the app in advance to save time and take full advantage of the AR offerings.
45,3.0,"It was fun and an escape from the cold outside during my visit. But, it was smaller than I thought. I was surprised when I have already reached the exit."
46,5.0,I didn't expect this museum to be this good!! Really loved all the effects and the originality of each one of the attractions!! The augmented reality app is just incredible!
47,5.0,"It is a completely different experience from any other place in Seoul, the place is just amazing, Nice Effects on the Museum app and constantly improving!, It's my second time going there and I was surprised by a lot of new effects in the Augmented reality app! I was able to spent a great time with my family!"
48,4.0,This place is a fun place for family and friends. You can spend a couple of hours taking 3d pictures. You can also download their application to enjoy the effects better. Worth the visit. This is for the young and young at heart.
49,5.0,"Itis very amazing to visit Trickeye Museum:you can try to come here and you can also do some of these things:1. you can take a photo (with trickeye application) and get the amazing result in your photo. beautiful photo with powerful motion of anime.2. you also ca get experience and know about some history from this museum.3. you can bring your child and play with him around this museum.Thank you for amazing experience, Trickeye Museum^^"
50,4.0,"I went to this museum with my family and all of us thought that was a very fun place to go. However, it was a bit crowded when we got there so I guess it'd be better if you could go as early as possible to avoid the crowd."
51,4.0,This place is worth visiting with the family. We had fun taking the 3d pictures. You could also download the app to enjoy it better. Fun place for the young and the young at heart!
52,3.0,"Kids love this kind of stuff. Situated in a bustling University neighborhood, this place is full of young people, college students and tourists. They recommend you download the Trickeye App which makes the photos you take become 3d videos.  I'd rather be sightseeing but it was nice quirky diversion for the kids. It doesn't take long to go through it, less than an hour."
53,4.0,"It was kind of difficult to find, but once we did it was amazing! Interactive pieces of art. Truly brings out the kid in you. Also the ice house is super fun be sure you bring a coat! Would definitely go again"
54,5.0,This place is awesome and is great for days when the weather is not. It is best to go with at least one other person so you may take pictures of each other interacting with the art.
55,5.0,"The Museum did not look much at the outside, but we had so much fun inside! Climbing up down the pictures or statues, swinging and walking and taking all sorts of funny pictures. Bring out the children and actor/actress in us! We look at the pictures again. They  are certainly the one of the highlight of our trip to Seoul. You really have to try it!"
56,5.0,"Fun for 8-10 year olds. Big room for virtual reality. You could spend lots of time there, depending on how many pictures you want to take. Exciting for a group of children, not just one. Requires you to download an app, to take pictures with special effects. Wouldn't be the same without the app. Staff is friendly, helpful, and speaks english."
57,5.0,We visited the trickeye museum and it was a great experience for a family with kids.  There is a free app to work with the museum but it will drain your battery. I highly recommend!
58,4.0,"Kids and adults will love this place.  Enjoyed all the AR experience except for the zombie street.  At certain stops, you need to be patient for the AR effect to appearDon't forgo the ice museum.  Has an ice sled inside which the little ones will enjoy. Word of caution... it is extremely cold inside.Do stop by the Tourist Information center for discount coupon worth 35%.  Keep the admission tickets. It has AR features too on it too."
59,5.0,Amazed by the creativity. Kids had a lot of fun posing for photos. You can download an app to add some augmented reality (AR) using the free wifi available.
60,2.0,"Not a Museum for me. It can be fun, but this is not a museum, this is a place where you go to make pictures with your kids or friends. I dind't like but maybe was because i went for myself and it doesn't have nothing to see."
61,5.0,"This place was so much fun, my brothers and I enjoyed going through and taking unique pictures. Def make a stop here"
62,4.0,This place of illusion is the ideal place to play out some fantasies. Want to strut Hollywood's red carpet? You can do it here. Want to ride a dragon? Absolutely.The app which you can download and use to enhance the pictures even more is welcome bonus.
63,5.0,My mom and I really enjoyed this place because we love to be silly and take photos. It's fun to really see the effects after and it was something new to us. Go only if you like taking pictures and are easily pleased :-) This came with a free entrance to the ice museum too but we only stayed a short while there because it was too cold!!
64,5.0,It was amazing! My daughter makes IMovies so she made one about this trip because she had plenty of pictures and videos. We stayed in a hotel for three days near it and went two of the days. Just saying  if you stay near it don't go every day. It was really cool though and now everybody in my family is begging to go back. If you haven't been there I tried not to spoil it to much.
65,4.0,Wow wat an experience  it was my first time at a 3d  museum  and u throughly enjoyed it just wanted to keep taking pictures it was so awesome.. please note you are to remove shoes here so be prepared for that . ...
66,5.0,We had such a  wonderful time here.  Only wish we could have stayed longer.   So much fun and easy to navigate
67,4.0,Price are not expensiv. It's a bit difficult to find. The woman at the ticket box speak english and explain you everything with a smile.The museum is actually 2 different museum the trickeye museum and the ice museum. You can't choose. It's better to have a smartphone with you to enjoy the special effects after downloading a free app. The ice museum was really cold and the girl at the entrance of the ice museum is even colder as she stare at you without saying or explaining anything.
68,5.0,"I took my father to the Trickeye Museum on our last day in Seoul because it was raining and the Government museums and closed on Monday. What a surprise, We Loved this Museum! My father said if he knew about this museum earlier he would have spent more time there. You can put yourself into the artwork and take a picture with your camera, now your part of the artwork. For the elderly of disabled, the downside of the museum is going down 2 full flights of stairs. No elevator."
69,5.0,"The Trickeye Museum is an interesting place to visit and it's free. There are several areas where there are distorted drawings on the floor, but when you take a photo of the drawings at a certain angle they turn out looking normal! They have a virtual ride, where you put on what looks like an oculus rift VR headset, where you can choose what type of ride to go on. I don't recall how much we paid, but our kids enjoyed it and that's all that really mattered. On the opposite side of the virtual ride there's a camera that takes a photo of your face which then crops your face into a Kpop music video on the TV next to it. We had a good laugh. We looked really funny doing the Crayon Pop and Gang Nam Style dance!  At the end of it all, we headed for the restroom because we didn't know when we'd get another chance to go. We were surprised at the images of people staring back at you while you are sitting on the toilet. It was surprisingly entertaining. This is a really cute and fun little place to visit once."
70,5.0,"Directions by subway: Take Line no. 2 green line and exit Hongik Station and walk out of exit 9. Keep walking straight for about 3- 5 mins depending on your speed, you will cross the first traffic light and you will see SPAO a big clothing store with red sign. Soon you will see Tonymoly, a beauty cosmetic store on the right corner, turn right and keep walking. You will see the vertical museum sign on the building on the right hand side in about 3 minutes. There was a horse carriage in the front of the entrance but I don't know if it belonged to the museum. Tips: 1. Must download the Trickyeye museum app before you go for maximum effect. You will not regret it. 2. Use the restroom so you don't have to come out plus there are some funny paintings inside. 3. There are small photos of suggestions of how to pose next to the props, take advantage of them. 4. Be patient as it may take more than a few tries to get the pose right. 5. I printed a coupon off the official Korea Tourism website for 12,000 wons per ticket. 6. There were probably 20 props so if you want to take a photo with all of them, it may take more than a couple hours."
71,5.0,"I had always wanted to go, so when my friends (and their kids) were in Korea, we thought we's check it out. Its not cheap (if you have a lot of kids) but when you download the app and experience the augmented reality-- wow! Be sure your phone battery is fully charged-- and preferably, bring an extra. Very cool, and something all ages can enjoy. If you can go mid-week or off-peak times, it's better with less people as you are taking turns, and people can walk in front of your camera."
72,4.0,This was a long cab drive from our hotel but worth the drive.  Plan to spend a good amount of time exploring the museum and taking pictures.  The museum was clean and well attended.
73,4.0,"A very clever display of 3d artwork and AR video imagery overlaid to make some impressive video and photos. My teenage children really enjoyed this place, especially the ice museum scupturing, though it was freezing.  Well worth the visit."
74,2.0,"not really good, repeated stuff. you can click only some picture on predefined spots. Nothing to explore or fun, just click click and click"
75,4.0,"Our family spent two hours there.  It's fun for everybody.  We got there early around 10am when it just opened.  So we had plenty of time in each spot.  It's app was downloaded at the entrance and the special of effect will pop out when you took pictures.  A small ice castle is the bonus attraction.  It's freezing inside, we couldn't bear the chill.  We walked in and out right after."
76,3.0,Interesting photos you can take. Lots of fun trying to act out the photos. You will have a lot of fun.
77,5.0,We had a good time here with our kids. Using trickeye mobile app is a must otherwise you won't experience all the great effects with fantastic creatures and scenes. The children liked it especially much. My son could not figure out why a  fire-breathing dragon or a grinning shark became alive on my mobile's screen :))) Funny photos will be a great memory about your time in Seoul
78,5.0,"A Seoul must-see attraction is a visit to Trick Eye Museum. There are so many paintings that one can pose to get the 3D effect, depending on the photographer's position and angle. It leaves to your imagination and some acting skills on how you want the photo to be presented realistically.There are sample photos at the sides you could copy to get the 3D effect. With also the Trick Eye Apps that you can download  the photographer is able to record a movie with creatures like dinosaurs, dragons moving around the subjects. He is also able to see on his phone screen special effects like moving fire, rain, bubbles, etc in the background. For only 18,000 won (SGD $23) you also get to see the Ice Museum where you see sculptures of igloos, trains, beds, toilets, pianos, bar counters, etc all in ice. By the way, it's icy cold inside, about -10 degrees C, as cold as the delivery container freezers trucks carrying meat. Not recommended for young children & the elderly. Something classic and extraordinary if you can withstand the cold. The sculptures are fantastic and realistic!."
79,5.0,"Enjoyable fun filled afternoon at the Trick Eye Museum. Wasnt expecting much but the experience really surpassed all expectation. Really had a great time taking pictures with 3D effect. The only problem is the trick eye app, it gives you unclear images compare to the phone camera. This is a must visit place for both kids and adults alike"
80,4.0,"It was fun for the kids with a great app you can download, which transforms the still artwork into animated masterpieces. The staff were great and the optical. Illusions funny. There is also a small ice museum.at the bottom which was very cold."
81,4.0,This is my 3rd visit to Seoul and my first overseas adventure with my kids! It was during December 2016 and I thought it would be good to have some indoor activities as the weather was really quite cold :p I think I made the right choice! The place is easily accessible (we took a taxi there) and there are a lot of small eateries located just outside the building. The paintings are so realistic and my kids had some much fun taking pictures! The price of the ticket also include entrance to the Ice Museum which is located within the same building but we didn't stay for long as it was near to dinner time and it is really small and nothing much in there for us to see.
82,1.0,An indoor place to take fake photos. Totally corny. Perhaps I'm spoiled having seen ice sculptures at Chena Hot Springs. These were sub par to me.
83,5.0,"Location is convenient in town.But if you play creative expression, you can shoot very interesting photos, although the moment put some action when there is a little embarrassing, because a lot of people next to see, but after returning to see The photo feels like a nice remembrance."
