,title,text
229,3.0,"Trickeye Museum is a great stop to make if you're going to be visiting Hongdae. It's not worth making a special trip to visit though. I think this museum concept is catching on in Korea because they've changing the Teddy Bear Museum to be a trickeye museum up at N Tower, too. While at the Trickeye, be sure to visit the Ice Museum and slide down the ice slide."
230,5.0,Visited the museum with my folks and aunt. The place had a lot of paintings that were great to take photos of. My dad and I took pictures with almost every display. Fun!
231,5.0,"excellent, interesting place to visit for kids and family and affordable too. Very hard to find, should have more signage..but again the locals are helpfull"
232,5.0,"Its really tricking my eye, great picture there, and have a new ice museum, so fun thereThey're really creative"
233,3.0,The place is in the basement. You will see a picture where if you take picture of it like live. Good but not spectacular. Is ok if you have more time but not must go. It's quite fun. They also have a little Ice castle.
234,4.0,"me and my family love the museum.there were a lot of people even in winter, lots of taking pictures with some camera trick, the angles and the paintings themselves but i wish for more tricks.but it was fun, shud give it a try in Seoul"
235,5.0,We had quite a blast in this fun attraction. We enjoyed the interactive paintings and took many photos. Would recommend this to anyone visiting Seoul for some light hearted fun.
236,4.0,"This is an eye opening for everybody especially for those photographers will love to try out their skills. It is designed from 2D, 3D and enjoy the 5D theatre"
237,4.0,"Pretty fun for young and old. Went in Dec, there was also an ice museum. All four of us have enjoyed the visit."
238,5.0,"Can have some interesting moments, were there for about 2-3 hrs. Those pictures spice up our album for the trip. We still laugh at the pictures when we go through them. Good to share with friends too."
239,3.0,"This place is best for those who have friends who could take '3D' images well, my aunt helped taken hundreds of pics yet only a few turned out acceptable. If you think you might take bad pictures, there are staff members situated nearby and they can help take a few pictures for you.Also, I find the museum a little bit boring as there aren't much to take with."
240,5.0,A quirky fun place that has little to do with Seoul or South Korea but a great place to take pictures of yourself and traveling companions.
241,4.0,"A different and fun part of Seoul! This makes a unique and fun outing..If you don't like crowds and pushing or if you always want the best pictures this place can be frustrating...however, if photo bombers aren't a problem take your kids, your friends, your camera and your imagination you'll have ablast!"
242,5.0,"A group of helpful young Koreans brought us to this place, when we were just asking for directions!  We were told that Trickeye was the older museum and we should go for Alive museum but in my opinion, Trickeye was the better one.  There were more variety and 3D stuff here vs Alive, which was more of arts and paintings (got boring after awhile).  We had lots of fun posing and laughing at the cheeky displays.  It was a good fun time for the young and old. The ticket price includes the Ice museum ... it was freezing cold inside but the kids loved the ice-carved slide. Trickeye was near the Hongaik Uni area.  Stay in this area for lunch, walk around and feel the vibrance of the area after visiting the museum."
243,5.0,"It's our 4th day in Korea in autumn, but our memory card is  almost empty as the kids are not so keen on taking photos. Not here. They gamely posed for photos, and even retaking shotswhen they're not satisfied. We had so much fun taking each other's pictures and I have discovered that my daughter has a penchant for photography, directing her little brother until she gets the perfect shot. It was a good break for my son who's not so much into the palaces. perfect for sharing at home too.Entrance fee is not cheap for 15000 won but definitely worth it. We presented the discount voucher printed from KTO website so we paid 12000 each. One voucher is good for 4."
244,5.0,it was like my second visit here but I have still enjoyed taking pictures. It has new illusions and an additional ice museum in which you can enjoy the cold breeze and slide.
245,5.0,Had the most amazing time with my mum and daughter.  WE took great photos and laughed so much.  What a brilliant idea..... would recommend this to anyone visiting Korea... bring someone with you so you can take photos of each other!!!
246,4.0,Very entertaining and some very memorable photos. Great for families with young children or teenagers.  The only disadvantage is that it was very crowded when we were there (weekday) making it very difficult to get a good photo opportunity.  The ice museum is also very entertaining but it is very cold that you cannot really spend too much time in there.
247,5.0,"a very intresting place to visit. many pictures captured in 3D painting....some are very funny painting. you have to follow the guide to take the picture otherwise the picture wont look 'real n lively'....my niece really enjoyed being here....for three people we paid won30000 .although it's quite difficult to find but the help from the tourist guide, we finally found it. we spent nearly 2 hours there....."
248,5.0,This is really great value for money. There are various different 3D looking paintings on the wall and you stand by them and have your photos taken and it looks like you are part of the picture.It was really busy when we went and the locals didn't seem to understand queueing they tended to push past you and take their photos. So I suggest either go first thing in the morning when its not as busy or don't stand back waiting to take your photo.There was also an ice gallery here as well which was small but fun to look around and a great way to cool off.We paid £7 for the two attractions.
249,5.0,"Funny pictures can be token, worth spending a morning there. But the location is difficult to be found, should give clear directions from the metro station."
250,4.0,"Never expected such a attraction where it uses perspective to create loads of fun. Remember to bring your camera as you put on your creativity hat and have loads of fun posing for pictures. We visited on a weekend and therefore its filled with locals and tourist. Therefore i recommend to go during the weekdays so that you have more space to take photos. Also the ticket comes with the Ice Museum ticket and you get to go inside a negative 4 ice container/fridge with a lot of beautiful ice sculptures. There's even a ice house with living area, bedroom and kitchen, all made of ice! There is also a ice slide that you can slide down! Really fun and worth the visit !"
251,4.0,Spent a about 1-2 hours there.located at a building's basement in a small road tucked away from the busy street.the pictures came out really fun and funny! may take quite a while to get a perfect shot with kids running around.good time filler if you have a short morning or afternoon to spare before you leave seoul
252,5.0,"Bring your camera! You'll take lots of pictures and have lots of fun ! We had a lot of fun taking pictures, posing and playing with the perspective art pieces. There were a lot of people as we went during the weekends so i'd recommend to go during the weekdays so that you have more space to take photos. A lot of people were crowded in an area and we had to excuse ourselves to take photos. Also the ticket comes with the Ice Museum ticket and you get to go inside a negative 4 ice container/fridge with a lot of beautiful ice sculptures. There is also a ice slide that you can slide down ! Really fun and worth the visit !"
253,5.0,"Well you need just 2 hours at maximum but you will thank me. It is nt one of those big lofty museums. It s just a small exhibition kind of thing that gives a lovely little amusing experience, so donot miss it"
254,5.0,"Lots of fun and interesting moments going through all the tricky path from start to finish. Enjoyable, fun and tricky experience in Trickeye Museum, Seoul, South Korea  2013"
255,5.0,"We've read about the Trick Eye museum in Hongdae while looking for some cool places to visit in Seoul. Good thing we are also staying in Mapo-gu where the crowd is mostly students. The museum is also near the Hongcup chicken which is a must-try. Prepare to spend more than an hour striking poses and taking pictures with the cool and tricky portraits and rooms. I like the one with all those confusing mirrors in it! So, make sure you have your camera ready with adequate memory space! :)"
256,4.0,"This place was really hard to find!! I got lost and asked some people, no one had any idea. So take good directions! To get there, take the subway to Hongik University (Line 2, Exit 9). Walk straight then turn left at the first intersection. Walk until you reach Starbucks on the left. Cross the main street on your right and go down the alley next to Holika Holika. It takes about 10 minutes to get there.This place is really fun (if a bit expensive 13000 won), it takes an hour or so to see everything. And make sure you go in a pair at least so you can take heaps of photos, or ask the staff, they are happy to help with poses and photo taking!"
257,4.0,The art comes to life.  it's a great little museum to take elementary school aged kids.  Is small but fun enough to keep you entertained for about an hour to hour.
258,4.0,It's a nice place to enjoy with family members. Quite difficult to locate as it is located within the basement of a complex. You need to be a kid again to enjoy this place. If you are too serious then you will not be able to act and have fun with the trick eye photos. have fun and lots of laugh...
259,2.0,Funny but overcrowded and tiny. 13000 won for a 20 min is a shame. I would like to tell you more about this museum but...there is nothing else to add.
