,star_point,title,text,Date of experience
0,5.0,nice seoul mosque,my the first time to visit here. only one mosque in korea i think. good place to visit. in itaewon area. with muslim friends it’s good time to show them here, February 2020
1,3.0,Glad to Find a Place to Worship in Seoul,"We visited the Seoul Central Mosque on a Jumuah.  It is down a small winding road that was so backed up with traffic while heading to Jumuah that we got out of our taxi and walked a bit of the way.  There was no clear signage for the sisters' prayer area. There were so many there to pray that brothers were praying outside.  We followed some sisters to a cramped prayer area.  It was so tiny compared to what Iater got to see was the brothers' area that I wondered if it was meant to dissaude sisters.  The khutbah was in Korean & Arabic. Don't recall there being an English portion.  After salat we got a better look at the masjid. It was once again difficult to find signage as to where sisters' should go. When I went toward the main entrance looks told me it wasn't the right spot, but no assistance.  Eventually my daughter and I found the way.  The masjid was lovely in the standard masjid way, however, once again the sisters' area was difficult to get to. It was up 3 flights of stairs (I thought about mothers with babies) and once you got upstairs it was once again a tiny space that was blocked off from viewing the khateeb.  So sisters if you're hoping to get a good look of a masjid in another country while you are visiting, don't get your hopes up for that. Go to pray and you would have met your goal!  Alhamdulillah.  We were so glad to find the masjid, pray there and be amongst the Muslims. May Allah reward them for establishing the masjid and the salat.", August 2019
2,5.0,A must visit for all Muslim traveller,"If are a Muslim in particular,and you are in Seoul, never miss the opportunity to visit and perform solah at Seoul Central Mosque. Located on a high hill in Itaewon, if you are not on excursion, you can reach there by taxi (easier but slightly costly) or bus. There are many halal restaurants around it. Take note that the nearest bus stop along main road on north side, and you need to go thru quite a steep wide staircase. Just be careful especially when wet.", December 2018
3,5.0,Beautiful Mosque,The mosque was peaceful and Islamic. It was beautiful. The mosque is very big and has a parking lot. It is the first mosque we encounter in seoul, June 2019
4,5.0,Second time here,"always love to come here and pray here, wonderful mosque especially at night. My second time here after 2014.", April 2019
5,5.0,A beautiful masjid,The masjid is high up on a hill. Please wear   comfortable shoes. There are toilets and ablution facilities for women and men. A beautiful masjid indeed., December 2018
6,5.0,Easily recognized,Must visit - the only mosque in Seoul. Take the Itaewon line and walk up the hill for about 300m. You wont miss it!, September 2018
7,3.0,A place for Muslim tourists,"A lot of halal restaurants nearby. But this place has nothing to offer for travelers seeking for something Korean. It gives a nice view of Seoul, but not worth that much to walk up the hill to get here, if you are not a muslim.", October 2018
8,5.0,Great mosque in Seoul,"I used to live in seoul for 5 years (2008-2013), this is the place that i frequently came for friday prayersNice place but need some toilet renovation", December 2017
9,5.0,Central mosque seoul,"Easy to find , surrounding with all halal foods from Iran and also korean.Very delicious and it will repeat my trip again", March 2018
10,5.0,Nice,"I am enjoying my time during the visit. Please have a good stamina, you need to hike up a bit 🤣 it have many halal restaurant along the road. I tried at makan halal restaurant. Yummy!", August 2018
11,5.0,Religion of peace ,Real peace real smile real happiness Good place for anyone find the righty wayOpen 7/7 365/365 for all human., August 2018
12,5.0,Majestic,"The women ablution and toilet are located outside the masjid. Like all other sites in Seoul, most of the places use automatic light (auto sensor light) Women prayer room is situated at 3rd floor. Quite a challenge for old people to climb the stairs. Stairs and prayer hall is fully carpeted. The women prayer area is quite dark but equipped with fans, sejadah and lots of telekung. We can witness the men praying from the 3rd floor. The masjid interior is decorated with beautiful Islamic designed mosaic. Imam's voice is melodious and I feel so peaceful praying in this masjid.", July 2018
13,5.0,Great experience,"A must visit for all Muslims. The mosque is situated up on a hill. Quite a walk from Itaewon subway. Maybe taking a taxi will be better for older folks. For young ones, no issues. The female prayer area is upstairs. If you are coming at night, the stairs appeared dark but no worries it has a sensor... So with movement, the passageway will be lit up. There are fans and heaters depending on the season that you visit. Lots of halal eateries nearby.", March 2018
14,5.0,Place that Muslims must visit,Perfect mosque to visit with many halal restaurants and foods surrounding that area. Many hostels and hotels neat by. If you need to travel to seoul town there is train station near by walking distance. The negative side of it is the area is on top of hill. Elder need assistance, May 2018
15,5.0,Happening,"Mosque, large enough, under renovation and still in full service. Grateful for a place pray of the community as well as visitor.", June 2018
16,5.0,Must to see...,It’s a Muslim house to worship we call it Masjid. But Whither you’re Muslim or not you should go see the place and there’s a guide to explain..., May 2018
17,4.0,The reason most Muslims live nearby,"Most Muslims live in Bogwang-dong and Itaewon-dong. That's because this is the only (probably) mosque in Seoul.Visitors are muslims and a few Koreans with curiosity.- Comparing to mosques in mid-east, this is just a simple one. I have been around several times and never heard ezan from outside.- This mosque is locating on a high area. It'll be a bit of climbing from Itaewon Station.- There are some Turkish restaurants and dessert shops nearby. But, arabic ones are relatively fewer.", March 2018
18,5.0,Mosque in Korea! Awesome!,"Definitely a place to visit for all muslim visiting Korea, peaceful and a great location too. When in Itaewon do visit this Mosque.", May 2018
19,5.0,A time for prayer,This building easily located. Very clean area typical of korean.people very friendly. A lot of halal food outlet araundGot some fresh meat. A must place to visit whenever on seoul, April 2018
20,5.0,The first & only mosque in Seoul ,"Very beautiful, from the top of the mosque at the entrance to male prayer hall u can see the view of the city. Very nice. U will need to climb the stairs to get to the male prayer hall.", January 2018
21,5.0,Must Visit For Muslim,"I arrived on Friday and the mosque was filled with people ready to perform Friday prayer. There was prayer mats outside for those who couldn't fit inside the main prayer hall. The women's prayer room is a little hidden away.  Along the streets leading to the mosque, you will find many halal restaurants (including korean halal cuisine), kebabs counters, and a halal supermarket.", April 2017
22,5.0,Great Place ,"I went there with my friend and it was a peacfull  and faith place ..also it is only Islamic place in Seoul so , must visit", September 2017
23,5.0,Masjid in Korea,"Never been here before, last time I visited Korea in 2010. Just have a chance now and it is great to visit this place in Korea. Seeing so many people from different countries come to this Masjid to do prayer is beautiful thing, since the location of the masjid is in Itaewon, quite from the office area in Seoul. Must visit place for muslim whenever you come to Korea.", April 2017
24,3.0,Near Itaewon stn,Its abt 10-15 mins walk from Itaewon station exit 3.. it is at uphill. So best to wear ur most comfortable shoes here. Halal restaurants and halal groceries shops nearby.. but the streets nearby can be quite quiet.. was here in the early afternoon.., April 2017
25,4.0,peaceful and quiet.,"if you want to see a mosque, come to this one. you can take photos, just make sure to take your shoes off at the entrance. also be mindful of the people praying inside.", March 2017
26,4.0,Central Mosque at Seoul,"Good to hear and see the mosque at Seoul.Located at Hannam street, Yongsan-gu. Not far away from the city.There are a moslem complex and halal food here. Must see and visit for a muslim", April 2016
27,5.0,Beautiful Mosque,"After a good meal at the Eid Restaurant nearby, I headed towards the mosque. It was during winter and I realised that the praying hall was upstairs and the place to take wudhu was located near the car park, in a container-ish block. So, I had to go up to the entrance of the prayer hall, took out my shoes, wore a pair of slippers provided and went down to the wudhu area with my freezing feet! I wasn't complaining as it was just an experience as I've never been to a place this cold.It is such a peaceful mosque. And beautiful too. I went with my wife and son. It is located in Itaewon district so, expect a short uphill journey from the train station to the mosque. It's not that hard to find as you will see the entrance from afar. More stairs to get to the mosque compound.Highly recommend to visit if you happen to be in Itaewon area. And if there's a chance, visit during Friday prayers. It would be a good experience.", December 2016
28,5.0,Ideal place to learn about Islam ,Very beautiful mosque looking over the great city of Seoul. You can come and learn more about Islam and pick up some books and take amazing pictures., February 2017
29,5.0,Central Mosque,Kinda hard to find for me. Very peaceful place. Lots of restaurants around. Also a great view of the city., December 2016
30,4.0,Peaceful energies ,"Near Itaewon station, 10 minutes walk. Outside is peaceful. You get a great view east of Seoul. Inside is tranquil. (Men downstairs and ladies upstairs ) Architecturally not a big thing. But interior with blue mosaic was pretty.", December 2016
31,4.0,Serene and beautiful mosque but the road leading to it was dirty,"The ladies' prayer section upstairs is accessible by a long flight of stairs. The mosque and its compound itself were clean and nice. However the road leading to the mosque - with its many halal restaurants and turkish supermarket- was shockingly dirty! Cigarette butts, rubbish, empty boxes/ bottles etc littered the streets in front of the shops and garbage bags were stacked high in the side streets. Compared to the other areas in Seoul this part of Itaewon seemed seedy.", December 2016
32,5.0,Beautiful...,"This is a beautiful mosque that is kind of hidden in Itaewon. It's not on the street. You have to walk in a big gate decorated with Islamic art and then go uphill a little bit to see it.What's baffling (and funny, actually) is that there is a red light district (and it's very red) literally 1-2 min walk away from this mosque. Whichever was there first, their presence next to each other is contradictory (unless I'm missing something). It's kinda like seeing a criminal hideout next to the central police station. Unless if the police was corrupt, then that would explain it, but... Who knows?", October 2016
33,4.0,Good Masjid,"It was located at very Nice Area of Seoul , It is Clean, and the other advantage of this Masjid is near to many halal restaurants", December 2016
34,5.0,Central mosque ,Took subway till itaewon station (exit 2). Then walk about 10 minutes to reach there.There is one man (ahjussi) i think he is a caretaker here. He showed me a way to the women area (at 4th floor and make sure to take wudhuk first at the back of the mosque). He is very helpful., October 2016
35,5.0,Seoul central masjed,"We took a metro to arrive and exit number 2 would be the nearest to achieved the masjed. However it a big masjed, it has a classes for both men and women.", October 2016
36,5.0,Nice place to be at,Nice place to be at. Its like on hill top and you can have a view of far. Moreover would get a glimpse of muslim place of worship., October 2016
37,4.0,Mosque and halal food,The mosque in Itaewon and surrounded by a lot of Halal restaurants and markets which sells halal food, August 2016
38,5.0,centeral location in itewan,the mousqe is sourrounded by many halal restaurants and Arabic and Islamic stores. the mousqe is on the top of a hill in itewan so the night view of seoul is beautiful from there. women wearing short clothes will be provided long skirts to wear., May 2016
39,5.0,Spiritually amazing,One of the best place to visit and get to know the Muslims in this city. Loads of halal eatery to be found surrounding this places!, September 2015
40,4.0,Heart of Itaewon,"The only mosque in Seoul is in the heart of Itaewon. It's a must-visit for any Muslim who's looking for a place to pray and for someplace to get good halal food. The climb to the mosque is a bit steep so it may be tough for someone who has knee trouble. The mosque offers brochures in Koreans introducing Islam and answering some popular questions that non-Muslims normally ask, and also has the Friday sermon available for anyone who's interested. Near the mosque are plenty of restaurants that serve halal food such as Eid which serves traditional Korean food.", April 2016
41,4.0,Beautiful architecture ,Interesting architecture. Relatively easy to find in Itaewon. Only Muslims are allowed to enter the mosque. The person at the front door was nice enough to let us take a peek inside., May 2016
42,5.0,Simply Amazing Mosque,"The 1 and only Mosque in Seoul, just 10mins from Namdaemun if you are taking taxi.Heaven for Halal Food if you are a muslim, just a walking distance from the Mosque.", March 2016
43,5.0,Pray,"Seoul Masjid is located in Iteawon center of city and bit climb but it,s real big and on Friday feel like Eid day you can see lord of Muslim from different country and color", February 2016
44,3.0,Mosque in Seoul,Mosque in Seoul for the Muslim community and individual worshipper in Seoul.  It is in Itaewon; a harmonious blend of different ethnic community., January 2016
45,4.0,Halal food aplenty,"As a muslim traveller, its quite difficult to find halal food is Seoul. We have to stick with veggie & seafood-based snacks. But around the mosque, we can find many kind of halal food from arabic, turkish as well as korean. Of course, do your religious duty at the mosque, which is comfortable enough.", December 2015
46,5.0,The one and only Mosque in Seoul,"Since I am a Moslem, then this place surely becoming a must-visit place for me in Seoul. This mosque is the one and only mosque in Seoul and since it's SUPER hard to find places to pray for Moslem in Seoul, than this place somehow will bring some happiness for you who crave a proper place to pray. I met many friends here and they're willing to smile and greet you warm-heartedly even you haven't met them before. I also met some tourist visited this Mosque for sightseeing. You can also find many halal restaurant (which quite hard to find in Seoul) as well as stores which sell halal products near this Mosque. This Mosque located in Itaewon which famous for its multicultural surroundings.", May 2015
47,5.0,Mosque and Islamic Center in Seoul,"Whenever I am in Seoul, this is one place that I always make a point to visit. One can meet other  Muslims in Seoul who live in the city and other muslim travelers. In fact, I was there during Ramadhan in 2015 and got a chance to break my fast with other mosque goers!As many reviewers have mentioned, this is the biggest, if not the only Mosque in Seoul. It has his own history and has other activities organized, not only the 5 daily payers, Friday prayer and Taraweeh in Ramadhan. The mosque is located in Itaewon area - so accessible by train, although, you must walk a little bit and it could be literally  an 'uphill battle' for some people :-) However you will be definitely be rewarded with the experience.  There are also many good halal restaurants serving all kinds of dishes (Korean, Malaysian, Indonesian, Pakistani, Indian etc) near the Mosque so you could grab some food on your way back.", July 2015
48,4.0,the only mosque in seoul,"it is located at vibrating town of Itaewon, this is the place where one can mix up with Muslim neighborhood.", November 2014
49,5.0,It feels too good!,"When we found about this place we loved to pray all the namaz whenever in this area.We asked one of the restaurant guy who directed us. to get here when you in Itaewon, look for Dubai Restaurant, if this restaurant is to your right walk a little ahead and take right walk straight for 2minutes and to the right you will see a lane going uphill walk another2-3 minutes on that street... just to know you on right street you will notice all the halal restaurants each side of the road.... keep walking and you will see the Masjid to your left side.Friday prayers it was full, people pray outside the masjid in the premises as its full. Ladies have a small section to pray on the 2nd level.Wadhu area is outside not inside. there is facility of water dispensor with cold water.there are donation box kept outside be generous and donate... even a small donation may help.I met a very helpful local who guided me. It feels so good to be there. And when we left from friday prayers there were 2 people outside the gate serving zamzam to everyone. highly recommend every Muslim visiting Seoul.", August 2015
50,3.0,Hoping to see the Mosque,Arr Seoul yesterday am Stayed at SP Guesthouse...ok n in Itaewon area.So fun the city vibrant wiz young ple..Today aiming to see mosque..hope to find it, August 2015
51,5.0,Love to find the mosque in Seoul.,"One of the must visit for me here, to see the mosque in the middle of Seoul, a city which Islam is minority. The mosque is big enough.", March 2015
52,4.0,Stands out amid the ever-present crosses,"The sight of the minarets at the top of the hill gave me two very different feelings. The first was delight at seeing something so welcoming among the endless skyline of Christian crosses topping the churches of South Korea. The second was the challenge of the climb up after an already long day of walking and navigating the public transit systems of this mega-city.There is a large diagram in the entry gate area that directs Muslims to their gender appropriate ablution areas and also contains information for the non-Muslim visitors to allow them to visit both respectfully and comfortably.The women's prayer room is a little hidden away both to find in the first place and then in its setting relative to the men's prayer room, which has a wide and obvious entryway. The stairs to the third floor are not well marked. Once inside the hallway the welcome signs fall away to multiple requests to remove one's shoes and a scattering of shower shoes clutter the floor. However, once upstairs the balcony prayer area is nice. Heavily carpeted with a low wall that allows a view of the main prayer room below, it is clean, quiet, well ventilated, and provides many additional supportive materials like prayer rugs and head scarves.It was well worth the climb up the hill.", April 2015
53,4.0,Korea's first and Seoul's only mosque,"This is Korea's first and Seoul's only mosque, erected in 1976 and located on a hilltop. To get here, you can take the subway to Itaewon station Line 6 Exit 3. Its a 10mins walk from the station. Along the streets leading to the mosque, you will find many halal restaurants (including korean halal cuisine), kebabs counters, and a halal supermarket. You will first see the entrance of the mosque (decorated in blue mosaic), take the stairs and beyond that is the mosque. The men's prayer hall is located at the main building and the wuhdu area is outside near the carpark. The ladies wudhu area and prayer room is in another part of the building. The prayer hall and toilet are rather small. We came in March (towards ending of winter) and yet it was cold to take your wudhu outside of the building (for the men). So in winter, it will be even colder.Visit this mosque if you have the opportunity. I understand that they are building funds for the reconstruction project of this mosque. So do donate if you happen to be there :)", March 2015
54,3.0,comfortable.,comfortable for muslim to pray but the toilet too small. easy to find halal food. the direction signboard confusing to follow., November 2014
55,5.0,Great to see such a building in a non-Islamic country.,"Great little mosque for the Muslims of Seoul and all those who are travelling there. I went for Friday prayer and it was rather busy with prayer mats outside for those who couldn't fit inside the main prater hall. To take wuduk you need to go into a small cabin that is a little walk from the prayer hall, so in the winter, I would recommend going there with you wuduk ready. For females there is a special area for their wuduk.It is lovely to see such a building in a country that isn't Islamic. In England most mosques are small houses or a school hall - so to see the acceptance of Islam and the freedom to pray by the Koreans is lovely.The local area is full of halal food - so it was great to eat halal food without worrying. There is a great book store just down the road from the mosque where you can buy great Islamic books for a reasonable price!", March 2015
56,5.0,Best Tourist attraction in Seoul,"Well this is the  best tourist attraction in seoul. People from all religions, colour, sex, countries visit this sacred place and they are all warmly welcomed. It is a worth visit place, as you will feel peace and repose.", January 2015
57,5.0,Large & Beautiful Masjid,"I had a chance to read my Magrib prayer here, on my two night trip. I was amazed on the size & stuture of the Masjid. Beautiful minarats and a large dome. It seems the Masjid had a a lot of facilities, i.e women area in the bottom half. Good scenery of Seoul because the Masjid is at the top of the Hill. A lot of halal shops around.", November 2014
58,4.0,Islamic tourism centre,A very nice mosque located on the hill top. An adjoining islamic school built together with the school and found out that they are plan to refurbish and extend the building. There are a lot of Muslim restaurants available nearby but it will be a lil expensive. You may find 2 groceries stores nearby the mosque with 100% halal ingredients. Nice Seoul view from the mosque parking area., November 2014
59,5.0,Masjid on a Hill,Beautiful Mosjid with an adjoining islamic school located on a hill top. Bit of a steep climb. Had the pleasure of praying one afternoon during Nov'2014. There is a plan to build a large mosjid complex. Most taxi drivers know the place. Several Indian/pak restaurants nearby. Saw a Halal meat shop as well nearby., November 2014
60,5.0,Very nice Masjid,Very nice area I love fact that there are many halal resturants and many middle eastern shops. Very nice I highly recommend visiting Muslims to visit and pray., June 2014
61,4.0,The most famous mosque in Seoul,"The mosque is worth going to. It is located uphill, so might require some effort to go up.  But the view from up is fairly good. While the mosque itself is very different from the typical mosque that you can find in muslim countries, it is also located in Ittaewon area, where lots of stores for shopping is available. Many halal food is also available here.", July 2013
62,4.0,Beautiful Mosque,This is a beautiful mosque I ran into by accident on my way to Itawonland. It is nice to drop by if you have the chance and are in the area., April 2014
63,4.0,Islam in the center of Seoul,"Never imagine a Muslim community living in the central of big metropolitan city like Seoul, where a rapid emerging human life with entertainment and popularity become a major aspect in life..Beautiful mosque, a lot of shops providing halal foods, and it is a beautiful scenery overall..", July 2013
64,4.0,The Middle East comes to Seoul,"Beautiful mosque, easy to get to, and inspiring to see such diversity in Seoul. I would recommend at least stopping buy, doesn't take long to view it  check out for the garden as well.", November 2013
65,4.0,Trace of Islam in Seoul,"I've been curious to trace the trail of Islam in this country, where it's not the majority, so I decided to pay a visit to the only mosque in Seoul. I walked from Itaewon station till I found Dunkin Donuts (yes you got it right) and I turned right. I walked and found some halal restaurants and shops along the way. I kept walking until I realized that I was lost (because I couldn't find it!) so I walked back and found out that I should've turned left on a junction before (there was actually a sign and I couldn't find it!)The road there was pretty steep and long, so be prepared. Better wear your running shoes (again). For women, the praying room is on the 3rd floor, so get ready to climb the stairs. the interior was good and the praying mat was thick and soft so it was pretty comfortable.", July 2013
66,5.0,A must see!,"I attended Jumuah prayers here.  The salaah begins early (at about 1:30pm) so get there early.  It's the only mosque in Seoul so the place gets packed.  Separate Ladies facilities are available,  which is to the left of the main entrance if you stand facing the mosque. The wudhu facilities are looked to the right of the mosque entrance in what appears to be a 40-foot container-like structure.  The mosque is abit of a walk from the itaewon station, but given the very little halal places in Seoul, it is a welcome sight and you feel quite at home. The adjacent area had many Islamic shops and halal eating places (beware: a lot of the indo-Pakistan owned restaurants are licensed, which would annoy if you are after strictly halal food).", September 2012
