,star_point,title,text,Date of experience
112,4.0,A Nice Introduction to Korean History,A good way to spend 1-2 hours getting some background on Korean History with an emphasis on Seoul. Lots of hands-on experiences for kids. Easy to find. Free admission. A Nice gift shop., July 2014
113,5.0,Another excellent museum,"This museum is a 10 minute walk from the Museum of Contemporary History, located in a lovely parkland in the midst of busy Seoul.  Take a walk around the building and enjoy the neighboring palace, too!  The permanent and temporary exhibits share the history and development of this very modern city.  I always find it inconceivable when I see the pre-War photos and see what is in Seoul now.  The coffee shop is a nice retreat.", June 2014
114,5.0,More than meets the eye,"Admission is free and I must say these free entrance is a real good deal! Not a really big museum but you really need a few hours to explore all the areas. There's just too much to learn over there. From the knowledge of the development of the country, to Joseon dynasty history to the miniature city landscape of korea, it's just soo educative and interesting to explore.Unlike museum in Singapore, seoul museum has a very interesting & creative ways to portray their display. That alone is enough to wow you for 1/2 an hour. You can take picture with their system and best part, they will email the photos to you so you'll get to keep a memory of your trip there!", May 2014
115,4.0,Interesting model of the city in this city museum,"This museum is in the heart of Seoul access by the Gwanghwamun subway station and directly opposite a huge 10 storey statue of a hammering man.  The museum is not large.  The miniature scale model of the entire city on the 2nd floor is a very interesting visit.  The guide there was very helpful and highlighted areas of the city and gave an overview of the span of this sprawling city.  Other than this display, the rest is a rather standard display of the history of the development and growth of the city.  The old photographs traced the interesting entry of foreign influence into Seoul. Good restful stop in the city.", February 2014
116,4.0,"Quick, easy & informative + child friendly","Small museum that describes the history and urbanization of the city of Seoul. The astounding pace at which this city has grown and modernized really sinks in here. Some (limited) fragments of Korea's broader history, especially last 150 years also on display. Many pictures, displays, a 1000 sqft model of city will keep children interested too. Interesting, free, quick to visit, very central, air conditioned/heated. Can't really ask for more.", July 2013
117,3.0,History of Seoul,"I thought this would be more about the history of Korea but the history of Seoul is interesting as it has been a main city for a long time. The museum starts in the 1200s and goes up to 2002 when Korea hosted the Olympics, so it does cover a lot of time. There is also a mini city inside which is quite impressive, but not as impressive as others that I've seen (i.e. Shanghai)", December 2012
118,4.0,Seoul history museum,"close to Gwanghwamum square and Gyeonbok Palace. walk distance from these 2 popular palces. free admission, you can compare the city of Seoul, old and new(now)..old means 1890s.. new means now.Pls have a look if you are in Gyeongbok Gung or Gwanghwamun. it is less than 20 min walk, away.", November 2012
119,3.0,Not Bad,"This museum is not too bad.  If your are on a short stay this is not a must see, but if you are here for a longer stay or even living here you may find some of the exhibits quite interesting.", June 2012
120,5.0,The Seoulo Museum of History.,"One of the South Korean capital's latest museums, the Seoul Museum of History first opened its gates onloy in mis 2002.  It covers the history, culture and way of life of the people of that great city from the Joseon Dynasty (1392-1910) to the present, and even offers a taltalising peek into the future.  Most of the artifacts on display had been donated by the proud residents of Seoul.These range from the ceremonial robes of one of the kings, classical paintings, portraits of notable citizens of the city, quality wooden antique furniture arranged as in a typical household, porcelainware, astronomical charts, and a great deal more. There is a lovely diorama recreating the market-place along the Han River.For me, the most fascinating part of the museum was the part covering the early Joseon eraAs we move closer to the 20th century, the artifacts change to items like a phonograph with an enormous horn to focus the sound, and a period telephone.Another exhibit that should not be missed is a 1:1,500 scale model of Seoul based on high-quality aerial photographs. It  covers not only the Seoul of today, but also shows plans for its future development.The museum is based in a modern-architecture building.  Its plaza has several open-air exhibits like a 1930s streetcar and stone artifacts, including the tombstone of Prince Eunsin.There is a well-stocked museum shop for souvenir hunters, and a well-maintained cafe.  Admission to the permanent exhibits is free.  The museum is a labour of love, and should not be missed.", June 2011
121,4.0,pretty good to now Seoul history,"in order to fee the recent Seoul, such as 1970's Myeongdong, late authors anogny, it was quite OK. Museum itself, is small place but behind the museum, there is a palace whic were simbolic of Korean history. it is under the renovation but still you can look around partially. that combination is good to go.", March 2012
122,4.0,Awesome 3D city model!,"This museum with a free entrance is definitely worth a visit if only for the 3D model of Seoul - located on the 2nd floor, it's an amazing work of art, showing you literally every building of the city. This huge model, partly under a glass floor visitors walk on, can also show you some specific areas of the city, using different colours of lighting. The language of the interactive part is Korean only though. The other exhibitions of the museum are also interesting, especially one about the urban development of Seoul. Most of the descriptions are both in Korean and English.", December 2011
